row_id,conflict_name,conflict_id,country_id,incompatibility,dyad_name,dyad_id,unclear_dyad,monadic_event,intensity,start_event,end_event,temporal_precision,source,third_states_no,third_igo_no,third_other,third_faith_based,third_name,third_id1,third_id2,third_id3,third_id4,third_id5,third_id6,third_id7,third_id8,third_id9,third_id10,third_id11,third_id12,third_id13,third_id14,third_id15,third_id16,third_id17,third_id18,third_id19,third_id20,third_total,warring_party,type_of_talks,talks_incompatibility,talks_conflict_behavior,talks_other,talks_unknown,good_office,fact_finding,permanent_observers,peacekeeping
1,Algeria,191,615,2,Government of Algeria - AIS,1,0,0,1,06/25/1993,06/25/1993,1,"Reuters 1993-06-25, ""Algerian head of state meets Egyptian president""",1,0,0,0,Egypt,651,0,0,0,0,0,0,0,0,0,0,0,0,0,0,0,0,0,0,0,1,1,3,0,0,1,0,0,0,0,0
2,Algeria,191,615,2,Government of Algeria - AIS,1,0,0,2,04/01/1994,04/30/1994,4,"Reuters 1994-12-13 ""French envoy offered Algeria mediation - FIS chief.""",1,0,0,0,France,220,0,0,0,0,0,0,0,0,0,0,0,0,0,0,0,0,0,0,0,1,2,3,0,0,1,0,0,0,0,0
3,Algeria,191,615,2,Government of Algeria - AIS,1,0,0,2,11/21/1994,11/22/1994,1,"Reuters 1994-11-21 ""Algerian press brands Rome talks ""oriental dance""."" AND Reuters 1994-11-22 ""Algerian opposition urges end to killing.""",0,0,1,1,The Sant' Egidio Community,12033,0,0,0,0,0,0,0,0,0,0,0,0,0,0,0,0,0,0,0,1,2,3,0,0,1,0,0,0,0,0
4,Algeria,191,615,2,Government of Algeria - AIS,1,0,0,1,01/08/1995,01/13/1995,1,"Reuters 1995-01-10 ""Algerian opposition groups draft peace proposal."" AND 1995-01-11 ""France cautiously welcomes Algeria parties' accord."" AND BBC 1995-01-16 ""OPPOSITION CALLS FOR TALKS WITH GOVERNMENT, RECOGNITION OF FIS.""",0,0,1,1,The Sant' Egidio Community,12033,0,0,0,0,0,0,0,0,0,0,0,0,0,0,0,0,0,0,0,1,2,3,0,1,1,0,0,0,0,0
5,Algeria,191,615,2,Government of Algeria - AIS,1,0,0,1,01/26/1995,01/26/1995,1,"Reuters 1995-01-25 ""Algerian Foreign Minister to meet Pope's aide."" AND Reuetrs 1995-01-26 ""Algerian elections possible in July, minister says.""",0,0,1,1,Vatican,12029,0,0,0,0,0,0,0,0,0,0,0,0,0,0,0,0,0,0,0,1,1,3,0,0,1,0,0,0,0,0
6,Algeria,191,615,2,Government of Algeria - AIS,1,0,0,1,02/12/1996,02/18/1996,3,"Reuters 1996-02-19 ""Algiers angered by Mandela talks with militant.""",1,0,0,0,South Africa,560,0,0,0,0,0,0,0,0,0,0,0,0,0,0,0,0,0,0,0,1,2,3,0,0,1,0,0,0,0,0
7,Algeria,191,615,2,Government of Algeria - AIS,1,0,0,1,02/24/1996,02/24/1996,1,"Reuters 1996-02-24 ""Mandela's emissary arrives in Algiers to mend ties.""",1,0,0,0,South Africa,560,0,0,0,0,0,0,0,0,0,0,0,0,0,0,0,0,0,0,0,1,1,3,0,0,1,0,0,0,0,0
8,Algeria,191,615,2,Government of Algeria - AIS,1,1,0,1,12/15/1997,12/16/1997,1,"Reuters 1997-12-15 ""Algerian interior minister visits Spain.""",1,0,0,0,Spain,230,0,0,0,0,0,0,0,0,0,0,0,0,0,0,0,0,0,0,0,1,1,3,0,0,1,0,0,0,0,0
9,Algeria,191,615,2,Government of Algeria - GIA,3,1,0,2,12/15/1997,12/16/1997,1,"Reuters 1997-12-15 ""Algerian interior minister visits Spain.""",1,0,0,0,Spain,230,0,0,0,0,0,0,0,0,0,0,0,0,0,0,0,0,0,0,0,1,1,3,0,0,1,0,0,0,0,0
10,Algeria,191,615,0,Government of Algeria - AIS,1,1,0,0,01/10/1998,01/13/1998,1,"Reuters 1998-01-11 ""Algeria wins Chinese support ahead of EU talks.""",1,0,0,0,China,710,0,0,0,0,0,0,0,0,0,0,0,0,0,0,0,0,0,0,0,1,1,3,0,0,0,1,0,0,0,0
11,Algeria,191,615,2,Government of Algeria - GIA,3,1,0,2,01/10/1998,01/13/1998,1,"Reuters 1998-01-11 ""Algeria wins Chinese support ahead of EU talks.""",1,0,0,0,China,710,0,0,0,0,0,0,0,0,0,0,0,0,0,0,0,0,0,0,0,1,1,3,0,0,0,1,0,0,0,0
12,Algeria,191,615,0,Government of Algeria - AIS,1,1,0,0,01/20/1998,01/21/1998,1,"Reuters 1998-01-19 ""EU mission heads for Algeria for talks on killings."" AND Reuters 1998-01-19 ""Ten die in shoot-out, attacks in Algeria - papers."" AND Reuters 1998-01-20 ""Positive start to delicate EU-Algeria talks - envoy.""",0,1,0,0,EC/EU,11010,0,0,0,0,0,0,0,0,0,0,0,0,0,0,0,0,0,0,0,1,1,3,0,0,1,0,0,0,0,0
13,Algeria,191,615,2,Government of Algeria - GIA,3,1,0,2,01/20/1998,01/21/1998,1,"Reuters 1998-01-19 ""EU mission heads for Algeria for talks on killings."" AND Reuters 1998-01-19 ""Ten die in shoot-out, attacks in Algeria - papers."" AND Reuters 1998-01-20 ""Positive start to delicate EU-Algeria talks - envoy.""",0,1,0,0,EC/EU,11010,0,0,0,0,0,0,0,0,0,0,0,0,0,0,0,0,0,0,0,1,1,3,0,0,1,0,0,0,0,0
14,Algeria,191,615,0,Government of Algeria - AIS,1,1,0,0,02/07/1998,02/11/1998,1,"Reuters 1998-02-11 ""Euro-deputies say Algeria moving on democracy.""",0,1,0,0,EC/EU,11010,0,0,0,0,0,0,0,0,0,0,0,0,0,0,0,0,0,0,0,1,1,3,0,0,1,0,0,0,0,0
15,Algeria,191,615,2,Government of Algeria - GIA,3,1,0,2,02/07/1998,02/11/1998,1,"Reuters 1998-02-11 ""Euro-deputies say Algeria moving on democracy.""",0,1,0,0,EC/EU,11010,0,0,0,0,0,0,0,0,0,0,0,0,0,0,0,0,0,0,0,1,1,3,0,0,1,0,0,0,0,0
16,Algeria,191,615,0,Government of Algeria - AIS,1,1,0,0,07/22/1998,08/05/1998,4,"Reuters 1998-07-22 ""UN fact-finding panel heads to violence-hit Algeria."" AND Reuters 1998-07-26 ""Twelve Algerians die in massacre amid U.N. team trip.""",0,1,0,0,UN,11024,0,0,0,0,0,0,0,0,0,0,0,0,0,0,0,0,0,0,0,1,0,0,0,0,0,0,0,1,0,0
17,Algeria,191,615,2,Government of Algeria - GIA,3,1,0,2,07/22/1998,08/05/1998,4,"Reuters 1998-07-22 ""UN fact-finding panel heads to violence-hit Algeria."" AND Reuters 1998-07-26 ""Twelve Algerians die in massacre amid U.N. team trip.""",0,1,0,0,UN,11024,0,0,0,0,0,0,0,0,0,0,0,0,0,0,0,0,0,0,0,1,0,0,0,0,0,0,0,1,0,0
18,Algeria,191,615,0,Government of Algeria - AIS,1,1,0,0,07/14/1999,07/14/1999,1,"Reuters 1999-07-14, ""New Algerian amnesty law for Moslem rebels""",0,1,0,0,AU,11000,0,0,0,0,0,0,0,0,0,0,0,0,0,0,0,0,0,0,0,1,1,3,1,0,0,0,0,0,0,0
19,Algeria,191,615,2,Government of Algeria - GIA,3,1,0,1,07/14/1999,07/14/1999,1,"Reuters 1999-07-14, ""New Algerian amnesty law for Moslem rebels""",0,1,0,0,AU,11000,0,0,0,0,0,0,0,0,0,0,0,0,0,0,0,0,0,0,0,1,1,3,1,0,0,0,0,0,0,0
20,Algeria,191,615,2,Government of Algeria - AQIM,4,1,0,1,07/14/1999,07/14/1999,1,"Reuters 1999-07-14, ""New Algerian amnesty law for Moslem rebels""",0,1,0,0,AU,11000,0,0,0,0,0,0,0,0,0,0,0,0,0,0,0,0,0,0,0,1,1,3,1,0,0,0,0,0,0,0
21,Algeria,191,615,0,Government of Algeria - AIS,1,1,0,0,06/01/2000,06/30/2000,4,"Reuters 2000-06-13 ""Rights group accuses Algerian state of abuses.""",0,0,1,0,FIDH,12040,0,0,0,0,0,0,0,0,0,0,0,0,0,0,0,0,0,0,0,1,0,0,0,0,0,0,0,1,0,0
22,Algeria,191,615,2,Government of Algeria - GIA,3,1,0,1,06/01/2000,06/30/2000,4,"Reuters 2000-06-13 ""Rights group accuses Algerian state of abuses.""",0,0,1,0,FIDH,12040,0,0,0,0,0,0,0,0,0,0,0,0,0,0,0,0,0,0,0,1,0,0,0,0,0,0,0,1,0,0
23,Algeria,191,615,2,Government of Algeria - GIA,3,1,0,1,11/05/2001,11/05/2001,1,"Reuters 2001-11-06, ""UPDATE 2-Bush seeks to shore up support for war efforts""",1,0,0,0,USA,2,0,0,0,0,0,0,0,0,0,0,0,0,0,0,0,0,0,0,0,1,1,3,0,0,1,0,0,0,0,0
24,Algeria,191,615,2,Government of Algeria - AQIM,4,1,0,1,11/05/2001,11/05/2001,1,"Reuters 2001-11-06, ""UPDATE 2-Bush seeks to shore up support for war efforts""",1,0,0,0,USA,2,0,0,0,0,0,0,0,0,0,0,0,0,0,0,0,0,0,0,0,1,1,3,0,0,1,0,0,0,0,0
25,Algeria,191,615,2,Government of Algeria - GIA,3,1,0,1,10/04/2002,10/04/2002,1,"AFP 2002-10-07, ""Rights group slams Madrid for anti-terrorism talks with Algeria""",1,0,0,0,Spain,230,0,0,0,0,0,0,0,0,0,0,0,0,0,0,0,0,0,0,0,1,1,3,0,0,1,0,0,0,0,0
26,Algeria,191,615,2,Government of Algeria - AQIM,4,1,0,1,10/04/2002,10/04/2002,1,"AFP 2002-10-07, ""Rights group slams Madrid for anti-terrorism talks with Algeria""",1,0,0,0,Spain,230,0,0,0,0,0,0,0,0,0,0,0,0,0,0,0,0,0,0,0,1,1,3,0,0,1,0,0,0,0,0
27,Algeria,191,615,2,Government of Algeria - GIA,3,0,0,1,10/07/2002,10/08/2002,1,"Reuters 2002-10-07 ""Rights group slams Madrid for anti-terrorism talks with Algeria.""",1,0,0,0,Spain,230,0,0,0,0,0,0,0,0,0,0,0,0,0,0,0,0,0,0,0,1,1,3,0,0,1,0,0,0,0,0
28,Algeria,191,615,2,Government of Algeria - GIA,3,1,0,1,12/09/2002,12/09/2002,1,"Reuters 2002-12-09, ""U.S. to sell arms to Algeria for fight against rebels""",1,0,0,0,USA,2,0,0,0,0,0,0,0,0,0,0,0,0,0,0,0,0,0,0,0,1,1,3,0,0,1,0,0,0,0,0
29,Algeria,191,615,2,Government of Algeria - AQIM,4,1,0,1,12/09/2002,12/09/2002,1,"Reuters 2002-12-09, ""U.S. to sell arms to Algeria for fight against rebels""",1,0,0,0,USA,2,0,0,0,0,0,0,0,0,0,0,0,0,0,0,0,0,0,0,0,1,1,3,0,0,1,0,0,0,0,0
30,Algeria,191,615,2,Government of Algeria - GIA,3,1,0,1,10/23/2003,10/23/2003,1,"Reuters 2003-10-25, ""Top US official discusses war on terror in Algeria""; Reuters 2003-10-25, ""UPDATE 1-U.S.-Algerian ""counter-terrorism"" to intensify-Burns""; Reuters 2003-10-25, ""UPDATE 1-U.S.-Algerian ""counter-terrorism"" to intensify-Burns""",1,0,0,0,USA,2,0,0,0,0,0,0,0,0,0,0,0,0,0,0,0,0,0,0,0,1,1,3,0,0,1,0,0,0,0,0
31,Algeria,191,615,2,Government of Algeria - AQIM,4,1,0,1,10/23/2003,10/23/2003,1,"Reuters 2003-10-25, ""Top US official discusses war on terror in Algeria""; Reuters 2003-10-25, ""UPDATE 1-U.S.-Algerian ""counter-terrorism"" to intensify-Burns""; Reuters 2003-10-25, ""UPDATE 1-U.S.-Algerian ""counter-terrorism"" to intensify-Burns""",1,0,0,0,USA,2,0,0,0,0,0,0,0,0,0,0,0,0,0,0,0,0,0,0,0,1,1,3,0,0,1,0,0,0,0,0
32,Algeria,191,615,2,Government of Algeria - GIA,3,1,0,1,12/01/2003,12/31/2003,4,"Reuters 2003-12-06, ""UPDATE 1-Europe to help North Africa fight roots of terror""",1,0,0,0,USA,2,0,0,0,0,0,0,0,0,0,0,0,0,0,0,0,0,0,0,0,1,1,3,0,0,1,0,0,0,0,0
33,Algeria,191,615,2,Government of Algeria - AQIM,4,1,0,1,12/01/2003,12/31/2003,4,"Reuters 2003-12-06, ""UPDATE 1-Europe to help North Africa fight roots of terror""",1,0,0,0,USA,2,0,0,0,0,0,0,0,0,0,0,0,0,0,0,0,0,0,0,0,1,1,3,0,0,1,0,0,0,0,0
34,Algeria,191,615,2,Government of Algeria - GIA,3,1,0,1,12/05/2003,12/05/2003,1,"Reuters 2003-12-06, ""UPDATE 1-Europe to help North Africa fight roots of terror""",5,1,0,0,"France, Italy, Malta, Portugal, Spain, The Arab Maghreb Union",220,325,338,235,230,11021,0,0,0,0,0,0,0,0,0,0,0,0,0,0,6,1,3,0,0,1,0,0,0,0,0
35,Algeria,191,615,2,Government of Algeria - AQIM,4,1,0,1,12/05/2003,12/05/2003,1,"Reuters 2003-12-06, ""UPDATE 1-Europe to help North Africa fight roots of terror""",5,1,0,0,"France, Italy, Malta, Portugal, Spain, The Arab Maghreb Union",220,325,338,235,230,11021,0,0,0,0,0,0,0,0,0,0,0,0,0,0,6,1,3,0,0,1,0,0,0,0,0
36,Algeria,191,615,0,Government of Algeria - GIA,3,1,0,0,07/17/2004,07/18/2004,1,"AFP 2004-07-16, ""French defense minister arrives for Algeria visit, first since independence""",1,0,0,0,France,220,0,0,0,0,0,0,0,0,0,0,0,0,0,0,0,0,0,0,0,1,1,3,0,0,1,0,0,0,0,0
37,Algeria,191,615,2,Government of Algeria - AQIM,4,1,0,1,07/17/2004,07/18/2004,1,"AFP 2004-07-16, ""French defense minister arrives for Algeria visit, first since independence""",1,0,0,0,France,220,0,0,0,0,0,0,0,0,0,0,0,0,0,0,0,0,0,0,0,1,1,3,0,0,1,0,0,0,0,0
38,Algeria,191,615,2,Government of Algeria - AQIM,4,0,0,1,07/19/2004,07/19/2004,1,"Xinhua 2004-07-21, ""Algeria denies talks with Chad rebels over top militant's extradition""",1,0,0,0,Chad,483,0,0,0,0,0,0,0,0,0,0,0,0,0,0,0,0,0,0,0,1,1,3,0,0,1,0,0,0,0,0
39,Algeria,191,615,2,Government of Algeria - AQIM,4,0,0,1,09/01/2004,09/30/2004,4,"Reuters 2004-09-12, ""UPDATE 1-Algeria in talks with Chad on handover of militant""",1,0,0,0,Chad,483,0,0,0,0,0,0,0,0,0,0,0,0,0,0,0,0,0,0,0,1,1,3,0,0,1,0,0,0,0,0
40,Algeria,191,615,0,Government of Algeria - GIA,3,1,0,0,10/07/2004,10/07/2004,1,"AFP 2004-10-07, ""Nigerian, Algerian presidents hold talks on trade and terrorism""",1,0,0,0,Nigeria,475,0,0,0,0,0,0,0,0,0,0,0,0,0,0,0,0,0,0,0,1,1,3,0,0,1,0,0,0,0,0
41,Algeria,191,615,2,Government of Algeria - AQIM,4,1,0,1,10/07/2004,10/07/2004,1,"AFP 2004-10-07, ""Nigerian, Algerian presidents hold talks on trade and terrorism""",1,0,0,0,Nigeria,475,0,0,0,0,0,0,0,0,0,0,0,0,0,0,0,0,0,0,0,1,1,3,0,0,1,0,0,0,0,0
42,Algeria,191,615,0,Government of Algeria - GIA,3,1,0,0,10/11/2004,10/12/2004,1,"AP 2004-10-12, ""French Interior Min In Algeria For Two Days Of Talks""",1,0,0,0,France,220,0,0,0,0,0,0,0,0,0,0,0,0,0,0,0,0,0,0,0,1,1,3,0,0,1,0,0,0,0,0
43,Algeria,191,615,2,Government of Algeria - AQIM,4,1,0,1,10/11/2004,10/12/2004,1,"AP 2004-10-12, ""French Interior Min In Algeria For Two Days Of Talks""",1,0,0,0,France,220,0,0,0,0,0,0,0,0,0,0,0,0,0,0,0,0,0,0,0,1,1,3,0,0,1,0,0,0,0,0
44,Algeria,191,615,0,Government of Algeria - GIA,3,1,0,0,10/16/2004,10/16/2004,1,"AFP 2004-10-16, ""Germany backing Algerian democratic reforms: Schroeder""",1,0,0,0,Germany,255,0,0,0,0,0,0,0,0,0,0,0,0,0,0,0,0,0,0,0,1,1,3,1,0,0,0,0,0,0,0
45,Algeria,191,615,2,Government of Algeria - AQIM,4,1,0,1,10/16/2004,10/16/2004,1,"AFP 2004-10-16, ""Germany backing Algerian democratic reforms: Schroeder""",1,0,0,0,Germany,255,0,0,0,0,0,0,0,0,0,0,0,0,0,0,0,0,0,0,0,1,1,3,1,0,0,0,0,0,0,0
46,Algeria,191,615,0,Government of Algeria - GIA,3,1,0,0,11/01/2004,11/30/2004,4,"AP 2004-11-24, ""NATO Chief Makes Inaugural Algeria Trip For Talks Thurs""",6,1,0,0,"Mauritania, Morocco, Egypt, Tunisia, Israel, Jordan, NATO",435,600,651,616,666,663,11015,0,0,0,0,0,0,0,0,0,0,0,0,0,7,1,3,0,0,1,0,0,0,0,0
47,Algeria,191,615,2,Government of Algeria - AQIM,4,1,0,1,11/01/2004,11/30/2004,4,"AP 2004-11-24, ""NATO Chief Makes Inaugural Algeria Trip For Talks Thurs""",6,1,0,0,"Mauritania, Morocco, Egypt, Tunisia, Israel, Jordan, NATO",435,600,651,616,666,663,11015,0,0,0,0,0,0,0,0,0,0,0,0,0,7,1,3,0,0,1,0,0,0,0,0
48,Algeria,191,615,0,Government of Algeria - GIA,3,1,0,0,11/24/2004,11/24/2004,1,"AP 2004-11-24, ""NATO Chief Makes Inaugural Algeria Trip For Talks Thurs""",0,1,0,0,NATO,11015,0,0,0,0,0,0,0,0,0,0,0,0,0,0,0,0,0,0,0,1,1,3,0,0,1,0,0,0,0,0
49,Algeria,191,615,2,Government of Algeria - AQIM,4,1,0,1,11/24/2004,11/24/2004,1,"AP 2004-11-24, ""NATO Chief Makes Inaugural Algeria Trip For Talks Thurs""",0,1,0,0,NATO,11015,0,0,0,0,0,0,0,0,0,0,0,0,0,0,0,0,0,0,0,1,1,3,0,0,1,0,0,0,0,0
50,Angola,131,540,2,Government of Angola - UNITA,7,0,0,2,09/03/1993,09/03/1993,1,"Reuters 1993-09-03 ""Angolan rebel leader makes fresh peace overtures.""",1,0,0,0,Portugal,235,0,0,0,0,0,0,0,0,0,0,0,0,0,0,0,0,0,0,0,1,2,3,0,1,0,0,0,0,0,0
51,Angola,131,540,2,Government of Angola - UNITA,7,0,0,2,09/06/1993,09/09/1993,2,"Reuters 1993-09-09 ""U.S. urges Savimbi to join new peace efforts.""",1,0,0,0,USA,2,0,0,0,0,0,0,0,0,0,0,0,0,0,0,0,0,0,0,0,1,2,3,0,0,1,0,0,0,0,0
52,Angola,131,540,2,Government of Angola - UNITA,7,0,0,2,09/12/1993,09/15/1993,2,"Reuters 1993-09-15 ""UNITA welcomes sanctions respite.""",0,1,0,0,UN,11024,0,0,0,0,0,0,0,0,0,0,0,0,0,0,0,0,0,0,0,1,2,3,0,0,0,1,0,0,0,0
53,Angola,131,540,2,Government of Angola - UNITA,7,0,0,2,09/14/1993,09/14/1993,1,"Reuters 1993-09-14 ""UNITA meets U.N. envoy to discuss Angola peace plans.""",0,1,0,0,UN,11024,0,0,0,0,0,0,0,0,0,0,0,0,0,0,0,0,0,0,0,1,2,3,0,0,1,0,0,0,0,0
54,Angola,131,540,2,Government of Angola - UNITA,7,0,0,2,09/14/1993,09/14/1993,1,"Reuters 1993-09-14 ""UNITA meets U.N. envoy to discuss Angola peace plans.""",1,0,0,0,Ivory Coast,437,0,0,0,0,0,0,0,0,0,0,0,0,0,0,0,0,0,0,0,1,0,0,0,0,0,0,1,0,0,0
55,Angola,131,540,2,Government of Angola - UNITA,7,0,0,2,09/14/1993,09/17/1993,2,"Reuters 1993-09-17 ""Angola's UNITA optimistic after talks with U.S. team.""",1,0,0,0,USA,2,0,0,0,0,0,0,0,0,0,0,0,0,0,0,0,0,0,0,0,1,2,3,0,0,1,0,0,0,0,0
56,Angola,131,540,2,Government of Angola - UNITA,7,0,0,2,09/14/1993,09/17/1993,2,"Reuters 1993-09-17 ""Angola's UNITA optimistic after talks with U.S. team.""",1,0,0,0,Ivory Coast,437,0,0,0,0,0,0,0,0,0,0,0,0,0,0,0,0,0,0,0,1,0,0,0,0,0,0,1,0,0,0
57,Angola,131,540,2,Government of Angola - UNITA,7,0,0,2,09/27/1993,09/28/1993,1,"Reuters 1993-09-27 ""Sao Tome, Angolan leaders meet to try for peace."" AND Reuters 1993-09-29 ""Sao Tome leader pessimistic on early Angola truce.""",1,0,0,0,Sao Tome and Principe,403,0,0,0,0,0,0,0,0,0,0,0,0,0,0,0,0,0,0,0,1,1,3,0,0,1,0,0,0,0,0
58,Angola,131,540,2,Government of Angola - UNITA,7,0,0,2,10/04/1993,10/07/1993,2,"Reuters 1993-10-07 ""Portugal urges Angola to resume talks with UNITA.""",1,0,0,0,Portugal,235,0,0,0,0,0,0,0,0,0,0,0,0,0,0,0,0,0,0,0,1,2,3,0,0,1,0,0,0,0,0
59,Angola,131,540,2,Government of Angola - UNITA,7,0,0,2,10/19/1993,10/19/1993,1,"Reuters 1993-10-19 ""UNITA makes concessions in talks with U.N.""",0,1,0,0,UN,11024,0,0,0,0,0,0,0,0,0,0,0,0,0,0,0,0,0,0,0,1,2,3,0,0,0,1,0,0,0,0
60,Angola,131,540,2,Government of Angola - UNITA,7,0,0,2,10/26/1993,10/26/1993,1,"Reuters 1993-10-26 ""Exploratory Angolan peace talks underway in Lusaka.""  AND Reuters 1993-10-29 ""Angolan peace talks end, fighting reported."" AND Reuters 1993-10-29 ""Angolan peace talks end in Zambia""",0,1,0,0,UN,11024,0,0,0,0,0,0,0,0,0,0,0,0,0,0,0,0,0,0,0,1,3,2,0,0,0,1,0,0,0,0
61,Angola,131,540,2,Government of Angola - UNITA,7,0,0,2,10/26/1993,10/26/1993,1,"Reuters 1993-10-26 ""Exploratory Angolan peace talks underway in Lusaka.""  AND Reuters 1993-10-29 ""Angolan peace talks end, fighting reported."" AND Reuters 1993-10-29 ""Angolan peace talks end in Zambia""",1,0,0,0,Zambia,551,0,0,0,0,0,0,0,0,0,0,0,0,0,0,0,0,0,0,0,1,0,0,0,0,0,0,1,0,0,0
62,Angola,131,540,2,Government of Angola - UNITA,7,0,0,2,11/15/1993,12/24/1993,1,"Reuters 1993-11-15 ""U.N. envoy meets observers, contacts Angolan foes."" AND 1993-11-16 ""Angolan government, rebels said to have met."" AND 1993-11-16 ""Angolan paper hints at ceasefire agreement."" AND 1993-11-23 ""Angolan peace talks inch towards progress."" AND Reuters 1993-12-24 ""UNITA says it might quit peace talks.""",3,1,0,0,"UN, USA, Russia, Portugal",11024,2,365,235,0,0,0,0,0,0,0,0,0,0,0,0,0,0,0,0,4,3,1,0,1,0,0,0,0,0,0
63,Angola,131,540,2,Government of Angola - UNITA,7,0,0,2,11/15/1993,12/24/1993,1,"Reuters 1993-11-15 ""U.N. envoy meets observers, contacts Angolan foes."" AND 1993-11-16 ""Angolan government, rebels said to have met."" AND 1993-11-16 ""Angolan paper hints at ceasefire agreement."" AND 1993-11-23 ""Angolan peace talks inch towards progress."" AND Reuters 1993-12-24 ""UNITA says it might quit peace talks.""",1,0,0,0,Zambia,551,0,0,0,0,0,0,0,0,0,0,0,0,0,0,0,0,0,0,0,1,0,0,0,0,0,0,1,0,0,0
64,Angola,131,540,2,Government of Angola - UNITA,7,0,0,2,01/06/1994,01/31/1994,1,"Reuters 1994-01-06 ""Angolan peace talks to resume after recess."" AND Reuters 1994-01-11 ""Angolan fighting worsens, government says."" AND Reuters 1994-01-13 ""Angolans agree on thorny issue of police."" AND Reuters 1994-01-13 ""Angolan talks make progress on police shake-out."" AND Reuters 1994-01-17 ""Angolan radio says 52 rebels killed in attacks."" AND Reuters 1994-01-18 ""Angolan government says peace talks are stalled."" AND Reuters 1994-01-31 ""Angolan government, UNITA agree on police force.""",3,1,0,0,"UN, USA, Russia, Portugal",11024,2,365,235,0,0,0,0,0,0,0,0,0,0,0,0,0,0,0,0,4,3,1,0,1,0,0,0,0,0,0
65,Angola,131,540,2,Government of Angola - UNITA,7,0,0,2,01/06/1994,01/31/1994,1,"Reuters 1994-01-06 ""Angolan peace talks to resume after recess."" AND Reuters 1994-01-11 ""Angolan fighting worsens, government says."" AND Reuters 1994-01-13 ""Angolans agree on thorny issue of police."" AND Reuters 1994-01-13 ""Angolan talks make progress on police shake-out."" AND Reuters 1994-01-17 ""Angolan radio says 52 rebels killed in attacks."" AND Reuters 1994-01-18 ""Angolan government says peace talks are stalled.""",1,0,0,0,Zambia,551,0,0,0,0,0,0,0,0,0,0,0,0,0,0,0,0,0,0,0,1,0,0,0,0,0,0,1,0,0,0
66,Angola,131,540,2,Government of Angola - UNITA,7,0,0,2,01/09/1994,01/09/1994,1,"Reuters 1994-01-09 ""U.S. congressmen meet Angolan rebels.""",1,0,0,0,USA,2,0,0,0,0,0,0,0,0,0,0,0,0,0,0,0,0,0,0,0,1,2,3,0,0,1,0,0,0,0,0
67,Angola,131,540,2,Government of Angola - UNITA,7,0,0,2,01/09/1994,01/09/1994,1,"Reuters 1994-01-09 ""U.S. congressmen meet Angolan rebels.""",1,0,0,0,Zimbabwe,552,0,0,0,0,0,0,0,0,0,0,0,0,0,0,0,0,0,0,0,1,0,0,0,0,0,0,1,0,0,0
68,Angola,131,540,2,Government of Angola - UNITA,7,0,0,2,02/09/1994,02/09/1994,1,"Reuters 1994-02-09 ""Angola says ceasefire talks must await overall deal.""",1,0,0,0,Sao Tome and Principe,403,0,0,0,0,0,0,0,0,0,0,0,0,0,0,0,0,0,0,0,1,1,3,0,0,1,0,0,0,0,0
69,Angola,131,540,2,Government of Angola - UNITA,7,0,0,2,02/15/1994,03/13/1994,4,"Reuters 1994-02-16 ""UNITA says reconciliation talks going well."" AND 1994-02-21 ""UNITA presents demands for national reconciliation."" AND 1994-03-01 ""UNITA says Angolan government not serious in talks."" AND Reuters 1994-03-13 ""Savimbi confident peace will be achieved in Lusaka.""",3,1,0,0,"UN, USA, Russia, Portugal",11024,2,365,235,0,0,0,0,0,0,0,0,0,0,0,0,0,0,0,0,4,3,1,1,0,0,0,0,0,0,0
70,Angola,131,540,2,Government of Angola - UNITA,7,0,0,2,02/15/1994,03/13/1994,4,"Reuters 1994-02-16 ""UNITA says reconciliation talks going well."" AND 1994-02-21 ""UNITA presents demands for national reconciliation."" AND 1994-03-01 ""UNITA says Angolan government not serious in talks."" AND Reuters 1994-03-13 ""Savimbi confident peace will be achieved in Lusaka.""",1,0,0,0,Zambia,551,0,0,0,0,0,0,0,0,0,0,0,0,0,0,0,0,0,0,0,1,0,0,0,0,0,0,1,0,0,0
71,Angola,131,540,2,Government of Angola - UNITA,7,0,0,2,03/13/1994,03/13/1994,1,"Reuters 1994-03-13 ""Savimbi confident peace will be achieved in Lusaka.""",0,1,0,0,UN,11024,0,0,0,0,0,0,0,0,0,0,0,0,0,0,0,0,0,0,0,1,2,3,0,0,0,1,0,0,0,0
72,Angola,131,540,2,Government of Angola - UNITA,7,0,0,2,03/13/1994,03/13/1994,1,"Reuters 1994-03-13 ""Savimbi confident peace will be achieved in Lusaka.""",0,1,0,0,UN,11024,0,0,0,0,0,0,0,0,0,0,0,0,0,0,0,0,0,0,0,1,1,3,0,0,0,1,0,0,0,0
73,Angola,131,540,2,Government of Angola - UNITA,7,0,0,2,03/15/1994,04/06/1994,4,"Reuters 1994-03-15 ""UNITA seeks clarification of opposition role."" AND Reuters 1994-03-18 "" UNITA accepts Angolan ministerial offers."" AND Reuters 1994-03-28 ""Angolan negotiators discuss new poll."" AND Reuters 1994-04-08 ""UN chief calls for new peace moves in Angola.""",3,1,0,0,"UN, USA, Russia, Portugal",11024,2,365,235,0,0,0,0,0,0,0,0,0,0,0,0,0,0,0,0,4,3,1,1,0,0,0,0,0,0,0
74,Angola,131,540,2,Government of Angola - UNITA,7,0,0,2,03/15/1994,04/06/1994,4,"Reuters 1994-03-15 ""UNITA seeks clarification of opposition role."" AND Reuters 1994-03-18 "" UNITA accepts Angolan ministerial offers."" AND Reuters 1994-03-28 ""Angolan negotiators discuss new poll."" AND Reuters 1994-04-08 ""UN chief calls for new peace moves in Angola.""",1,0,0,0,Zambia,551,0,0,0,0,0,0,0,0,0,0,0,0,0,0,0,0,0,0,0,1,0,0,0,0,0,0,1,0,0,0
75,Angola,131,540,2,Government of Angola - UNITA,7,0,0,2,04/08/1994,04/11/1994,2,"Reuters 1994-04-11 ""U.N. mediator to return to Lusaka talks.""",0,1,0,0,UN,11024,0,0,0,0,0,0,0,0,0,0,0,0,0,0,0,0,0,0,0,1,1,3,0,0,0,1,0,0,0,0
76,Angola,131,540,2,Government of Angola - UNITA,7,0,0,2,04/12/1994,05/21/1994,1,"Reuters 1994-04-12 ""Angola peace talks to resume as fighting continue."" AND Reuters 1994-04-20 ""Angolan sides agree rules for second election."" AND Reuters 1994-05-06 ""U.N. reports breakthrough in Angola peace talks."" AND 1994-05-17 ""Angolan peace talks in Lusaka seen wavering."" AND Reuters 1994-05-21 ""Angolan rebel negotiators fly home for talks.""",3,1,0,0,"UN, USA, Russia, Portugal",11024,2,365,235,0,0,0,0,0,0,0,0,0,0,0,0,0,0,0,0,4,3,1,1,0,0,0,0,0,0,0
77,Angola,131,540,2,Government of Angola - UNITA,7,0,0,2,04/12/1994,05/21/1994,1,"Reuters 1994-04-12 ""Angola peace talks to resume as fighting continue."" AND Reuters 1994-04-20 ""Angolan sides agree rules for second election."" AND Reuters 1994-05-06 ""U.N. reports breakthrough in Angola peace talks."" AND 1994-05-17 ""Angolan peace talks in Lusaka seen wavering."" AND Reuters 1994-05-21 ""Angolan rebel negotiators fly home for talks.""",1,0,0,0,Zambia,551,0,0,0,0,0,0,0,0,0,0,0,0,0,0,0,0,0,0,0,1,0,0,0,0,0,0,1,0,0,0
78,Angola,131,540,2,Government of Angola - UNITA,7,0,0,2,05/20/1994,05/20/1994,1,"Reuters 1994-05-21 ""Angolan rebel negotiators fly home for talks.""",1,0,0,0,USA,2,0,0,0,0,0,0,0,0,0,0,0,0,0,0,0,0,0,0,0,1,1,3,0,0,0,1,0,0,0,0
79,Angola,131,540,2,Government of Angola - UNITA,7,0,0,2,05/26/1994,07/04/1994,5,"Reuters 1994-05-26 ""Angola's UNITA says key peace issue unresolved."" AND 1994-06-01 ""Angolan peace talks resume in pessimistic mood."" AND 1994-06-08 ""Rebels accept offer on Angolan government posts."" AND Reuters 1994-06-13 ""Angolan peace talks stumble over issue of Huambo."" AND Reuters 1994-07-01 ""UNITA criticises U.N. line on Angola."" AND Reuters 1994-07-04 ""Chiluba to visit Angola for talks with dos Santos.""",3,1,0,0,"UN, USA, Russia, Portugal",11024,2,365,235,0,0,0,0,0,0,0,0,0,0,0,0,0,0,0,0,4,3,1,1,0,0,0,0,0,0,0
80,Angola,131,540,2,Government of Angola - UNITA,7,0,0,2,05/26/1994,07/04/1994,5,"Reuters 1994-05-26 ""Angola's UNITA says key peace issue unresolved."" AND 1994-06-01 ""Angolan peace talks resume in pessimistic mood."" AND 1994-06-08 ""Rebels accept offer on Angolan government posts."" AND Reuters 1994-06-13 ""Angolan peace talks stumble over issue of Huambo."" AND Reuters 1994-07-01 ""UNITA criticises U.N. line on Angola."" AND Reuters 1994-07-04 ""Chiluba to visit Angola for talks with dos Santos.""",1,0,0,0,Zambia,551,0,0,0,0,0,0,0,0,0,0,0,0,0,0,0,0,0,0,0,1,0,0,0,0,0,0,1,0,0,0
81,Angola,131,540,2,Government of Angola - UNITA,7,0,0,2,06/14/1994,06/14/1994,1,"Reuters 1994-06-14 ""Rwanda tops OAU agenda, Mandela mediates on Angola.""",1,0,0,0,South Africa,560,0,0,0,0,0,0,0,0,0,0,0,0,0,0,0,0,0,0,0,1,1,3,0,0,0,1,0,0,0,0
82,Angola,131,540,2,Government of Angola - UNITA,7,0,0,2,06/14/1994,06/14/1994,1,"Reuters 1994-06-14 ""Rwanda tops OAU agenda, Mandela mediates on Angola.""",1,0,0,0,Tunisia,616,0,0,0,0,0,0,0,0,0,0,0,0,0,0,0,0,0,0,0,1,0,0,0,0,0,0,1,0,0,0
83,Angola,131,540,2,Government of Angola - UNITA,7,0,0,2,06/17/1994,06/20/1994,2,"Reuters 1994-06-20 ""Savimbi ready to help talks bring peace to Angola.""",0,1,0,0,UN,11024,0,0,0,0,0,0,0,0,0,0,0,0,0,0,0,0,0,0,0,1,2,3,0,0,0,1,0,0,0,0
84,Angola,131,540,2,Government of Angola - UNITA,7,0,0,2,06/17/1994,06/20/1994,2,"Reuters 1994-06-20 ""Savimbi ready to help talks bring peace to Angola.""",0,1,0,0,UN,11024,0,0,0,0,0,0,0,0,0,0,0,0,0,0,0,0,0,0,0,1,1,3,0,0,0,1,0,0,0,0
85,Angola,131,540,2,Government of Angola - UNITA,7,0,0,2,07/05/1994,07/05/1994,1,"Reuters 1994-07-05 ""Zambian leader flies to Luanda for peace talks. "" AND Reuters 1994-07-06 ""Mandela draws leaders together on Angola peace.""",1,0,0,0,Zambia,551,0,0,0,0,0,0,0,0,0,0,0,0,0,0,0,0,0,0,0,1,1,3,0,0,0,1,0,0,0,0
86,Angola,131,540,2,Government of Angola - UNITA,7,0,0,2,07/07/1994,07/07/1994,1,"Reuters 1994-07-07 ""Mobutu, dos Santos to revive security, defence talks."" AND Reuters 1994-07-07 ""No reason for pessimism over Angola peace - Mandela.""",3,0,0,0,"South Africa, Democratic Republic of the Congo, Mozambique",560,490,541,0,0,0,0,0,0,0,0,0,0,0,0,0,0,0,0,0,3,1,3,0,0,1,0,0,0,0,0
87,Angola,131,540,2,Government of Angola - UNITA,7,0,0,2,07/18/1994,07/18/1994,1,"Reuters 1994-07-18 ""UNITA delegates hold meeting with Nzo.""",1,0,0,0,South Africa,560,0,0,0,0,0,0,0,0,0,0,0,0,0,0,0,0,0,0,0,1,2,3,0,0,0,1,0,0,0,0
88,Angola,131,540,2,Government of Angola - UNITA,7,0,0,2,07/31/1994,09/23/1994,1,"Reuters 1994-07-31 ""UNITA rebels offer compromise at zambian talks."" AND Reuters 1994-08-04 ""Angolan government, UNITA edge towards agreement."" AND Reuters 1994-08-16 ""Angolan peace talks sidestep Huambo deadlock."" AND Reuters 1994-09-01 ""Angolan rebels compromise in peace talks."" AND Reuters 1994-09-07 ""Angolan rebels definitely drop demand for Huambo."" AND Reuters 1994-09-17 ""Angolan government and UNITA agree on observers."" AND 1994-09-23 ""Angolan negotiators to consult on final accord.""",3,1,0,0,"UN, USA, Russia, Portugal",11024,2,365,235,0,0,0,0,0,0,0,0,0,0,0,0,0,0,0,0,4,3,1,1,0,0,0,0,0,0,0
89,Angola,131,540,2,Government of Angola - UNITA,7,0,0,2,07/31/1994,09/23/1994,1,"Reuters 1994-07-31 ""UNITA rebels offer compromise at zambian talks."" AND Reuters 1994-08-04 ""Angolan government, UNITA edge towards agreement."" AND Reuters 1994-08-16 ""Angolan peace talks sidestep Huambo deadlock."" AND Reuters 1994-09-01 ""Angolan rebels compromise in peace talks."" AND Reuters 1994-09-07 ""Angolan rebels definitely drop demand for Huambo."" AND Reuters 1994-09-17 ""Angolan government and UNITA agree on observers."" AND 1994-09-23 ""Angolan negotiators to consult on final accord.""",1,0,0,0,Zambia,551,0,0,0,0,0,0,0,0,0,0,0,0,0,0,0,0,0,0,0,1,0,0,0,0,0,0,1,0,0,0
90,Angola,131,540,2,Government of Angola - UNITA,7,0,0,2,09/05/1994,09/11/1994,2,"Reuters 1994-09-05 ""U.N. envoy in Angola on fact-finding mission.""",0,1,0,0,UN,11024,0,0,0,0,0,0,0,0,0,0,0,0,0,0,0,0,0,0,0,1,0,0,0,0,0,0,0,1,0,0
91,Angola,131,540,2,Government of Angola - UNITA,7,0,0,2,09/28/1994,10/31/1994,1,"Reuters 1994-09-28 ""Angolan peace talks stall over naming commission."" AND Reuters 1994-10-14 ""Angolan rebels accept local government offers."" AND Reuters 1994-10-18 ""Angolans warily await details of peace agreement."" AND Reuters 1994-10-25 ""Angolan accord to be signed by mid-November - U.N."" AND Reuters 1994-10-31 ""Angolan president ruled over disintegrating state."" AND Reuters 1994-11-13 ""Angolan government ready to declare truce.""",3,1,0,0,"UN, USA, Russia, Portugal",11024,2,365,235,0,0,0,0,0,0,0,0,0,0,0,0,0,0,0,0,4,3,1,1,0,0,0,0,0,0,0
92,Angola,131,540,2,Government of Angola - UNITA,7,0,0,2,09/28/1994,10/31/1994,1,"Reuters 1994-09-28 ""Angolan peace talks stall over naming commission."" AND Reuters 1994-10-14 ""Angolan rebels accept local government offers."" AND Reuters 1994-10-18 ""Angolans warily await details of peace agreement."" AND Reuters 1994-10-25 ""Angolan accord to be signed by mid-November - U.N."" AND Reuters 1994-10-31 ""Angolan president ruled over disintegrating state."" AND Reuters 1994-11-13 ""Angolan government ready to declare truce.""",1,0,0,0,Zambia,551,0,0,0,0,0,0,0,0,0,0,0,0,0,0,0,0,0,0,0,1,0,0,0,0,0,0,1,0,0,0
93,Angola,131,540,2,Government of Angola - UNITA,7,0,0,2,10/18/1994,10/24/1994,3,"Reuters 1994-10-24 ""Angola peace accord is close, says Portugal.""",0,1,0,0,UN,11024,0,0,0,0,0,0,0,0,0,0,0,0,0,0,0,0,0,0,0,1,1,3,0,0,0,1,0,0,0,0
94,Angola,131,540,2,Government of Angola - UNITA,7,0,0,2,10/18/1994,10/24/1994,3,"Reuters 1994-10-23 ""Savimbi alive and well, says U.N. envoy.""",0,1,0,0,UN,11024,0,0,0,0,0,0,0,0,0,0,0,0,0,0,0,0,0,0,0,1,2,3,0,0,1,0,0,0,0,0
95,Angola,131,540,2,Government of Angola - UNITA,7,0,0,2,10/27/1994,10/27/1994,1,"Reuters 1994-10-28 ""U.N. mediator says Angolan accord imminent.""",0,1,0,0,UN,11024,0,0,0,0,0,0,0,0,0,0,0,0,0,0,0,0,0,0,0,1,2,3,0,0,0,1,0,0,0,0
96,Angola,131,540,2,Government of Angola - UNITA,7,0,0,2,10/28/1994,10/28/1994,1,"Reuters 1994-10-28 ""U.N. mediator says Angolan accord imminent.""",0,1,0,0,UN,11024,0,0,0,0,0,0,0,0,0,0,0,0,0,0,0,0,0,0,0,1,1,3,0,0,0,1,0,0,0,0
97,Angola,131,540,2,Government of Angola - UNITA,7,0,0,2,11/15/1994,11/15/1994,1,"Reuters 1994-11-15 ""Mandela says Angolan president ready for ceasefire.""",2,0,0,0,"South Africa, Zambia",560,551,0,0,0,0,0,0,0,0,0,0,0,0,0,0,0,0,0,0,2,1,3,0,0,1,0,0,0,0,0
98,Angola,131,540,2,Government of Angola - UNITA,7,0,0,2,11/15/1994,11/17/1994,1,"Reuters 1994-11-16 ""Angolan civil war foes declare truce."" AND Reuters 1994-11-18 ""Angola's tenuous peace accord in balance again.""",0,1,0,0,UN,11024,0,0,0,0,0,0,0,0,0,0,0,0,0,0,0,0,0,0,0,1,3,1,0,1,0,0,0,0,0,0
99,Angola,131,540,2,Government of Angola - UNITA,7,0,0,2,11/15/1994,11/17/1994,1,"Reuters 1994-11-16 ""Angolan civil war foes declare truce."" AND Reuters 1994-11-18 ""Angola's tenuous peace accord in balance again.""",1,0,0,0,Zambia,551,0,0,0,0,0,0,0,0,0,0,0,0,0,0,0,0,0,0,0,1,0,0,0,0,0,0,1,0,0,0
100,Angola,131,540,2,Government of Angola - UNITA,7,0,0,2,11/19/1994,11/19/1994,1,"Reuters 1994-11-20 ""Southern African leaders meet in Lusaka on Angola.""",7,0,0,0,"Zimbabwe, Zambia, South Africa, Lesotho, Swaziland, Malawi, Tanzania",552,551,560,570,572,553,510,0,0,0,0,0,0,0,0,0,0,0,0,0,7,1,3,0,0,1,0,0,0,0,0
101,Angola,131,540,2,Government of Angola - UNITA,7,0,0,2,11/20/1994,11/20/1994,1,"EIU Country Report 4th quarter 1994, 9ff, AC No 13, 1994, No 24, 1994, Jane\'s World of Defence 1995, 71 AND Reuters 1994-11-20 ""Angolan analysts dubious about peace prospects.""",3,1,0,0,"UN, USA, Russia, Portugal",11024,2,365,235,0,0,0,0,0,0,0,0,0,0,0,0,0,0,0,0,4,3,1,1,0,0,0,0,0,0,0
102,Angola,131,540,2,Government of Angola - UNITA,7,0,0,2,11/20/1994,11/20/1994,1,"EIU Country Report 4th quarter 1994, 9ff, AC No 13, 1994, No 24, 1994, Jane\'s World of Defence 1995, 71 AND Reuters 1994-11-20 ""Angolan analysts dubious about peace prospects.""",1,0,0,0,Zambia,551,0,0,0,0,0,0,0,0,0,0,0,0,0,0,0,0,0,0,0,1,0,0,0,0,0,0,1,0,0,0
103,Angola,131,540,2,Government of Angola - UNITA,7,0,0,2,12/04/1994,12/04/1994,1,"Reuters 1994-12-04 ""U.N. envoy leaves Angola for talks in New York.""",0,1,0,0,UN,11024,0,0,0,0,0,0,0,0,0,0,0,0,0,0,0,0,0,0,0,1,3,1,1,0,0,0,0,0,0,0
104,Angola,131,540,2,Government of Angola - UNITA,7,0,0,2,12/20/1994,12/20/1994,1,"Reuters 1994-12-20 ""Last chance for Angolan peace, U.S. envoy says.""",1,0,0,0,USA,2,0,0,0,0,0,0,0,0,0,0,0,0,0,0,0,0,0,0,0,1,3,2,0,1,0,0,0,0,0,0
105,Angola,131,540,2,Government of Angola - UNITA,7,0,0,2,12/30/1994,12/30/1994,1,"Reuters 1994-12-30 ""Angolan government, UNITA meet U.N. mediators.""",0,1,0,0,UN,11024,0,0,0,0,0,0,0,0,0,0,0,0,0,0,0,0,0,0,0,1,3,2,0,1,1,0,0,0,0,0
106,Angola,131,540,2,Government of Angola - UNITA,7,0,0,1,01/04/1995,01/04/1995,1,"Reuters 1995-01-04 ""Angolan, UNITA rebel military leaders to meet.""",3,1,0,0,"UN, USA, Russia, Portugal",11024,2,365,235,0,0,0,0,0,0,0,0,0,0,0,0,0,0,0,0,4,3,2,0,0,1,0,0,0,0,0
107,Angola,131,540,2,Government of Angola - UNITA,7,0,0,1,01/06/1995,01/06/1995,1,"Reuters 1995-01-06 ""Angolan government, UNITA officials discuss accords.""",3,1,0,0,"UN, USA, Russia, Portugal",11024,2,365,235,0,0,0,0,0,0,0,0,0,0,0,0,0,0,0,0,4,3,1,0,0,1,0,0,0,0,0
108,Angola,131,540,2,Government of Angola - UNITA,7,0,0,1,01/10/1995,01/10/1995,1,"Reuters 1995-01-10 ""Angolan, UNITA military chiefs start peace session.""",3,0,0,0,"USA, Russia, Portugal",2,365,235,0,0,0,0,0,0,0,0,0,0,0,0,0,0,0,0,0,3,3,1,0,1,0,0,0,0,0,0
109,Angola,131,540,2,Government of Angola - UNITA,7,0,0,1,01/16/1995,01/16/1995,1,"Reuters 1995-01-16 ""Angolan commission meets on ceasefire violations.""",0,1,0,0,UN,11024,0,0,0,0,0,0,0,0,0,0,0,0,0,0,0,0,0,0,0,1,3,1,0,1,0,0,0,0,0,0
110,Angola,131,540,2,Government of Angola - UNITA,7,0,0,1,01/26/1995,01/26/1995,1,"Reuters 1995-01-26 ""Angolan foes trade ceasefire violations.""",3,1,0,0,"UN, USA, Russia, Portugal",11024,2,365,235,0,0,0,0,0,0,0,0,0,0,0,0,0,0,0,0,4,3,1,0,1,0,0,0,0,0,0
111,Angola,131,540,2,Government of Angola - UNITA,7,0,0,1,02/01/1995,06/30/1997,6,"Heldt & Wallensteen, p. 44",0,1,0,0,UN,11024,0,0,0,0,0,0,0,0,0,0,0,0,0,0,0,0,0,0,0,1,0,0,0,0,0,0,0,0,0,1
112,Angola,131,540,2,Government of Angola - UNITA,7,0,0,1,02/19/1995,02/19/1995,1,"Reuters 1995-02-20 ""Savimbi meets U.S. and U.N. special envoys.""",1,1,0,0,"UN, USA",11024,2,0,0,0,0,0,0,0,0,0,0,0,0,0,0,0,0,0,0,2,2,3,0,0,0,1,0,0,0,0
113,Angola,131,540,2,Government of Angola - UNITA,7,0,0,1,02/20/1995,02/20/1995,1,"Reuters 1995-02-20 ""U.N. general caught in crossfire in Angola.""",0,1,0,0,UN,11024,0,0,0,0,0,0,0,0,0,0,0,0,0,0,0,0,0,0,0,1,2,3,0,0,0,1,0,0,0,0
114,Angola,131,540,2,Government of Angola - UNITA,7,0,0,1,03/01/1995,03/01/1995,1,"Reuters 1995-03-01 ""U.N. force to monitor Angolan troop disengagement.""",3,1,0,0,"UN, USA, Russia, Portugal",11024,2,365,235,0,0,0,0,0,0,0,0,0,0,0,0,0,0,0,0,4,3,1,0,0,0,1,0,0,0,0
115,Angola,131,540,2,Government of Angola - UNITA,7,0,0,1,03/06/1995,03/12/1995,3,"Reuters 1995-03-10 ""Angolan president says peace process is in danger. """,0,1,0,0,UN,11024,0,0,0,0,0,0,0,0,0,0,0,0,0,0,0,0,0,0,0,1,3,4,0,0,0,1,0,0,0,0
116,Angola,131,540,2,Government of Angola - UNITA,7,0,0,1,04/29/1995,04/29/1995,1,"Reuters 1995-05-01 ""Savimbi says he seeks no specific government post."" AND Reuters 1995-04-28 ""Savimbi to meet Ivorian president on Saturday.""",1,0,0,0,Ivory Coast,437,0,0,0,0,0,0,0,0,0,0,0,0,0,0,0,0,0,0,0,1,2,3,0,0,0,1,0,0,0,0
117,Angola,131,540,2,Government of Angola - UNITA,7,0,0,1,05/02/1995,05/02/1995,1,"Reuters 1995-05-02 ""Moroccan King Hassan meets UNITA leader Savimbi.""",1,0,0,0,Morocco,600,0,0,0,0,0,0,0,0,0,0,0,0,0,0,0,0,0,0,0,1,2,3,0,0,0,1,0,0,0,0
118,Angola,131,540,2,Government of Angola - UNITA,7,0,0,1,05/06/1995,05/06/1995,1,"Reuters 1995-05-06 ""Dos Santos, Savimbi begin Angola peace talks."" AND Reuters 1995-05-07 ""Peace summit seen as crucial step for Angola.",1,0,0,0,Zambia,551,0,0,0,0,0,0,0,0,0,0,0,0,0,0,0,0,0,0,0,1,3,1,0,0,1,0,0,0,0,0
119,Angola,131,540,2,Government of Angola - UNITA,7,0,0,1,05/09/1995,05/12/1995,2,"Reuters 1995-05-11 ""Angolan president visits Sao Tome.""",1,0,0,0,Sao Tome and Principe,403,0,0,0,0,0,0,0,0,0,0,0,0,0,0,0,0,0,0,0,1,1,3,0,0,1,0,0,0,0,0
120,Angola,131,540,2,Government of Angola - UNITA,7,0,0,1,05/17/1995,05/18/1995,1,"Reuters 1995-05-17 ""UNITA's Savimbi in Cape Town for talks with Mandela."" AND Reuters 1995-05-18 ""Savimbi pledge on S.African mercenaries.""",1,0,0,0,South Africa,560,0,0,0,0,0,0,0,0,0,0,0,0,0,0,0,0,0,0,0,1,2,3,0,0,1,0,0,0,0,0
121,Angola,131,540,2,Government of Angola - UNITA,7,0,0,1,06/14/1995,06/14/1995,1,"Reuters 1995-06-15 ""  Savimbi would accept Angolan vice-presidency. """,1,0,0,0,Benin,434,0,0,0,0,0,0,0,0,0,0,0,0,0,0,0,0,0,0,0,1,2,3,0,0,0,1,0,0,0,0
122,Angola,131,540,2,Government of Angola - UNITA,7,0,0,1,06/19/1995,06/22/1995,2,"Reuters 1995-06-19 ""Britain's Baroness Chalker arrives in Angola.""",1,0,0,0,UK,200,0,0,0,0,0,0,0,0,0,0,0,0,0,0,0,0,0,0,0,1,1,3,0,0,0,1,0,0,0,0
123,Angola,131,540,2,Government of Angola - UNITA,7,0,0,1,07/10/1995,07/13/1995,2,"Reuters 1995-07-13 ""Safety fear keeps Savimbi from U.N.talks - diplomats.""",0,1,0,0,UN,11024,0,0,0,0,0,0,0,0,0,0,0,0,0,0,0,0,0,0,0,1,2,3,0,0,1,0,0,0,0,0
124,Angola,131,540,2,Government of Angola - UNITA,7,0,0,1,07/13/1995,07/16/1995,2,"Reuters 1995-07-13 ""Savimbi, fearing for safety, might miss talks.""  AND 1995-07-17 ""Angolan peacekeepers in place by August -- U.N..""",0,1,0,0,UN,11024,0,0,0,0,0,0,0,0,0,0,0,0,0,0,0,0,0,0,0,1,3,2,0,0,0,1,0,0,0,0
125,Angola,131,540,2,Government of Angola - UNITA,7,0,0,1,07/19/1995,07/19/1995,1,"Reuters 1995-07-19 ""U.N. envoy meets Angola's Savimbi.""",0,1,0,0,UN,11024,0,0,0,0,0,0,0,0,0,0,0,0,0,0,0,0,0,0,0,1,2,3,0,0,0,1,0,0,0,0
126,Angola,131,540,2,Government of Angola - UNITA,7,0,0,1,08/10/1995,08/10/1995,1,"Reuters 1995-08-10 ""Angola's rival leaders meet in Gabon."" AND 1995-08-11 ""Savimbi accepts Angolan vice presidency.""",1,0,0,0,Gabon,481,0,0,0,0,0,0,0,0,0,0,0,0,0,0,0,0,0,0,0,1,3,1,1,0,0,0,0,0,0,0
127,Angola,131,540,2,Government of Angola - UNITA,7,0,0,1,10/11/1995,10/11/1995,1,"Reuters 1995-10-11 ""Angola's Savimbi in Zimbabwe to make new friends.""",1,0,0,0,Zimbabwe,552,0,0,0,0,0,0,0,0,0,0,0,0,0,0,0,0,0,0,0,1,2,3,0,0,0,1,0,0,0,0
128,Angola,131,540,2,Government of Angola - UNITA,7,0,0,1,10/13/1995,10/13/1995,1,"Reuters 1995-10-13 ""Angola's Savimbi seeks South African support.""",1,0,0,0,South Africa,560,0,0,0,0,0,0,0,0,0,0,0,0,0,0,0,0,0,0,0,1,2,3,0,0,0,1,0,0,0,0
129,Angola,131,540,2,Government of Angola - UNITA,7,0,0,1,10/14/1995,10/15/1995,1,"Reuters 1995-10-14 ""Angola's Savimbi in Zambia for private talks.""",1,0,0,0,Zambia,551,0,0,0,0,0,0,0,0,0,0,0,0,0,0,0,0,0,0,0,1,2,3,0,0,0,1,0,0,0,0
130,Angola,131,540,2,Government of Angola - UNITA,7,0,0,1,11/25/1995,11/28/1995,2,"Reuters 1995-11-29 ""Angola's Savimbi to move to Luanda in January.""",1,0,0,0,Congo,484,0,0,0,0,0,0,0,0,0,0,0,0,0,0,0,0,0,0,0,1,2,3,0,0,0,1,0,0,0,0
131,Angola,131,540,2,Government of Angola - UNITA,7,0,0,1,12/05/1995,12/08/1995,2,"Reuters 1995-12-07 ""Angolan Leader Visits U.S. Amid Concerns Over Ceasefire."" AND Reuters 1995-12-07 ""U.S. to urge Angola to move on peace.""",1,0,0,0,USA,2,0,0,0,0,0,0,0,0,0,0,0,0,0,0,0,0,0,0,0,1,1,3,0,1,0,0,0,0,0,0
132,Angola,131,540,2,Government of Angola - UNITA,7,0,0,1,12/28/1995,12/28/1995,1,"Reuters 1995-12-29 ""U.N. Investigates Rebel Charges of Angolan Army Offensive""",0,1,0,0,UN,11024,0,0,0,0,0,0,0,0,0,0,0,0,0,0,0,0,0,0,0,1,2,3,0,0,0,1,0,0,0,0
133,Angola,131,540,2,Government of Angola - UNITA,7,0,0,1,12/28/1995,12/28/1995,1,"Reuters 1995-12-29 ""Luanda government in talks over peace pact crisis.""",0,1,0,0,UN,11024,0,0,0,0,0,0,0,0,0,0,0,0,0,0,0,0,0,0,0,1,1,3,0,0,0,1,0,0,0,0
134,Angola,131,540,0,Government of Angola - UNITA,7,0,0,0,01/12/1996,01/12/1996,1,"Reuters 1996-01-12 ""Angola Military Talks Resume After Three-Month Hiatus."" AND 1996-01-12 ""Angolan govt - UNITA agree steps to peace -- U.N..""",3,1,0,0,"UN, USA, Russia, Portugal",11024,2,365,235,0,0,0,0,0,0,0,0,0,0,0,0,0,0,0,0,4,3,1,0,1,0,0,0,0,0,0
135,Angola,131,540,0,Government of Angola - UNITA,7,0,0,0,01/18/1996,01/18/1996,1,"Reuters 1996-01-18 ""Angolan peace talks postponed - dos Santos.""",0,1,0,0,UN,11024,0,0,0,0,0,0,0,0,0,0,0,0,0,0,0,0,0,0,0,1,1,3,0,0,0,1,0,0,0,0
136,Angola,131,540,0,Government of Angola - UNITA,7,0,0,0,01/31/1996,01/31/1996,1,"Reuters 1996-01-31 ""S.African minister discusses Angola mercenary row.""",1,1,0,0,"South Africa, UN",560,11024,0,0,0,0,0,0,0,0,0,0,0,0,0,0,0,0,0,0,2,3,1,0,0,1,0,0,0,0,0
137,Angola,131,540,0,Government of Angola - UNITA,7,0,0,0,02/01/1996,02/01/1996,1,"Reuters 1996-02-05 ""About 5,000 ex-UNITA rebels disarmed - observer.""",0,1,0,0,UN,11024,0,0,0,0,0,0,0,0,0,0,0,0,0,0,0,0,0,0,0,1,2,3,0,0,1,0,0,0,0,0
138,Angola,131,540,0,Government of Angola - UNITA,7,0,0,0,02/05/1996,02/05/1996,1,"Reuters 1995-02-05 ""About 5,000 ex-UNITA rebels disarmed - observer.""",1,0,0,0,USA,2,0,0,0,0,0,0,0,0,0,0,0,0,0,0,0,0,0,0,0,1,1,3,0,0,1,0,0,0,0,0
139,Angola,131,540,0,Government of Angola - UNITA,7,0,0,0,02/20/1996,02/20/1996,1,"Reuters 1996-02-20 ""Savimbi urges Angola government participation.""",1,0,0,0,UK,200,0,0,0,0,0,0,0,0,0,0,0,0,0,0,0,0,0,0,0,1,2,3,0,0,1,0,0,0,0,0
140,Angola,131,540,0,Government of Angola - UNITA,7,0,0,0,02/28/1996,02/28/1996,1,"Reuters 1996-02-28 ""UNITA disarmament dissatifies Angolan government.""",3,1,0,0,"UN, USA, Russia, Portugal",11024,2,365,235,0,0,0,0,0,0,0,0,0,0,0,0,0,0,0,0,4,3,1,0,0,1,0,0,0,0,0
141,Angola,131,540,0,Government of Angola - UNITA,7,0,0,0,03/01/1996,03/01/1996,1,"Reuters 1996-03-01 ""Angola's chief rivals start pact talks in Gabon.""",1,0,0,0,Gabon,481,0,0,0,0,0,0,0,0,0,0,0,0,0,0,0,0,0,0,0,1,0,0,0,0,0,0,1,0,0,0
142,Angola,131,540,0,Government of Angola - UNITA,7,0,0,0,03/18/1996,03/18/1996,1,"Reuters 1996-03-18 ""Savimbi committed to Angola peace, say observers.""",3,1,0,0,"UN, USA, Russia, Portugal",11024,2,365,235,0,0,0,0,0,0,0,0,0,0,0,0,0,0,0,0,4,2,3,0,0,1,0,0,0,0,0
143,Angola,131,540,0,Government of Angola - UNITA,7,0,0,0,06/14/1996,06/17/1996,2,"Reuters 1996-06-17 "" U.N. chief in Angola hold talks with UNITA leader.""",0,1,0,0,UN,11024,0,0,0,0,0,0,0,0,0,0,0,0,0,0,0,0,0,0,0,1,2,3,0,0,1,0,0,0,0,0
144,Angola,131,540,0,Government of Angola - UNITA,7,0,0,0,07/08/1996,07/08/1996,1,"Reuters 1996-07-08 ""Savimbi discusses Angolan peace in S.Africa.""",1,0,0,0,South Africa,560,0,0,0,0,0,0,0,0,0,0,0,0,0,0,0,0,0,0,0,1,2,3,0,0,0,1,0,0,0,0
145,Angola,131,540,0,Government of Angola - UNITA,7,0,0,0,07/11/1996,07/14/1996,1,"Reuters 1996-07-11 ""U.S. envoy arrives in Angola for four-day visit.""",1,0,0,0,USA,2,0,0,0,0,0,0,0,0,0,0,0,0,0,0,0,0,0,0,0,1,3,4,0,0,0,1,0,0,0,0
146,Angola,131,540,0,Government of Angola - UNITA,7,0,0,0,07/16/1996,07/16/1996,1,"Reuters 1996-07-16 ""Angolan selection of UNITA fighters to resume-U.N. """,0,1,0,0,UN,11024,0,0,0,0,0,0,0,0,0,0,0,0,0,0,0,0,0,0,0,1,2,3,0,0,0,1,0,0,0,0
147,Angola,131,540,0,Government of Angola - UNITA,7,0,0,0,09/05/1996,09/05/1996,1,"Reuters 1996-09-09 ""UNITA generals fly to Luanda for army integration.""",0,1,0,0,UN,11024,0,0,0,0,0,0,0,0,0,0,0,0,0,0,0,0,0,0,0,1,2,3,0,0,1,0,0,0,0,0
148,Angola,131,540,0,Government of Angola - UNITA,7,0,0,0,09/07/1996,09/10/1996,2,"Reuters 1996-09-09 ""UNITA generals fly to Luanda for army integration."" AND Reuters 1996-09-10 ""Former rival Angolan generals hug before talks.""",3,1,0,0,"UN, USA, Russia, Portugal",11024,2,365,235,0,0,0,0,0,0,0,0,0,0,0,0,0,0,0,0,4,3,1,0,1,0,0,0,0,0,0
149,Angola,131,540,0,Government of Angola - UNITA,7,0,0,0,09/27/1996,09/27/1996,1,"Reuters 1996-09-27 ""U.N. mediator sees Savimbi on Angola peace deal.""",0,1,0,0,UN,11024,0,0,0,0,0,0,0,0,0,0,0,0,0,0,0,0,0,0,0,1,2,3,0,0,0,1,0,0,0,0
150,Angola,131,540,0,Government of Angola - UNITA,7,0,0,0,10/14/1996,10/14/1996,1,"Reuters 1996-10-14 ""ANGOLA-CHRISTOPHER PRESSES FOR RAPID PEACE AGREEMENT.""",1,0,0,0,USA,2,0,0,0,0,0,0,0,0,0,0,0,0,0,0,0,0,0,0,0,1,1,3,0,0,0,1,0,0,0,0
151,Angola,131,540,0,Government of Angola - UNITA,7,0,0,0,10/15/1996,10/15/1996,1,"Reuters 1996-10-18 ""U.S. says Savimbi statements are positive.""",0,1,0,0,UN,11024,0,0,0,0,0,0,0,0,0,0,0,0,0,0,0,0,0,0,0,1,2,3,0,0,0,1,0,0,0,0
152,Angola,131,540,0,Government of Angola - UNITA,7,0,0,0,01/06/1997,01/08/1997,1,"Reuters 1997-01-06 ""Angolan UNITA leader arrives to see Mandela."" AND 1997-01-08 ""S.Africa says will mediate in Angola dispute.""",1,0,0,0,South Africa,560,0,0,0,0,0,0,0,0,0,0,0,0,0,0,0,0,0,0,0,1,2,3,0,0,0,1,0,0,0,0
153,Angola,131,540,0,Government of Angola - UNITA,7,0,0,0,01/09/1997,01/12/1997,2,"Reuters 1997-01-12 ""S.Africa won't mediate in Angola - Mandela.""",1,0,0,0,South Africa,560,0,0,0,0,0,0,0,0,0,0,0,0,0,0,0,0,0,0,0,1,1,3,0,0,0,1,0,0,0,0
154,Angola,131,540,0,Government of Angola - UNITA,7,0,0,0,01/18/1997,01/21/1997,2,"Reuters 1997-01-20 ""South Africa's Mbeki heads to Angola for talks. """,1,0,0,0,South Africa,560,0,0,0,0,0,0,0,0,0,0,0,0,0,0,0,0,0,0,0,1,3,4,0,0,0,1,0,0,0,0
155,Angola,131,540,0,Government of Angola - UNITA,7,0,0,0,01/20/1997,01/20/1997,1,"Reuters 1997-01-20 ""Angolans doubtful over unity government deadline.""",0,1,0,0,UN,11024,0,0,0,0,0,0,0,0,0,0,0,0,0,0,0,0,0,0,0,1,3,1,0,0,1,0,0,0,0,0
156,Angola,131,540,0,Government of Angola - UNITA,7,0,0,0,01/23/1997,01/23/1997,1,"Reuters 1997-01-24 ""UN says Angola postpones unity government.""",3,1,0,0,"UN, USA, Russia, Portugal",11024,2,365,235,0,0,0,0,0,0,0,0,0,0,0,0,0,0,0,0,4,3,1,0,0,1,0,0,0,0,0
157,Angola,131,540,0,Government of Angola - UNITA,7,0,0,0,06/14/1997,06/17/1997,2,"Reuters 1997-06-17 ""U.N. commanders says Angolan diamond area tense.""",3,1,0,0,"UN, USA, Russia, Portugal",11024,2,365,235,0,0,0,0,0,0,0,0,0,0,0,0,0,0,0,0,4,0,0,0,0,0,0,0,1,0,0
158,Angola,131,540,0,Government of Angola - UNITA,7,0,0,0,07/01/1997,02/28/1999,6,"Heldt & Wallensteen, p. 45",0,1,0,0,UN,11024,0,0,0,0,0,0,0,0,0,0,0,0,0,0,0,0,0,0,0,1,0,0,0,0,0,0,0,0,0,1
159,Angola,131,540,0,Government of Angola - UNITA,7,0,0,0,08/28/1997,08/28/1997,1,"Reuters 1997-08-29 ""UNITA pledges to meet peace demands -U.S. envoy.""",1,0,0,0,USA,2,0,0,0,0,0,0,0,0,0,0,0,0,0,0,0,0,0,0,0,1,2,3,0,0,1,0,0,0,0,0
160,Angola,131,540,0,Government of Angola - UNITA,7,0,0,0,10/31/1997,10/31/1997,1,"Reuters 1997-10-31 ""Angolan government says open to talks with UNITA.""",0,1,0,0,UN,11024,0,0,0,0,0,0,0,0,0,0,0,0,0,0,0,0,0,0,0,1,2,3,0,0,1,0,0,0,0,0
161,Angola,131,540,0,Government of Angola - UNITA,7,0,0,0,11/17/1997,11/23/1997,3,"Reuters 1997-11-25 ""TEN UNITA MEMBERS DIE IN ANGOLA JAIL - U.N.. """,0,1,0,0,UN,11024,0,0,0,0,0,0,0,0,0,0,0,0,0,0,0,0,0,0,0,1,2,3,0,0,1,0,0,0,0,0
162,Angola,131,540,0,Government of Angola - UNITA,7,0,0,0,12/08/1997,12/11/1997,2,"Reuters 1997-12-11 ""U.N. envoy breaks holiday to meet UNITA's Savimbi.""",0,1,0,0,UN,11024,0,0,0,0,0,0,0,0,0,0,0,0,0,0,0,0,0,0,0,1,3,2,0,0,0,1,0,0,0,0
163,Angola,131,540,0,Government of Angola - UNITA,7,0,0,0,12/09/1997,12/12/1997,2,"Reuters 1997-12-12 ""Albright warns Angola's Savimbi of marginalisation.""",1,0,0,0,USA,2,0,0,0,0,0,0,0,0,0,0,0,0,0,0,0,0,0,0,0,1,3,2,0,0,0,1,0,0,0,0
164,Angola,131,540,2,Government of Angola - UNITA,7,0,0,2,02/27/1998,02/27/1998,1,"Reuters 1998-02-28 ""Angola government, U.N. losing patience with UNITA.""",0,1,0,0,UN,11024,0,0,0,0,0,0,0,0,0,0,0,0,0,0,0,0,0,0,0,1,3,1,0,0,1,0,0,0,0,0
165,Angola,131,540,2,Government of Angola - UNITA,7,0,0,2,03/18/1998,03/18/1998,1,"Reuters 1998-03-19 ""UNITA Leader's Bodyguards Registered in Angola.""",0,1,0,0,UN,11024,0,0,0,0,0,0,0,0,0,0,0,0,0,0,0,0,0,0,0,1,2,3,0,0,0,1,0,0,0,0
166,Angola,131,540,2,Government of Angola - UNITA,7,0,0,2,04/28/1998,04/30/1998,1,"Reuters 1998-04-30 ""Mandela Praises Luanda's Efforts for Peace.""",1,0,0,0,South Africa,560,0,0,0,0,0,0,0,0,0,0,0,0,0,0,0,0,0,0,0,1,1,3,0,0,0,1,0,0,0,0
167,Angola,131,540,2,Government of Angola - UNITA,7,0,0,2,05/05/1998,05/08/1998,2,"Reuters 1998-05-08 ""Maneuvers of Unidentified Troops Found in Angola - UN Observers.""",1,0,0,0,Portugal,235,0,0,0,0,0,0,0,0,0,0,0,0,0,0,0,0,0,0,0,1,1,3,0,0,1,0,0,0,0,0
168,Angola,131,540,2,Government of Angola - UNITA,7,0,0,2,06/16/1998,06/16/1998,1,"Reuters 1998-06-16 ""Two U.N. policemen detained by UNITA in Angola."" AND Reuters 1998-06-17 ""Angola's Peace Process Takes Turn for Better.""",0,1,0,0,UN,11024,0,0,0,0,0,0,0,0,0,0,0,0,0,0,0,0,0,0,0,1,2,3,0,0,1,0,0,0,0,0
169,Angola,131,540,2,Government of Angola - UNITA,7,0,0,2,06/17/1998,06/17/1998,1,"Reuters 1998-06-17 ""Angola's Peace Process Takes Turn for Better.""",4,1,0,0,"Benin, UN, USA, Portugal, Russia",434,11024,2,235,365,0,0,0,0,0,0,0,0,0,0,0,0,0,0,0,5,1,3,0,0,1,0,0,0,0,0
170,Angola,131,540,2,Government of Angola - UNITA,7,0,0,2,07/08/1998,07/08/1998,1,"Reuters 1998-07-08 ""UNITA Still Hopes for Peace, UN Official.""",0,1,0,0,UN,11024,0,0,0,0,0,0,0,0,0,0,0,0,0,0,0,0,0,0,0,1,2,3,0,0,1,0,0,0,0,0
171,Angola,131,540,2,Government of Angola - UNITA,7,0,0,2,07/11/1998,07/14/1998,2,"Reuters 1998-07-14 ""African leaders discuss troubled Angola peace.""",2,0,0,0,"Namibia, Democratic Republic of the Congo",565,490,0,0,0,0,0,0,0,0,0,0,0,0,0,0,0,0,0,0,2,1,3,0,0,0,1,0,0,0,0
172,Angola,131,540,2,Government of Angola - UNITA,7,0,0,2,08/03/1998,08/03/1998,1,"Reuters 1998-08-04 ""U.N. envoy meets Angola's Savimbi on war fear.""",0,1,0,0,UN,11024,0,0,0,0,0,0,0,0,0,0,0,0,0,0,0,0,0,0,0,1,1,3,0,0,0,1,0,0,0,0
173,Angola,131,540,2,Government of Angola - UNITA,7,0,0,2,08/04/1998,08/04/1998,1,"Reuters 1998-08-04 ""U.N. envoy meets Angola's Savimbi on war fear.""",0,1,0,0,UN,11024,0,0,0,0,0,0,0,0,0,0,0,0,0,0,0,0,0,0,0,1,2,3,0,0,1,0,0,0,0,0
174,Angola,131,540,2,Government of Angola - UNITA,7,0,0,2,08/07/1998,08/07/1998,1,"Reuters 1998-08-07 ""Angolan Govt Resumes Talks with UNITA.""",0,1,0,0,UN,11024,0,0,0,0,0,0,0,0,0,0,0,0,0,0,0,0,0,0,0,1,3,1,1,0,0,0,0,0,0,0
175,Angola,131,540,2,Government of Angola - UNITA,7,0,0,2,08/13/1998,08/13/1998,1,"Reuters 1998-08-13 ""Angolan Peace Process Makes No Headway.""",0,1,0,0,UN,11024,0,0,0,0,0,0,0,0,0,0,0,0,0,0,0,0,0,0,0,1,3,1,1,0,0,0,0,0,0,0
176,Angola,131,540,2,Government of Angola - UNITA,7,0,0,2,10/30/1998,10/30/1998,1,"Reuters 1998-10-30 ""U.S. urges UNITA, government to uphold Angola peace.""",1,0,0,0,USA,2,0,0,0,0,0,0,0,0,0,0,0,0,0,0,0,0,0,0,0,1,1,3,0,0,0,1,0,0,0,0
177,Angola,131,540,2,Government of Angola - UNITA,7,0,0,2,12/02/1998,12/02/1998,1,"Reuters 1998-12-02 ""Angola Agrees to Extension of U.N. Observers' Term.""",3,1,0,0,"UN, USA, Russia, Portugal",11024,2,365,235,0,0,0,0,0,0,0,0,0,0,0,0,0,0,0,0,4,1,3,0,0,1,0,0,0,0,0
178,Angola,131,540,2,Government of Angola - UNITA,7,0,0,2,01/05/1999,01/05/1999,1,"Reuters 1999-01-05 ""FOCUS-U.N. demands complete ceasefire in Angola.""",0,1,0,0,UN,11024,0,0,0,0,0,0,0,0,0,0,0,0,0,0,0,0,0,0,0,1,1,3,0,0,1,0,0,0,0,0
179,Angola,131,540,2,Government of Angola - UNITA,7,0,0,2,06/13/1999,06/13/1999,1,"Reuters 1999-06-13 ""U.N. says Angola sanctions may take time to work.""",0,1,0,0,UN,11024,0,0,0,0,0,0,0,0,0,0,0,0,0,0,0,0,0,0,0,1,1,3,0,0,1,0,0,0,0,0
180,Angola,131,540,2,Government of Angola - UNITA,7,0,0,2,06/18/1999,06/18/1999,1,"Xinhua 1999-06-18 ""Angolan FM Holds Talks with Former U.N. Special Envoy.""",0,1,0,0,UN,11024,0,0,0,0,0,0,0,0,0,0,0,0,0,0,0,0,0,0,0,1,1,3,0,0,1,0,0,0,0,0
181,Angola,131,540,2,Government of Angola - UNITA,7,0,0,2,09/28/1999,09/28/1999,1,"Reuters 1999-09-28 ""S.Africa's Mbeki in talks with Angolan officials."" AND Reuters 1999-09-30 ""S.Africa prods Angola on peace talks to end war.""",1,0,0,0,South Africa,560,0,0,0,0,0,0,0,0,0,0,0,0,0,0,0,0,0,0,0,1,1,3,0,0,1,0,0,0,0,0
182,Angola,131,540,2,Government of Angola - UNITA,7,0,0,2,12/01/1999,12/15/1999,4,"Reuters 1999-12-15 ""Senior U.S. official arrives in Angola for talks.""",1,0,0,0,USA,2,0,0,0,0,0,0,0,0,0,0,0,0,0,0,0,0,0,0,0,1,1,3,0,0,0,1,0,0,0,0
183,Angola,131,540,2,Government of Angola - UNITA,7,0,0,2,12/15/1999,12/15/1999,1,"Reuters 1999-12-15 ""Senior U.S. official arrives in Angola for talks.""",1,0,0,0,USA,2,0,0,0,0,0,0,0,0,0,0,0,0,0,0,0,0,0,0,0,1,1,3,0,0,1,0,0,0,0,0
184,Angola,131,540,2,Government of Angola - UNITA,7,0,0,2,01/01/2001,12/31/2001,5,"Reuters 2001-06-14 ""U.S. Admits Contact with UNITA Representatives.""",1,0,0,0,USA,2,0,0,0,0,0,0,0,0,0,0,0,0,0,0,0,0,0,0,0,1,2,3,0,0,0,1,0,0,0,0
185,Angola,131,540,2,Government of Angola - UNITA,7,0,0,2,05/18/2001,05/18/2001,1,"Reuters 2001-05-18 ""U.N. envoys back Angola's president against UNITA.""",0,1,0,0,UN,11024,0,0,0,0,0,0,0,0,0,0,0,0,0,0,0,0,0,0,0,1,1,3,0,0,1,0,0,0,0,0
186,Angola,131,540,2,Government of Angola - UNITA,7,0,0,2,09/20/2001,09/20/2001,1,"Reuters 2001-09-21 ""UN asks Angola rebels to end attacks on civilians.""",0,1,0,0,UN,11024,0,0,0,0,0,0,0,0,0,0,0,0,0,0,0,0,0,0,0,1,1,3,0,0,0,1,0,0,0,0
187,Angola,131,540,2,Government of Angola - UNITA,7,0,0,2,10/12/2001,10/12/2001,1,"Reuters 2001-10-12 ""Angolan FM, Troika Observers Discuss Peace Process.""",3,0,0,0,"USA, Russia, Portugal",2,365,235,0,0,0,0,0,0,0,0,0,0,0,0,0,0,0,0,0,3,1,3,0,0,1,0,0,0,0,0
188,Angola,131,540,2,Government of Angola - UNITA,7,0,0,1,01/01/2002,02/15/2002,5,"Reuters 2002-02-15 ""UN tries to revive peace talks to end Angolan war.""",0,1,0,0,UN,11024,0,0,0,0,0,0,0,0,0,0,0,0,0,0,0,0,0,0,0,1,2,3,0,0,1,0,0,0,0,0
189,Angola,131,540,2,Government of Angola - UNITA,7,0,0,1,02/24/2002,02/24/2002,1,"Reuters 2002-02-24 ""UPDATE 5-Angolan leader seeks rapid steps to ceasefire.""",1,0,0,0,Portugal,235,0,0,0,0,0,0,0,0,0,0,0,0,0,0,0,0,0,0,0,1,1,3,0,1,0,0,0,0,0,0
190,Angola,131,540,2,Government of Angola - UNITA,7,0,0,1,02/26/2002,02/26/2002,1,"Reuters 2002-02-27 ""Bush calls for cease-fire in Angola."" AND Reuters 2002-02-27 ""Angola's Dos Santos renews call for ceasefire [Corrected 02/26/02]""",1,0,0,0,USA,2,0,0,0,0,0,0,0,0,0,0,0,0,0,0,0,0,0,0,0,1,1,3,0,1,0,0,0,0,0,0
191,Angola,131,540,2,Government of Angola - UNITA,7,0,0,1,03/14/2002,03/14/2002,1,"Reuters 2002-03-14 ""UPDATE 2-Angola offers UNITA rebels truce as olive branch.""",0,1,0,0,UN,11024,0,0,0,0,0,0,0,0,0,0,0,0,0,0,0,0,0,0,0,1,1,3,0,1,0,0,0,0,0,0
192,Angola,131,540,2,Government of Angola - UNITA,7,0,0,1,03/18/2002,03/18/2002,1,"Xinhua 2002-03-18 ""UN to Mediate Peace Process in Angola After Signing Ceasefire Accord.""",0,1,0,0,UN,11024,0,0,0,0,0,0,0,0,0,0,0,0,0,0,0,0,0,0,0,1,1,3,0,0,1,0,0,0,0,0
193,Angola,131,540,2,Government of Angola - UNITA,7,0,0,1,03/26/2002,03/26/2002,1,"AFP 2002-03-27 ""Britain urges ""transparent"" Angolan peace talks.""",1,0,0,0,UK,200,0,0,0,0,0,0,0,0,0,0,0,0,0,0,0,0,0,0,0,1,1,3,0,0,0,1,0,0,0,0
194,Angola,131,540,2,Government of Angola - UNITA,7,0,0,1,03/30/2002,03/30/2002,1,"Reuters 2002-03-30 ""UPDATE 2-Angola armed forces, rebels sign ceasefire - report.""",3,1,0,0,"UN, USA, Russia, Portugal",11024,2,365,235,0,0,0,0,0,0,0,0,0,0,0,0,0,0,0,0,4,3,1,0,1,0,0,0,0,0,0
195,Angola,131,540,2,Government of Angola - UNITA,7,0,0,1,04/04/2002,04/04/2002,1,"AFP 2002-04-04 ""Angolan army and rebels sign a ceasefire [Corrected 04/04/02]""",3,1,0,0,"UN, USA, Russia, Portugal",11024,2,365,235,0,0,0,0,0,0,0,0,0,0,0,0,0,0,0,0,4,3,1,0,1,0,0,0,0,0,0
196,Angola,131,540,2,Government of Angola - UNITA,7,0,0,1,04/10/2002,04/10/2002,1,"Xinhua 2002-04-10 ""Angolan Army, UNITA Hold 1st Meeting of Joint Military Commission.""",3,1,0,0,"UN, USA, Russia, Portugal",11024,2,365,235,0,0,0,0,0,0,0,0,0,0,0,0,0,0,0,0,4,3,1,0,0,1,0,0,0,0,0
197,Angola,131,540,2,Government of Angola - UNITA,7,0,0,1,04/17/2002,04/17/2002,1,"Xinhua 2002-04-18 ""Angolan Peace Accord Respected With Smooth Followup.""",3,0,0,0,"USA, Russia, Portugal",2,365,235,0,0,0,0,0,0,0,0,0,0,0,0,0,0,0,0,0,3,3,1,0,1,0,0,0,0,0,0
198,Angola,131,540,2,Government of Angola - UNITA,7,0,0,1,04/27/2002,04/30/2002,2,"AFP 2002-04-30 ""Portuguese military observers due in Angola: foreign minister.""",1,0,0,0,Portugal,235,0,0,0,0,0,0,0,0,0,0,0,0,0,0,0,0,0,0,0,1,1,3,0,0,0,1,0,0,0,0
199,Angola,131,540,2,Government of Angola - UNITA,7,0,0,1,08/26/2002,08/26/2002,1,"Xinhua 2002-08-26 ""Joint commission holds first meeting in Angola.""",3,1,0,0,"UN, USA, Russia, Portugal",11024,2,365,235,0,0,0,0,0,0,0,0,0,0,0,0,0,0,0,0,4,3,1,0,0,1,0,0,0,0,0
200,Angola,131,540,2,Government of Angola - UNITA,7,0,0,1,09/05/2002,09/05/2002,1,"AP 2002-09-05 ""Powell urges Angola to maintain cease-fire, make better use of its oil wealth.""",1,0,0,0,USA,2,0,0,0,0,0,0,0,0,0,0,0,0,0,0,0,0,0,0,0,1,1,3,0,0,0,1,0,0,0,0
201,Angola,131,540,2,Government of Angola - UNITA,7,0,0,1,09/05/2002,09/05/2002,1,"AP 2002-09-05 ""Powell urges Angola to maintain cease-fire, make better use of its oil wealth.""",1,1,0,0,"UN, USA",11024,2,0,0,0,0,0,0,0,0,0,0,0,0,0,0,0,0,0,0,2,3,1,0,0,0,1,0,0,0,0
202,Angola,131,540,2,Government of Angola - UNITA,7,0,0,1,09/16/2002,11/21/2002,1,"Xinhua 2002-09-16 ""UN opens new round of Angolan peace talks."" AND Xinhua 2002-09-16 ""UN to make all efforts to consolidate peace in Angola - UN representative."" AND  Xinhua 2002-11-21 ""Joint commission for implementing peace accord in Angola dissolved."" AND AP 2002-11-21 ""U.N.-brokered peace deal implemented in Angola; parties call for lifting of sanctions against rebels.""",3,1,0,0,"UN, USA, Russia, Portugal",11024,2,365,235,0,0,0,0,0,0,0,0,0,0,0,0,0,0,0,0,4,3,1,1,0,0,0,0,0,0,0
203,Angola,131,540,0,0,9540,0,1,0,01/13/2003,01/16/2003,2,"All Africa 2003-01-16 ""UN Human Rights Chief Expresses Solidarity With People.""",0,1,0,0,UN,11024,0,0,0,0,0,0,0,0,0,0,0,0,0,0,0,0,0,0,0,1,1,3,0,0,1,0,0,0,0,0
204,Angola (Cabinda),192,540,0,Government of Angola - FLEC-R,191,0,0,0,08/01/1993,08/31/1993,4,"UCDP database/dyads: Africa Confidential, Vol 35, Nr 19",1,0,0,0,Gabon,481,0,0,0,0,0,0,0,0,0,0,0,0,0,0,0,0,0,0,0,1,0,0,0,0,0,0,1,0,0,0
205,Angola (Cabinda),192,540,1,Government of Angola - FLEC-FAC,190,0,0,1,02/01/1994,02/28/1994,4,"AC Vol 35, No 19, 5",1,0,0,0,France,220,0,0,0,0,0,0,0,0,0,0,0,0,0,0,0,0,0,0,0,1,3,1,0,1,1,0,0,0,0,0
206,Angola (Cabinda),192,540,0,Government of Angola - FLEC-R,191,0,0,0,06/01/1995,06/30/1995,4,"AC Vol 37, No 1, 6f, EIU 4th quarter 1995, 14,",1,0,0,0,Ethiopia,530,0,0,0,0,0,0,0,0,0,0,0,0,0,0,0,0,0,0,0,1,3,0,0,0,0,0,1,0,0,0
207,Angola (Cabinda),192,540,0,Government of Angola - FLEC-R,191,0,0,0,06/01/1995,07/01/1995,4,"AC Vol 37, No 1, 6f, EIU 4th quarter 1995, 14,",1,0,0,0,Namibia,565,0,0,0,0,0,0,0,0,0,0,0,0,0,0,0,0,0,0,0,1,3,2,0,1,1,0,0,0,0,0
208,Angola (Cabinda),192,540,0,Government of Angola - FLEC-R,191,0,0,0,08/01/1995,08/31/1995,4,"AC Vol 37, No 1, 6f, EIU 4th quarter 1995, 14,",1,0,0,0,Namibia,565,0,0,0,0,0,0,0,0,0,0,0,0,0,0,0,0,0,0,0,1,3,2,0,1,0,0,0,0,0,0
209,Angola (Cabinda),192,540,0,Government of Angola - FLEC-R,191,0,0,0,09/01/1995,09/30/1995,4,"AC Vol 37, No 1, 6f, EIU 4th quarter 1995, 14,",1,0,0,0,Congo,484,0,0,0,0,0,0,0,0,0,0,0,0,0,0,0,0,0,0,0,1,3,0,0,0,0,0,1,0,0,0
210,Angola (Cabinda),192,540,0,Government of Angola - FLEC-FAC,190,1,0,0,09/18/1995,09/18/1995,1,"DJTES 1995-09-18, ""Congolese, Angolan Leaders To Discuss Oil-Rich Enclave""",1,0,0,0,Congo,484,0,0,0,0,0,0,0,0,0,0,0,0,0,0,0,0,0,0,0,1,1,3,0,0,1,0,0,0,0,0
211,Angola (Cabinda),192,540,0,Government of Angola - FLEC-R,191,1,0,0,09/18/1995,09/18/1995,1,"DJTES 1995-09-18, ""Congolese, Angolan Leaders To Discuss Oil-Rich Enclave""",1,0,0,0,Congo,484,0,0,0,0,0,0,0,0,0,0,0,0,0,0,0,0,0,0,0,1,1,3,0,0,1,0,0,0,0,0
212,Angola (Cabinda),192,540,0,Government of Angola - FLEC-R,191,0,0,0,01/09/1996,01/12/1996,2,"Reuters 1996-01-12 ""Angolan team in Namibia for talks with separatists.""",1,0,0,0,Namibia,565,0,0,0,0,0,0,0,0,0,0,0,0,0,0,0,0,0,0,0,1,0,0,0,0,0,0,1,0,0,0
213,Angola (Cabinda),192,540,0,Government of Angola - FLEC-R,191,0,0,0,02/01/1996,02/29/1996,4,"UCDP database/dyad: ARB April 1996, 12233, (AND AC Vol 38, No 8)",1,0,0,0,Namibia,565,0,0,0,0,0,0,0,0,0,0,0,0,0,0,0,0,0,0,0,1,0,0,0,0,0,0,1,0,0,0
214,Angola (Cabinda),192,540,0,Government of Angola - FLEC-R,191,0,0,0,02/24/1996,02/27/1996,2,"BBC 1996-02-27 ""PROVINCIAL GOVERNOR SAYS CABINDA PEACE PROCESS ON TRACK."" AND  (Africa Confidential, Vol 38, No 5) AND Africa Research Bulletin, Vol 1996, No 12233",1,0,0,0,Congo,484,0,0,0,0,0,0,0,0,0,0,0,0,0,0,0,0,0,0,0,1,0,0,0,0,0,0,1,0,0,0
215,Angola (Cabinda),192,540,0,Government of Angola - FLEC-R,191,0,0,0,04/10/1996,04/10/1996,1,"ARB April, 1996, no 12233",1,0,0,0,Namibia,565,0,0,0,0,0,0,0,0,0,0,0,0,0,0,0,0,0,0,0,1,0,0,0,0,0,0,1,0,0,0
216,Angola (Cabinda),192,540,1,Government of Angola - FLEC-FAC,190,0,0,1,05/01/1996,05/31/1996,4,"AC Vol 38, No 8, 5, BBC Monitoring Service 6 January 1996, BBC Monitoring Service 2 July 1996, ARB April 1996, 12233, ARB July 1996, 12343",1,0,0,0,Congo,484,0,0,0,0,0,0,0,0,0,0,0,0,0,0,0,0,0,0,0,1,3,0,0,0,0,0,1,0,0,0
217,Angola (Cabinda),192,540,1,Government of Angola - FLEC-FAC,190,0,0,1,07/22/1996,07/22/1996,1,"AC Vol 38, No 8, 5, BBC Monitoring Service 6 January 1996, BBC Monitoring Service 2 July 1996, ARB April 1996, 12233, ARB July 1996, 12343",1,0,0,0,Gabon,481,0,0,0,0,0,0,0,0,0,0,0,0,0,0,0,0,0,0,0,1,3,0,0,0,0,0,1,0,0,0
218,Angola (Cabinda),192,540,1,Government of Angola - FLEC-FAC,190,0,0,1,12/09/1997,12/09/1997,1,"Reuters 1997-12-09, ""Angolan government moves to tighten borders""",1,0,0,0,Zambia,551,0,0,0,0,0,0,0,0,0,0,0,0,0,0,0,0,0,0,0,1,1,3,0,0,1,0,0,0,0,0
219,Angola (Cabinda),192,540,1,Government of Angola - FLEC-FAC,190,0,0,1,12/09/1997,12/09/1997,1,"Reuters 1997-12-09, ""Angolan government moves to tighten borders""",1,0,0,0,Congo,484,0,0,0,0,0,0,0,0,0,0,0,0,0,0,0,0,0,0,0,1,1,3,0,0,1,0,0,0,0,0
220,Angola (Cabinda),192,540,1,Government of Angola - FLEC-R,191,0,0,1,12/09/1997,12/09/1997,1,"Reuters 1997-12-09, ""Angolan government moves to tighten borders""",1,0,0,0,Zambia,551,0,0,0,0,0,0,0,0,0,0,0,0,0,0,0,0,0,0,0,1,1,3,0,0,1,0,0,0,0,0
221,Angola (Cabinda),192,540,1,Government of Angola - FLEC-R,191,0,0,1,12/09/1997,12/09/1997,1,"Reuters 1997-12-09, ""Angolan government moves to tighten borders""",1,0,0,0,Congo,484,0,0,0,0,0,0,0,0,0,0,0,0,0,0,0,0,0,0,0,1,1,3,0,0,1,0,0,0,0,0
222,Angola (Cabinda),192,540,0,Government of Angola - FLEC-FAC,190,0,0,0,01/09/2003,01/09/2003,1,"UN Integrated Regional Information Networks/All Africa Global Media via COMTEX 2003-02-11, ""Cabinda Seperatists Confirm ""Exploratory"" Talks With Government""",1,0,0,0,France,220,0,0,0,0,0,0,0,0,0,0,0,0,0,0,0,0,0,0,0,1,3,0,0,0,0,0,1,0,0,0
223,Angola (Cabinda),192,540,0,Government of Angola - FLEC-FAC,190,0,0,0,01/15/2003,01/15/2003,1,"AFP 2003-01-15, ""Angolan, Congolese leaders hold regional security summit""",2,0,0,0,"Congo, Democratic Republic of the Congo",484,490,0,0,0,0,0,0,0,0,0,0,0,0,0,0,0,0,0,0,2,1,3,0,0,1,0,0,0,0,0
224,Angola (Cabinda),192,540,0,Government of Angola - FLEC-R,191,0,0,0,01/15/2003,01/15/2003,1,"AFP 2003-01-15, ""Angolan, Congolese leaders hold regional security summit""",2,0,0,0,"Congo, Democratic Republic of the Congo",484,490,0,0,0,0,0,0,0,0,0,0,0,0,0,0,0,0,0,0,2,1,3,0,0,1,0,0,0,0,0
225,Angola (Cabinda),192,540,0,Government of Angola - FLEC-FAC,190,0,0,0,11/25/2003,11/25/2003,1,"AP 2003-11-26, ""Congo Neighbors To Help Angola End Cabinda Rebellion""",2,0,0,0,"Congo, Democratic Republic of the Congo",484,490,0,0,0,0,0,0,0,0,0,0,0,0,0,0,0,0,0,0,2,1,3,0,0,1,0,0,0,0,0
226,Angola (Cabinda),192,540,0,Government of Angola - FLEC-R,191,0,0,0,11/25/2003,11/25/2003,1,"AP 2003-11-26, ""Congo Neighbors To Help Angola End Cabinda Rebellion""",2,0,0,0,"Congo, Democratic Republic of the Congo",484,490,0,0,0,0,0,0,0,0,0,0,0,0,0,0,0,0,0,0,2,1,3,0,0,1,0,0,0,0,0
227,Burundi,90,516,0,Government of Burundi - Palipehutu,11,1,0,0,12/06/1994,12/06/1994,1,"Reuters 1994-12-06, ""Burundi and Rwanda seek to stem border violence""",1,0,0,0,Rwanda,517,0,0,0,0,0,0,0,0,0,0,0,0,0,0,0,0,0,0,0,1,1,3,0,1,1,0,0,0,0,0
228,Burundi,90,516,2,Government of Burundi - CNDD,12,1,0,1,12/06/1994,12/06/1994,1,"Reuters 1994-12-06, ""Burundi and Rwanda seek to stem border violence""",1,0,0,0,Rwanda,517,0,0,0,0,0,0,0,0,0,0,0,0,0,0,0,0,0,0,0,1,1,3,0,1,1,0,0,0,0,0
229,Burundi,90,516,0,Government of Burundi - Palipehutu,11,1,0,0,02/08/1995,02/12/1995,1,"Reuters 1995-02-06, ""UN Council sends mission to Burundi, Rwanda""",0,1,0,0,UN,11024,0,0,0,0,0,0,0,0,0,0,0,0,0,0,0,0,0,0,0,1,0,0,0,0,0,0,0,1,0,0
230,Burundi,90,516,2,Government of Burundi - CNDD,12,1,0,1,02/08/1995,02/12/1995,1,"Reuters 1995-02-06, ""UN Council sends mission to Burundi, Rwanda""",0,1,0,0,UN,11024,0,0,0,0,0,0,0,0,0,0,0,0,0,0,0,0,0,0,0,1,0,0,0,0,0,0,0,1,0,0
231,Burundi,90,516,0,Government of Burundi - Palipehutu,11,1,0,0,02/15/1995,02/15/1995,1,"Reuters 1995-02-18, ""Rwanda refugee talks protected from ethnic hatred""",1,2,0,0,"USA, AU, UN",2,11000,11024,0,0,0,0,0,0,0,0,0,0,0,0,0,0,0,0,0,3,1,3,0,0,1,0,0,0,0,0
232,Burundi,90,516,2,Government of Burundi - CNDD,12,1,0,1,02/15/1995,02/15/1995,1,"Reuters 1995-02-18, ""Rwanda refugee talks protected from ethnic hatred""",1,2,0,0,"USA, AU, UN",2,11000,11024,0,0,0,0,0,0,0,0,0,0,0,0,0,0,0,0,0,3,1,3,0,0,1,0,0,0,0,0
233,Burundi,90,516,0,Government of Burundi - Palipehutu,11,1,0,0,02/19/1995,02/19/1995,1,"Reuters 1995-02-19, ""Burundi president warns of potential holocaust""",0,1,0,0,AU,11000,0,0,0,0,0,0,0,0,0,0,0,0,0,0,0,0,0,0,0,1,1,3,0,1,0,0,0,0,0,0
234,Burundi,90,516,2,Government of Burundi - CNDD,12,1,0,1,02/19/1995,02/19/1995,1,"Reuters 1995-02-19, ""Burundi president warns of potential holocaust""",0,1,0,0,AU,11000,0,0,0,0,0,0,0,0,0,0,0,0,0,0,0,0,0,0,0,1,1,3,0,1,0,0,0,0,0,0
235,Burundi,90,516,0,Government of Burundi - Palipehutu,11,1,0,0,05/17/1995,05/17/1995,1,"Reuters 1995-05-17, ""Burundi prime minister in Zaire for refugee talks""",1,0,0,0,Democratic Republic of the Congo,490,0,0,0,0,0,0,0,0,0,0,0,0,0,0,0,0,0,0,0,1,1,3,0,0,1,0,0,0,0,0
236,Burundi,90,516,2,Government of Burundi - CNDD,12,1,0,1,05/17/1995,05/17/1995,1,"Reuters 1995-05-17, ""Burundi prime minister in Zaire for refugee talks""",1,0,0,0,Democratic Republic of the Congo,490,0,0,0,0,0,0,0,0,0,0,0,0,0,0,0,0,0,0,0,1,1,3,0,0,1,0,0,0,0,0
237,Burundi,90,516,0,Government of Burundi - Palipehutu,11,1,0,0,06/12/1995,06/12/1995,1,"Reuters 1995-06-14, ""Gunmen ambush U.S., OAU diplomats; Burundi foreign minister""",0,2,0,0,"AU, UN",11000,11024,0,0,0,0,0,0,0,0,0,0,0,0,0,0,0,0,0,0,2,1,3,0,0,1,0,0,0,0,0
238,Burundi,90,516,2,Government of Burundi - CNDD,12,1,0,1,06/12/1995,06/12/1995,1,"Reuters 1995-06-14, ""Gunmen ambush U.S., OAU diplomats; Burundi foreign minister""",0,2,0,0,"AU, UN",11000,11024,0,0,0,0,0,0,0,0,0,0,0,0,0,0,0,0,0,0,2,1,3,0,0,1,0,0,0,0,0
239,Burundi,90,516,0,Government of Burundi - Palipehutu,11,1,0,0,07/16/1995,07/16/1995,1,"Reuters 1995-07-17, ""U.N. chief warns Burundi it risks civil war""",0,1,0,0,UN,11024,0,0,0,0,0,0,0,0,0,0,0,0,0,0,0,0,0,0,0,1,1,3,0,0,1,0,0,0,0,0
240,Burundi,90,516,2,Government of Burundi - CNDD,12,1,0,1,07/16/1995,07/16/1995,1,"Reuters 1995-07-17, ""U.N. chief warns Burundi it risks civil war""",0,1,0,0,UN,11024,0,0,0,0,0,0,0,0,0,0,0,0,0,0,0,0,0,0,0,1,1,3,0,0,1,0,0,0,0,0
241,Burundi,90,516,0,Government of Burundi - Palipehutu,11,1,0,0,09/02/1995,09/02/1995,1,"Reuters 1995-09-02, ""U.N. refugee agency chief in Burundi talks""",0,1,0,0,UN,11024,0,0,0,0,0,0,0,0,0,0,0,0,0,0,0,0,0,0,0,1,1,3,0,0,1,0,0,0,0,0
242,Burundi,90,516,2,Government of Burundi - CNDD,12,1,0,1,09/02/1995,09/02/1995,1,"Reuters 1995-09-02, ""U.N. refugee agency chief in Burundi talks""",0,1,0,0,UN,11024,0,0,0,0,0,0,0,0,0,0,0,0,0,0,0,0,0,0,0,1,1,3,0,0,1,0,0,0,0,0
243,Burundi,90,516,0,Government of Burundi - Palipehutu,11,1,0,0,10/01/1995,10/31/1995,4,"Reuters 1995-10-27, ""Burundi minister vows ""merciless war' on extremists""",0,0,1,1,The Sant' Egidio Community,12033,0,0,0,0,0,0,0,0,0,0,0,0,0,0,0,0,0,0,0,1,1,3,0,0,0,1,0,0,0,0
244,Burundi,90,516,0,Government of Burundi - Palipehutu,11,1,0,0,10/01/1995,10/31/1995,4,"Reuters 1995-10-27, ""Burundi minister vows ""merciless war' on extremists""",1,0,0,0,Italy,325,0,0,0,0,0,0,0,0,0,0,0,0,0,0,0,0,0,0,0,1,1,0,0,0,0,0,1,0,0,0
245,Burundi,90,516,2,Government of Burundi - CNDD,12,1,0,1,10/01/1995,10/31/1995,4,"Reuters 1995-10-27, ""Burundi minister vows ""merciless war' on extremists""",0,0,1,1,The Sant' Egidio Community,12033,0,0,0,0,0,0,0,0,0,0,0,0,0,0,0,0,0,0,0,1,1,3,0,0,0,1,0,0,0,0
246,Burundi,90,516,2,Government of Burundi - CNDD,12,1,0,1,10/01/1995,10/31/1995,4,"Reuters 1995-10-27, ""Burundi minister vows ""merciless war' on extremists""",1,0,0,0,Italy,325,0,0,0,0,0,0,0,0,0,0,0,0,0,0,0,0,0,0,0,1,1,0,0,0,0,0,1,0,0,0
247,Burundi,90,516,0,Government of Burundi - Palipehutu,11,1,0,0,10/31/1995,10/31/1995,1,"Reuters 1995-10-31, ""Burundi president wants conference on refugees""",1,0,0,0,France,220,0,0,0,0,0,0,0,0,0,0,0,0,0,0,0,0,0,0,0,1,1,3,0,0,1,0,0,0,0,0
248,Burundi,90,516,2,Government of Burundi - CNDD,12,1,0,1,10/31/1995,10/31/1995,1,"Reuters 1995-10-31, ""Burundi president wants conference on refugees""",1,0,0,0,France,220,0,0,0,0,0,0,0,0,0,0,0,0,0,0,0,0,0,0,0,1,1,3,0,0,1,0,0,0,0,0
249,Burundi,90,516,0,Government of Burundi - Palipehutu,11,1,0,0,11/20/1995,11/20/1995,1,"Reuters 1995-11-20, ""Carter in talks with Burundi leaders""",0,0,1,0,Jimmy Carter,12018,0,0,0,0,0,0,0,0,0,0,0,0,0,0,0,0,0,0,0,1,1,3,0,0,1,0,0,0,0,0
250,Burundi,90,516,2,Government of Burundi - CNDD,12,1,0,1,11/20/1995,11/20/1995,1,"Reuters 1995-11-20, ""Carter in talks with Burundi leaders""",0,0,1,0,Jimmy Carter,12018,0,0,0,0,0,0,0,0,0,0,0,0,0,0,0,0,0,0,0,1,1,3,0,0,1,0,0,0,0,0
251,Burundi,90,516,0,Government of Burundi - Palipehutu,11,1,0,0,11/28/1995,11/28/1995,1,"Reuters 1995-11-27, ""Central African leaders arriving for Cairo summit""",0,0,1,0,Jimmy Carter,12018,0,0,0,0,0,0,0,0,0,0,0,0,0,0,0,0,0,0,0,1,1,3,0,0,1,0,0,0,0,0
252,Burundi,90,516,0,Government of Burundi - Palipehutu,11,1,0,0,11/28/1995,11/28/1995,1,"Reuters 1995-11-27, ""Central African leaders arriving for Cairo summit""",1,0,0,0,Egypt,651,0,0,0,0,0,0,0,0,0,0,0,0,0,0,0,0,0,0,0,1,1,0,0,0,0,0,1,0,0,0
253,Burundi,90,516,2,Government of Burundi - CNDD,12,1,0,1,11/28/1995,11/28/1995,1,"Reuters 1995-11-27, ""Central African leaders arriving for Cairo summit""",0,0,1,0,Jimmy Carter,12018,0,0,0,0,0,0,0,0,0,0,0,0,0,0,0,0,0,0,0,1,1,3,0,0,1,0,0,0,0,0
254,Burundi,90,516,2,Government of Burundi - CNDD,12,1,0,1,11/28/1995,11/28/1995,1,"Reuters 1995-11-27, ""Central African leaders arriving for Cairo summit""",1,0,0,0,Egypt,651,0,0,0,0,0,0,0,0,0,0,0,0,0,0,0,0,0,0,0,1,1,0,0,0,0,0,1,0,0,0
255,Burundi,90,516,0,Government of Burundi - Palipehutu,11,1,0,0,12/15/1995,12/15/1995,1,"Reuters 1995-12-16, ""Tanzania's Mkapa in Burundi, Rwanda refugee deal""",1,0,0,0,Tajikistan,702,0,0,0,0,0,0,0,0,0,0,0,0,0,0,0,0,0,0,0,1,1,3,0,0,1,0,0,0,0,0
256,Burundi,90,516,2,Government of Burundi - CNDD,12,1,0,1,12/15/1995,12/15/1995,1,"Reuters 1995-12-16, ""Tanzania's Mkapa in Burundi, Rwanda refugee deal""",1,0,0,0,Tajikistan,702,0,0,0,0,0,0,0,0,0,0,0,0,0,0,0,0,0,0,0,1,1,3,0,0,1,0,0,0,0,0
257,Burundi,90,516,0,Government of Burundi - Palipehutu,11,1,0,0,12/22/1995,12/23/1995,1,"Reuters 1995-12-22, ""Burundi president in Rwanda for security talks""",1,0,0,0,Rwanda,517,0,0,0,0,0,0,0,0,0,0,0,0,0,0,0,0,0,0,0,1,1,3,0,0,1,0,0,0,0,0
258,Burundi,90,516,2,Government of Burundi - CNDD,12,1,0,1,12/22/1995,12/23/1995,1,"Reuters 1995-12-22, ""Burundi president in Rwanda for security talks""",1,0,0,0,Rwanda,517,0,0,0,0,0,0,0,0,0,0,0,0,0,0,0,0,0,0,0,1,1,3,0,0,1,0,0,0,0,0
259,Burundi,90,516,2,Government of Burundi - CNDD,12,0,0,1,01/01/1996,12/31/1996,5,"Reuters 1996-03-13, ""Tunis summit could herald Burundi talks""",0,0,1,0,Jimmy Carter,12018,0,0,0,0,0,0,0,0,0,0,0,0,0,0,0,0,0,0,0,1,2,3,0,0,0,1,0,0,0,0
260,Burundi,90,516,2,Government of Burundi - CNDD,12,1,0,1,01/06/1996,01/07/1996,1,"Reuters 1996-01-05, ""U.N. refugee chief Ogata to visit Burundi""",0,1,0,0,UN,11024,0,0,0,0,0,0,0,0,0,0,0,0,0,0,0,0,0,0,0,1,1,3,0,0,1,0,0,0,0,0
261,Burundi,90,516,2,Government of Burundi - CNDD,12,1,0,1,02/09/1996,02/09/1996,1,"Reuters 1996-02-09, ""Burundi president to talks in Zaire on refugees""",1,0,0,0,Democratic Republic of the Congo,490,0,0,0,0,0,0,0,0,0,0,0,0,0,0,0,0,0,0,0,1,1,3,0,0,1,0,0,0,0,0
262,Burundi,90,516,2,Government of Burundi - CNDD,12,1,0,1,03/01/1996,03/31/1996,4,"Reuters 1996-03-13, ""Burundi leader urges world to help disarm militias""",0,0,1,1,The Sant' Egidio Community,12033,0,0,0,0,0,0,0,0,0,0,0,0,0,0,0,0,0,0,0,1,1,3,0,0,1,0,0,0,0,0
263,Burundi,90,516,2,Government of Burundi - CNDD,12,1,0,1,03/01/1996,03/31/1996,4,"Reuters 1996-03-13, ""Burundi leader urges world to help disarm militias""",1,0,0,0,Italy,325,0,0,0,0,0,0,0,0,0,0,0,0,0,0,0,0,0,0,0,1,1,0,0,0,0,0,1,0,0,0
264,Burundi,90,516,2,Government of Burundi - CNDD,12,1,0,1,03/09/1996,03/09/1996,1,"Reuters 1996-03-07, ""International mediator Nyerere flies to Burundi""; Reuters 1996-03-09, ""International mediator Nyerere leaves Burundi""",0,2,0,0,"AU, UN",11000,11024,0,0,0,0,0,0,0,0,0,0,0,0,0,0,0,0,0,0,2,1,3,0,0,1,0,0,0,0,0
265,Burundi,90,516,2,Government of Burundi - CNDD,12,1,0,1,03/16/1996,03/17/1996,1,"Reuters 1996-03-16, ""Divided African leaders start Rwanda-Burundi talks""; Reuters 1996-03-17, ""Presidents tape video for Rwanda-Burundi refugees""; Reuters 1996-03-19, ""Carter says Rwanda-Burundi mediation working""",4,1,1,0,"Rwanda, Tanzania, Uganda, Democratic Republic of the Congo, Jimmy Carter, UN",517,510,500,490,12018,11024,0,0,0,0,0,0,0,0,0,0,0,0,0,0,6,1,3,1,0,1,0,0,0,0,0
266,Burundi,90,516,2,Government of Burundi - CNDD,12,1,0,1,03/16/1996,03/17/1996,1,"Reuters 1996-03-16, ""Divided African leaders start Rwanda-Burundi talks""",1,0,0,0,Tunisia,616,0,0,0,0,0,0,0,0,0,0,0,0,0,0,0,0,0,0,0,1,1,0,0,0,0,0,1,0,0,0
267,Burundi,90,516,2,Government of Burundi - CNDD,12,1,0,1,03/20/1996,03/20/1996,1,"Reuters, 1996-03-20, ""Burundi president calls for dialogue to end crisis""",1,0,0,0,Kenya,501,0,0,0,0,0,0,0,0,0,0,0,0,0,0,0,0,0,0,0,1,1,3,0,0,1,0,0,0,0,0
268,Burundi,90,516,2,Government of Burundi - CNDD,12,1,0,1,04/11/1996,04/12/1996,1,"Reuters 1996-04-11, ""Nyerere in Burundi as government gets tougher""",0,2,0,0,"AU, UN",11000,11024,0,0,0,0,0,0,0,0,0,0,0,0,0,0,0,0,0,0,2,1,3,0,0,1,0,0,0,0,0
269,Burundi,90,516,2,Government of Burundi - CNDD,12,1,0,1,04/22/1996,04/26/1996,1,"Reuters 1996-04-23, ""Nyerere orders media gag on Burundi talks"", Reuters 1996-04-26, ""Burundi peace negotiators agree to meet again""",0,1,0,0,AU,11000,0,0,0,0,0,0,0,0,0,0,0,0,0,0,0,0,0,0,0,1,1,3,0,0,1,0,0,0,0,0
270,Burundi,90,516,2,Government of Burundi - CNDD,12,1,0,1,04/22/1996,04/26/1996,1,"Reuters 1996-04-23, ""Nyerere orders media gag on Burundi talks"", Reuters 1996-04-26, ""Burundi peace negotiators agree to meet again""",1,0,0,0,Tanzania,510,0,0,0,0,0,0,0,0,0,0,0,0,0,0,0,0,0,0,0,1,1,0,0,0,0,0,1,0,0,0
271,Burundi,90,516,2,Government of Burundi - CNDD,12,1,0,1,05/01/1996,05/31/1996,4,"Reuters 1996-05-31, ""U.S. diplomacy in Burundi to restart peace talks""",1,0,0,0,USA,2,0,0,0,0,0,0,0,0,0,0,0,0,0,0,0,0,0,0,0,1,1,3,0,0,0,1,0,0,0,0
272,Burundi,90,516,2,Government of Burundi - CNDD,12,0,0,1,05/01/1996,05/31/1996,4,"Reuters 1996-05-27, ""Exiled Hutu leader agrees Burundi truce - Zaire""; Reuters 1996-05-27, ""Zaire says Burundi rebels agree truce, aide denies""",1,0,0,0,Democratic Republic of the Congo,490,0,0,0,0,0,0,0,0,0,0,0,0,0,0,0,0,0,0,0,1,2,3,0,1,0,0,0,0,0,0
273,Burundi,90,516,2,Government of Burundi - CNDD,12,1,0,1,05/08/1996,05/08/1996,1,"Reuters 1996-05-08, ""U.S. envoy in Burundi, army probes Hutu massacre""",1,0,0,0,USA,2,0,0,0,0,0,0,0,0,0,0,0,0,0,0,0,0,0,0,0,1,1,3,0,0,1,0,0,0,0,0
274,Burundi,90,516,2,Government of Burundi - CNDD,12,0,0,1,05/18/1996,05/19/1996,1,"Reuters 1996-05-18, ""Zaire prime minister in Burundi for security talks""; Reuters 1996-05-20, ""Zaire says Burundi border to remain closed""",1,0,0,0,Democratic Republic of the Congo,490,0,0,0,0,0,0,0,0,0,0,0,0,0,0,0,0,0,0,0,1,1,3,0,0,1,0,0,0,0,0
275,Burundi,90,516,2,Government of Burundi - CNDD,12,1,0,1,05/31/1996,05/31/1996,1,"Reuters 1996-05-31, ""Burundi massacre victims buried; US envoy negotiates""",1,0,0,0,USA,2,0,0,0,0,0,0,0,0,0,0,0,0,0,0,0,0,0,0,0,1,1,3,0,0,0,1,0,0,0,0
276,Burundi,90,516,2,Government of Burundi - CNDD,12,1,0,1,06/04/1996,06/09/1996,1,"Reuters 1996-06-03, ""Burundi talks to consider condemning violence""; Reuters 1996-06-10, ""Mediator Nyerere sees time running out for Burundi""",0,2,0,0,"AU, UN",11000,11024,0,0,0,0,0,0,0,0,0,0,0,0,0,0,0,0,0,0,2,1,3,0,0,1,0,0,0,0,0
277,Burundi,90,516,2,Government of Burundi - CNDD,12,1,0,1,06/04/1996,06/09/1996,1,"Reuters 1996-06-03, ""Burundi talks to consider condemning violence""; Reuters 1996-06-10, ""Mediator Nyerere sees time running out for Burundi""",1,0,0,0,Tanzania,510,0,0,0,0,0,0,0,0,0,0,0,0,0,0,0,0,0,0,0,1,1,0,0,0,0,0,1,0,0,0
278,Burundi,90,516,2,Government of Burundi - CNDD,12,1,0,1,06/11/1996,06/12/1996,1,"Reuters 1996-06-12, ""Belgium urges calm in former protectorate Burundi""",1,0,0,0,Belgium,211,0,0,0,0,0,0,0,0,0,0,0,0,0,0,0,0,0,0,0,1,1,3,0,0,0,1,0,0,0,0
279,Burundi,90,516,2,Government of Burundi - CNDD,12,1,0,1,06/16/1996,06/16/1996,1,"Reuters 1996-06-15, ""Burundi political parties to meet in Tanzania""; Reuters 1996-06-19, ""Burundi premier sees softening at party talks""",0,2,0,0,"AU, UN",11000,11024,0,0,0,0,0,0,0,0,0,0,0,0,0,0,0,0,0,0,2,1,3,0,0,0,1,0,0,0,0
280,Burundi,90,516,2,Government of Burundi - CNDD,12,1,0,1,06/21/1996,06/21/1996,1,"Reuters 1996-06-21, ""Burundi Uprona leader wants observers at talks""",2,0,1,1,"Vatican, Italy, The Sant' Egidio Community",327,325,12033,0,0,0,0,0,0,0,0,0,0,0,0,0,0,0,0,0,3,1,3,0,0,1,0,0,0,0,0
281,Burundi,90,516,2,Government of Burundi - CNDD,12,1,0,1,06/25/1996,06/25/1996,1,"Reuters 1996-06-25, ""African leaders agree on study as Burundi arms""; Reuters 1996-06-25, ""African leaders end talks on crisis in Burundi""",5,1,0,0,"Ethiopia, Kenya, Rwanda, Tanzania, Uganda, AU",530,501,517,510,500,11000,0,0,0,0,0,0,0,0,0,0,0,0,0,0,6,1,3,0,0,1,0,0,0,0,0
282,Burundi,90,516,2,Government of Burundi - CNDD,12,1,0,1,06/30/1996,07/02/1996,1,"Reuters 1996-07-02, ""U.S. envoy warns of tremendous disaster in Burundi""",1,0,0,0,USA,2,0,0,0,0,0,0,0,0,0,0,0,0,0,0,0,0,0,0,0,1,1,3,0,0,1,0,0,0,0,0
283,Burundi,90,516,2,Government of Burundi - CNDD,12,1,0,1,07/01/1996,07/03/1996,1,"Reuters 1996-07-02, ""African ministers try to stop Burundi bloodshed""; Reuters 1996-07-03, ""African military experts end meeting on Burundi""",4,0,0,0,"Ethiopia, Rwanda, Tanzania, Uganda",530,517,510,500,0,0,0,0,0,0,0,0,0,0,0,0,0,0,0,0,4,1,3,0,0,1,0,0,0,0,0
284,Burundi,90,516,2,Government of Burundi - CNDD,12,1,0,1,07/01/1996,07/31/1996,4,"Reuters 1996-08-03, ""Paper says Burundi military head meets Mobutu""",1,0,0,0,Democratic Republic of the Congo,490,0,0,0,0,0,0,0,0,0,0,0,0,0,0,0,0,0,0,0,1,1,3,0,0,0,1,0,0,0,0
285,Burundi,90,516,2,Government of Burundi - CNDD,12,1,0,1,07/01/1996,07/31/1996,4,"Reuters 1996-08-03, ""Paper says Burundi military head meets Mobutu""",1,0,0,0,Portugal,235,0,0,0,0,0,0,0,0,0,0,0,0,0,0,0,0,0,0,0,1,1,0,0,0,0,0,1,0,0,0
286,Burundi,90,516,2,Government of Burundi - CNDD,12,1,0,1,07/09/1996,07/09/1996,1,"Reuters 1996-07-09, ""OAU seen to give cautious backing for Burundi plan""",0,1,0,0,AU,11000,0,0,0,0,0,0,0,0,0,0,0,0,0,0,0,0,0,0,0,1,1,3,0,0,1,0,0,0,0,0
287,Burundi,90,516,2,Government of Burundi - CNDD,12,1,0,1,07/09/1996,07/09/1996,1,"Reuters 1996-07-09, ""OAU seen to give cautious backing for Burundi plan""",1,0,0,0,Cameroon,471,0,0,0,0,0,0,0,0,0,0,0,0,0,0,0,0,0,0,0,1,1,0,0,0,0,0,1,0,0,0
288,Burundi,90,516,2,Government of Burundi - CNDD,12,1,0,1,07/22/1996,07/22/1996,1,"Reuters 1996-07-22, ""OAU condemns Burundi massacre""",0,1,0,0,AU,11000,0,0,0,0,0,0,0,0,0,0,0,0,0,0,0,0,0,0,0,1,0,0,0,0,0,0,0,1,0,0
289,Burundi,90,516,2,Government of Burundi - CNDD,12,1,0,1,07/30/1996,07/30/1996,1,"Reuters 1996-07-30, ""Burundi's military ruler seeks regional support""",1,0,1,0,"Uganda, Julius Nyerere",500,12019,0,0,0,0,0,0,0,0,0,0,0,0,0,0,0,0,0,0,2,1,3,0,0,0,1,0,0,0,0
290,Burundi,90,516,2,Government of Burundi - CNDD,12,1,0,1,07/30/1996,07/30/1996,1,"Reuters 1996-07-30, ""Burundi's military ruler seeks regional support""",1,0,0,0,Tanzania,510,0,0,0,0,0,0,0,0,0,0,0,0,0,0,0,0,0,0,0,1,1,0,0,0,0,0,1,0,0,0
291,Burundi,90,516,2,Government of Burundi - CNDD,12,1,0,1,08/01/1996,08/31/1996,4,"Reuters 1996-08-14, ""OAU chief will have to deal with Burundi ruler""",0,1,0,0,AU,11000,0,0,0,0,0,0,0,0,0,0,0,0,0,0,0,0,0,0,0,1,1,3,0,0,0,1,0,0,0,0
292,Burundi,90,516,2,Government of Burundi - CNDD,12,0,0,1,08/01/1996,08/31/1996,4,"Reuters 1996-08-27, ""Nyerere due in Rome amid talk of Burundi dialogue""",0,0,1,1,The Sant' Egidio Community,12033,0,0,0,0,0,0,0,0,0,0,0,0,0,0,0,0,0,0,0,1,2,3,0,0,0,1,0,0,0,0
293,Burundi,90,516,2,Government of Burundi - CNDD,12,0,0,1,08/01/1996,08/31/1996,4,"Reuters 1996-08-27, ""Nyerere due in Rome amid talk of Burundi dialogue""",1,0,0,0,Italy,325,0,0,0,0,0,0,0,0,0,0,0,0,0,0,0,0,0,0,0,1,2,0,0,0,0,0,1,0,0,0
294,Burundi,90,516,2,Government of Burundi - CNDD,12,1,0,1,08/25/1996,08/25/1996,1,"Reuters 1996-08-25, ""Burundi's Buyoya requests regional summit""",0,2,0,0,"AU, UN",11000,11024,0,0,0,0,0,0,0,0,0,0,0,0,0,0,0,0,0,0,2,1,3,0,0,1,0,0,0,0,0
295,Burundi,90,516,2,Government of Burundi - CNDD,12,1,0,1,08/25/1996,08/25/1996,1,"Reuters 1996-08-25, ""Burundi's Buyoya requests regional summit""",1,0,0,0,Tanzania,510,0,0,0,0,0,0,0,0,0,0,0,0,0,0,0,0,0,0,0,1,1,0,0,0,0,0,1,0,0,0
296,Burundi,90,516,2,Government of Burundi - CNDD,12,0,0,1,08/28/1996,08/28/1996,1,"Reuters 1996-08-28, ""Burundi defends military regime to hostile UN""",0,1,0,0,UN,11024,0,0,0,0,0,0,0,0,0,0,0,0,0,0,0,0,0,0,0,1,1,3,0,0,1,0,0,0,0,0
297,Burundi,90,516,2,Government of Burundi - CNDD,12,1,0,1,09/07/1996,09/07/1996,1,"Reuters 1996-09-07, ""Burundi leader says negotiator working on summit""",0,2,0,0,"AU, UN",11000,11024,0,0,0,0,0,0,0,0,0,0,0,0,0,0,0,0,0,0,2,1,3,0,0,1,0,0,0,0,0
298,Burundi,90,516,2,Government of Burundi - CNDD,12,1,0,1,09/07/1996,09/07/1996,1,"Reuters 1996-09-07, ""Burundi leader says negotiator working on summit""",1,0,0,0,Tanzania,510,0,0,0,0,0,0,0,0,0,0,0,0,0,0,0,0,0,0,0,1,1,0,0,0,0,0,1,0,0,0
299,Burundi,90,516,2,Government of Burundi - CNDD,12,1,0,1,09/30/1996,10/03/1996,1,"Reuters 1996-09-30, ""U.S. envoy to Burundi holds talks with Buyoya""; Reuters 1996-10-03, ""Burundi warns Hutu rebels as U.S. envoy leaves""",1,0,0,0,USA,2,0,0,0,0,0,0,0,0,0,0,0,0,0,0,0,0,0,0,0,1,1,3,1,0,1,0,0,0,0,0
300,Burundi,90,516,2,Government of Burundi - CNDD,12,1,0,1,10/09/1996,10/09/1996,1,"Reuters 1996-10-10, ""Burundi ruler in talks with Burundi mediator.",0,2,0,0,"AU, UN",11000,11024,0,0,0,0,0,0,0,0,0,0,0,0,0,0,0,0,0,0,2,1,3,0,0,0,1,0,0,0,0
301,Burundi,90,516,2,Government of Burundi - CNDD,12,1,0,1,10/09/1996,10/09/1996,1,"Reuters 1996-10-10, ""Burundi ruler in talks with Burundi mediator.",1,0,0,0,Tanzania,510,0,0,0,0,0,0,0,0,0,0,0,0,0,0,0,0,0,0,0,1,1,0,0,0,0,0,1,0,0,0
302,Burundi,90,516,2,Government of Burundi - CNDD,12,1,0,1,10/18/1996,10/18/1996,1,"Reuters 1996-10-18, ""African sanctions team meets Burundi leaders""",2,0,0,0,"Tanzania, Democratic Republic of the Congo",510,490,0,0,0,0,0,0,0,0,0,0,0,0,0,0,0,0,0,0,2,1,3,0,0,1,0,0,0,0,0
303,Burundi,90,516,2,Government of Burundi - CNDD,12,1,0,1,11/16/1996,11/16/1996,1,"Reuters 1996-11-17, ""Burundi leader in talks on economic sanctions""",0,2,0,0,"AU, UN",11000,11024,0,0,0,0,0,0,0,0,0,0,0,0,0,0,0,0,0,0,2,1,3,0,0,1,0,0,0,0,0
304,Burundi,90,516,2,Government of Burundi - CNDD,12,1,0,1,11/16/1996,11/16/1996,1,"Reuters 1996-11-17, ""Burundi leader in talks on economic sanctions""",1,0,0,0,Tanzania,510,0,0,0,0,0,0,0,0,0,0,0,0,0,0,0,0,0,0,0,1,1,0,0,0,0,0,1,0,0,0
305,Burundi,90,516,2,Government of Burundi - CNDD,12,0,0,1,12/01/1996,12/31/1996,4,"Reuters 1996-12-23, ""Burundi's Hutu rebels announce 11-day ceasefire""",0,2,0,0,"AU, UN",11000,11024,0,0,0,0,0,0,0,0,0,0,0,0,0,0,0,0,0,0,2,3,4,0,0,0,1,0,0,0,0
306,Burundi,90,516,2,Government of Burundi - CNDD,12,0,0,1,12/01/1996,12/31/1996,4,"Reuters 1996-12-23, ""Burundi's Hutu rebels announce 11-day ceasefire""",1,0,0,0,Tanzania,510,0,0,0,0,0,0,0,0,0,0,0,0,0,0,0,0,0,0,0,1,3,0,0,0,0,0,1,0,0,0
307,Burundi,90,516,2,Government of Burundi - CNDD,12,0,0,1,12/01/1996,05/30/1997,6,"Reuters 1997-05-13, ""Burundi's Buyoya confirms talks with Hutu rebels"", Reuters 1997-05-15, ""U.S. envoy welcomes Burundi negotiations""",0,0,1,1,The Sant' Egidio Community,12033,0,0,0,0,0,0,0,0,0,0,0,0,0,0,0,0,0,0,0,1,3,1,0,1,1,0,0,0,0,0
308,Burundi,90,516,2,Government of Burundi - CNDD,12,0,0,1,12/01/1996,05/30/1997,6,"Reuters 1997-05-13, ""Burundi's Buyoya confirms talks with Hutu rebels"", Reuters 1997-05-15, ""U.S. envoy welcomes Burundi negotiations""",1,0,0,0,Italy,325,0,0,0,0,0,0,0,0,0,0,0,0,0,0,0,0,0,0,0,1,3,0,0,0,0,0,1,0,0,0
309,Burundi,90,516,2,Government of Burundi - CNDD,12,1,0,1,01/11/1997,01/12/1997,1,"Reuters 1997-01-14, ""U.S. deplores army massacre in Burundi""",1,0,0,0,USA,2,0,0,0,0,0,0,0,0,0,0,0,0,0,0,0,0,0,0,0,1,1,3,0,1,0,0,0,0,0,0
310,Burundi,90,516,2,Government of Burundi - Frolina,13,1,0,1,01/11/1997,01/12/1997,1,"Reuters 1997-01-14, ""U.S. deplores army massacre in Burundi""",1,0,0,0,USA,2,0,0,0,0,0,0,0,0,0,0,0,0,0,0,0,0,0,0,0,1,1,3,0,1,0,0,0,0,0,0
311,Burundi,90,516,2,Government of Burundi - Palipehutu-FNL,15,1,0,1,01/11/1997,01/12/1997,1,"Reuters 1997-01-14, ""U.S. deplores army massacre in Burundi""",1,0,0,0,USA,2,0,0,0,0,0,0,0,0,0,0,0,0,0,0,0,0,0,0,0,1,1,3,0,1,0,0,0,0,0,0
312,Burundi,90,516,2,Government of Burundi - CNDD,12,1,0,1,02/03/1997,02/03/1997,1,"Reuters 1997-02-03, ""Burundi military ruler meets mediator Nyerere""",0,2,0,0,"AU, UN",11000,11024,0,0,0,0,0,0,0,0,0,0,0,0,0,0,0,0,0,0,2,1,3,0,0,0,1,0,0,0,0
313,Burundi,90,516,2,Government of Burundi - CNDD,12,1,0,1,02/03/1997,02/03/1997,1,"Reuters 1997-02-03, ""Burundi military ruler meets mediator Nyerere""",1,0,0,0,Tanzania,510,0,0,0,0,0,0,0,0,0,0,0,0,0,0,0,0,0,0,0,1,1,0,0,0,0,0,1,0,0,0
314,Burundi,90,516,2,Government of Burundi - Frolina,13,1,0,1,02/03/1997,02/03/1997,1,"Reuters 1997-02-03, ""Burundi military ruler meets mediator Nyerere""",0,2,0,0,"AU, UN",11000,11024,0,0,0,0,0,0,0,0,0,0,0,0,0,0,0,0,0,0,2,1,3,0,0,0,1,0,0,0,0
315,Burundi,90,516,2,Government of Burundi - Frolina,13,1,0,1,02/03/1997,02/03/1997,1,"Reuters 1997-02-03, ""Burundi military ruler meets mediator Nyerere""",1,0,0,0,Tanzania,510,0,0,0,0,0,0,0,0,0,0,0,0,0,0,0,0,0,0,0,1,1,0,0,0,0,0,1,0,0,0
316,Burundi,90,516,2,Government of Burundi - Palipehutu-FNL,15,1,0,1,02/03/1997,02/03/1997,1,"Reuters 1997-02-03, ""Burundi military ruler meets mediator Nyerere""",0,2,0,0,"AU, UN",11000,11024,0,0,0,0,0,0,0,0,0,0,0,0,0,0,0,0,0,0,2,1,3,0,0,0,1,0,0,0,0
317,Burundi,90,516,2,Government of Burundi - Palipehutu-FNL,15,1,0,1,02/03/1997,02/03/1997,1,"Reuters 1997-02-03, ""Burundi military ruler meets mediator Nyerere""",1,0,0,0,Tanzania,510,0,0,0,0,0,0,0,0,0,0,0,0,0,0,0,0,0,0,0,1,1,0,0,0,0,0,1,0,0,0
318,Burundi,90,516,2,Government of Burundi - CNDD,12,1,0,1,06/19/1997,06/19/1997,1,"Reuters 1997-06-19, ""U.S. rights envoy optimistic over Burundi""",1,0,0,0,USA,2,0,0,0,0,0,0,0,0,0,0,0,0,0,0,0,0,0,0,0,1,1,3,0,0,1,0,0,0,0,0
319,Burundi,90,516,2,Government of Burundi - Frolina,13,1,0,1,06/19/1997,06/19/1997,1,"Reuters 1997-06-19, ""U.S. rights envoy optimistic over Burundi""",1,0,0,0,USA,2,0,0,0,0,0,0,0,0,0,0,0,0,0,0,0,0,0,0,0,1,1,3,0,0,1,0,0,0,0,0
320,Burundi,90,516,2,Government of Burundi - Palipehutu-FNL,15,1,0,1,06/19/1997,06/19/1997,1,"Reuters 1997-06-19, ""U.S. rights envoy optimistic over Burundi""",1,0,0,0,USA,2,0,0,0,0,0,0,0,0,0,0,0,0,0,0,0,0,0,0,0,1,1,3,0,0,1,0,0,0,0,0
321,Burundi,90,516,2,Government of Burundi - CNDD,12,0,0,1,07/01/1997,07/31/1997,4,"Reuters 1997-07-30, ""Tanzania's Nyerere sets date for Burundi talks""",0,1,1,0,"Envoy or representative of Julius Nyerere (former Tanzanian President), UN",12020,11024,0,0,0,0,0,0,0,0,0,0,0,0,0,0,0,0,0,0,2,3,2,0,0,1,0,0,0,0,0
322,Burundi,90,516,2,Government of Burundi - CNDD,12,1,0,1,07/28/1997,07/28/1997,1,"Reuters 1997-07-28, ""U.N. envoy has talks with Burundian leaders""",0,2,0,0,"AU, UN",11000,11024,0,0,0,0,0,0,0,0,0,0,0,0,0,0,0,0,0,0,2,1,3,0,0,0,1,0,0,0,0
323,Burundi,90,516,2,Government of Burundi - Frolina,13,1,0,1,07/28/1997,07/28/1997,1,"Reuters 1997-07-28, ""U.N. envoy has talks with Burundian leaders""",0,2,0,0,"AU, UN",11000,11024,0,0,0,0,0,0,0,0,0,0,0,0,0,0,0,0,0,0,2,1,3,0,0,0,1,0,0,0,0
324,Burundi,90,516,2,Government of Burundi - Palipehutu-FNL,15,1,0,1,07/28/1997,07/28/1997,1,"Reuters 1997-07-28, ""U.N. envoy has talks with Burundian leaders""",0,2,0,0,"AU, UN",11000,11024,0,0,0,0,0,0,0,0,0,0,0,0,0,0,0,0,0,0,2,1,3,0,0,0,1,0,0,0,0
325,Burundi,90,516,2,Government of Burundi - CNDD,12,1,0,1,08/22/1997,08/22/1997,1,"Reuters 1997-08-22, ""Burundi Hutu rebels say will attend peace talks""",0,0,1,0,Envoy or representative of Julius Nyerere (former Tanzanian President),12020,0,0,0,0,0,0,0,0,0,0,0,0,0,0,0,0,0,0,0,1,1,3,0,0,0,1,0,0,0,0
326,Burundi,90,516,2,Government of Burundi - Frolina,13,1,0,1,08/22/1997,08/22/1997,1,"Reuters 1997-08-22, ""Burundi Hutu rebels say will attend peace talks""",0,0,1,0,Envoy or representative of Julius Nyerere (former Tanzanian President),12020,0,0,0,0,0,0,0,0,0,0,0,0,0,0,0,0,0,0,0,1,1,3,0,0,0,1,0,0,0,0
327,Burundi,90,516,2,Government of Burundi - Palipehutu-FNL,15,1,0,1,08/22/1997,08/22/1997,1,"Reuters 1997-08-22, ""Burundi Hutu rebels say will attend peace talks""",0,0,1,0,Envoy or representative of Julius Nyerere (former Tanzanian President),12020,0,0,0,0,0,0,0,0,0,0,0,0,0,0,0,0,0,0,0,1,1,3,0,0,0,1,0,0,0,0
328,Burundi,90,516,2,Government of Burundi - CNDD,12,1,0,1,08/24/1997,08/24/1997,1,"Reuters 1997-08-24, ""Burundi-Tanzania rift widens ahead of peace talks""",0,2,0,0,"UN, AU",11024,11000,0,0,0,0,0,0,0,0,0,0,0,0,0,0,0,0,0,0,2,1,3,0,0,1,0,0,0,0,0
329,Burundi,90,516,2,Government of Burundi - Frolina,13,1,0,1,08/24/1997,08/24/1997,1,"Reuters 1997-08-24, ""Burundi-Tanzania rift widens ahead of peace talks""",0,2,0,0,"UN, AU",11024,11000,0,0,0,0,0,0,0,0,0,0,0,0,0,0,0,0,0,0,2,1,3,0,0,1,0,0,0,0,0
330,Burundi,90,516,2,Government of Burundi - Palipehutu-FNL,15,1,0,1,08/24/1997,08/24/1997,1,"Reuters 1997-08-24, ""Burundi-Tanzania rift widens ahead of peace talks""",0,2,0,0,"UN, AU",11024,11000,0,0,0,0,0,0,0,0,0,0,0,0,0,0,0,0,0,0,2,1,3,0,0,1,0,0,0,0,0
331,Burundi,90,516,2,Government of Burundi - CNDD,12,1,0,1,09/12/1997,09/12/1997,1,"Reuters 1997-09-16, ""Italy peace group hopes Burundi talks can resume""",1,0,0,0,Uganda,500,0,0,0,0,0,0,0,0,0,0,0,0,0,0,0,0,0,0,0,1,1,3,0,0,1,0,0,0,0,0
332,Burundi,90,516,2,Government of Burundi - Frolina,13,1,0,1,09/12/1997,09/12/1997,1,"Reuters 1997-09-16, ""Italy peace group hopes Burundi talks can resume""",1,0,0,0,Uganda,500,0,0,0,0,0,0,0,0,0,0,0,0,0,0,0,0,0,0,0,1,1,3,0,0,1,0,0,0,0,0
333,Burundi,90,516,2,Government of Burundi - Palipehutu-FNL,15,1,0,1,09/12/1997,09/12/1997,1,"Reuters 1997-09-16, ""Italy peace group hopes Burundi talks can resume""",1,0,0,0,Uganda,500,0,0,0,0,0,0,0,0,0,0,0,0,0,0,0,0,0,0,0,1,1,3,0,0,1,0,0,0,0,0
334,Burundi,90,516,2,Government of Burundi - CNDD,12,1,0,1,10/30/1997,10/30/1997,1,"Reuters 1997-10-30, ""Democratic Congo's Kabila arrives in Burundi""",1,0,0,0,Democratic Republic of the Congo,490,0,0,0,0,0,0,0,0,0,0,0,0,0,0,0,0,0,0,0,1,1,3,0,0,1,0,0,0,0,0
335,Burundi,90,516,2,Government of Burundi - Frolina,13,1,0,1,10/30/1997,10/30/1997,1,"Reuters 1997-10-30, ""Democratic Congo's Kabila arrives in Burundi""",1,0,0,0,Democratic Republic of the Congo,490,0,0,0,0,0,0,0,0,0,0,0,0,0,0,0,0,0,0,0,1,1,3,0,0,1,0,0,0,0,0
336,Burundi,90,516,2,Government of Burundi - Palipehutu-FNL,15,1,0,1,10/30/1997,10/30/1997,1,"Reuters 1997-10-30, ""Democratic Congo's Kabila arrives in Burundi""",1,0,0,0,Democratic Republic of the Congo,490,0,0,0,0,0,0,0,0,0,0,0,0,0,0,0,0,0,0,0,1,1,3,0,0,1,0,0,0,0,0
337,Burundi,90,516,2,Government of Burundi - CNDD,12,1,0,1,12/02/1997,12/05/1997,1,"Reuters 1997-12-05, ""Mediator Nyerere plans Burundi talks in new year""",1,0,0,0,Uganda,500,0,0,0,0,0,0,0,0,0,0,0,0,0,0,0,0,0,0,0,1,0,0,0,0,0,0,0,1,0,0
338,Burundi,90,516,2,Government of Burundi - Frolina,13,1,0,1,12/02/1997,12/05/1997,1,"Reuters 1997-12-05, ""Mediator Nyerere plans Burundi talks in new year""",1,0,0,0,Uganda,500,0,0,0,0,0,0,0,0,0,0,0,0,0,0,0,0,0,0,0,1,0,0,0,0,0,0,0,1,0,0
339,Burundi,90,516,2,Government of Burundi - Palipehutu-FNL,15,1,0,1,12/02/1997,12/05/1997,1,"Reuters 1997-12-05, ""Mediator Nyerere plans Burundi talks in new year""",1,0,0,0,Uganda,500,0,0,0,0,0,0,0,0,0,0,0,0,0,0,0,0,0,0,0,1,0,0,0,0,0,0,0,1,0,0
340,Burundi,90,516,2,Government of Burundi - CNDD,12,1,0,1,02/12/1998,02/28/1998,4,"Reuters 1998-02-12, ""U.N.'s Ogata arrives in Burundi for refugee talks""",0,1,0,0,UN,11024,0,0,0,0,0,0,0,0,0,0,0,0,0,0,0,0,0,0,0,1,1,3,0,0,1,0,0,0,0,0
341,Burundi,90,516,0,Government of Burundi - Frolina,13,1,0,0,02/12/1998,02/28/1998,4,"Reuters 1998-02-12, ""U.N.'s Ogata arrives in Burundi for refugee talks""",0,1,0,0,UN,11024,0,0,0,0,0,0,0,0,0,0,0,0,0,0,0,0,0,0,0,1,1,3,0,0,1,0,0,0,0,0
342,Burundi,90,516,2,Government of Burundi - Palipehutu-FNL,15,1,0,1,02/12/1998,02/28/1998,4,"Reuters 1998-02-12, ""U.N.'s Ogata arrives in Burundi for refugee talks""",0,1,0,0,UN,11024,0,0,0,0,0,0,0,0,0,0,0,0,0,0,0,0,0,0,0,1,1,3,0,0,1,0,0,0,0,0
343,Burundi,90,516,2,Government of Burundi - CNDD,12,1,0,1,02/19/1998,02/19/1998,1,"Reuters 1998-02-21, ""FOCUS-Burundi's Buyoya faces jury of presidents""",1,0,0,0,Uganda,500,0,0,0,0,0,0,0,0,0,0,0,0,0,0,0,0,0,0,0,1,1,3,0,0,1,0,0,0,0,0
344,Burundi,90,516,0,Government of Burundi - Frolina,13,1,0,0,02/19/1998,02/19/1998,1,"Reuters 1998-02-21, ""FOCUS-Burundi's Buyoya faces jury of presidents""",1,0,0,0,Uganda,500,0,0,0,0,0,0,0,0,0,0,0,0,0,0,0,0,0,0,0,1,1,3,0,0,1,0,0,0,0,0
345,Burundi,90,516,2,Government of Burundi - Palipehutu-FNL,15,1,0,1,02/19/1998,02/19/1998,1,"Reuters 1998-02-21, ""FOCUS-Burundi's Buyoya faces jury of presidents""",1,0,0,0,Uganda,500,0,0,0,0,0,0,0,0,0,0,0,0,0,0,0,0,0,0,0,1,1,3,0,0,1,0,0,0,0,0
346,Burundi,90,516,2,Government of Burundi - CNDD,12,1,0,1,04/03/1998,04/03/1998,1,"Reuters 1998-04-03, ""Tanzania envoys in Burundi to revive peace process""",0,0,1,0,Envoy or representative of Julius Nyerere (former Tanzanian President),12020,0,0,0,0,0,0,0,0,0,0,0,0,0,0,0,0,0,0,0,1,1,3,0,0,1,0,0,0,0,0
347,Burundi,90,516,0,Government of Burundi - Frolina,13,1,0,0,04/03/1998,04/03/1998,1,"Reuters 1998-04-03, ""Tanzania envoys in Burundi to revive peace process""",0,0,1,0,Envoy or representative of Julius Nyerere (former Tanzanian President),12020,0,0,0,0,0,0,0,0,0,0,0,0,0,0,0,0,0,0,0,1,1,3,0,0,1,0,0,0,0,0
348,Burundi,90,516,2,Government of Burundi - Palipehutu-FNL,15,1,0,1,04/03/1998,04/03/1998,1,"Reuters 1998-04-03, ""Tanzania envoys in Burundi to revive peace process""",0,0,1,0,Envoy or representative of Julius Nyerere (former Tanzanian President),12020,0,0,0,0,0,0,0,0,0,0,0,0,0,0,0,0,0,0,0,1,1,3,0,0,1,0,0,0,0,0
349,Burundi,90,516,2,Government of Burundi - CNDD,12,1,0,1,05/01/1998,05/31/1998,4,"Xinhua 1998-05-20, ""Buyoya, Factions Leaders Agree to All-party Peace Talks""",0,1,0,0,UN,11024,0,0,0,0,0,0,0,0,0,0,0,0,0,0,0,0,0,0,0,1,1,3,0,0,1,0,0,0,0,0
350,Burundi,90,516,0,Government of Burundi - Frolina,13,1,0,0,05/01/1998,05/31/1998,4,"Xinhua 1998-05-20, ""Buyoya, Factions Leaders Agree to All-party Peace Talks""",0,1,0,0,UN,11024,0,0,0,0,0,0,0,0,0,0,0,0,0,0,0,0,0,0,0,1,1,3,0,0,1,0,0,0,0,0
351,Burundi,90,516,2,Government of Burundi - CNDD-FDD,14,1,0,1,05/01/1998,05/31/1998,4,"Xinhua 1998-05-20, ""Buyoya, Factions Leaders Agree to All-party Peace Talks""",0,1,0,0,UN,11024,0,0,0,0,0,0,0,0,0,0,0,0,0,0,0,0,0,0,0,1,1,3,0,0,1,0,0,0,0,0
352,Burundi,90,516,2,Government of Burundi - Palipehutu-FNL,15,1,0,1,05/01/1998,05/31/1998,4,"Xinhua 1998-05-20, ""Buyoya, Factions Leaders Agree to All-party Peace Talks""",0,1,0,0,UN,11024,0,0,0,0,0,0,0,0,0,0,0,0,0,0,0,0,0,0,0,1,1,3,0,0,1,0,0,0,0,0
353,Burundi,90,516,2,Government of Burundi - CNDD,12,1,0,1,05/04/1998,05/06/1998,1,"Reuters 1998-05-07, ""Burundi peace talks set for June in Tanzania""",0,0,1,0,Envoy or representative of Julius Nyerere (former Tanzanian President),12020,0,0,0,0,0,0,0,0,0,0,0,0,0,0,0,0,0,0,0,1,1,3,0,0,1,0,0,0,0,0
354,Burundi,90,516,0,Government of Burundi - Frolina,13,1,0,0,05/04/1998,05/06/1998,1,"Reuters 1998-05-07, ""Burundi peace talks set for June in Tanzania""",0,0,1,0,Envoy or representative of Julius Nyerere (former Tanzanian President),12020,0,0,0,0,0,0,0,0,0,0,0,0,0,0,0,0,0,0,0,1,1,3,0,0,1,0,0,0,0,0
355,Burundi,90,516,2,Government of Burundi - CNDD-FDD,14,1,0,1,05/04/1998,05/06/1998,1,"Reuters 1998-05-07, ""Burundi peace talks set for June in Tanzania""",0,0,1,0,Envoy or representative of Julius Nyerere (former Tanzanian President),12020,0,0,0,0,0,0,0,0,0,0,0,0,0,0,0,0,0,0,0,1,1,3,0,0,1,0,0,0,0,0
356,Burundi,90,516,2,Government of Burundi - Palipehutu-FNL,15,1,0,1,05/04/1998,05/06/1998,1,"Reuters 1998-05-07, ""Burundi peace talks set for June in Tanzania""",0,0,1,0,Envoy or representative of Julius Nyerere (former Tanzanian President),12020,0,0,0,0,0,0,0,0,0,0,0,0,0,0,0,0,0,0,0,1,1,3,0,0,1,0,0,0,0,0
357,Burundi,90,516,2,Government of Burundi - CNDD,12,1,0,1,05/16/1998,05/20/1998,1,"Reuters 1998-05-20, ""Burundians agree agenda for latest peace meeting""; Xinhua 1998-05-20, ""Buyoya, Factions Leaders Agree to All-party Peace Talks""",0,0,1,0,Envoy or representative of Julius Nyerere (former Tanzanian President),12020,0,0,0,0,0,0,0,0,0,0,0,0,0,0,0,0,0,0,0,1,1,3,0,0,1,0,0,0,0,0
358,Burundi,90,516,2,Government of Burundi - CNDD,12,0,0,1,05/16/1998,05/20/1998,1,"Reuters 1998-05-20, ""Burundians agree agenda for latest peace meeting""; Xinhua 1998-05-20, ""Buyoya, Factions Leaders Agree to All-party Peace Talks""",0,0,1,0,Julius Nyerere,12019,0,0,0,0,0,0,0,0,0,0,0,0,0,0,0,0,0,0,0,1,2,3,0,0,1,0,0,0,0,0
359,Burundi,90,516,0,Government of Burundi - Frolina,13,1,0,0,05/16/1998,05/20/1998,1,"Reuters 1998-05-20, ""Burundians agree agenda for latest peace meeting""; Xinhua 1998-05-20, ""Buyoya, Factions Leaders Agree to All-party Peace Talks""",0,0,1,0,Envoy or representative of Julius Nyerere (former Tanzanian President),12020,0,0,0,0,0,0,0,0,0,0,0,0,0,0,0,0,0,0,0,1,1,3,0,0,1,0,0,0,0,0
360,Burundi,90,516,2,Government of Burundi - CNDD-FDD,14,1,0,1,05/16/1998,05/20/1998,1,"Reuters 1998-05-20, ""Burundians agree agenda for latest peace meeting""; Xinhua 1998-05-20, ""Buyoya, Factions Leaders Agree to All-party Peace Talks""",0,0,1,0,Envoy or representative of Julius Nyerere (former Tanzanian President),12020,0,0,0,0,0,0,0,0,0,0,0,0,0,0,0,0,0,0,0,1,1,3,0,0,1,0,0,0,0,0
361,Burundi,90,516,2,Government of Burundi - Palipehutu-FNL,15,1,0,1,05/16/1998,05/20/1998,1,"Reuters 1998-05-20, ""Burundians agree agenda for latest peace meeting""; Xinhua 1998-05-20, ""Buyoya, Factions Leaders Agree to All-party Peace Talks""",0,0,1,0,Envoy or representative of Julius Nyerere (former Tanzanian President),12020,0,0,0,0,0,0,0,0,0,0,0,0,0,0,0,0,0,0,0,1,1,3,0,0,1,0,0,0,0,0
362,Burundi,90,516,2,Government of Burundi - CNDD,12,1,0,1,06/02/1998,06/04/1998,1,"PANA 1998-06-04, ""Burundi-Tanzania Burundi Conflict Mediator's Envoy Leaves""",0,0,1,0,Envoy or representative of Julius Nyerere (former Tanzanian President),12020,0,0,0,0,0,0,0,0,0,0,0,0,0,0,0,0,0,0,0,1,1,3,0,0,1,0,0,0,0,0
363,Burundi,90,516,2,Government of Burundi - CNDD,12,1,0,1,06/03/1998,06/03/1998,1,"Reuters 1998-06-03, ""European envoy sees Burundi talks ending embargo""",3,1,0,0,"EC/EU, UK, Luxembourg, Australia",11010,200,212,900,0,0,0,0,0,0,0,0,0,0,0,0,0,0,0,0,4,1,3,0,0,1,0,0,0,0,0
364,Burundi,90,516,0,Government of Burundi - Frolina,13,1,0,0,06/03/1998,06/03/1998,1,"Reuters 1998-06-03, ""European envoy sees Burundi talks ending embargo""",3,1,0,0,"EC/EU, UK, Luxembourg, Australia",11010,200,212,900,0,0,0,0,0,0,0,0,0,0,0,0,0,0,0,0,4,1,3,0,0,1,0,0,0,0,0
365,Burundi,90,516,2,Government of Burundi - CNDD-FDD,14,1,0,1,06/03/1998,06/03/1998,1,"Reuters 1998-06-03, ""European envoy sees Burundi talks ending embargo""",3,1,0,0,"EC/EU, UK, Luxembourg, Australia",11010,200,212,900,0,0,0,0,0,0,0,0,0,0,0,0,0,0,0,0,4,1,3,0,0,1,0,0,0,0,0
366,Burundi,90,516,2,Government of Burundi - Palipehutu-FNL,15,1,0,1,06/03/1998,06/03/1998,1,"Reuters 1998-06-03, ""European envoy sees Burundi talks ending embargo""",3,1,0,0,"EC/EU, UK, Luxembourg, Australia",11010,200,212,900,0,0,0,0,0,0,0,0,0,0,0,0,0,0,0,0,4,1,3,0,0,1,0,0,0,0,0
367,Burundi,90,516,2,Government of Burundi - CNDD,12,0,0,1,06/15/1998,06/21/1998,1,"Reuters 1998-06-15, ""FOCUS-Burundi peace talks open in Tanzania""; Xinhua 1998-06-15, ""Burundi Leaders Agree to Seek Reconciliation""; Reuters 1998-06-16, ""FOCUS-Burundi factions in second day of peace talks""; Reuters 1998-06-21, ""Burundi peace talks yield truce, future meetings""",0,2,0,0,"AU, UN",11000,11024,0,0,0,0,0,0,0,0,0,0,0,0,0,0,0,0,0,0,2,3,2,0,1,1,0,0,0,0,0
368,Burundi,90,516,2,Government of Burundi - CNDD,12,0,0,1,06/15/1998,06/21/1998,1,"Reuters 1998-06-15, ""FOCUS-Burundi peace talks open in Tanzania""; Reuters 1998-06-21, ""Burundi peace talks yield truce, future meetings""",1,0,0,0,Tanzania,510,0,0,0,0,0,0,0,0,0,0,0,0,0,0,0,0,0,0,0,1,3,0,0,0,0,0,1,0,0,0
369,Burundi,90,516,0,Government of Burundi - Frolina,13,0,0,0,06/15/1998,06/21/1998,1,"Reuters 1998-06-15, ""FOCUS-Burundi peace talks open in Tanzania""; Xinhua 1998-06-15, ""Burundi Leaders Agree to Seek Reconciliation""; Reuters 1998-06-16, ""FOCUS-Burundi factions in second day of peace talks""; Reuters 1998-06-21, ""Burundi peace talks yield truce, future meetings""",0,2,0,0,"AU, UN",11000,11024,0,0,0,0,0,0,0,0,0,0,0,0,0,0,0,0,0,0,2,3,2,0,1,1,0,0,0,0,0
370,Burundi,90,516,0,Government of Burundi - Frolina,13,0,0,0,06/15/1998,06/21/1998,1,"Reuters 1998-06-15, ""FOCUS-Burundi peace talks open in Tanzania""; Reuters 1998-06-21, ""Burundi peace talks yield truce, future meetings""",1,0,0,0,Tanzania,510,0,0,0,0,0,0,0,0,0,0,0,0,0,0,0,0,0,0,0,1,3,0,0,0,0,0,1,0,0,0
371,Burundi,90,516,2,Government of Burundi - CNDD-FDD,14,0,0,1,06/21/1998,06/21/1998,1,"ICG 1998 Burundi's Peace Process: The Road from Arusha, p. 6",0,2,0,0,"AU, UN",11000,11024,0,0,0,0,0,0,0,0,0,0,0,0,0,0,0,0,0,0,2,2,3,0,0,0,1,0,0,0,0
372,Burundi,90,516,2,Government of Burundi - CNDD-FDD,14,0,0,1,06/21/1998,06/21/1998,1,"ICG 1998 Burundi's Peace Process: The Road from Arusha, p. 6",1,0,0,0,Tanzania,510,0,0,0,0,0,0,0,0,0,0,0,0,0,0,0,0,0,0,0,1,0,0,0,0,0,0,1,0,0,0
373,Burundi,90,516,2,Government of Burundi - CNDD,12,0,0,1,07/20/1998,07/20/1998,1,"Xinhua 1998-07-20, ""Warring Burundians Meet for Second Round of Peace Talks""; Reuters 1998-07-20, ""FOCUS-Burundi peace talks delayed until Tuesday""; Xinhua 1998-07-21, ""Burundi Peace Talks Prove Tough"";",0,2,0,0,"AU, UN",11000,11024,0,0,0,0,0,0,0,0,0,0,0,0,0,0,0,0,0,0,2,3,4,0,0,1,0,0,0,0,0
374,Burundi,90,516,2,Government of Burundi - CNDD,12,0,0,1,07/20/1998,07/20/1998,1,"Xinhua 1998-07-20, ""Warring Burundians Meet for Second Round of Peace Talks""; Reuters 1998-07-29, ""Burundi sides end second round of peace talks""",1,0,0,0,Tanzania,510,0,0,0,0,0,0,0,0,0,0,0,0,0,0,0,0,0,0,0,1,3,0,0,0,0,0,1,0,0,0
375,Burundi,90,516,0,Government of Burundi - Frolina,13,0,0,0,07/20/1998,07/20/1998,1,"Xinhua 1998-07-20, ""Warring Burundians Meet for Second Round of Peace Talks""; Reuters 1998-07-20, ""FOCUS-Burundi peace talks delayed until Tuesday""; Xinhua 1998-07-21, ""Burundi Peace Talks Prove Tough"";",0,2,0,0,"AU, UN",11000,11024,0,0,0,0,0,0,0,0,0,0,0,0,0,0,0,0,0,0,2,3,4,0,0,1,0,0,0,0,0
376,Burundi,90,516,0,Government of Burundi - Frolina,13,0,0,0,07/20/1998,07/20/1998,1,"Xinhua 1998-07-20, ""Warring Burundians Meet for Second Round of Peace Talks""; Reuters 1998-07-29, ""Burundi sides end second round of peace talks""",1,0,0,0,Tanzania,510,0,0,0,0,0,0,0,0,0,0,0,0,0,0,0,0,0,0,0,1,3,0,0,0,0,0,1,0,0,0
377,Burundi,90,516,2,Government of Burundi - CNDD,12,0,0,1,07/21/1998,07/21/1998,1,"Xinhua 1998-07-21, ""Burundi Peace Talks Prove Tough""",0,2,0,0,"AU, UN",11000,11024,0,0,0,0,0,0,0,0,0,0,0,0,0,0,0,0,0,0,2,3,1,0,0,1,0,0,0,0,0
378,Burundi,90,516,2,Government of Burundi - CNDD,12,0,0,1,07/21/1998,07/21/1998,1,"Xinhua 1998-07-21, ""Burundi Peace Talks Prove Tough""",0,2,0,0,"AU, UN",11000,11024,0,0,0,0,0,0,0,0,0,0,0,0,0,0,0,0,0,0,2,1,3,0,0,1,0,0,0,0,0
379,Burundi,90,516,2,Government of Burundi - CNDD,12,0,0,1,07/21/1998,07/21/1998,1,"Xinhua 1998-07-21, ""Burundi Peace Talks Prove Tough""",0,2,0,0,"AU, UN",11000,11024,0,0,0,0,0,0,0,0,0,0,0,0,0,0,0,0,0,0,2,2,3,0,0,1,0,0,0,0,0
380,Burundi,90,516,0,Government of Burundi - Frolina,13,0,0,0,07/21/1998,07/21/1998,1,"Xinhua 1998-07-21, ""Burundi Peace Talks Prove Tough""",0,2,0,0,"AU, UN",11000,11024,0,0,0,0,0,0,0,0,0,0,0,0,0,0,0,0,0,0,2,3,1,0,0,1,0,0,0,0,0
381,Burundi,90,516,0,Government of Burundi - Frolina,13,0,0,0,07/21/1998,07/21/1998,1,"Xinhua 1998-07-21, ""Burundi Peace Talks Prove Tough""",0,2,0,0,"AU, UN",11000,11024,0,0,0,0,0,0,0,0,0,0,0,0,0,0,0,0,0,0,2,1,3,0,0,1,0,0,0,0,0
382,Burundi,90,516,0,Government of Burundi - Frolina,13,0,0,0,07/21/1998,07/21/1998,1,"Xinhua 1998-07-21, ""Burundi Peace Talks Prove Tough""",0,2,0,0,"AU, UN",11000,11024,0,0,0,0,0,0,0,0,0,0,0,0,0,0,0,0,0,0,2,2,3,0,0,1,0,0,0,0,0
383,Burundi,90,516,2,Government of Burundi - CNDD,12,0,0,1,07/22/1998,07/29/1998,1,"Reuters 1998-07-22, ""FOCUS-Progress slow at Burundi peace talks""; Reuters 1998-07-24, ""Burundi's warring sides reach heart of the matter""; Xinhua 1998-07-28, ""Burundi Parties Continue Discussions on Root of Conflict""",0,2,0,0,"AU, UN",11000,11024,0,0,0,0,0,0,0,0,0,0,0,0,0,0,0,0,0,0,2,3,1,0,0,1,0,0,0,0,0
384,Burundi,90,516,0,Government of Burundi - Frolina,13,0,0,0,07/22/1998,07/29/1998,1,"Reuters 1998-07-22, ""FOCUS-Progress slow at Burundi peace talks""; Reuters 1998-07-24, ""Burundi's warring sides reach heart of the matter""; Xinhua 1998-07-28, ""Burundi Parties Continue Discussions on Root of Conflict""",0,2,0,0,"AU, UN",11000,11024,0,0,0,0,0,0,0,0,0,0,0,0,0,0,0,0,0,0,2,3,1,0,0,1,0,0,0,0,0
385,Burundi,90,516,2,Government of Burundi - CNDD,12,0,0,1,10/13/1998,10/13/1998,1,"Xinhua 1998-10-13, ""Burundi Peace Talks Start in Arusha""",0,2,0,0,"AU, UN",11000,11024,0,0,0,0,0,0,0,0,0,0,0,0,0,0,0,0,0,0,2,3,4,0,0,0,1,0,0,0,0
386,Burundi,90,516,2,Government of Burundi - CNDD,12,0,0,1,10/13/1998,10/22/1998,1,"Xinhua 1998-10-13, ""Burundi Peace Talks Start in Arusha""",1,0,0,0,Tanzania,510,0,0,0,0,0,0,0,0,0,0,0,0,0,0,0,0,0,0,0,1,3,0,0,0,0,0,1,0,0,0
387,Burundi,90,516,0,Government of Burundi - Frolina,13,0,0,0,10/13/1998,10/13/1998,1,"Xinhua 1998-10-13, ""Burundi Peace Talks Start in Arusha""",0,2,0,0,"AU, UN",11000,11024,0,0,0,0,0,0,0,0,0,0,0,0,0,0,0,0,0,0,2,3,4,0,0,0,1,0,0,0,0
388,Burundi,90,516,0,Government of Burundi - Frolina,13,0,0,0,10/13/1998,10/22/1998,1,"Xinhua 1998-10-13, ""Burundi Peace Talks Start in Arusha""",1,0,0,0,Tanzania,510,0,0,0,0,0,0,0,0,0,0,0,0,0,0,0,0,0,0,0,1,3,0,0,0,0,0,1,0,0,0
389,Burundi,90,516,2,Government of Burundi - CNDD,12,0,0,1,10/14/1998,10/22/1998,1,"Xinhua 1998-10-14, ""Burundi Conflicting Parties Begin Face-to-Face Talks""; Xinhua 1998-10-15, ""Former Burundian President Urges Warring Parties to Reconcile""; Xinhua 1998-10-16, ""Burundi Warring Factions Call for Transitional Govt""; Xinhua 1998-10-22, ""Burundi Conflicting Parties Content With Peace Talks""; Reuters 1998-10-22, ""Burundi warring factions end round of peace talks""",0,2,0,0,"AU, UN",11000,11024,0,0,0,0,0,0,0,0,0,0,0,0,0,0,0,0,0,0,2,3,1,1,1,1,0,0,0,0,0
390,Burundi,90,516,0,Government of Burundi - Frolina,13,0,0,0,10/14/1998,10/22/1998,1,"Xinhua 1998-10-14, ""Burundi Conflicting Parties Begin Face-to-Face Talks""; Xinhua 1998-10-15, ""Former Burundian President Urges Warring Parties to Reconcile""; Xinhua 1998-10-16, ""Burundi Warring Factions Call for Transitional Govt""; Xinhua 1998-10-22, ""Burundi Conflicting Parties Content With Peace Talks""; Reuters 1998-10-22, ""Burundi warring factions end round of peace talks""",0,2,0,0,"AU, UN",11000,11024,0,0,0,0,0,0,0,0,0,0,0,0,0,0,0,0,0,0,2,3,1,1,1,1,0,0,0,0,0
391,Burundi,90,516,2,Government of Burundi - CNDD,12,0,0,1,10/16/1998,10/16/1998,1,"Xinhua 1998-10-16, ""Burundi Warring Factions Call for Transitional Govt""",0,0,1,0,"NGO, domestic or local ",12028,0,0,0,0,0,0,0,0,0,0,0,0,0,0,0,0,0,0,0,1,3,1,0,0,0,1,0,0,0,0
392,Burundi,90,516,0,Government of Burundi - Frolina,13,0,0,0,10/16/1998,10/16/1998,1,"Xinhua 1998-10-16, ""Burundi Warring Factions Call for Transitional Govt""",0,0,1,0,"NGO, domestic or local ",12028,0,0,0,0,0,0,0,0,0,0,0,0,0,0,0,0,0,0,0,1,3,1,0,0,0,1,0,0,0,0
393,Burundi,90,516,2,Government of Burundi - CNDD,12,0,0,1,12/14/1998,12/20/1998,1,"Reuters 1998-12-14, ""Burundi factions restart peace talks amid fighting""; Xinhua 1998-12-21, ""Nyerere to Report Progress in Burundi Peace Talks""",0,2,0,0,"AU, UN",11000,11024,0,0,0,0,0,0,0,0,0,0,0,0,0,0,0,0,0,0,2,3,1,0,0,0,1,0,0,0,0
394,Burundi,90,516,2,Government of Burundi - CNDD,12,0,0,1,12/14/1998,12/20/1998,1,"Reuters 1998-12-14, ""Burundi factions restart peace talks amid fighting""; Xinhua 1998-12-21, ""Nyerere to Report Progress in Burundi Peace Talks""",1,0,0,0,Tanzania,510,0,0,0,0,0,0,0,0,0,0,0,0,0,0,0,0,0,0,0,1,3,0,0,0,0,0,1,0,0,0
395,Burundi,90,516,0,Government of Burundi - Frolina,13,0,0,0,12/14/1998,12/20/1998,1,"Reuters 1998-12-14, ""Burundi factions restart peace talks amid fighting""; Xinhua 1998-12-21, ""Nyerere to Report Progress in Burundi Peace Talks""",0,2,0,0,"AU, UN",11000,11024,0,0,0,0,0,0,0,0,0,0,0,0,0,0,0,0,0,0,2,3,1,0,0,0,1,0,0,0,0
396,Burundi,90,516,0,Government of Burundi - Frolina,13,0,0,0,12/14/1998,12/20/1998,1,"Reuters 1998-12-14, ""Burundi factions restart peace talks amid fighting""; Xinhua 1998-12-21, ""Nyerere to Report Progress in Burundi Peace Talks""",1,0,0,0,Tanzania,510,0,0,0,0,0,0,0,0,0,0,0,0,0,0,0,0,0,0,0,1,3,0,0,0,0,0,1,0,0,0
397,Burundi,90,516,0,Government of Burundi - CNDD,12,1,0,0,01/01/1999,12/31/1999,5,"Reuters 1999-10-18, ""Burundi looks to S.Africa to help end civil war""",0,0,1,0,Privat person - not in a former official position acting independently,12030,0,0,0,0,0,0,0,0,0,0,0,0,0,0,0,0,0,0,0,1,3,4,0,0,0,1,0,0,0,0
398,Burundi,90,516,0,Government of Burundi - Frolina,13,1,0,0,01/01/1999,12/31/1999,5,"Reuters 1999-10-18, ""Burundi looks to S.Africa to help end civil war""",0,0,1,0,Privat person - not in a former official position acting independently,12030,0,0,0,0,0,0,0,0,0,0,0,0,0,0,0,0,0,0,0,1,3,4,0,0,0,1,0,0,0,0
399,Burundi,90,516,2,Government of Burundi - CNDD-FDD,14,1,0,1,01/01/1999,12/31/1999,5,"Reuters 1999-10-18, ""Burundi looks to S.Africa to help end civil war""",0,0,1,0,Privat person - not in a former official position acting independently,12030,0,0,0,0,0,0,0,0,0,0,0,0,0,0,0,0,0,0,0,1,3,4,0,0,0,1,0,0,0,0
400,Burundi,90,516,2,Government of Burundi - CNDD-FDD,14,0,0,1,01/01/1999,12/31/1999,5,"Reuters 2000-01-16, ""Mandela to launch renewed Burundi peace bid""",1,0,0,0,South Africa,560,0,0,0,0,0,0,0,0,0,0,0,0,0,0,0,0,0,0,0,1,0,0,0,0,0,0,1,0,0,0
401,Burundi,90,516,2,Government of Burundi - Palipehutu-FNL,15,1,0,1,01/01/1999,12/31/1999,5,"Reuters 1999-10-18, ""Burundi looks to S.Africa to help end civil war""",0,0,1,0,Privat person - not in a former official position acting independently,12030,0,0,0,0,0,0,0,0,0,0,0,0,0,0,0,0,0,0,0,1,3,4,0,0,0,1,0,0,0,0
402,Burundi,90,516,0,Government of Burundi - CNDD,12,0,0,0,01/18/1999,03/16/1999,1,"PANA 1999-01-18, ""Burundi-Negotiations Fourth Round Of Burundian Peace Talks Opens In Arusha""; Reuters 1999-01-18, ""FOCUS-Burundi govt wants rebels at peace talks""; Xinhua 1999-03-17, ""Burundi Peace Committees Proceed Slowly""",0,2,0,0,"AU, UN",11000,11024,0,0,0,0,0,0,0,0,0,0,0,0,0,0,0,0,0,0,2,3,1,1,0,1,0,0,0,0,0
403,Burundi,90,516,0,Government of Burundi - CNDD,12,0,0,0,01/18/1999,03/16/1999,1,"PANA 1999-01-18, ""Burundi-Negotiations Fourth Round Of Burundian Peace Talks Opens In Arusha""; Xinhua 1999-03-17, ""Burundi Peace Committees Proceed Slowly""",1,0,0,0,Tanzania,510,0,0,0,0,0,0,0,0,0,0,0,0,0,0,0,0,0,0,0,1,3,0,0,0,0,0,1,0,0,0
404,Burundi,90,516,0,Government of Burundi - Frolina,13,0,0,0,01/18/1999,03/16/1999,1,"PANA 1999-01-18, ""Burundi-Negotiations Fourth Round Of Burundian Peace Talks Opens In Arusha""; Reuters 1999-01-18, ""FOCUS-Burundi govt wants rebels at peace talks""; Xinhua 1999-03-17, ""Burundi Peace Committees Proceed Slowly""",0,2,0,0,"AU, UN",11000,11024,0,0,0,0,0,0,0,0,0,0,0,0,0,0,0,0,0,0,2,3,1,1,0,1,0,0,0,0,0
405,Burundi,90,516,0,Government of Burundi - Frolina,13,0,0,0,01/18/1999,03/16/1999,1,"PANA 1999-01-18, ""Burundi-Negotiations Fourth Round Of Burundian Peace Talks Opens In Arusha""; Xinhua 1999-03-17, ""Burundi Peace Committees Proceed Slowly""",1,0,0,0,Tanzania,510,0,0,0,0,0,0,0,0,0,0,0,0,0,0,0,0,0,0,0,1,3,0,0,0,0,0,1,0,0,0
406,Burundi,90,516,0,Government of Burundi - CNDD,12,0,0,0,03/08/1999,03/08/1999,1,"Reuters 1999-03-08, ""Bosnia's Sacirbey advises Burundi factions on peace""",1,0,0,0,Bosnia and Herzegovina,346,0,0,0,0,0,0,0,0,0,0,0,0,0,0,0,0,0,0,0,1,3,1,0,0,1,0,0,0,0,0
407,Burundi,90,516,0,Government of Burundi - CNDD,12,0,0,0,03/08/1999,03/08/1999,1,"Reuters 1999-03-08, ""Bosnia's Sacirbey advises Burundi factions on peace""",1,0,0,0,Finland,375,0,0,0,0,0,0,0,0,0,0,0,0,0,0,0,0,0,0,0,1,3,1,0,0,0,1,0,0,0,0
408,Burundi,90,516,0,Government of Burundi - Frolina,13,0,0,0,03/08/1999,03/08/1999,1,"Reuters 1999-03-08, ""Bosnia's Sacirbey advises Burundi factions on peace""",1,0,0,0,Bosnia and Herzegovina,346,0,0,0,0,0,0,0,0,0,0,0,0,0,0,0,0,0,0,0,1,3,1,0,0,1,0,0,0,0,0
409,Burundi,90,516,0,Government of Burundi - Frolina,13,0,0,0,03/08/1999,03/08/1999,1,"Reuters 1999-03-08, ""Bosnia's Sacirbey advises Burundi factions on peace""",1,0,0,0,Finland,375,0,0,0,0,0,0,0,0,0,0,0,0,0,0,0,0,0,0,0,1,3,1,0,0,0,1,0,0,0,0
410,Burundi,90,516,0,Government of Burundi - CNDD,12,1,0,0,05/09/1999,05/09/1999,1,"Xinhua 1999-05-09, ""Buyoya Holds Talks with Nyerere on Peace""",0,2,0,0,"AU, UN",11000,11024,0,0,0,0,0,0,0,0,0,0,0,0,0,0,0,0,0,0,2,1,3,0,0,1,0,0,0,0,0
411,Burundi,90,516,0,Government of Burundi - CNDD,12,1,0,0,05/09/1999,05/09/1999,1,"Xinhua 1999-05-09, ""Buyoya Holds Talks with Nyerere on Peace""",1,0,0,0,Tanzania,510,0,0,0,0,0,0,0,0,0,0,0,0,0,0,0,0,0,0,0,1,1,0,0,0,0,0,1,0,0,0
412,Burundi,90,516,0,Government of Burundi - Frolina,13,1,0,0,05/09/1999,05/09/1999,1,"Xinhua 1999-05-09, ""Buyoya Holds Talks with Nyerere on Peace""",0,2,0,0,"AU, UN",11000,11024,0,0,0,0,0,0,0,0,0,0,0,0,0,0,0,0,0,0,2,1,3,0,0,1,0,0,0,0,0
413,Burundi,90,516,0,Government of Burundi - Frolina,13,1,0,0,05/09/1999,05/09/1999,1,"Xinhua 1999-05-09, ""Buyoya Holds Talks with Nyerere on Peace""",1,0,0,0,Tanzania,510,0,0,0,0,0,0,0,0,0,0,0,0,0,0,0,0,0,0,0,1,1,0,0,0,0,0,1,0,0,0
414,Burundi,90,516,2,Government of Burundi - CNDD-FDD,14,1,0,1,05/09/1999,05/09/1999,1,"Xinhua 1999-05-09, ""Buyoya Holds Talks with Nyerere on Peace""",0,2,0,0,"AU, UN",11000,11024,0,0,0,0,0,0,0,0,0,0,0,0,0,0,0,0,0,0,2,1,3,0,0,1,0,0,0,0,0
415,Burundi,90,516,2,Government of Burundi - CNDD-FDD,14,1,0,1,05/09/1999,05/09/1999,1,"Xinhua 1999-05-09, ""Buyoya Holds Talks with Nyerere on Peace""",1,0,0,0,Tanzania,510,0,0,0,0,0,0,0,0,0,0,0,0,0,0,0,0,0,0,0,1,1,0,0,0,0,0,1,0,0,0
416,Burundi,90,516,2,Government of Burundi - Palipehutu-FNL,15,1,0,1,05/09/1999,05/09/1999,1,"Xinhua 1999-05-09, ""Buyoya Holds Talks with Nyerere on Peace""",0,2,0,0,"AU, UN",11000,11024,0,0,0,0,0,0,0,0,0,0,0,0,0,0,0,0,0,0,2,1,3,0,0,1,0,0,0,0,0
417,Burundi,90,516,2,Government of Burundi - Palipehutu-FNL,15,1,0,1,05/09/1999,05/09/1999,1,"Xinhua 1999-05-09, ""Buyoya Holds Talks with Nyerere on Peace""",1,0,0,0,Tanzania,510,0,0,0,0,0,0,0,0,0,0,0,0,0,0,0,0,0,0,0,1,1,0,0,0,0,0,1,0,0,0
418,Burundi,90,516,0,Government of Burundi - CNDD,12,0,0,0,05/10/1999,05/31/1999,4,"Reuters 1999-05-10, ""Burundi govt, rebels hold talks as war continues""; Xinhua 1999-05-15, ""Burundi Envoy Expects Peace Agreements""; The East African 1999-06-03, ""Groupings Undermine Burundi Peace Talks""",0,2,0,0,"AU, UN",11000,11024,0,0,0,0,0,0,0,0,0,0,0,0,0,0,0,0,0,0,2,3,1,1,0,1,0,0,0,0,0
419,Burundi,90,516,0,Government of Burundi - CNDD,12,0,0,0,05/10/1999,05/31/1999,4,"Reuters 1999-05-10, ""Burundi govt, rebels hold talks as war continues""; Xinhua 1999-05-15, ""Burundi Envoy Expects Peace Agreements""; The East African 1999-06-03, ""Groupings Undermine Burundi Peace Talks""",1,0,0,0,Tanzania,510,0,0,0,0,0,0,0,0,0,0,0,0,0,0,0,0,0,0,0,1,3,0,0,0,0,0,1,0,0,0
420,Burundi,90,516,0,Government of Burundi - Frolina,13,0,0,0,05/10/1999,05/31/1999,4,"Reuters 1999-05-10, ""Burundi govt, rebels hold talks as war continues""; Xinhua 1999-05-15, ""Burundi Envoy Expects Peace Agreements""; The East African 1999-06-03, ""Groupings Undermine Burundi Peace Talks""",0,2,0,0,"AU, UN",11000,11024,0,0,0,0,0,0,0,0,0,0,0,0,0,0,0,0,0,0,2,3,1,1,0,1,0,0,0,0,0
421,Burundi,90,516,0,Government of Burundi - Frolina,13,0,0,0,05/10/1999,05/31/1999,4,"Reuters 1999-05-10, ""Burundi govt, rebels hold talks as war continues""; Xinhua 1999-05-15, ""Burundi Envoy Expects Peace Agreements""; The East African 1999-06-03, ""Groupings Undermine Burundi Peace Talks""",1,0,0,0,Tanzania,510,0,0,0,0,0,0,0,0,0,0,0,0,0,0,0,0,0,0,0,1,3,0,0,0,0,0,1,0,0,0
422,Burundi,90,516,0,Government of Burundi - CNDD,12,1,0,0,06/11/1999,06/11/1999,1,"Xinhua 1999-06-19, ""Burundi Peace Deal Likely by Late 1999 - Nyerere""",0,2,0,0,"AU, UN",11000,11024,0,0,0,0,0,0,0,0,0,0,0,0,0,0,0,0,0,0,2,1,3,0,0,0,1,0,0,0,0
423,Burundi,90,516,0,Government of Burundi - CNDD,12,1,0,0,06/11/1999,06/11/1999,1,"Xinhua 1999-06-19, ""Burundi Peace Deal Likely by Late 1999 - Nyerere""",1,0,0,0,South Africa,560,0,0,0,0,0,0,0,0,0,0,0,0,0,0,0,0,0,0,0,1,1,0,0,0,0,0,1,0,0,0
424,Burundi,90,516,0,Government of Burundi - Frolina,13,1,0,0,06/11/1999,06/11/1999,1,"Xinhua 1999-06-19, ""Burundi Peace Deal Likely by Late 1999 - Nyerere""",0,2,0,0,"AU, UN",11000,11024,0,0,0,0,0,0,0,0,0,0,0,0,0,0,0,0,0,0,2,1,3,0,0,0,1,0,0,0,0
425,Burundi,90,516,0,Government of Burundi - Frolina,13,1,0,0,06/11/1999,06/11/1999,1,"Xinhua 1999-06-19, ""Burundi Peace Deal Likely by Late 1999 - Nyerere""",1,0,0,0,South Africa,560,0,0,0,0,0,0,0,0,0,0,0,0,0,0,0,0,0,0,0,1,1,0,0,0,0,0,1,0,0,0
426,Burundi,90,516,2,Government of Burundi - CNDD-FDD,14,1,0,1,06/11/1999,06/11/1999,1,"Xinhua 1999-06-19, ""Burundi Peace Deal Likely by Late 1999 - Nyerere""",0,2,0,0,"AU, UN",11000,11024,0,0,0,0,0,0,0,0,0,0,0,0,0,0,0,0,0,0,2,1,3,0,0,0,1,0,0,0,0
427,Burundi,90,516,2,Government of Burundi - CNDD-FDD,14,1,0,1,06/11/1999,06/11/1999,1,"Xinhua 1999-06-19, ""Burundi Peace Deal Likely by Late 1999 - Nyerere""",1,0,0,0,South Africa,560,0,0,0,0,0,0,0,0,0,0,0,0,0,0,0,0,0,0,0,1,1,0,0,0,0,0,1,0,0,0
428,Burundi,90,516,2,Government of Burundi - Palipehutu-FNL,15,1,0,1,06/11/1999,06/11/1999,1,"Xinhua 1999-06-19, ""Burundi Peace Deal Likely by Late 1999 - Nyerere""",0,2,0,0,"AU, UN",11000,11024,0,0,0,0,0,0,0,0,0,0,0,0,0,0,0,0,0,0,2,1,3,0,0,0,1,0,0,0,0
429,Burundi,90,516,2,Government of Burundi - Palipehutu-FNL,15,1,0,1,06/11/1999,06/11/1999,1,"Xinhua 1999-06-19, ""Burundi Peace Deal Likely by Late 1999 - Nyerere""",1,0,0,0,South Africa,560,0,0,0,0,0,0,0,0,0,0,0,0,0,0,0,0,0,0,0,1,1,0,0,0,0,0,1,0,0,0
430,Burundi,90,516,0,Government of Burundi - CNDD,12,0,0,0,07/08/1999,07/16/1999,1,"Reuters 1999-07-08, ""Burundi peace talks resume despite doubt of success""; Reuters 1999-07-16, ""Burundi peace talks end in deadlock""",0,2,0,0,"AU, UN",11000,11024,0,0,0,0,0,0,0,0,0,0,0,0,0,0,0,0,0,0,2,3,1,0,0,1,0,0,0,0,0
431,Burundi,90,516,0,Government of Burundi - CNDD,12,0,0,0,07/08/1999,07/16/1999,1,"Reuters 1999-07-08, ""Burundi peace talks resume despite doubt of success""; Reuters 1999-07-16, ""Burundi peace talks end in deadlock""",1,0,0,0,Tanzania,510,0,0,0,0,0,0,0,0,0,0,0,0,0,0,0,0,0,0,0,1,3,0,0,0,0,0,1,0,0,0
432,Burundi,90,516,0,Government of Burundi - Frolina,13,0,0,0,07/08/1999,07/16/1999,1,"Reuters 1999-07-08, ""Burundi peace talks resume despite doubt of success""; Reuters 1999-07-16, ""Burundi peace talks end in deadlock""",0,2,0,0,"AU, UN",11000,11024,0,0,0,0,0,0,0,0,0,0,0,0,0,0,0,0,0,0,2,3,1,0,0,1,0,0,0,0,0
433,Burundi,90,516,0,Government of Burundi - Frolina,13,0,0,0,07/08/1999,07/16/1999,1,"Reuters 1999-07-08, ""Burundi peace talks resume despite doubt of success""; Reuters 1999-07-16, ""Burundi peace talks end in deadlock""",1,0,0,0,Tanzania,510,0,0,0,0,0,0,0,0,0,0,0,0,0,0,0,0,0,0,0,1,3,0,0,0,0,0,1,0,0,0
434,Burundi,90,516,0,Government of Burundi - CNDD,12,1,0,0,08/11/1999,08/11/1999,1,"Reuters 1999-08-10, ""Burundian, Tanzanian Defense Ministers to Hold Talks on Security""",1,0,0,0,Tanzania,510,0,0,0,0,0,0,0,0,0,0,0,0,0,0,0,0,0,0,0,1,1,3,0,0,1,0,0,0,0,0
435,Burundi,90,516,0,Government of Burundi - Frolina,13,1,0,0,08/11/1999,08/11/1999,1,"Reuters 1999-08-10, ""Burundian, Tanzanian Defense Ministers to Hold Talks on Security""",1,0,0,0,Tanzania,510,0,0,0,0,0,0,0,0,0,0,0,0,0,0,0,0,0,0,0,1,1,3,0,0,1,0,0,0,0,0
436,Burundi,90,516,2,Government of Burundi - CNDD-FDD,14,1,0,1,08/11/1999,08/11/1999,1,"Reuters 1999-08-10, ""Burundian, Tanzanian Defense Ministers to Hold Talks on Security""",1,0,0,0,Tanzania,510,0,0,0,0,0,0,0,0,0,0,0,0,0,0,0,0,0,0,0,1,1,3,0,0,1,0,0,0,0,0
437,Burundi,90,516,2,Government of Burundi - Palipehutu-FNL,15,1,0,1,08/11/1999,08/11/1999,1,"Reuters 1999-08-10, ""Burundian, Tanzanian Defense Ministers to Hold Talks on Security""",1,0,0,0,Tanzania,510,0,0,0,0,0,0,0,0,0,0,0,0,0,0,0,0,0,0,0,1,1,3,0,0,1,0,0,0,0,0
438,Burundi,90,516,0,Government of Burundi - CNDD,12,0,0,0,09/13/1999,09/18/1999,1,"Reuters 1999-09-13, ""Burundi peace talks restart amid pessimism""; Xinhua 1999-09-13, ""Burundi Peace Talks Resume in Tanzanian Town""; Reuters 1999-09-18, ""Latest Burundian peace talks end, no sign of deal""; Xinhua 1999-09-20, ""Burundian Factions to Further Negotiate for Peace""",0,0,1,0,Envoy or representative of Julius Nyerere (former Tanzanian President),12020,0,0,0,0,0,0,0,0,0,0,0,0,0,0,0,0,0,0,0,1,3,1,1,0,1,0,0,0,0,0
439,Burundi,90,516,0,Government of Burundi - CNDD,12,0,0,0,09/13/1999,09/18/1999,1,"Reuters 1999-09-13, ""Burundi peace talks restart amid pessimism""; Xinhua 1999-09-13, ""Burundi Peace Talks Resume in Tanzanian Town""; Reuters 1999-09-18, ""Latest Burundian peace talks end, no sign of deal""",1,0,0,0,Tanzania,510,0,0,0,0,0,0,0,0,0,0,0,0,0,0,0,0,0,0,0,1,3,0,0,0,0,0,1,0,0,0
440,Burundi,90,516,0,Government of Burundi - Frolina,13,0,0,0,09/13/1999,09/18/1999,1,"Reuters 1999-09-13, ""Burundi peace talks restart amid pessimism""; Xinhua 1999-09-13, ""Burundi Peace Talks Resume in Tanzanian Town""; Reuters 1999-09-18, ""Latest Burundian peace talks end, no sign of deal""; Xinhua 1999-09-20, ""Burundian Factions to Further Negotiate for Peace""",0,0,1,0,Envoy or representative of Julius Nyerere (former Tanzanian President),12020,0,0,0,0,0,0,0,0,0,0,0,0,0,0,0,0,0,0,0,1,3,1,1,0,1,0,0,0,0,0
441,Burundi,90,516,0,Government of Burundi - Frolina,13,0,0,0,09/13/1999,09/18/1999,1,"Reuters 1999-09-13, ""Burundi peace talks restart amid pessimism""; Xinhua 1999-09-13, ""Burundi Peace Talks Resume in Tanzanian Town""; Reuters 1999-09-18, ""Latest Burundian peace talks end, no sign of deal""",1,0,0,0,Tanzania,510,0,0,0,0,0,0,0,0,0,0,0,0,0,0,0,0,0,0,0,1,3,0,0,0,0,0,1,0,0,0
442,Burundi,90,516,0,Government of Burundi - CNDD,12,0,0,0,09/18/1999,09/18/1999,1,"Xinhua 1999-09-18, ""Security in Burundi Improving - President""",1,0,0,0,Uganda,500,0,0,0,0,0,0,0,0,0,0,0,0,0,0,0,0,0,0,0,1,1,3,0,0,0,1,0,0,0,0
443,Burundi,90,516,0,Government of Burundi - Frolina,13,0,0,0,09/18/1999,09/18/1999,1,"Xinhua 1999-09-18, ""Security in Burundi Improving - President""",1,0,0,0,Uganda,500,0,0,0,0,0,0,0,0,0,0,0,0,0,0,0,0,0,0,0,1,1,3,0,0,0,1,0,0,0,0
444,Burundi,90,516,0,Government of Burundi - CNDD,12,0,0,0,09/26/1999,09/26/1999,1,"Reuters 1999-09-26, ""Burundi leader denies talk of Rwandan military aid""",1,0,0,0,Rwanda,517,0,0,0,0,0,0,0,0,0,0,0,0,0,0,0,0,0,0,0,1,1,3,0,0,1,0,0,0,0,0
445,Burundi,90,516,0,Government of Burundi - Frolina,13,0,0,0,09/26/1999,09/26/1999,1,"Reuters 1999-09-26, ""Burundi leader denies talk of Rwandan military aid""",1,0,0,0,Rwanda,517,0,0,0,0,0,0,0,0,0,0,0,0,0,0,0,0,0,0,0,1,1,3,0,0,1,0,0,0,0,0
446,Burundi,90,516,0,Government of Burundi - CNDD,12,1,0,0,10/02/1999,10/02/1999,1,"Reuters 1999-10-02, ""Burundi calls on rebels to come to peace table""",0,1,0,0,UN,11024,0,0,0,0,0,0,0,0,0,0,0,0,0,0,0,0,0,0,0,1,1,3,0,0,1,0,0,0,0,0
447,Burundi,90,516,0,Government of Burundi - Frolina,13,1,0,0,10/02/1999,10/02/1999,1,"Reuters 1999-10-02, ""Burundi calls on rebels to come to peace table""",0,1,0,0,UN,11024,0,0,0,0,0,0,0,0,0,0,0,0,0,0,0,0,0,0,0,1,1,3,0,0,1,0,0,0,0,0
448,Burundi,90,516,2,Government of Burundi - CNDD-FDD,14,1,0,1,10/02/1999,10/02/1999,1,"Reuters 1999-10-02, ""Burundi calls on rebels to come to peace table""",0,1,0,0,UN,11024,0,0,0,0,0,0,0,0,0,0,0,0,0,0,0,0,0,0,0,1,1,3,0,0,1,0,0,0,0,0
449,Burundi,90,516,2,Government of Burundi - Palipehutu-FNL,15,1,0,1,10/02/1999,10/02/1999,1,"Reuters 1999-10-02, ""Burundi calls on rebels to come to peace table""",0,1,0,0,UN,11024,0,0,0,0,0,0,0,0,0,0,0,0,0,0,0,0,0,0,0,1,1,3,0,0,1,0,0,0,0,0
450,Burundi,90,516,0,Government of Burundi - CNDD,12,1,0,0,10/21/1999,10/21/1999,1,"Reuters 1999-10-21, ""U.S. asks Burundi to press on with peace talks""",1,0,0,0,USA,2,0,0,0,0,0,0,0,0,0,0,0,0,0,0,0,0,0,0,0,1,1,3,0,0,1,0,0,0,0,0
451,Burundi,90,516,0,Government of Burundi - Frolina,13,1,0,0,10/21/1999,10/21/1999,1,"Reuters 1999-10-21, ""U.S. asks Burundi to press on with peace talks""",1,0,0,0,USA,2,0,0,0,0,0,0,0,0,0,0,0,0,0,0,0,0,0,0,0,1,1,3,0,0,1,0,0,0,0,0
452,Burundi,90,516,2,Government of Burundi - CNDD-FDD,14,1,0,1,10/21/1999,10/21/1999,1,"Reuters 1999-10-21, ""U.S. asks Burundi to press on with peace talks""",1,0,0,0,USA,2,0,0,0,0,0,0,0,0,0,0,0,0,0,0,0,0,0,0,0,1,1,3,0,0,1,0,0,0,0,0
453,Burundi,90,516,2,Government of Burundi - Palipehutu-FNL,15,1,0,1,10/21/1999,10/21/1999,1,"Reuters 1999-10-21, ""U.S. asks Burundi to press on with peace talks""",1,0,0,0,USA,2,0,0,0,0,0,0,0,0,0,0,0,0,0,0,0,0,0,0,0,1,1,3,0,0,1,0,0,0,0,0
454,Burundi,90,516,0,Government of Burundi - CNDD,12,1,0,0,11/06/1999,11/07/1999,1,"Reuters 1999-11-07, ""Burundi says new mediator needed for peace talks""",1,0,0,0,Tanzania,510,0,0,0,0,0,0,0,0,0,0,0,0,0,0,0,0,0,0,0,1,1,3,0,0,1,0,0,0,0,0
455,Burundi,90,516,0,Government of Burundi - Frolina,13,1,0,0,11/06/1999,11/07/1999,1,"Reuters 1999-11-07, ""Burundi says new mediator needed for peace talks""",1,0,0,0,Tanzania,510,0,0,0,0,0,0,0,0,0,0,0,0,0,0,0,0,0,0,0,1,1,3,0,0,1,0,0,0,0,0
456,Burundi,90,516,2,Government of Burundi - CNDD-FDD,14,1,0,1,11/06/1999,11/07/1999,1,"Reuters 1999-11-07, ""Burundi says new mediator needed for peace talks""",1,0,0,0,Tanzania,510,0,0,0,0,0,0,0,0,0,0,0,0,0,0,0,0,0,0,0,1,1,3,0,0,1,0,0,0,0,0
457,Burundi,90,516,2,Government of Burundi - Palipehutu-FNL,15,1,0,1,11/06/1999,11/07/1999,1,"Reuters 1999-11-07, ""Burundi says new mediator needed for peace talks""",1,0,0,0,Tanzania,510,0,0,0,0,0,0,0,0,0,0,0,0,0,0,0,0,0,0,0,1,1,3,0,0,1,0,0,0,0,0
458,Burundi,90,516,0,Government of Burundi - CNDD,12,1,0,0,12/01/1999,12/01/1999,1,"Xinhua 1999-12-01, ""Mandela Succeeds Nyerere as New Burundi Peace Facilitator""",8,2,0,0,"Uganda, Tanzania, Kenya, South Africa, Burundi, Ethiopia, Rwanda, Zambia, AU, UN",500,510,501,560,516,530,517,551,11000,11024,0,0,0,0,0,0,0,0,0,0,10,1,3,0,0,1,0,0,0,0,0
459,Burundi,90,516,0,Government of Burundi - Frolina,13,1,0,0,12/01/1999,12/01/1999,1,"Xinhua 1999-12-01, ""Mandela Succeeds Nyerere as New Burundi Peace Facilitator""",8,2,0,0,"Uganda, Tanzania, Kenya, South Africa, Burundi, Ethiopia, Rwanda, Zambia, AU, UN",500,510,501,560,516,530,517,551,11000,11024,0,0,0,0,0,0,0,0,0,0,10,1,3,0,0,1,0,0,0,0,0
460,Burundi,90,516,2,Government of Burundi - CNDD-FDD,14,1,0,1,12/01/1999,12/01/1999,1,"Xinhua 1999-12-01, ""Mandela Succeeds Nyerere as New Burundi Peace Facilitator""",8,2,0,0,"Uganda, Tanzania, Kenya, South Africa, Burundi, Ethiopia, Rwanda, Zambia, AU, UN",500,510,501,560,516,530,517,551,11000,11024,0,0,0,0,0,0,0,0,0,0,10,1,3,0,0,1,0,0,0,0,0
461,Burundi,90,516,2,Government of Burundi - Palipehutu-FNL,15,1,0,1,12/01/1999,12/01/1999,1,"Xinhua 1999-12-01, ""Mandela Succeeds Nyerere as New Burundi Peace Facilitator""",8,2,0,0,"Uganda, Tanzania, Kenya, South Africa, Burundi, Ethiopia, Rwanda, Zambia, AU, UN",500,510,501,560,516,530,517,551,11000,11024,0,0,0,0,0,0,0,0,0,0,10,1,3,0,0,1,0,0,0,0,0
462,Burundi,90,516,0,Government of Burundi - CNDD,12,0,0,0,12/06/1999,12/11/1999,1,"Xinhua 1999-12-06, ""Arusha Peace Talks on Burundi Conflict Resume""; Xinhua 1999-12-11, ""Mandela Calls for Peace Agreement in Burundi""; Xinhua 2000-01-12, ""Mandela to Arrive in Tanzania for Burundi Peace""",0,0,1,0,Envoy or representative of Julius Nyerere (former Tanzanian President),12020,0,0,0,0,0,0,0,0,0,0,0,0,0,0,0,0,0,0,0,1,3,4,0,0,1,0,0,0,0,0
463,Burundi,90,516,0,Government of Burundi - CNDD,12,0,0,0,12/06/1999,12/11/1999,1,"Xinhua 1999-12-06, ""Arusha Peace Talks on Burundi Conflict Resume""; Xinhua 1999-12-11, ""Mandela Calls for Peace Agreement in Burundi""",1,0,0,0,Tanzania,510,0,0,0,0,0,0,0,0,0,0,0,0,0,0,0,0,0,0,0,1,3,0,0,0,0,0,1,0,0,0
464,Burundi,90,516,0,Government of Burundi - Frolina,13,0,0,0,12/06/1999,12/11/1999,1,"Xinhua 1999-12-06, ""Arusha Peace Talks on Burundi Conflict Resume""; Xinhua 1999-12-11, ""Mandela Calls for Peace Agreement in Burundi""; Xinhua 2000-01-12, ""Mandela to Arrive in Tanzania for Burundi Peace""",0,0,1,0,Envoy or representative of Julius Nyerere (former Tanzanian President),12020,0,0,0,0,0,0,0,0,0,0,0,0,0,0,0,0,0,0,0,1,3,4,0,0,1,0,0,0,0,0
465,Burundi,90,516,0,Government of Burundi - Frolina,13,0,0,0,12/06/1999,12/11/1999,1,"Xinhua 1999-12-06, ""Arusha Peace Talks on Burundi Conflict Resume""; Xinhua 1999-12-11, ""Mandela Calls for Peace Agreement in Burundi""",1,0,0,0,Tanzania,510,0,0,0,0,0,0,0,0,0,0,0,0,0,0,0,0,0,0,0,1,3,0,0,0,0,0,1,0,0,0
466,Burundi,90,516,0,Government of Burundi - CNDD,12,0,0,0,12/28/1999,12/28/1999,1,"Xinhua 1999-12-29, ""Ugandan President pledges full support to the ongoing peace process in Burundi""",1,0,0,0,Uganda,500,0,0,0,0,0,0,0,0,0,0,0,0,0,0,0,0,0,0,0,1,1,3,0,0,1,0,0,0,0,0
467,Burundi,90,516,0,Government of Burundi - Frolina,13,0,0,0,12/28/1999,12/28/1999,1,"Xinhua 1999-12-29, ""Ugandan President pledges full support to the ongoing peace process in Burundi""",1,0,0,0,Uganda,500,0,0,0,0,0,0,0,0,0,0,0,0,0,0,0,0,0,0,0,1,1,3,0,0,1,0,0,0,0,0
468,Burundi,90,516,0,Government of Burundi - CNDD,12,1,0,0,01/13/2000,01/13/2000,1,"Reuters 2000-01-13, ""Mandela to launch Burundi mediation bid""",2,0,0,0,"Tanzania, Uganda",510,500,0,0,0,0,0,0,0,0,0,0,0,0,0,0,0,0,0,0,2,1,3,0,0,0,1,0,0,0,0
469,Burundi,90,516,0,Government of Burundi - Frolina,13,1,0,0,01/13/2000,01/13/2000,1,"Reuters 2000-01-13, ""Mandela to launch Burundi mediation bid""",2,0,0,0,"Tanzania, Uganda",510,500,0,0,0,0,0,0,0,0,0,0,0,0,0,0,0,0,0,0,2,1,3,0,0,0,1,0,0,0,0
470,Burundi,90,516,2,Government of Burundi - CNDD-FDD,14,1,0,1,01/13/2000,01/13/2000,1,"Reuters 2000-01-13, ""Mandela to launch Burundi mediation bid""",2,0,0,0,"Tanzania, Uganda",510,500,0,0,0,0,0,0,0,0,0,0,0,0,0,0,0,0,0,0,2,1,3,0,0,0,1,0,0,0,0
471,Burundi,90,516,2,Government of Burundi - Palipehutu-FNL,15,1,0,1,01/13/2000,01/13/2000,1,"Reuters 2000-01-13, ""Mandela to launch Burundi mediation bid""",2,0,0,0,"Tanzania, Uganda",510,500,0,0,0,0,0,0,0,0,0,0,0,0,0,0,0,0,0,0,2,1,3,0,0,0,1,0,0,0,0
472,Burundi,90,516,0,Government of Burundi - CNDD,12,0,0,0,01/16/2000,01/16/2000,1,"Xinhua 2000-01-16, ""Mandela Urges Burundian Parties to Accept Peace""",0,0,1,0,Nelson Mandela (former President of South Africa),12026,0,0,0,0,0,0,0,0,0,0,0,0,0,0,0,0,0,0,0,1,3,4,0,0,0,1,0,0,0,0
473,Burundi,90,516,0,Government of Burundi - CNDD,12,0,0,0,01/16/2000,01/16/2000,1,"Xinhua 2000-01-16, ""Mandela Urges Burundian Parties to Accept Peace""",1,0,0,0,Tanzania,510,0,0,0,0,0,0,0,0,0,0,0,0,0,0,0,0,0,0,0,1,3,0,0,0,0,0,1,0,0,0
474,Burundi,90,516,0,Government of Burundi - Frolina,13,0,0,0,01/16/2000,01/16/2000,1,"Xinhua 2000-01-16, ""Mandela Urges Burundian Parties to Accept Peace""",0,0,1,0,Nelson Mandela (former President of South Africa),12026,0,0,0,0,0,0,0,0,0,0,0,0,0,0,0,0,0,0,0,1,3,4,0,0,0,1,0,0,0,0
475,Burundi,90,516,0,Government of Burundi - Frolina,13,0,0,0,01/16/2000,01/16/2000,1,"Xinhua 2000-01-16, ""Mandela Urges Burundian Parties to Accept Peace""",1,0,0,0,Tanzania,510,0,0,0,0,0,0,0,0,0,0,0,0,0,0,0,0,0,0,0,1,3,0,0,0,0,0,1,0,0,0
476,Burundi,90,516,0,Government of Burundi - CNDD,12,1,0,0,01/20/2000,01/20/2000,1,"Xinhua 2000-01-20, ""Burundi Peace Talks Continue in Tanzania""",0,0,1,0,Envoy or representative of Nelson Mandela,12027,0,0,0,0,0,0,0,0,0,0,0,0,0,0,0,0,0,0,0,1,3,1,0,0,0,1,0,0,0,0
477,Burundi,90,516,0,Government of Burundi - CNDD,12,1,0,0,01/20/2000,01/20/2000,1,"Xinhua 2000-01-20, ""Burundi Peace Talks Continue in Tanzania""",1,0,0,0,Tanzania,510,0,0,0,0,0,0,0,0,0,0,0,0,0,0,0,0,0,0,0,1,3,0,0,0,0,0,1,0,0,0
478,Burundi,90,516,0,Government of Burundi - CNDD,12,1,0,0,02/01/2000,02/28/2000,4,"Reuters 2000-02-09, ""Burundi rebels to meet Mandela in peace bid""",0,0,1,0,Nelson Mandela (former President of South Africa),12026,0,0,0,0,0,0,0,0,0,0,0,0,0,0,0,0,0,0,0,1,1,3,0,0,1,0,0,0,0,0
479,Burundi,90,516,0,Government of Burundi - Frolina,13,1,0,0,02/01/2000,02/28/2000,4,"Reuters 2000-02-09, ""Burundi rebels to meet Mandela in peace bid""",0,0,1,0,Nelson Mandela (former President of South Africa),12026,0,0,0,0,0,0,0,0,0,0,0,0,0,0,0,0,0,0,0,1,1,3,0,0,1,0,0,0,0,0
480,Burundi,90,516,2,Government of Burundi - CNDD-FDD,14,1,0,1,02/01/2000,02/28/2000,4,"Reuters 2000-02-09, ""Burundi rebels to meet Mandela in peace bid""",0,0,1,0,Nelson Mandela (former President of South Africa),12026,0,0,0,0,0,0,0,0,0,0,0,0,0,0,0,0,0,0,0,1,1,3,0,0,1,0,0,0,0,0
481,Burundi,90,516,2,Government of Burundi - Palipehutu-FNL,15,1,0,1,02/01/2000,02/28/2000,4,"Reuters 2000-02-09, ""Burundi rebels to meet Mandela in peace bid""",0,0,1,0,Nelson Mandela (former President of South Africa),12026,0,0,0,0,0,0,0,0,0,0,0,0,0,0,0,0,0,0,0,1,1,3,0,0,1,0,0,0,0,0
482,Burundi,90,516,0,Government of Burundi - CNDD,12,0,0,0,02/21/2000,03/04/2000,1,"Reuters 2000-02-21, ""Clinton to nudge Burundi peace talks via video""; Xinhua 2000-02-21, ""Great Lakes Summit Discusses Burundi Peace""; Xinhua 2000-02-21, ""Mandela Urges Burundi Rebels to Join Peace Talks""; Reuters 2000-03-04, ""Burundi peace talks end without breakthrough""",6,2,1,0,"Nelson Mandela (former President of South Africa), Tanzania, Uganda, Mozambique, South Africa, UK, France, AU, EC/EU",12026,510,500,541,560,200,220,11000,11010,0,0,0,0,0,0,0,0,0,0,0,9,1,3,0,0,1,0,0,0,0,0
483,Burundi,90,516,0,Government of Burundi - Frolina,13,0,0,0,02/21/2000,03/04/2000,1,"Reuters 2000-02-21, ""Clinton to nudge Burundi peace talks via video""; Xinhua 2000-02-21, ""Great Lakes Summit Discusses Burundi Peace""; Xinhua 2000-02-21, ""Mandela Urges Burundi Rebels to Join Peace Talks""; Reuters 2000-03-04, ""Burundi peace talks end without breakthrough""",6,2,1,0,"Nelson Mandela (former President of South Africa), Tanzania, Uganda, Mozambique, South Africa, UK, France, AU, EC/EU",12026,510,500,541,560,200,220,11000,11010,0,0,0,0,0,0,0,0,0,0,0,9,1,3,0,0,1,0,0,0,0,0
484,Burundi,90,516,0,Government of Burundi - CNDD,12,1,0,0,03/04/2000,03/04/2000,1,"Reuters 2000-03-04, ""Burundi peace talks end without breakthrough""",1,0,0,0,South Africa,560,0,0,0,0,0,0,0,0,0,0,0,0,0,0,0,0,0,0,0,1,1,3,0,0,1,0,0,0,0,0
485,Burundi,90,516,0,Government of Burundi - Frolina,13,1,0,0,03/04/2000,03/04/2000,1,"Reuters 2000-03-04, ""Burundi peace talks end without breakthrough""",1,0,0,0,South Africa,560,0,0,0,0,0,0,0,0,0,0,0,0,0,0,0,0,0,0,0,1,1,3,0,0,1,0,0,0,0,0
486,Burundi,90,516,2,Government of Burundi - CNDD-FDD,14,1,0,1,03/04/2000,03/04/2000,1,"Reuters 2000-03-04, ""Burundi peace talks end without breakthrough""",1,0,0,0,South Africa,560,0,0,0,0,0,0,0,0,0,0,0,0,0,0,0,0,0,0,0,1,1,3,0,0,1,0,0,0,0,0
487,Burundi,90,516,2,Government of Burundi - Palipehutu-FNL,15,1,0,1,03/04/2000,03/04/2000,1,"Reuters 2000-03-04, ""Burundi peace talks end without breakthrough""",1,0,0,0,South Africa,560,0,0,0,0,0,0,0,0,0,0,0,0,0,0,0,0,0,0,0,1,1,3,0,0,1,0,0,0,0,0
488,Burundi,90,516,2,Government of Burundi - CNDD-FDD,14,0,0,1,03/20/2000,03/20/2000,1,"Reuters 2000-03-20, ""Burundian rebel leader agrees to join peace talks""",0,0,1,0,Nelson Mandela (former President of South Africa),12026,0,0,0,0,0,0,0,0,0,0,0,0,0,0,0,0,0,0,0,1,2,3,0,0,1,0,0,0,0,0
489,Burundi,90,516,2,Government of Burundi - CNDD-FDD,14,0,0,1,03/20/2000,03/20/2000,1,"Reuters 2000-03-20, ""Burundian rebel leader agrees to join peace talks""",1,0,0,0,South Africa,560,0,0,0,0,0,0,0,0,0,0,0,0,0,0,0,0,0,0,0,1,2,0,0,0,0,0,1,0,0,0
490,Burundi,90,516,2,Government of Burundi - Palipehutu-FNL,15,0,0,1,03/24/2000,03/24/2000,1,"Reuters 2000-03-24, ""Burundi's FNL rebels agree to join peace talks""; AFP 2000-03-24, ""Second guerrilla leader agrees to join Burundi talks""",0,0,1,0,Nelson Mandela (former President of South Africa),12026,0,0,0,0,0,0,0,0,0,0,0,0,0,0,0,0,0,0,0,1,2,3,0,0,1,0,0,0,0,0
491,Burundi,90,516,2,Government of Burundi - Palipehutu-FNL,15,0,0,1,03/24/2000,03/24/2000,1,"Reuters 2000-03-24, ""Burundi's FNL rebels agree to join peace talks""",1,0,0,0,South Africa,560,0,0,0,0,0,0,0,0,0,0,0,0,0,0,0,0,0,0,0,1,2,0,0,0,0,0,1,0,0,0
492,Burundi,90,516,0,Government of Burundi - CNDD,12,1,0,0,04/28/2000,04/28/2000,1,"Xinhua 2000-04-28, ""Mandela Urges Burundian Army to Support Peace""; Reuters 2000-04-28, ""Mandela visits Burundi for first time as mediator""",0,0,1,0,Nelson Mandela (former President of South Africa),12026,0,0,0,0,0,0,0,0,0,0,0,0,0,0,0,0,0,0,0,1,1,3,0,0,0,1,0,0,0,0
493,Burundi,90,516,0,Government of Burundi - Frolina,13,1,0,0,04/28/2000,04/28/2000,1,"Xinhua 2000-04-28, ""Mandela Urges Burundian Army to Support Peace""; Reuters 2000-04-28, ""Mandela visits Burundi for first time as mediator""",0,0,1,0,Nelson Mandela (former President of South Africa),12026,0,0,0,0,0,0,0,0,0,0,0,0,0,0,0,0,0,0,0,1,1,3,0,0,0,1,0,0,0,0
494,Burundi,90,516,2,Government of Burundi - CNDD-FDD,14,1,0,1,04/28/2000,04/28/2000,1,"Xinhua 2000-04-28, ""Mandela Urges Burundian Army to Support Peace""; Reuters 2000-04-28, ""Mandela visits Burundi for first time as mediator""",0,0,1,0,Nelson Mandela (former President of South Africa),12026,0,0,0,0,0,0,0,0,0,0,0,0,0,0,0,0,0,0,0,1,1,3,0,0,0,1,0,0,0,0
495,Burundi,90,516,2,Government of Burundi - Palipehutu-FNL,15,1,0,1,04/28/2000,04/28/2000,1,"Xinhua 2000-04-28, ""Mandela Urges Burundian Army to Support Peace""; Reuters 2000-04-28, ""Mandela visits Burundi for first time as mediator""",0,0,1,0,Nelson Mandela (former President of South Africa),12026,0,0,0,0,0,0,0,0,0,0,0,0,0,0,0,0,0,0,0,1,1,3,0,0,0,1,0,0,0,0
496,Burundi,90,516,0,Government of Burundi - CNDD,12,1,0,0,05/19/2000,05/19/2000,1,"Internews 2000-05-19, ""UN Expert On Peace Keeping Missions Briefs Burundi Delegates""",0,1,0,0,UN,11024,0,0,0,0,0,0,0,0,0,0,0,0,0,0,0,0,0,0,0,1,1,3,0,0,1,0,0,0,0,0
497,Burundi,90,516,0,Government of Burundi - CNDD,12,1,0,0,05/19/2000,05/19/2000,1,"Internews 2000-05-19, ""UN Expert On Peace Keeping Missions Briefs Burundi Delegates""",1,0,0,0,Tanzania,510,0,0,0,0,0,0,0,0,0,0,0,0,0,0,0,0,0,0,0,1,1,0,0,0,0,0,1,0,0,0
498,Burundi,90,516,0,Government of Burundi - Frolina,13,1,0,0,05/19/2000,05/19/2000,1,"Internews 2000-05-19, ""UN Expert On Peace Keeping Missions Briefs Burundi Delegates""",0,1,0,0,UN,11024,0,0,0,0,0,0,0,0,0,0,0,0,0,0,0,0,0,0,0,1,1,3,0,0,1,0,0,0,0,0
499,Burundi,90,516,0,Government of Burundi - Frolina,13,1,0,0,05/19/2000,05/19/2000,1,"Internews 2000-05-19, ""UN Expert On Peace Keeping Missions Briefs Burundi Delegates""",1,0,0,0,Tanzania,510,0,0,0,0,0,0,0,0,0,0,0,0,0,0,0,0,0,0,0,1,1,0,0,0,0,0,1,0,0,0
500,Burundi,90,516,2,Government of Burundi - CNDD-FDD,14,1,0,1,05/19/2000,05/19/2000,1,"Internews 2000-05-19, ""UN Expert On Peace Keeping Missions Briefs Burundi Delegates""",0,1,0,0,UN,11024,0,0,0,0,0,0,0,0,0,0,0,0,0,0,0,0,0,0,0,1,1,3,0,0,1,0,0,0,0,0
501,Burundi,90,516,2,Government of Burundi - CNDD-FDD,14,1,0,1,05/19/2000,05/19/2000,1,"Internews 2000-05-19, ""UN Expert On Peace Keeping Missions Briefs Burundi Delegates""",1,0,0,0,Tanzania,510,0,0,0,0,0,0,0,0,0,0,0,0,0,0,0,0,0,0,0,1,1,0,0,0,0,0,1,0,0,0
502,Burundi,90,516,2,Government of Burundi - Palipehutu-FNL,15,1,0,1,05/19/2000,05/19/2000,1,"Internews 2000-05-19, ""UN Expert On Peace Keeping Missions Briefs Burundi Delegates""",0,1,0,0,UN,11024,0,0,0,0,0,0,0,0,0,0,0,0,0,0,0,0,0,0,0,1,1,3,0,0,1,0,0,0,0,0
503,Burundi,90,516,2,Government of Burundi - Palipehutu-FNL,15,1,0,1,05/19/2000,05/19/2000,1,"Internews 2000-05-19, ""UN Expert On Peace Keeping Missions Briefs Burundi Delegates""",1,0,0,0,Tanzania,510,0,0,0,0,0,0,0,0,0,0,0,0,0,0,0,0,0,0,0,1,1,0,0,0,0,0,1,0,0,0
504,Burundi,90,516,0,Government of Burundi - CNDD,12,1,0,0,05/22/2000,05/22/2000,1,"AFP 2000-05-22, ""Mandela holds talks with Burundi rebels in Johannesburg""",0,0,1,0,Nelson Mandela (former President of South Africa),12026,0,0,0,0,0,0,0,0,0,0,0,0,0,0,0,0,0,0,0,1,2,3,0,0,0,1,0,0,0,0
505,Burundi,90,516,0,Government of Burundi - CNDD,12,1,0,0,05/22/2000,05/22/2000,1,"AFP 2000-05-22, ""Mandela holds talks with Burundi rebels in Johannesburg""",1,0,0,0,Tanzania,510,0,0,0,0,0,0,0,0,0,0,0,0,0,0,0,0,0,0,0,1,2,0,0,0,0,0,1,0,0,0
506,Burundi,90,516,0,Government of Burundi - Frolina,13,1,0,0,05/22/2000,05/22/2000,1,"AFP 2000-05-22, ""Mandela holds talks with Burundi rebels in Johannesburg""",0,0,1,0,Nelson Mandela (former President of South Africa),12026,0,0,0,0,0,0,0,0,0,0,0,0,0,0,0,0,0,0,0,1,2,3,0,0,0,1,0,0,0,0
507,Burundi,90,516,0,Government of Burundi - Frolina,13,1,0,0,05/22/2000,05/22/2000,1,"AFP 2000-05-22, ""Mandela holds talks with Burundi rebels in Johannesburg""",1,0,0,0,Tanzania,510,0,0,0,0,0,0,0,0,0,0,0,0,0,0,0,0,0,0,0,1,2,0,0,0,0,0,1,0,0,0
508,Burundi,90,516,2,Government of Burundi - CNDD-FDD,14,1,0,1,05/22/2000,05/22/2000,1,"AFP 2000-05-22, ""Mandela holds talks with Burundi rebels in Johannesburg""",0,0,1,0,Nelson Mandela (former President of South Africa),12026,0,0,0,0,0,0,0,0,0,0,0,0,0,0,0,0,0,0,0,1,2,3,0,0,0,1,0,0,0,0
509,Burundi,90,516,2,Government of Burundi - CNDD-FDD,14,1,0,1,05/22/2000,05/22/2000,1,"AFP 2000-05-22, ""Mandela holds talks with Burundi rebels in Johannesburg""",1,0,0,0,Tanzania,510,0,0,0,0,0,0,0,0,0,0,0,0,0,0,0,0,0,0,0,1,2,0,0,0,0,0,1,0,0,0
510,Burundi,90,516,2,Government of Burundi - Palipehutu-FNL,15,1,0,1,05/22/2000,05/22/2000,1,"AFP 2000-05-22, ""Mandela holds talks with Burundi rebels in Johannesburg""",0,0,1,0,Nelson Mandela (former President of South Africa),12026,0,0,0,0,0,0,0,0,0,0,0,0,0,0,0,0,0,0,0,1,2,3,0,0,0,1,0,0,0,0
511,Burundi,90,516,2,Government of Burundi - Palipehutu-FNL,15,1,0,1,05/22/2000,05/22/2000,1,"AFP 2000-05-22, ""Mandela holds talks with Burundi rebels in Johannesburg""",1,0,0,0,Tanzania,510,0,0,0,0,0,0,0,0,0,0,0,0,0,0,0,0,0,0,0,1,2,0,0,0,0,0,1,0,0,0
512,Burundi,90,516,0,Government of Burundi - CNDD,12,0,0,0,06/07/2000,06/07/2000,1,"Xinhua 2000-06-07, ""Burundians in Camps to Be Release by End of July""",0,0,1,0,Nelson Mandela (former President of South Africa),12026,0,0,0,0,0,0,0,0,0,0,0,0,0,0,0,0,0,0,0,1,1,3,1,1,1,0,0,0,0,0
513,Burundi,90,516,0,Government of Burundi - CNDD,12,0,0,0,06/07/2000,06/07/2000,1,"Xinhua 2000-06-07, ""Burundians in Camps to Be Release by End of July""",1,0,0,0,South Africa,560,0,0,0,0,0,0,0,0,0,0,0,0,0,0,0,0,0,0,0,1,1,0,0,0,0,0,1,0,0,0
514,Burundi,90,516,0,Government of Burundi - Frolina,13,0,0,0,06/07/2000,06/07/2000,1,"Xinhua 2000-06-07, ""Burundians in Camps to Be Release by End of July""",0,0,1,0,Nelson Mandela (former President of South Africa),12026,0,0,0,0,0,0,0,0,0,0,0,0,0,0,0,0,0,0,0,1,1,3,1,1,1,0,0,0,0,0
515,Burundi,90,516,0,Government of Burundi - Frolina,13,0,0,0,06/07/2000,06/07/2000,1,"Xinhua 2000-06-07, ""Burundians in Camps to Be Release by End of July""",1,0,0,0,South Africa,560,0,0,0,0,0,0,0,0,0,0,0,0,0,0,0,0,0,0,0,1,1,0,0,0,0,0,1,0,0,0
516,Burundi,90,516,0,Government of Burundi - CNDD,12,1,0,0,06/12/2000,06/12/2000,1,"Reuters 2000-06-12, ""Mandela arrives in Burundi for peace tour""",0,0,1,0,Nelson Mandela (former President of South Africa),12026,0,0,0,0,0,0,0,0,0,0,0,0,0,0,0,0,0,0,0,1,1,3,0,0,1,0,0,0,0,0
517,Burundi,90,516,0,Government of Burundi - Frolina,13,1,0,0,06/12/2000,06/12/2000,1,"Reuters 2000-06-12, ""Mandela arrives in Burundi for peace tour""",0,0,1,0,Nelson Mandela (former President of South Africa),12026,0,0,0,0,0,0,0,0,0,0,0,0,0,0,0,0,0,0,0,1,1,3,0,0,1,0,0,0,0,0
518,Burundi,90,516,2,Government of Burundi - CNDD-FDD,14,1,0,1,06/12/2000,06/12/2000,1,"Reuters 2000-06-12, ""Mandela arrives in Burundi for peace tour""",0,0,1,0,Nelson Mandela (former President of South Africa),12026,0,0,0,0,0,0,0,0,0,0,0,0,0,0,0,0,0,0,0,1,1,3,0,0,1,0,0,0,0,0
519,Burundi,90,516,2,Government of Burundi - Palipehutu-FNL,15,1,0,1,06/12/2000,06/12/2000,1,"Reuters 2000-06-12, ""Mandela arrives in Burundi for peace tour""",0,0,1,0,Nelson Mandela (former President of South Africa),12026,0,0,0,0,0,0,0,0,0,0,0,0,0,0,0,0,0,0,0,1,1,3,0,0,1,0,0,0,0,0
520,Burundi,90,516,0,Government of Burundi - CNDD,12,1,0,0,07/17/2000,07/17/2000,1,"AFP 2000-07-18, ""Burundian rebel leader makes first visit to peace talks""",0,0,1,0,Envoy or representative of Nelson Mandela,12027,0,0,0,0,0,0,0,0,0,0,0,0,0,0,0,0,0,0,0,1,1,3,1,1,1,0,0,0,0,0
521,Burundi,90,516,0,Government of Burundi - CNDD,12,0,0,0,07/17/2000,07/19/2000,1,"AFP 2000-07-18, ""Burundian rebel leader makes first visit to peace talks""; Xinhua 2000-07-19, ""African Leaders Satisfied With Burundi Peace Process""",1,0,0,0,Tanzania,510,0,0,0,0,0,0,0,0,0,0,0,0,0,0,0,0,0,0,0,1,3,0,0,0,0,0,1,0,0,0
522,Burundi,90,516,0,Government of Burundi - Frolina,13,1,0,0,07/17/2000,07/17/2000,1,"AFP 2000-07-18, ""Burundian rebel leader makes first visit to peace talks""",0,0,1,0,Envoy or representative of Nelson Mandela,12027,0,0,0,0,0,0,0,0,0,0,0,0,0,0,0,0,0,0,0,1,1,3,1,1,1,0,0,0,0,0
523,Burundi,90,516,0,Government of Burundi - Frolina,13,0,0,0,07/17/2000,07/19/2000,1,"AFP 2000-07-18, ""Burundian rebel leader makes first visit to peace talks""; Xinhua 2000-07-19, ""African Leaders Satisfied With Burundi Peace Process""",1,0,0,0,Tanzania,510,0,0,0,0,0,0,0,0,0,0,0,0,0,0,0,0,0,0,0,1,3,0,0,0,0,0,1,0,0,0
524,Burundi,90,516,2,Government of Burundi - CNDD-FDD,14,0,0,1,07/18/2000,07/19/2000,1,"Xinhua 2000-07-19, ""African Leaders Satisfied With Burundi Peace Process""",0,0,1,0,Envoy or representative of Nelson Mandela,12027,0,0,0,0,0,0,0,0,0,0,0,0,0,0,0,0,0,0,0,1,2,3,0,0,0,1,0,0,0,0
525,Burundi,90,516,0,Government of Burundi - CNDD,12,0,0,0,07/19/2000,07/19/2000,1,"Xinhua 2000-07-19, ""African Leaders Satisfied With Burundi Peace Process""",5,1,1,0,"Nelson Mandela (former President of South Africa), AU, Uganda, Kenya, Zambia, Ethiopia, Tanzania",12026,11000,500,501,551,530,510,0,0,0,0,0,0,0,0,0,0,0,0,0,7,3,1,1,1,1,0,0,0,0,0
526,Burundi,90,516,2,Government of Burundi - CNDD-FDD,14,0,0,1,07/19/2000,07/19/2000,1,"Xinhua 2000-07-19, ""African Leaders Satisfied With Burundi Peace Process""",5,1,1,0,"Nelson Mandela (former President of South Africa), AU, Uganda, Kenya, Zambia, Ethiopia, Tanzania",12026,11000,500,501,551,530,510,0,0,0,0,0,0,0,0,0,0,0,0,0,7,3,1,1,1,1,0,0,0,0,0
527,Burundi,90,516,2,Government of Burundi - CNDD-FDD,14,0,0,1,08/01/2000,08/31/2000,4,"Reuters 2000-08-26, ""UPDATE 1-Mandela in last-minute talks on Burundi""",0,0,1,0,Nelson Mandela (former President of South Africa),12026,0,0,0,0,0,0,0,0,0,0,0,0,0,0,0,0,0,0,0,1,2,3,0,1,1,0,0,0,0,0
528,Burundi,90,516,2,Government of Burundi - CNDD-FDD,14,0,0,1,08/01/2000,08/31/2000,4,"Reuters 2000-08-26, ""UPDATE 1-Mandela in last-minute talks on Burundi""",1,0,0,0,South Africa,560,0,0,0,0,0,0,0,0,0,0,0,0,0,0,0,0,0,0,0,1,2,0,0,0,0,0,1,0,0,0
529,Burundi,90,516,2,Government of Burundi - Palipehutu-FNL,15,0,0,1,08/01/2000,08/31/2000,4,"Reuters 2000-08-26, ""UPDATE 1-Mandela in last-minute talks on Burundi""",0,0,1,0,Nelson Mandela (former President of South Africa),12026,0,0,0,0,0,0,0,0,0,0,0,0,0,0,0,0,0,0,0,1,2,3,0,1,1,0,0,0,0,0
530,Burundi,90,516,2,Government of Burundi - Palipehutu-FNL,15,0,0,1,08/01/2000,08/31/2000,4,"Reuters 2000-08-26, ""UPDATE 1-Mandela in last-minute talks on Burundi""",1,0,0,0,South Africa,560,0,0,0,0,0,0,0,0,0,0,0,0,0,0,0,0,0,0,0,1,2,0,0,0,0,0,1,0,0,0
531,Burundi,90,516,0,Government of Burundi - CNDD,12,1,0,0,08/03/2000,08/04/2000,1,"Reuters 2000-08-04, ""UPDATE 1-Mandela sees Burundi peace deal in August""",1,0,1,0,"USA, Nelson Mandela (former President of South Africa)",2,12026,0,0,0,0,0,0,0,0,0,0,0,0,0,0,0,0,0,0,2,1,3,0,0,1,0,0,0,0,0
532,Burundi,90,516,0,Government of Burundi - CNDD,12,1,0,0,08/03/2000,08/04/2000,1,"Reuters 2000-08-04, ""UPDATE 1-Mandela sees Burundi peace deal in August""",1,0,0,0,South Africa,560,0,0,0,0,0,0,0,0,0,0,0,0,0,0,0,0,0,0,0,1,1,0,0,0,0,0,1,0,0,0
533,Burundi,90,516,0,Government of Burundi - Frolina,13,1,0,0,08/03/2000,08/04/2000,1,"Reuters 2000-08-04, ""UPDATE 1-Mandela sees Burundi peace deal in August""",1,0,1,0,"USA, Nelson Mandela (former President of South Africa)",2,12026,0,0,0,0,0,0,0,0,0,0,0,0,0,0,0,0,0,0,2,1,3,0,0,1,0,0,0,0,0
534,Burundi,90,516,0,Government of Burundi - Frolina,13,1,0,0,08/03/2000,08/04/2000,1,"Reuters 2000-08-04, ""UPDATE 1-Mandela sees Burundi peace deal in August""",1,0,0,0,South Africa,560,0,0,0,0,0,0,0,0,0,0,0,0,0,0,0,0,0,0,0,1,1,0,0,0,0,0,1,0,0,0
535,Burundi,90,516,2,Government of Burundi - CNDD-FDD,14,1,0,1,08/03/2000,08/04/2000,1,"Reuters 2000-08-04, ""UPDATE 1-Mandela sees Burundi peace deal in August""",1,0,1,0,"USA, Nelson Mandela (former President of South Africa)",2,12026,0,0,0,0,0,0,0,0,0,0,0,0,0,0,0,0,0,0,2,1,3,0,0,1,0,0,0,0,0
536,Burundi,90,516,2,Government of Burundi - CNDD-FDD,14,1,0,1,08/03/2000,08/04/2000,1,"Reuters 2000-08-04, ""UPDATE 1-Mandela sees Burundi peace deal in August""",1,0,0,0,South Africa,560,0,0,0,0,0,0,0,0,0,0,0,0,0,0,0,0,0,0,0,1,1,0,0,0,0,0,1,0,0,0
537,Burundi,90,516,2,Government of Burundi - Palipehutu-FNL,15,1,0,1,08/03/2000,08/04/2000,1,"Reuters 2000-08-04, ""UPDATE 1-Mandela sees Burundi peace deal in August""",1,0,1,0,"USA, Nelson Mandela (former President of South Africa)",2,12026,0,0,0,0,0,0,0,0,0,0,0,0,0,0,0,0,0,0,2,1,3,0,0,1,0,0,0,0,0
538,Burundi,90,516,2,Government of Burundi - Palipehutu-FNL,15,1,0,1,08/03/2000,08/04/2000,1,"Reuters 2000-08-04, ""UPDATE 1-Mandela sees Burundi peace deal in August""",1,0,0,0,South Africa,560,0,0,0,0,0,0,0,0,0,0,0,0,0,0,0,0,0,0,0,1,1,0,0,0,0,0,1,0,0,0
539,Burundi,90,516,0,Government of Burundi - CNDD,12,0,0,0,08/07/2000,08/31/2000,4,"Xinhua 2000-08-07, ""Burundi Peace Talks Resume Amid Major Differences""; AFP 2000-08-25, ""Burundi delegations arrive in Arusha ahead of accord signing""",0,0,1,0,Nelson Mandela (former President of South Africa),12026,0,0,0,0,0,0,0,0,0,0,0,0,0,0,0,0,0,0,0,1,1,3,1,1,1,0,0,0,0,0
540,Burundi,90,516,0,Government of Burundi - CNDD,12,0,0,0,08/07/2000,08/31/2000,4,"Reuters 2000-08-06, ""Burundi peacemakers start new round of talks""",1,0,0,0,Tanzania,510,0,0,0,0,0,0,0,0,0,0,0,0,0,0,0,0,0,0,0,1,1,0,0,0,0,0,1,0,0,0
541,Burundi,90,516,0,Government of Burundi - Frolina,13,0,0,0,08/07/2000,08/31/2000,4,"Xinhua 2000-08-07, ""Burundi Peace Talks Resume Amid Major Differences""; AFP 2000-08-25, ""Burundi delegations arrive in Arusha ahead of accord signing""",0,0,1,0,Nelson Mandela (former President of South Africa),12026,0,0,0,0,0,0,0,0,0,0,0,0,0,0,0,0,0,0,0,1,1,3,1,1,1,0,0,0,0,0
542,Burundi,90,516,0,Government of Burundi - Frolina,13,0,0,0,08/07/2000,08/31/2000,4,"Reuters 2000-08-06, ""Burundi peacemakers start new round of talks""",1,0,0,0,Tanzania,510,0,0,0,0,0,0,0,0,0,0,0,0,0,0,0,0,0,0,0,1,1,0,0,0,0,0,1,0,0,0
543,Burundi,90,516,2,Government of Burundi - CNDD-FDD,14,0,0,1,08/07/2000,08/31/2000,4,"Xinhua 2000-08-07, ""Burundi Peace Talks Resume Amid Major Differences""; AFP 2000-08-25, ""Burundi delegations arrive in Arusha ahead of accord signing""",0,0,1,0,Nelson Mandela (former President of South Africa),12026,0,0,0,0,0,0,0,0,0,0,0,0,0,0,0,0,0,0,0,1,1,3,1,1,1,0,0,0,0,0
544,Burundi,90,516,2,Government of Burundi - CNDD-FDD,14,0,0,1,08/07/2000,08/31/2000,4,"Reuters 2000-08-06, ""Burundi peacemakers start new round of talks""",1,0,0,0,Tanzania,510,0,0,0,0,0,0,0,0,0,0,0,0,0,0,0,0,0,0,0,1,1,0,0,0,0,0,1,0,0,0
545,Burundi,90,516,2,Government of Burundi - Palipehutu-FNL,15,0,0,1,08/07/2000,08/31/2000,4,"Xinhua 2000-08-07, ""Burundi Peace Talks Resume Amid Major Differences""; AFP 2000-08-25, ""Burundi delegations arrive in Arusha ahead of accord signing""",0,0,1,0,Nelson Mandela (former President of South Africa),12026,0,0,0,0,0,0,0,0,0,0,0,0,0,0,0,0,0,0,0,1,1,3,1,1,1,0,0,0,0,0
546,Burundi,90,516,2,Government of Burundi - Palipehutu-FNL,15,0,0,1,08/07/2000,08/31/2000,4,"Reuters 2000-08-06, ""Burundi peacemakers start new round of talks""",1,0,0,0,Tanzania,510,0,0,0,0,0,0,0,0,0,0,0,0,0,0,0,0,0,0,0,1,1,0,0,0,0,0,1,0,0,0
547,Burundi,90,516,0,Government of Burundi - CNDD,12,1,0,0,08/15/2000,08/15/2000,1,"Reuters 2000-08-15, ""Burundi ruler in S.Africa for talks with Mandela""",0,0,1,0,Nelson Mandela (former President of South Africa),12026,0,0,0,0,0,0,0,0,0,0,0,0,0,0,0,0,0,0,0,1,1,3,0,0,0,1,0,0,0,0
548,Burundi,90,516,0,Government of Burundi - CNDD,12,1,0,0,08/15/2000,08/15/2000,1,"Reuters 2000-08-15, ""Burundi ruler in S.Africa for talks with Mandela""",1,0,0,0,South Africa,560,0,0,0,0,0,0,0,0,0,0,0,0,0,0,0,0,0,0,0,1,1,0,0,0,0,0,1,0,0,0
549,Burundi,90,516,0,Government of Burundi - Frolina,13,1,0,0,08/15/2000,08/15/2000,1,"Reuters 2000-08-15, ""Burundi ruler in S.Africa for talks with Mandela""",0,0,1,0,Nelson Mandela (former President of South Africa),12026,0,0,0,0,0,0,0,0,0,0,0,0,0,0,0,0,0,0,0,1,1,3,0,0,0,1,0,0,0,0
550,Burundi,90,516,0,Government of Burundi - Frolina,13,1,0,0,08/15/2000,08/15/2000,1,"Reuters 2000-08-15, ""Burundi ruler in S.Africa for talks with Mandela""",1,0,0,0,South Africa,560,0,0,0,0,0,0,0,0,0,0,0,0,0,0,0,0,0,0,0,1,1,0,0,0,0,0,1,0,0,0
551,Burundi,90,516,2,Government of Burundi - CNDD-FDD,14,1,0,1,08/15/2000,08/15/2000,1,"Reuters 2000-08-15, ""Burundi ruler in S.Africa for talks with Mandela""",0,0,1,0,Nelson Mandela (former President of South Africa),12026,0,0,0,0,0,0,0,0,0,0,0,0,0,0,0,0,0,0,0,1,1,3,0,0,0,1,0,0,0,0
552,Burundi,90,516,2,Government of Burundi - CNDD-FDD,14,1,0,1,08/15/2000,08/15/2000,1,"Reuters 2000-08-15, ""Burundi ruler in S.Africa for talks with Mandela""",1,0,0,0,South Africa,560,0,0,0,0,0,0,0,0,0,0,0,0,0,0,0,0,0,0,0,1,1,0,0,0,0,0,1,0,0,0
553,Burundi,90,516,2,Government of Burundi - Palipehutu-FNL,15,1,0,1,08/15/2000,08/15/2000,1,"Reuters 2000-08-15, ""Burundi ruler in S.Africa for talks with Mandela""",0,0,1,0,Nelson Mandela (former President of South Africa),12026,0,0,0,0,0,0,0,0,0,0,0,0,0,0,0,0,0,0,0,1,1,3,0,0,0,1,0,0,0,0
554,Burundi,90,516,2,Government of Burundi - Palipehutu-FNL,15,1,0,1,08/15/2000,08/15/2000,1,"Reuters 2000-08-15, ""Burundi ruler in S.Africa for talks with Mandela""",1,0,0,0,South Africa,560,0,0,0,0,0,0,0,0,0,0,0,0,0,0,0,0,0,0,0,1,1,0,0,0,0,0,1,0,0,0
555,Burundi,90,516,0,Government of Burundi - CNDD,12,0,0,0,08/17/2000,08/17/2000,1,"Reuters 2000-08-17 ""Burundi leader, rebels confer in South Africa.""",1,0,0,0,South Africa,560,0,0,0,0,0,0,0,0,0,0,0,0,0,0,0,0,0,0,0,1,0,0,0,0,0,0,1,0,0,0
556,Burundi,90,516,2,Government of Burundi - CNDD-FDD,14,0,0,1,08/17/2000,08/17/2000,1,"Reuters 2000-08-17, ""Burundi leader, rebels confer in South Africa""",1,0,0,0,South Africa,560,0,0,0,0,0,0,0,0,0,0,0,0,0,0,0,0,0,0,0,1,3,0,0,0,0,0,1,0,0,0
557,Burundi,90,516,0,Government of Burundi - CNDD,12,1,0,0,08/26/2000,08/28/2000,1,"Reuters 2000-08-26, ""UPDATE 1-Mandela in last-minute talks on Burundi""; AFP 2000-08-25, ""Burundi delegations arrive in Arusha ahead of accord signing""; Reuters 2000-08-27, ""Mandela presses for Burundi peace agreement""; Reuters 2000-08-28, ""UPDATE 2-Burundi peace deal signed but some Tutsis say 'No'""",0,0,1,0,Nelson Mandela (former President of South Africa),12026,0,0,0,0,0,0,0,0,0,0,0,0,0,0,0,0,0,0,0,1,2,3,1,1,1,0,0,0,0,0
558,Burundi,90,516,0,Government of Burundi - CNDD,12,1,0,0,08/26/2000,08/28/2000,1,"Reuters 2000-08-26, ""UPDATE 1-Mandela in last-minute talks on Burundi""; AFP 2000-08-25, ""Burundi delegations arrive in Arusha ahead of accord signing""; Reuters 2000-08-27, ""Mandela presses for Burundi peace agreement""; Reuters 2000-08-28, ""UPDATE 2-Burundi peace deal signed but some Tutsis say 'No'""",0,0,1,0,Nelson Mandela (former President of South Africa),12026,0,0,0,0,0,0,0,0,0,0,0,0,0,0,0,0,0,0,0,1,3,4,1,1,1,0,0,0,0,0
559,Burundi,90,516,0,Government of Burundi - CNDD,12,1,0,0,08/26/2000,08/28/2000,1,"Reuters 2000-08-26, ""UPDATE 1-Mandela in last-minute talks on Burundi""; AFP 2000-08-25, ""Burundi delegations arrive in Arusha ahead of accord signing""; Reuters 2000-08-27, ""Mandela presses for Burundi peace agreement""; Reuters 2000-08-28, ""UPDATE 2-Burundi peace deal signed but some Tutsis say 'No'""",1,0,0,0,Tanzania,510,0,0,0,0,0,0,0,0,0,0,0,0,0,0,0,0,0,0,0,1,1,0,0,0,0,0,1,0,0,0
560,Burundi,90,516,0,Government of Burundi - Frolina,13,1,0,0,08/26/2000,08/28/2000,1,"Reuters 2000-08-26, ""UPDATE 1-Mandela in last-minute talks on Burundi""; AFP 2000-08-25, ""Burundi delegations arrive in Arusha ahead of accord signing""; Reuters 2000-08-27, ""Mandela presses for Burundi peace agreement""; Reuters 2000-08-28, ""UPDATE 2-Burundi peace deal signed but some Tutsis say 'No'""",0,0,1,0,Nelson Mandela (former President of South Africa),12026,0,0,0,0,0,0,0,0,0,0,0,0,0,0,0,0,0,0,0,1,2,3,1,1,1,0,0,0,0,0
561,Burundi,90,516,0,Government of Burundi - Frolina,13,1,0,0,08/26/2000,08/28/2000,1,"Reuters 2000-08-26, ""UPDATE 1-Mandela in last-minute talks on Burundi""; AFP 2000-08-25, ""Burundi delegations arrive in Arusha ahead of accord signing""; Reuters 2000-08-27, ""Mandela presses for Burundi peace agreement""; Reuters 2000-08-28, ""UPDATE 2-Burundi peace deal signed but some Tutsis say 'No'""",0,0,1,0,Nelson Mandela (former President of South Africa),12026,0,0,0,0,0,0,0,0,0,0,0,0,0,0,0,0,0,0,0,1,3,4,1,1,1,0,0,0,0,0
562,Burundi,90,516,0,Government of Burundi - Frolina,13,1,0,0,08/26/2000,08/28/2000,1,"Reuters 2000-08-26, ""UPDATE 1-Mandela in last-minute talks on Burundi""; AFP 2000-08-25, ""Burundi delegations arrive in Arusha ahead of accord signing""; Reuters 2000-08-27, ""Mandela presses for Burundi peace agreement""; Reuters 2000-08-28, ""UPDATE 2-Burundi peace deal signed but some Tutsis say 'No'""",1,0,0,0,Tanzania,510,0,0,0,0,0,0,0,0,0,0,0,0,0,0,0,0,0,0,0,1,1,0,0,0,0,0,1,0,0,0
563,Burundi,90,516,0,Government of Burundi - CNDD,12,1,0,0,08/30/2000,08/30/2000,1,"Xinhua 2000-08-31, ""Mandela Hails Signing of Burundian Peace Agreement""",0,0,1,0,Nelson Mandela (former President of South Africa),12026,0,0,0,0,0,0,0,0,0,0,0,0,0,0,0,0,0,0,0,1,3,4,0,0,1,0,0,0,0,0
564,Burundi,90,516,0,Government of Burundi - CNDD,12,1,0,0,08/30/2000,08/30/2000,1,"Xinhua 2000-08-31, ""Mandela Hails Signing of Burundian Peace Agreement""",1,0,0,0,Tanzania,510,0,0,0,0,0,0,0,0,0,0,0,0,0,0,0,0,0,0,0,1,1,0,0,0,0,0,1,0,0,0
565,Burundi,90,516,0,Government of Burundi - Frolina,13,1,0,0,08/30/2000,08/30/2000,1,"Xinhua 2000-08-31, ""Mandela Hails Signing of Burundian Peace Agreement""",0,0,1,0,Nelson Mandela (former President of South Africa),12026,0,0,0,0,0,0,0,0,0,0,0,0,0,0,0,0,0,0,0,1,3,4,0,0,1,0,0,0,0,0
566,Burundi,90,516,0,Government of Burundi - Frolina,13,1,0,0,08/30/2000,08/30/2000,1,"Xinhua 2000-08-31, ""Mandela Hails Signing of Burundian Peace Agreement""",1,0,0,0,Tanzania,510,0,0,0,0,0,0,0,0,0,0,0,0,0,0,0,0,0,0,0,1,1,0,0,0,0,0,1,0,0,0
567,Burundi,90,516,2,Government of Burundi - CNDD-FDD,14,0,0,1,09/20/2000,09/20/2000,1,"AFP 2000-09-20, ""Burundi rebels reject pressure for ceasefire""; Reuters 2000-09-20, ""Mandela, leaders arrive for Burundi peace talks""",4,0,1,0,"Kenya, Uganda, Rwanda, Tanzania, Nelson Mandela (former President of South Africa)",501,500,517,510,12026,0,0,0,0,0,0,0,0,0,0,0,0,0,0,0,5,3,1,0,1,1,0,0,0,0,0
568,Burundi,90,516,2,Government of Burundi - Palipehutu-FNL,15,0,0,1,09/20/2000,09/20/2000,1,"AFP 2000-09-20, ""Burundi rebels reject pressure for ceasefire""; Reuters 2000-09-20, ""Mandela, leaders arrive for Burundi peace talks""",4,0,1,0,"Kenya, Uganda, Rwanda, Tanzania, Nelson Mandela (former President of South Africa)",501,500,517,510,12026,0,0,0,0,0,0,0,0,0,0,0,0,0,0,0,5,3,1,0,1,1,0,0,0,0,0
569,Burundi,90,516,0,Government of Burundi - CNDD,12,0,0,0,09/25/2000,09/25/2000,1,"AFP 2000-09-25, ""Burundi peace depends on rapidly reaching ceasefire accord: mediator""",1,0,0,0,Tanzania,510,0,0,0,0,0,0,0,0,0,0,0,0,0,0,0,0,0,0,0,1,1,0,0,0,0,0,1,0,0,0
570,Burundi,90,516,0,Government of Burundi - CNDD,12,0,0,0,09/25/2000,09/30/2000,1,"AFP 2000-09-25, ""Burundi peace depends on rapidly reaching ceasefire accord: mediator""; Xinhua 2000-10-01, ""Burundi Peace Accord Signatories End Talks Without Achievement""",0,0,1,0,Envoy or representative of Nelson Mandela,12027,0,0,0,0,0,0,0,0,0,0,0,0,0,0,0,0,0,0,0,1,3,1,0,1,1,0,0,0,0,0
571,Burundi,90,516,0,Government of Burundi - Frolina,13,0,0,0,09/25/2000,09/25/2000,1,"AFP 2000-09-25, ""Burundi peace depends on rapidly reaching ceasefire accord: mediator""",1,0,0,0,Tanzania,510,0,0,0,0,0,0,0,0,0,0,0,0,0,0,0,0,0,0,0,1,1,0,0,0,0,0,1,0,0,0
572,Burundi,90,516,0,Government of Burundi - Frolina,13,0,0,0,09/25/2000,09/30/2000,1,"AFP 2000-09-25, ""Burundi peace depends on rapidly reaching ceasefire accord: mediator""; Xinhua 2000-10-01, ""Burundi Peace Accord Signatories End Talks Without Achievement""",0,0,1,0,Envoy or representative of Nelson Mandela,12027,0,0,0,0,0,0,0,0,0,0,0,0,0,0,0,0,0,0,0,1,3,1,0,1,1,0,0,0,0,0
573,Burundi,90,516,2,Government of Burundi - Palipehutu-FNL,15,0,0,1,10/01/2000,10/31/2000,4,"Xinhua 2000-10-28, ""Burundi Peace Facilitation Team Leader to Consult Mandela Over Peace Talks""",0,0,1,0,Nelson Mandela (former President of South Africa),12026,0,0,0,0,0,0,0,0,0,0,0,0,0,0,0,0,0,0,0,1,2,3,0,0,0,1,0,0,0,0
574,Burundi,90,516,2,Government of Burundi - Palipehutu-FNL,15,0,0,1,10/01/2000,10/31/2000,4,"Xinhua 2000-10-28, ""Burundi Peace Facilitation Team Leader to Consult Mandela Over Peace Talks""",1,0,0,0,South Africa,560,0,0,0,0,0,0,0,0,0,0,0,0,0,0,0,0,0,0,0,1,2,0,0,0,0,0,1,0,0,0
575,Burundi,90,516,2,Government of Burundi - CNDD-FDD,14,0,0,1,11/01/2000,11/30/2000,4,"Xinhua 2000-11-14, ""Mandela Meets U.N. Delegation Over Burundi Peace Process""",0,1,0,0,UN,11024,0,0,0,0,0,0,0,0,0,0,0,0,0,0,0,0,0,0,0,1,2,3,0,0,1,0,0,0,0,0
576,Burundi,90,516,2,Government of Burundi - CNDD-FDD,14,0,0,1,11/01/2000,11/30/2000,4,"Xinhua 2000-11-14, ""Mandela Meets U.N. Delegation Over Burundi Peace Process""",1,0,0,0,South Africa,560,0,0,0,0,0,0,0,0,0,0,0,0,0,0,0,0,0,0,0,1,2,0,0,0,0,0,1,0,0,0
577,Burundi,90,516,2,Government of Burundi - Palipehutu-FNL,15,0,0,1,11/01/2000,11/30/2000,4,"Xinhua 2000-11-14, ""Mandela Meets U.N. Delegation Over Burundi Peace Process""",0,1,0,0,UN,11024,0,0,0,0,0,0,0,0,0,0,0,0,0,0,0,0,0,0,0,1,2,3,0,0,1,0,0,0,0,0
578,Burundi,90,516,2,Government of Burundi - Palipehutu-FNL,15,0,0,1,11/01/2000,11/30/2000,4,"Xinhua 2000-11-14, ""Mandela Meets U.N. Delegation Over Burundi Peace Process""",1,0,0,0,South Africa,560,0,0,0,0,0,0,0,0,0,0,0,0,0,0,0,0,0,0,0,1,2,0,0,0,0,0,1,0,0,0
579,Burundi,90,516,0,Government of Burundi - CNDD,12,1,0,0,11/25/2000,11/30/2000,1,"Reuters 2000-11-25, ""Burundi parties open talks, criticised by mediators""; Internews 2000-11-27, ""Burundi Leaders Not Serious With Peace Accord, Says Bomani""; Internews 2000-11-30, ""Burundi Facilitation Team Hands Over Peace Process To Implementation Committee""",0,0,1,0,Envoy or representative of Nelson Mandela,12027,0,0,0,0,0,0,0,0,0,0,0,0,0,0,0,0,0,0,0,1,3,1,1,1,1,0,0,0,0,0
580,Burundi,90,516,0,Government of Burundi - CNDD,12,1,0,0,11/25/2000,11/30/2000,1,"Reuters 2000-11-25, ""Burundi parties open talks, criticised by mediators""; Internews 2000-11-27, ""Burundi Leaders Not Serious With Peace Accord, Says Bomani""; Internews 2000-11-30, ""Burundi Facilitation Team Hands Over Peace Process To Implementation Committee""",1,0,0,0,Tanzania,510,0,0,0,0,0,0,0,0,0,0,0,0,0,0,0,0,0,0,0,1,3,0,0,0,0,0,1,0,0,0
581,Burundi,90,516,0,Government of Burundi - Frolina,13,1,0,0,11/25/2000,11/30/2000,1,"Reuters 2000-11-25, ""Burundi parties open talks, criticised by mediators""; Internews 2000-11-27, ""Burundi Leaders Not Serious With Peace Accord, Says Bomani""; Internews 2000-11-30, ""Burundi Facilitation Team Hands Over Peace Process To Implementation Committee""",0,0,1,0,Envoy or representative of Nelson Mandela,12027,0,0,0,0,0,0,0,0,0,0,0,0,0,0,0,0,0,0,0,1,3,1,1,1,1,0,0,0,0,0
582,Burundi,90,516,0,Government of Burundi - Frolina,13,1,0,0,11/25/2000,11/30/2000,1,"Reuters 2000-11-25, ""Burundi parties open talks, criticised by mediators""; Internews 2000-11-27, ""Burundi Leaders Not Serious With Peace Accord, Says Bomani""; Internews 2000-11-30, ""Burundi Facilitation Team Hands Over Peace Process To Implementation Committee""",1,0,0,0,Tanzania,510,0,0,0,0,0,0,0,0,0,0,0,0,0,0,0,0,0,0,0,1,3,0,0,0,0,0,1,0,0,0
583,Burundi,90,516,2,Government of Burundi - CNDD-FDD,14,0,0,1,12/01/2000,12/31/2000,4,"AFP 2001-01-10, ""Burundi moves toward peace, for itself and for war-torn region by Juliette Hollier-Larousse""",1,0,0,0,France,220,0,0,0,0,0,0,0,0,0,0,0,0,0,0,0,0,0,0,0,1,1,3,0,0,1,0,0,0,0,0
584,Burundi,90,516,2,Government of Burundi - CNDD-FDD,14,0,0,1,12/01/2000,12/31/2000,4,"Xinhua 2000-12-21, ""Burundian Army Officers, Rebels to Meet in S. Africa on Ceasefire Accord""; Reuters 2000-12-21, ""UN members ask rebels to join Burundi peace talks""; Xinhua 2000-12-27, ""Mistrust Exists Among Burundi Peace Agreement Signatories""",1,0,0,0,South Africa,560,0,0,0,0,0,0,0,0,0,0,0,0,0,0,0,0,0,0,0,1,3,4,0,1,0,0,0,0,0,0
585,Burundi,90,516,2,Government of Burundi - Palipehutu-FNL,15,0,0,1,12/01/2000,12/31/2000,4,"Xinhua 2000-12-21, ""Burundian Army Officers, Rebels to Meet in S. Africa on Ceasefire Accord""; Reuters 2000-12-21, ""UN members ask rebels to join Burundi peace talks""; Xinhua 2000-12-27, ""Mistrust Exists Among Burundi Peace Agreement Signatories""",1,0,0,0,South Africa,560,0,0,0,0,0,0,0,0,0,0,0,0,0,0,0,0,0,0,0,1,3,4,0,1,0,0,0,0,0,0
586,Burundi,90,516,0,Government of Burundi - CNDD,12,1,0,0,12/10/2000,12/10/2000,1,"Xinhua 2000-12-09, ""Mandela to Seek Financial Support for Burundi Peace Conference""",0,0,1,0,Nelson Mandela (former President of South Africa),12026,0,0,0,0,0,0,0,0,0,0,0,0,0,0,0,0,0,0,0,1,1,3,0,0,0,1,0,0,0,0
587,Burundi,90,516,0,Government of Burundi - CNDD,12,1,0,0,12/10/2000,12/10/2000,1,"Xinhua 2000-12-09, ""Mandela to Seek Financial Support for Burundi Peace Conference""",1,0,0,0,France,220,0,0,0,0,0,0,0,0,0,0,0,0,0,0,0,0,0,0,0,1,1,0,0,0,0,0,1,0,0,0
588,Burundi,90,516,0,Government of Burundi - Frolina,13,1,0,0,12/10/2000,12/10/2000,1,"Xinhua 2000-12-09, ""Mandela to Seek Financial Support for Burundi Peace Conference""",0,0,1,0,Nelson Mandela (former President of South Africa),12026,0,0,0,0,0,0,0,0,0,0,0,0,0,0,0,0,0,0,0,1,1,3,0,0,0,1,0,0,0,0
589,Burundi,90,516,0,Government of Burundi - Frolina,13,1,0,0,12/10/2000,12/10/2000,1,"Xinhua 2000-12-09, ""Mandela to Seek Financial Support for Burundi Peace Conference""",1,0,0,0,France,220,0,0,0,0,0,0,0,0,0,0,0,0,0,0,0,0,0,0,0,1,1,0,0,0,0,0,1,0,0,0
590,Burundi,90,516,2,Government of Burundi - CNDD-FDD,14,1,0,1,12/10/2000,12/10/2000,1,"Xinhua 2000-12-09, ""Mandela to Seek Financial Support for Burundi Peace Conference""",0,0,1,0,Nelson Mandela (former President of South Africa),12026,0,0,0,0,0,0,0,0,0,0,0,0,0,0,0,0,0,0,0,1,1,3,0,0,0,1,0,0,0,0
591,Burundi,90,516,2,Government of Burundi - CNDD-FDD,14,1,0,1,12/10/2000,12/10/2000,1,"Xinhua 2000-12-09, ""Mandela to Seek Financial Support for Burundi Peace Conference""",1,0,0,0,France,220,0,0,0,0,0,0,0,0,0,0,0,0,0,0,0,0,0,0,0,1,1,0,0,0,0,0,1,0,0,0
592,Burundi,90,516,2,Government of Burundi - Palipehutu-FNL,15,1,0,1,12/10/2000,12/10/2000,1,"Xinhua 2000-12-09, ""Mandela to Seek Financial Support for Burundi Peace Conference""",0,0,1,0,Nelson Mandela (former President of South Africa),12026,0,0,0,0,0,0,0,0,0,0,0,0,0,0,0,0,0,0,0,1,1,3,0,0,0,1,0,0,0,0
593,Burundi,90,516,2,Government of Burundi - Palipehutu-FNL,15,1,0,1,12/10/2000,12/10/2000,1,"Xinhua 2000-12-09, ""Mandela to Seek Financial Support for Burundi Peace Conference""",1,0,0,0,France,220,0,0,0,0,0,0,0,0,0,0,0,0,0,0,0,0,0,0,0,1,1,0,0,0,0,0,1,0,0,0
594,Burundi,90,516,2,Government of Burundi - CNDD-FDD,14,0,0,1,12/24/2000,12/24/2000,1,"AFP 2001-01-10, ""Burundi moves toward peace, for itself and for war-torn region by Juliette Hollier-Larousse""",1,0,0,0,Democratic Republic of the Congo,490,0,0,0,0,0,0,0,0,0,0,0,0,0,0,0,0,0,0,0,1,1,3,0,0,1,0,0,0,0,0
595,Burundi,90,516,2,Government of Burundi - CNDD-FDD,14,0,0,1,12/24/2000,12/24/2000,1,"AFP 2001-01-10, ""Burundi moves toward peace, for itself and for war-torn region by Juliette Hollier-Larousse""",1,0,0,0,Nigeria,475,0,0,0,0,0,0,0,0,0,0,0,0,0,0,0,0,0,0,0,1,1,0,0,0,0,0,1,0,0,0
596,Burundi,90,516,0,Government of Burundi - CNDD,12,1,0,0,01/01/2001,12/31/2001,5,"Xinhua 2001-01-11, ""Burundian President Pledges Willingness to Meet Oppositions""",1,0,0,0,South Africa,560,0,0,0,0,0,0,0,0,0,0,0,0,0,0,0,0,0,0,0,1,1,3,0,0,1,0,0,0,0,0
597,Burundi,90,516,2,Government of Burundi - CNDD-FDD,14,0,0,1,01/01/2001,01/31/2001,4,"Reuters 2001-01-28, ""Hopes rise for cease-fire in Burundi""",0,0,1,0,Nelson Mandela (former President of South Africa),12026,0,0,0,0,0,0,0,0,0,0,0,0,0,0,0,0,0,0,0,1,2,3,0,1,0,0,0,0,0,0
598,Burundi,90,516,2,Government of Burundi - CNDD-FDD,14,1,0,1,01/01/2001,12/31/2001,5,"Xinhua 2001-01-11, ""Burundian President Pledges Willingness to Meet Oppositions""",1,0,0,0,South Africa,560,0,0,0,0,0,0,0,0,0,0,0,0,0,0,0,0,0,0,0,1,1,3,0,0,1,0,0,0,0,0
599,Burundi,90,516,2,Government of Burundi - CNDD-FDD,14,0,0,1,01/01/2001,12/31/2001,5,"Xinhua 2001-07-15, ""Regional Leaders to Push for Swift Implementation of Burundi Peace Accord""",1,0,0,0,South Africa,560,0,0,0,0,0,0,0,0,0,0,0,0,0,0,0,0,0,0,0,1,2,3,0,1,0,0,0,0,0,0
600,Burundi,90,516,2,Government of Burundi - Palipehutu-FNL,15,0,0,1,01/01/2001,01/31/2001,4,"Reuters 2001-01-28, ""Hopes rise for cease-fire in Burundi""",0,0,1,0,Nelson Mandela (former President of South Africa),12026,0,0,0,0,0,0,0,0,0,0,0,0,0,0,0,0,0,0,0,1,2,3,0,1,0,0,0,0,0,0
601,Burundi,90,516,2,Government of Burundi - Palipehutu-FNL,15,1,0,1,01/01/2001,12/31/2001,5,"Xinhua 2001-01-11, ""Burundian President Pledges Willingness to Meet Oppositions""",1,0,0,0,South Africa,560,0,0,0,0,0,0,0,0,0,0,0,0,0,0,0,0,0,0,0,1,1,3,0,0,1,0,0,0,0,0
602,Burundi,90,516,2,Government of Burundi - Palipehutu-FNL,15,0,0,1,01/01/2001,12/31/2001,5,"Xinhua 2001-07-15, ""Regional Leaders to Push for Swift Implementation of Burundi Peace Accord""",1,0,0,0,South Africa,560,0,0,0,0,0,0,0,0,0,0,0,0,0,0,0,0,0,0,0,1,2,3,0,1,0,0,0,0,0,0
603,Burundi,90,516,2,Government of Burundi - CNDD-FDD,14,0,0,1,01/09/2001,01/09/2001,1,"AFP 2001-01-10, ""Burundi moves toward peace, for itself and for war-torn region by Juliette Hollier-Larousse""; Reuters 2001-01-10, ""UPDATE 1-Congo says Burundian army, rebels to withdraw""; UN Integrated Regional Information Network 2001-01-11, ""IRIN-CEA Update 1,090 for the Great Lakes""",1,0,0,0,Democratic Republic of the Congo,490,0,0,0,0,0,0,0,0,0,0,0,0,0,0,0,0,0,0,0,1,3,1,0,1,1,0,0,0,0,0
604,Burundi,90,516,2,Government of Burundi - CNDD-FDD,14,0,0,1,01/09/2001,01/09/2001,1,"AFP 2001-01-10, ""Burundi moves toward peace, for itself and for war-torn region by Juliette Hollier-Larousse""",1,0,0,0,Gabon,481,0,0,0,0,0,0,0,0,0,0,0,0,0,0,0,0,0,0,0,1,3,0,0,0,0,0,1,0,0,0
605,Burundi,90,516,0,Government of Burundi - CNDD,12,1,0,0,01/10/2001,01/10/2001,1,"AFP 2001-01-08, ""Tanzania's Mkapa continues bid to end conflicts in DRC, Burundi by John Kulekana""; Xinhua 2001-01-11, ""Burundian President Pledges Willingness to Meet Oppositions""",1,0,0,0,Tanzania,510,0,0,0,0,0,0,0,0,0,0,0,0,0,0,0,0,0,0,0,1,1,3,0,0,1,0,0,0,0,0
606,Burundi,90,516,2,Government of Burundi - CNDD-FDD,14,1,0,1,01/10/2001,01/10/2001,1,"AFP 2001-01-08, ""Tanzania's Mkapa continues bid to end conflicts in DRC, Burundi by John Kulekana""; Xinhua 2001-01-11, ""Burundian President Pledges Willingness to Meet Oppositions""",1,0,0,0,Tanzania,510,0,0,0,0,0,0,0,0,0,0,0,0,0,0,0,0,0,0,0,1,1,3,0,0,1,0,0,0,0,0
607,Burundi,90,516,2,Government of Burundi - Palipehutu-FNL,15,1,0,1,01/10/2001,01/10/2001,1,"AFP 2001-01-08, ""Tanzania's Mkapa continues bid to end conflicts in DRC, Burundi by John Kulekana""; Xinhua 2001-01-11, ""Burundian President Pledges Willingness to Meet Oppositions""",1,0,0,0,Tanzania,510,0,0,0,0,0,0,0,0,0,0,0,0,0,0,0,0,0,0,0,1,1,3,0,0,1,0,0,0,0,0
608,Burundi,90,516,0,Government of Burundi - CNDD,12,0,0,0,02/26/2001,02/26/2001,1,"Xinhua 2001-02-26, ""Mandela Proposes New Plans on Burundi Transitional Leadership""",6,0,1,0,"Nelson Mandela (former President of South Africa), Tanzania, Kenya, Rwanda, Uganda, South Africa, Gabon",12026,510,501,517,500,560,481,0,0,0,0,0,0,0,0,0,0,0,0,0,7,1,3,1,0,0,0,0,0,0,0
609,Burundi,90,516,2,Government of Burundi - CNDD-FDD,14,0,0,1,02/26/2001,02/26/2001,1,"Xinhua 2001-02-26, ""Mandela Proposes New Plans on Burundi Transitional Leadership""",1,0,0,0,South Africa,560,0,0,0,0,0,0,0,0,0,0,0,0,0,0,0,0,0,0,0,1,1,3,0,1,0,0,0,0,0,0
610,Burundi,90,516,2,Government of Burundi - Palipehutu-FNL,15,0,0,1,02/26/2001,02/26/2001,1,"Xinhua 2001-02-26, ""Mandela Proposes New Plans on Burundi Transitional Leadership""",1,0,0,0,South Africa,560,0,0,0,0,0,0,0,0,0,0,0,0,0,0,0,0,0,0,0,1,1,3,0,1,0,0,0,0,0,0
611,Burundi,90,516,2,Government of Burundi - CNDD-FDD,14,0,0,1,02/27/2001,02/27/2001,1,"Xinhua 2001-02-27, ""Burundi Troops Clash With Rebels Amid Peace Talks""",0,0,1,0,Nelson Mandela (former President of South Africa),12026,0,0,0,0,0,0,0,0,0,0,0,0,0,0,0,0,0,0,0,1,1,3,0,1,0,0,0,0,0,0
612,Burundi,90,516,2,Government of Burundi - Palipehutu-FNL,15,0,0,1,02/27/2001,02/27/2001,1,"Xinhua 2001-02-27, ""Burundi Troops Clash With Rebels Amid Peace Talks""",0,0,1,0,Nelson Mandela (former President of South Africa),12026,0,0,0,0,0,0,0,0,0,0,0,0,0,0,0,0,0,0,0,1,1,3,0,1,0,0,0,0,0,0
613,Burundi,90,516,2,Government of Burundi - CNDD-FDD,14,0,0,1,04/09/2001,04/09/2001,1,"AFP 2001-04-09, ""Visiting SAfrican deputy president mediates for Burundi peace""",1,0,0,0,South Africa,560,0,0,0,0,0,0,0,0,0,0,0,0,0,0,0,0,0,0,0,1,2,3,0,0,1,0,0,0,0,0
614,Burundi,90,516,2,Government of Burundi - CNDD-FDD,14,0,0,1,04/09/2001,04/09/2001,1,"AFP 2001-04-09, ""Visiting SAfrican deputy president mediates for Burundi peace""",1,0,0,0,Democratic Republic of the Congo,490,0,0,0,0,0,0,0,0,0,0,0,0,0,0,0,0,0,0,0,1,2,0,0,0,0,0,1,0,0,0
615,Burundi,90,516,0,Government of Burundi - CNDD,12,1,0,0,04/17/2001,04/17/2001,1,"AFP 2001-04-18, ""Kabila demands Burundi troops leave DRCongo""",1,0,0,0,Gabon,481,0,0,0,0,0,0,0,0,0,0,0,0,0,0,0,0,0,0,0,1,1,3,0,0,0,1,0,0,0,0
616,Burundi,90,516,0,Government of Burundi - CNDD,12,1,0,0,04/17/2001,04/18/2001,1,"AFP 2001-04-18, ""Burundi president told situation under control: Zuma""; AFP 2001-04-18, ""Kabila demands Burundi troops leave DRCongo""",1,0,0,0,Democratic Republic of the Congo,490,0,0,0,0,0,0,0,0,0,0,0,0,0,0,0,0,0,0,0,1,1,3,0,0,1,0,0,0,0,0
617,Burundi,90,516,2,Government of Burundi - CNDD-FDD,14,1,0,1,04/17/2001,04/17/2001,1,"AFP 2001-04-18, ""Kabila demands Burundi troops leave DRCongo""",1,0,0,0,Gabon,481,0,0,0,0,0,0,0,0,0,0,0,0,0,0,0,0,0,0,0,1,1,3,0,0,0,1,0,0,0,0
618,Burundi,90,516,2,Government of Burundi - CNDD-FDD,14,1,0,1,04/17/2001,04/18/2001,1,"AFP 2001-04-18, ""Burundi president told situation under control: Zuma""; AFP 2001-04-18, ""Kabila demands Burundi troops leave DRCongo""",1,0,0,0,Democratic Republic of the Congo,490,0,0,0,0,0,0,0,0,0,0,0,0,0,0,0,0,0,0,0,1,1,3,0,0,1,0,0,0,0,0
619,Burundi,90,516,2,Government of Burundi - CNDD-FDD,14,1,0,1,04/17/2001,04/18/2001,1,"AFP 2001-04-18, ""Burundi president told situation under control: Zuma""",1,0,0,0,Gabon,481,0,0,0,0,0,0,0,0,0,0,0,0,0,0,0,0,0,0,0,1,1,0,0,0,0,0,1,0,0,0
620,Burundi,90,516,2,Government of Burundi - CNDD-FDD,14,0,0,1,04/17/2001,04/18/2001,1,"AFP 2001-04-18, ""Burundi president told situation under control: Zuma""; AFP 2001-04-18, ""Kabila demands Burundi troops leave DRCongo""",1,0,0,0,Gabon,481,0,0,0,0,0,0,0,0,0,0,0,0,0,0,0,0,0,0,0,1,3,0,0,0,0,0,1,0,0,0
621,Burundi,90,516,2,Government of Burundi - Palipehutu-FNL,15,1,0,1,04/17/2001,04/17/2001,1,"AFP 2001-04-18, ""Kabila demands Burundi troops leave DRCongo""",1,0,0,0,Gabon,481,0,0,0,0,0,0,0,0,0,0,0,0,0,0,0,0,0,0,0,1,1,3,0,0,0,1,0,0,0,0
622,Burundi,90,516,2,Government of Burundi - Palipehutu-FNL,15,1,0,1,04/17/2001,04/18/2001,1,"AFP 2001-04-18, ""Burundi president told situation under control: Zuma""; AFP 2001-04-18, ""Kabila demands Burundi troops leave DRCongo""",1,0,0,0,Democratic Republic of the Congo,490,0,0,0,0,0,0,0,0,0,0,0,0,0,0,0,0,0,0,0,1,1,3,0,0,1,0,0,0,0,0
623,Burundi,90,516,0,Government of Burundi - CNDD,12,1,0,0,04/18/2001,04/18/2001,1,"AFP 2001-04-18, ""Burundi president told situation under control: Zuma""; AFP 2001-04-18, ""Kabila demands Burundi troops leave DRCongo""",1,0,0,0,South Africa,560,0,0,0,0,0,0,0,0,0,0,0,0,0,0,0,0,0,0,0,1,1,3,0,0,0,1,0,0,0,0
624,Burundi,90,516,2,Government of Burundi - CNDD-FDD,14,1,0,1,04/18/2001,04/18/2001,1,"AFP 2001-04-18, ""Burundi president told situation under control: Zuma""; AFP 2001-04-18, ""Kabila demands Burundi troops leave DRCongo""",1,0,0,0,South Africa,560,0,0,0,0,0,0,0,0,0,0,0,0,0,0,0,0,0,0,0,1,1,3,0,0,0,1,0,0,0,0
625,Burundi,90,516,2,Government of Burundi - Palipehutu-FNL,15,1,0,1,04/18/2001,04/18/2001,1,"AFP 2001-04-18, ""Burundi president told situation under control: Zuma""; AFP 2001-04-18, ""Kabila demands Burundi troops leave DRCongo""",1,0,0,0,South Africa,560,0,0,0,0,0,0,0,0,0,0,0,0,0,0,0,0,0,0,0,1,1,3,0,0,0,1,0,0,0,0
626,Burundi,90,516,2,Government of Burundi - CNDD-FDD,14,0,0,1,05/01/2001,05/31/2001,4,"Reuters 2001-05-23, ""UN team arrives in Burundi on regional tour""",1,0,0,0,Democratic Republic of the Congo,490,0,0,0,0,0,0,0,0,0,0,0,0,0,0,0,0,0,0,0,1,2,0,0,0,0,0,1,0,0,0
627,Burundi,90,516,0,Government of Burundi - CNDD,12,1,0,0,05/04/2001,05/04/2001,1,"AFP 2001-05-04, ""Burundi mediator Nelson Mandela meets delegation on peace process""",0,0,2,0,"Civil society / community activists, Nelson Mandela (former President of South Africa)",12008,12026,0,0,0,0,0,0,0,0,0,0,0,0,0,0,0,0,0,0,2,1,3,0,0,1,0,0,0,0,0
628,Burundi,90,516,2,Government of Burundi - CNDD-FDD,14,1,0,1,05/04/2001,05/04/2001,1,"AFP 2001-05-04, ""Burundi mediator Nelson Mandela meets delegation on peace process""",0,0,2,0,"Civil society / community activists, Nelson Mandela (former President of South Africa)",12008,12026,0,0,0,0,0,0,0,0,0,0,0,0,0,0,0,0,0,0,2,1,3,0,0,1,0,0,0,0,0
629,Burundi,90,516,2,Government of Burundi - CNDD-FDD,14,0,0,1,05/04/2001,05/05/2001,1,"AFP 2001-05-04, ""Burundi mediator Nelson Mandela meets delegation on peace process""; Xinhua 2001-05-07, ""Two Rebel Groups Agree to Join Burundian Peace Talks - President""",1,0,0,0,South Africa,560,0,0,0,0,0,0,0,0,0,0,0,0,0,0,0,0,0,0,0,1,1,0,0,0,0,0,1,0,0,0
630,Burundi,90,516,2,Government of Burundi - Palipehutu-FNL,15,1,0,1,05/04/2001,05/04/2001,1,"AFP 2001-05-04, ""Burundi mediator Nelson Mandela meets delegation on peace process""",0,0,2,0,"Civil society / community activists, Nelson Mandela (former President of South Africa)",12008,12026,0,0,0,0,0,0,0,0,0,0,0,0,0,0,0,0,0,0,2,1,3,0,0,1,0,0,0,0,0
631,Burundi,90,516,2,Government of Burundi - Palipehutu-FNL,15,0,0,1,05/04/2001,05/05/2001,1,"AFP 2001-05-04, ""Burundi mediator Nelson Mandela meets delegation on peace process""; Xinhua 2001-05-07, ""Two Rebel Groups Agree to Join Burundian Peace Talks - President""",1,0,0,0,South Africa,560,0,0,0,0,0,0,0,0,0,0,0,0,0,0,0,0,0,0,0,1,1,0,0,0,0,0,1,0,0,0
632,Burundi,90,516,2,Government of Burundi - CNDD-FDD,14,0,0,1,05/05/2001,05/05/2001,1,"Xinhua 2001-05-07, ""Two Rebel Groups Agree to Join Burundian Peace Talks - President""",0,0,1,0,Nelson Mandela (former President of South Africa),12026,0,0,0,0,0,0,0,0,0,0,0,0,0,0,0,0,0,0,0,1,1,3,0,0,1,0,0,0,0,0
633,Burundi,90,516,2,Government of Burundi - Palipehutu-FNL,15,0,0,1,05/05/2001,05/05/2001,1,"Xinhua 2001-05-07, ""Two Rebel Groups Agree to Join Burundian Peace Talks - President""",0,0,1,0,Nelson Mandela (former President of South Africa),12026,0,0,0,0,0,0,0,0,0,0,0,0,0,0,0,0,0,0,0,1,1,3,0,0,1,0,0,0,0,0
634,Burundi,90,516,2,Government of Burundi - CNDD-FDD,14,0,0,1,05/23/2001,05/23/2001,1,"Reuters 2001-05-23, ""UN team arrives in Burundi on regional tour""",0,1,0,0,UN,11024,0,0,0,0,0,0,0,0,0,0,0,0,0,0,0,0,0,0,0,1,2,3,0,0,0,1,0,0,0,0
635,Burundi,90,516,2,Government of Burundi - CNDD-FDD,14,0,0,1,06/16/2001,06/16/2001,1,"AFP 2001-06-16, ""Burundi defence minister in Tanzania to discuss border security""",1,0,0,0,Tanzania,510,0,0,0,0,0,0,0,0,0,0,0,0,0,0,0,0,0,0,0,1,1,3,0,0,1,0,0,0,0,0
636,Burundi,90,516,0,Government of Burundi - CNDD,12,1,0,0,06/22/2001,06/22/2001,1,"Xinhua 2001-06-22, ""Mandela Optimistic About Achieving Peace in Burundi""",0,0,1,0,Nelson Mandela (former President of South Africa),12026,0,0,0,0,0,0,0,0,0,0,0,0,0,0,0,0,0,0,0,1,1,3,0,0,0,1,0,0,0,0
637,Burundi,90,516,2,Government of Burundi - CNDD-FDD,14,1,0,1,06/22/2001,06/22/2001,1,"Xinhua 2001-06-22, ""Mandela Optimistic About Achieving Peace in Burundi""",0,0,1,0,Nelson Mandela (former President of South Africa),12026,0,0,0,0,0,0,0,0,0,0,0,0,0,0,0,0,0,0,0,1,1,3,0,0,0,1,0,0,0,0
638,Burundi,90,516,2,Government of Burundi - Palipehutu-FNL,15,1,0,1,06/22/2001,06/22/2001,1,"Xinhua 2001-06-22, ""Mandela Optimistic About Achieving Peace in Burundi""",0,0,1,0,Nelson Mandela (former President of South Africa),12026,0,0,0,0,0,0,0,0,0,0,0,0,0,0,0,0,0,0,0,1,1,3,0,0,0,1,0,0,0,0
639,Burundi,90,516,0,Government of Burundi - CNDD,12,1,0,0,06/23/2001,06/23/2001,1,"AFP 2001-06-23, ""Tanzania, Burundi defence ministers hold talks""; Reuters 2001-06-23, ""Burundi, Tanzania discuss border tensions""",1,0,0,0,Tanzania,510,0,0,0,0,0,0,0,0,0,0,0,0,0,0,0,0,0,0,0,1,1,3,0,0,0,1,0,0,0,0
640,Burundi,90,516,2,Government of Burundi - CNDD-FDD,14,1,0,1,06/23/2001,06/23/2001,1,"AFP 2001-06-23, ""Tanzania, Burundi defence ministers hold talks""; Reuters 2001-06-23, ""Burundi, Tanzania discuss border tensions""",1,0,0,0,Tanzania,510,0,0,0,0,0,0,0,0,0,0,0,0,0,0,0,0,0,0,0,1,1,3,0,0,0,1,0,0,0,0
641,Burundi,90,516,2,Government of Burundi - Palipehutu-FNL,15,1,0,1,06/23/2001,06/23/2001,1,"AFP 2001-06-23, ""Tanzania, Burundi defence ministers hold talks""; Reuters 2001-06-23, ""Burundi, Tanzania discuss border tensions""",1,0,0,0,Tanzania,510,0,0,0,0,0,0,0,0,0,0,0,0,0,0,0,0,0,0,0,1,1,3,0,0,0,1,0,0,0,0
642,Burundi,90,516,0,Government of Burundi - CNDD,12,1,0,0,06/27/2001,06/27/2001,1,"Xinhua 2001-06-27, ""Kenyan President Calls for Complete Cease-fire in Burundi""",1,0,0,0,Kenya,501,0,0,0,0,0,0,0,0,0,0,0,0,0,0,0,0,0,0,0,1,1,3,1,1,1,0,0,0,0,0
643,Burundi,90,516,0,Government of Burundi - CNDD,12,1,0,0,06/27/2001,06/27/2001,1,"Xinhua 2001-06-27, ""Kenyan President Calls for Complete Cease-fire in Burundi""",1,0,0,0,USA,2,0,0,0,0,0,0,0,0,0,0,0,0,0,0,0,0,0,0,0,1,1,0,0,0,0,0,1,0,0,0
644,Burundi,90,516,2,Government of Burundi - CNDD-FDD,14,1,0,1,06/27/2001,06/27/2001,1,"Xinhua 2001-06-27, ""Kenyan President Calls for Complete Cease-fire in Burundi""",1,0,0,0,Kenya,501,0,0,0,0,0,0,0,0,0,0,0,0,0,0,0,0,0,0,0,1,1,3,1,1,1,0,0,0,0,0
645,Burundi,90,516,2,Government of Burundi - CNDD-FDD,14,1,0,1,06/27/2001,06/27/2001,1,"Xinhua 2001-06-27, ""Kenyan President Calls for Complete Cease-fire in Burundi""",1,0,0,0,USA,2,0,0,0,0,0,0,0,0,0,0,0,0,0,0,0,0,0,0,0,1,1,0,0,0,0,0,1,0,0,0
646,Burundi,90,516,2,Government of Burundi - Palipehutu-FNL,15,1,0,1,06/27/2001,06/27/2001,1,"Xinhua 2001-06-27, ""Kenyan President Calls for Complete Cease-fire in Burundi""",1,0,0,0,Kenya,501,0,0,0,0,0,0,0,0,0,0,0,0,0,0,0,0,0,0,0,1,1,3,1,1,1,0,0,0,0,0
647,Burundi,90,516,2,Government of Burundi - Palipehutu-FNL,15,1,0,1,06/27/2001,06/27/2001,1,"Xinhua 2001-06-27, ""Kenyan President Calls for Complete Cease-fire in Burundi""",1,0,0,0,USA,2,0,0,0,0,0,0,0,0,0,0,0,0,0,0,0,0,0,0,0,1,1,0,0,0,0,0,1,0,0,0
648,Burundi,90,516,0,Government of Burundi - CNDD,12,1,0,0,07/05/2001,07/05/2001,1,"Reuters 2001-07-05, ""African nations, Belgium plan Burundi peacekeeping""",5,0,0,0,"Ghana, Nigeria, Senegal, Belgium, South Africa",452,475,433,211,560,0,0,0,0,0,0,0,0,0,0,0,0,0,0,0,5,1,3,0,1,1,0,0,0,0,0
649,Burundi,90,516,2,Government of Burundi - CNDD-FDD,14,1,0,1,07/05/2001,07/05/2001,1,"Reuters 2001-07-05, ""African nations, Belgium plan Burundi peacekeeping""",5,0,0,0,"Ghana, Nigeria, Senegal, Belgium, South Africa",452,475,433,211,560,0,0,0,0,0,0,0,0,0,0,0,0,0,0,0,5,1,3,0,1,1,0,0,0,0,0
650,Burundi,90,516,2,Government of Burundi - Palipehutu-FNL,15,1,0,1,07/05/2001,07/05/2001,1,"Reuters 2001-07-05, ""African nations, Belgium plan Burundi peacekeeping""",5,0,0,0,"Ghana, Nigeria, Senegal, Belgium, South Africa",452,475,433,211,560,0,0,0,0,0,0,0,0,0,0,0,0,0,0,0,5,1,3,0,1,1,0,0,0,0,0
651,Burundi,90,516,0,Government of Burundi - CNDD,12,1,0,0,07/10/2001,07/10/2001,1,"AFP 2001-07-10, ""Buyoya to head transition in Burundi: Mandela""; AFP 2001-07-10, ""Buyoya agrees to 11 conditions for Burundi transition""",0,0,1,0,Nelson Mandela (former President of South Africa),12026,0,0,0,0,0,0,0,0,0,0,0,0,0,0,0,0,0,0,0,1,1,3,0,0,1,0,0,0,0,0
652,Burundi,90,516,0,Government of Burundi - CNDD,12,1,0,0,07/10/2001,07/10/2001,1,"AFP 2001-07-10, ""Buyoya to head transition in Burundi: Mandela""",1,0,0,0,South Africa,560,0,0,0,0,0,0,0,0,0,0,0,0,0,0,0,0,0,0,0,1,1,0,0,0,0,0,1,0,0,0
653,Burundi,90,516,2,Government of Burundi - CNDD-FDD,14,1,0,1,07/10/2001,07/10/2001,1,"AFP 2001-07-10, ""Buyoya to head transition in Burundi: Mandela""; AFP 2001-07-10, ""Buyoya agrees to 11 conditions for Burundi transition""",0,0,1,0,Nelson Mandela (former President of South Africa),12026,0,0,0,0,0,0,0,0,0,0,0,0,0,0,0,0,0,0,0,1,1,3,0,0,1,0,0,0,0,0
654,Burundi,90,516,2,Government of Burundi - CNDD-FDD,14,1,0,1,07/10/2001,07/10/2001,1,"AFP 2001-07-10, ""Buyoya to head transition in Burundi: Mandela""",1,0,0,0,South Africa,560,0,0,0,0,0,0,0,0,0,0,0,0,0,0,0,0,0,0,0,1,1,0,0,0,0,0,1,0,0,0
655,Burundi,90,516,2,Government of Burundi - Palipehutu-FNL,15,1,0,1,07/10/2001,07/10/2001,1,"AFP 2001-07-10, ""Buyoya to head transition in Burundi: Mandela""; AFP 2001-07-10, ""Buyoya agrees to 11 conditions for Burundi transition""",0,0,1,0,Nelson Mandela (former President of South Africa),12026,0,0,0,0,0,0,0,0,0,0,0,0,0,0,0,0,0,0,0,1,1,3,0,0,1,0,0,0,0,0
656,Burundi,90,516,2,Government of Burundi - Palipehutu-FNL,15,1,0,1,07/10/2001,07/10/2001,1,"AFP 2001-07-10, ""Buyoya to head transition in Burundi: Mandela""",1,0,0,0,South Africa,560,0,0,0,0,0,0,0,0,0,0,0,0,0,0,0,0,0,0,0,1,1,0,0,0,0,0,1,0,0,0
657,Burundi,90,516,2,Government of Burundi - CNDD-FDD,14,0,0,1,07/26/2001,07/26/2001,1,"Xinhua 2001-07-26, ""Burundi President Optimistic About Achieving Peace""; Reuters 2001-07-27, ""Burundi peace talks continue Friday, mood positive""",3,0,0,0,"South Africa, Gabon, Democratic Republic of the Congo",560,481,490,0,0,0,0,0,0,0,0,0,0,0,0,0,0,0,0,0,3,3,2,0,1,0,0,0,0,0,0
658,Burundi,90,516,2,Government of Burundi - CNDD-FDD,14,0,0,1,07/27/2001,07/27/2001,1,"Xinhua 2001-07-26, ""Burundi President Optimistic About Achieving Peace""; Reuters 2001-07-27, ""Burundi peace talks continue Friday, mood positive""",3,0,0,0,"South Africa, Gabon, Democratic Republic of the Congo",560,481,490,0,0,0,0,0,0,0,0,0,0,0,0,0,0,0,0,0,3,3,1,0,1,1,0,0,0,0,0
659,Burundi,90,516,2,Government of Burundi - Palipehutu-FNL,15,0,0,1,08/01/2001,08/31/2001,4,"UN Integrated Regional Information Network/All Africa Global Media via COMTEX 2001-08-23, ""Talks With Opposition FNL Under Way - Buyoya""",1,0,0,0,South Africa,560,0,0,0,0,0,0,0,0,0,0,0,0,0,0,0,0,0,0,0,1,3,0,0,0,0,0,1,0,0,0
660,Burundi,90,516,0,Government of Burundi - CNDD,12,1,0,0,09/04/2001,09/04/2001,1,"Xinhua 2001-09-04, ""Burundian President Arrives in Tanzania for Talks on Civil War""",1,0,0,0,Tanzania,510,0,0,0,0,0,0,0,0,0,0,0,0,0,0,0,0,0,0,0,1,1,3,0,0,1,0,0,0,0,0
661,Burundi,90,516,2,Government of Burundi - CNDD-FDD,14,1,0,1,09/04/2001,09/04/2001,1,"Xinhua 2001-09-04, ""Burundian President Arrives in Tanzania for Talks on Civil War""",1,0,0,0,Tanzania,510,0,0,0,0,0,0,0,0,0,0,0,0,0,0,0,0,0,0,0,1,1,3,0,0,1,0,0,0,0,0
662,Burundi,90,516,2,Government of Burundi - Palipehutu-FNL,15,1,0,1,09/04/2001,09/04/2001,1,"Xinhua 2001-09-04, ""Burundian President Arrives in Tanzania for Talks on Civil War""",1,0,0,0,Tanzania,510,0,0,0,0,0,0,0,0,0,0,0,0,0,0,0,0,0,0,0,1,1,3,0,0,1,0,0,0,0,0
663,Burundi,90,516,0,Government of Burundi - CNDD,12,1,0,0,10/01/2001,10/01/2001,1,"Xinhua 2001-10-01, ""Summit on Burundi Ends Without Security Arrangement""",7,0,0,0,"Uganda, Kenya, Rwanda, South Africa, Nigeria, Ghana, Democratic Republic of the Congo",500,501,517,560,475,452,490,0,0,0,0,0,0,0,0,0,0,0,0,0,7,1,3,0,0,1,0,0,0,0,0
664,Burundi,90,516,2,Government of Burundi - CNDD-FDD,14,1,0,1,10/01/2001,10/01/2001,1,"Xinhua 2001-10-01, ""Summit on Burundi Ends Without Security Arrangement""",7,0,0,0,"Uganda, Kenya, Rwanda, South Africa, Nigeria, Ghana, Democratic Republic of the Congo",500,501,517,560,475,452,490,0,0,0,0,0,0,0,0,0,0,0,0,0,7,1,3,0,0,1,0,0,0,0,0
665,Burundi,90,516,2,Government of Burundi - Palipehutu-FNL,15,1,0,1,10/01/2001,10/01/2001,1,"Xinhua 2001-10-01, ""Summit on Burundi Ends Without Security Arrangement""",7,0,0,0,"Uganda, Kenya, Rwanda, South Africa, Nigeria, Ghana, Democratic Republic of the Congo",500,501,517,560,475,452,490,0,0,0,0,0,0,0,0,0,0,0,0,0,7,1,3,0,0,1,0,0,0,0,0
666,Burundi,90,516,0,Government of Burundi - CNDD,12,1,0,0,10/11/2001,10/11/2001,1,"Reuters 2001-10-11, ""African leaders, Mandela start Burundi peace talks""",6,0,1,0,"Uganda, Tanzania, Gabon, Democratic Republic of the Congo, Rwanda, Kenya, Nelson Mandela (former President of South Africa)",500,510,481,490,517,501,12026,0,0,0,0,0,0,0,0,0,0,0,0,0,7,1,3,0,0,0,1,0,0,0,0
667,Burundi,90,516,0,Government of Burundi - CNDD,12,1,0,0,10/11/2001,10/11/2001,1,"Reuters 2001-10-11, ""African leaders, Mandela start Burundi peace talks""",1,0,0,0,South Africa,560,0,0,0,0,0,0,0,0,0,0,0,0,0,0,0,0,0,0,0,1,1,0,0,0,0,0,1,0,0,0
668,Burundi,90,516,2,Government of Burundi - CNDD-FDD,14,1,0,1,10/11/2001,10/11/2001,1,"Reuters 2001-10-11, ""African leaders, Mandela start Burundi peace talks""",6,0,1,0,"Uganda, Tanzania, Gabon, Democratic Republic of the Congo, Rwanda, Kenya, Nelson Mandela (former President of South Africa)",500,510,481,490,517,501,12026,0,0,0,0,0,0,0,0,0,0,0,0,0,7,1,3,0,0,0,1,0,0,0,0
669,Burundi,90,516,2,Government of Burundi - CNDD-FDD,14,1,0,1,10/11/2001,10/11/2001,1,"Reuters 2001-10-11, ""African leaders, Mandela start Burundi peace talks""",6,0,1,0,"Uganda, Tanzania, Gabon, Democratic Republic of the Congo, Rwanda, Kenya, Nelson Mandela (former President of South Africa)",500,510,481,490,517,501,12026,0,0,0,0,0,0,0,0,0,0,0,0,0,7,1,3,0,0,0,1,0,0,0,0
670,Burundi,90,516,2,Government of Burundi - CNDD-FDD,14,0,0,1,10/11/2001,10/11/2001,1,"AFP 2001-10-12, ""New government for Burundi by November 1, but no ceasefire: Mandela""",6,0,1,0,"Uganda, Tanzania, Gabon, Democratic Republic of the Congo, Rwanda, Kenya, Nelson Mandela (former President of South Africa)",500,510,481,490,517,501,12026,0,0,0,0,0,0,0,0,0,0,0,0,0,7,3,4,0,1,1,0,0,0,0,0
671,Burundi,90,516,2,Government of Burundi - CNDD-FDD,14,1,0,1,10/11/2001,10/11/2001,1,"Reuters 2001-10-11, ""African leaders, Mandela start Burundi peace talks""",1,0,0,0,South Africa,560,0,0,0,0,0,0,0,0,0,0,0,0,0,0,0,0,0,0,0,1,1,0,0,0,0,0,1,0,0,0
672,Burundi,90,516,2,Government of Burundi - Palipehutu-FNL,15,1,0,1,10/11/2001,10/11/2001,1,"Reuters 2001-10-11, ""African leaders, Mandela start Burundi peace talks""",6,0,1,0,"Uganda, Tanzania, Gabon, Democratic Republic of the Congo, Rwanda, Kenya, Nelson Mandela (former President of South Africa)",500,510,481,490,517,501,12026,0,0,0,0,0,0,0,0,0,0,0,0,0,7,1,3,0,0,0,1,0,0,0,0
673,Burundi,90,516,2,Government of Burundi - Palipehutu-FNL,15,0,0,1,10/11/2001,10/11/2001,1,"AFP 2001-10-12, ""New government for Burundi by November 1, but no ceasefire: Mandela""",6,0,1,0,"Uganda, Tanzania, Gabon, Democratic Republic of the Congo, Rwanda, Kenya, Nelson Mandela (former President of South Africa)",500,510,481,490,517,501,12026,0,0,0,0,0,0,0,0,0,0,0,0,0,7,3,4,0,1,1,0,0,0,0,0
674,Burundi,90,516,2,Government of Burundi - Palipehutu-FNL,15,1,0,1,10/11/2001,10/11/2001,1,"Reuters 2001-10-11, ""African leaders, Mandela start Burundi peace talks""",1,0,0,0,South Africa,560,0,0,0,0,0,0,0,0,0,0,0,0,0,0,0,0,0,0,0,1,1,0,0,0,0,0,1,0,0,0
675,Burundi,90,516,2,Government of Burundi - CNDD-FDD,14,0,0,1,10/31/2001,10/31/2001,1,"AFP 2001-11-01, ""Burundi rebels ready to talk to new government: Mandela""",0,0,1,0,Nelson Mandela (former President of South Africa),12026,0,0,0,0,0,0,0,0,0,0,0,0,0,0,0,0,0,0,0,1,2,3,0,0,1,0,0,0,0,0
676,Burundi,90,516,0,Government of Burundi - CNDD,12,1,0,0,11/28/2001,11/28/2001,1,"Reuters 2001-11-28, ""UPDATE 1-S.African minister visits troops in Burundi""",1,0,0,0,South Africa,560,0,0,0,0,0,0,0,0,0,0,0,0,0,0,0,0,0,0,0,1,1,3,0,0,1,0,0,0,0,0
677,Burundi,90,516,2,Government of Burundi - CNDD-FDD,14,1,0,1,11/28/2001,11/28/2001,1,"Reuters 2001-11-28, ""UPDATE 1-S.African minister visits troops in Burundi""",1,0,0,0,South Africa,560,0,0,0,0,0,0,0,0,0,0,0,0,0,0,0,0,0,0,0,1,1,3,0,0,1,0,0,0,0,0
678,Burundi,90,516,2,Government of Burundi - Palipehutu-FNL,15,1,0,1,11/28/2001,11/28/2001,1,"Reuters 2001-11-28, ""UPDATE 1-S.African minister visits troops in Burundi""",1,0,0,0,South Africa,560,0,0,0,0,0,0,0,0,0,0,0,0,0,0,0,0,0,0,0,1,1,3,0,0,1,0,0,0,0,0
679,Burundi,90,516,0,Government of Burundi - CNDD,12,1,0,0,12/14/2001,12/14/2001,1,"AFP 2001-12-15, ""Ceasefire process needs speeding up: Burundi president""",0,0,1,0,Nelson Mandela (former President of South Africa),12026,0,0,0,0,0,0,0,0,0,0,0,0,0,0,0,0,0,0,0,1,1,3,0,1,0,0,0,0,0,0
680,Burundi,90,516,2,Government of Burundi - CNDD-FDD,14,1,0,1,12/14/2001,12/14/2001,1,"AFP 2001-12-15, ""Ceasefire process needs speeding up: Burundi president""",0,0,1,0,Nelson Mandela (former President of South Africa),12026,0,0,0,0,0,0,0,0,0,0,0,0,0,0,0,0,0,0,0,1,1,3,0,1,0,0,0,0,0,0
681,Burundi,90,516,2,Government of Burundi - Palipehutu-FNL,15,1,0,1,12/14/2001,12/14/2001,1,"AFP 2001-12-15, ""Ceasefire process needs speeding up: Burundi president""",0,0,1,0,Nelson Mandela (former President of South Africa),12026,0,0,0,0,0,0,0,0,0,0,0,0,0,0,0,0,0,0,0,1,1,3,0,1,0,0,0,0,0,0
682,Burundi,90,516,0,Government of Burundi - CNDD,12,1,0,0,12/15/2001,12/15/2001,1,"AFP 2001-12-15, ""Ceasefire process needs speeding up: Burundi president""",1,0,0,0,South Africa,560,0,0,0,0,0,0,0,0,0,0,0,0,0,0,0,0,0,0,0,1,1,3,0,1,0,0,0,0,0,0
683,Burundi,90,516,2,Government of Burundi - CNDD-FDD,14,1,0,1,12/15/2001,12/15/2001,1,"AFP 2001-12-15, ""Ceasefire process needs speeding up: Burundi president""",1,0,0,0,South Africa,560,0,0,0,0,0,0,0,0,0,0,0,0,0,0,0,0,0,0,0,1,1,3,0,1,0,0,0,0,0,0
684,Burundi,90,516,2,Government of Burundi - Palipehutu-FNL,15,1,0,1,12/15/2001,12/15/2001,1,"AFP 2001-12-15, ""Ceasefire process needs speeding up: Burundi president""",1,0,0,0,South Africa,560,0,0,0,0,0,0,0,0,0,0,0,0,0,0,0,0,0,0,0,1,1,3,0,1,0,0,0,0,0,0
685,Burundi,90,516,2,Government of Burundi - CNDD-FDD,14,1,0,1,01/10/2002,01/10/2002,1,"AFP 2002-01-10, ""South Africa to host Burundi peace talks""; AFP 2002-01-12, ""South African official urges pressure on Burundi rebels""",1,0,0,0,South Africa,560,0,0,0,0,0,0,0,0,0,0,0,0,0,0,0,0,0,0,0,1,1,3,0,1,1,0,0,0,0,0
686,Burundi,90,516,2,Government of Burundi - Palipehutu-FNL,15,1,0,1,01/10/2002,01/10/2002,1,"AFP 2002-01-10, ""South Africa to host Burundi peace talks""; AFP 2002-01-12, ""South African official urges pressure on Burundi rebels""",1,0,0,0,South Africa,560,0,0,0,0,0,0,0,0,0,0,0,0,0,0,0,0,0,0,0,1,1,3,0,1,1,0,0,0,0,0
687,Burundi,90,516,2,Government of Burundi - CNDD-FDD,14,1,0,1,01/31/2002,01/31/2002,1,"AFP 2002-02-01, ""Tanzania says will urge Burundian rebels to negotiate truce""",1,0,0,0,Tanzania,510,0,0,0,0,0,0,0,0,0,0,0,0,0,0,0,0,0,0,0,1,1,3,0,0,0,1,0,0,0,0
688,Burundi,90,516,2,Government of Burundi - Palipehutu-FNL,15,1,0,1,01/31/2002,01/31/2002,1,"AFP 2002-02-01, ""Tanzania says will urge Burundian rebels to negotiate truce""",1,0,0,0,Tanzania,510,0,0,0,0,0,0,0,0,0,0,0,0,0,0,0,0,0,0,0,1,1,3,0,0,0,1,0,0,0,0
689,Burundi,90,516,2,Government of Burundi - CNDD-FDD,14,0,0,1,03/13/2002,03/20/2002,1,"UN Integrated Regional Information Networks/All Africa Global Media via COMTEX 2002-06-07, ""Rebel Group Ready for Ceasefire Talks""",1,0,0,0,Tanzania,510,0,0,0,0,0,0,0,0,0,0,0,0,0,0,0,0,0,0,0,1,2,3,0,1,0,0,0,0,0,0
690,Burundi,90,516,2,Government of Burundi - CNDD-FDD,14,1,0,1,03/24/2002,03/24/2002,1,"AFP 2002-03-24, ""Uganda to help end Burundian civil war: president""",1,0,0,0,Uganda,500,0,0,0,0,0,0,0,0,0,0,0,0,0,0,0,0,0,0,0,1,1,3,0,1,0,0,0,0,0,0
691,Burundi,90,516,2,Government of Burundi - CNDD-FDD,14,1,0,1,03/24/2002,03/24/2002,1,"AFP 2002-03-24, ""Uganda to help end Burundian civil war: president""",1,0,0,0,Uganda,500,0,0,0,0,0,0,0,0,0,0,0,0,0,0,0,0,0,0,0,1,1,3,0,1,0,0,0,0,0,0
692,Burundi,90,516,2,Government of Burundi - Palipehutu-FNL,15,0,0,1,04/01/2002,04/30/2002,4,"AFP 2002-04-29, ""UN Security Council team meets Burundian rebel group""",1,0,0,0,Gabon,481,0,0,0,0,0,0,0,0,0,0,0,0,0,0,0,0,0,0,0,1,2,3,0,0,0,1,0,0,0,0
693,Burundi,90,516,2,Government of Burundi - Palipehutu-FNL,15,0,0,1,04/01/2002,04/30/2002,4,"Reuters 2002-04-29, ""U.N. envoys urge Burundi rebels to stop war""",0,1,0,0,UN,11024,0,0,0,0,0,0,0,0,0,0,0,0,0,0,0,0,0,0,0,1,2,3,0,1,0,0,0,0,0,0
694,Burundi,90,516,2,Government of Burundi - CNDD-FDD,14,0,0,1,04/21/2002,04/30/2002,4,"AFP 2002-04-26, ""Burundi rebel faction accuses Zuma of scuppering peace talks""; AFP 2002-04-29, ""Security Council team meets S.African deputy leader""; AFP 2002-04-29, ""UN Security Council team meets Burundian rebel group""",1,0,0,0,South Africa,560,0,0,0,0,0,0,0,0,0,0,0,0,0,0,0,0,0,0,0,1,3,0,0,0,0,0,1,0,0,0
695,Burundi,90,516,2,Government of Burundi - Palipehutu-FNL,15,0,0,1,04/21/2002,04/30/2002,4,"AFP 2002-04-26, ""Burundi rebel faction accuses Zuma of scuppering peace talks""; AFP 2002-04-29, ""Security Council team meets S.African deputy leader""; AFP 2002-04-29, ""UN Security Council team meets Burundian rebel group""",1,0,0,0,South Africa,560,0,0,0,0,0,0,0,0,0,0,0,0,0,0,0,0,0,0,0,1,3,0,0,0,0,0,1,0,0,0
696,Burundi,90,516,2,Government of Burundi - Palipehutu-FNL,15,0,0,1,04/27/2002,04/27/2002,1,"AFP 2002-04-29, ""UN Security Council team meets Burundian rebel group""",1,0,0,0,South Africa,560,0,0,0,0,0,0,0,0,0,0,0,0,0,0,0,0,0,0,0,1,2,3,0,0,0,1,0,0,0,0
697,Burundi,90,516,2,Government of Burundi - Palipehutu-FNL,15,0,0,1,04/29/2002,04/29/2002,1,"AFP 2002-04-29, ""UN Security Council team meets Burundian rebel group""",0,1,0,0,UN,11024,0,0,0,0,0,0,0,0,0,0,0,0,0,0,0,0,0,0,0,1,2,3,0,0,0,1,0,0,0,0
698,Burundi,90,516,2,Government of Burundi - CNDD-FDD,14,1,0,1,05/05/2002,05/05/2002,1,"AFP 2002-05-05, ""UN Security Council team in bid to boost Burundi peace process""",0,1,0,0,UN,11024,0,0,0,0,0,0,0,0,0,0,0,0,0,0,0,0,0,0,0,1,1,3,0,1,1,0,0,0,0,0
699,Burundi,90,516,2,Government of Burundi - Palipehutu-FNL,15,1,0,1,05/05/2002,05/05/2002,1,"AFP 2002-05-05, ""UN Security Council team in bid to boost Burundi peace process""",0,1,0,0,UN,11024,0,0,0,0,0,0,0,0,0,0,0,0,0,0,0,0,0,0,0,1,1,3,0,1,1,0,0,0,0,0
700,Burundi,90,516,2,Government of Burundi - Palipehutu-FNL,15,0,0,1,05/28/2002,06/03/2002,1,"AFP 2002-06-07, ""Rebel Group Ready for Ceasefire Talks""",1,0,0,0,Tanzania,510,0,0,0,0,0,0,0,0,0,0,0,0,0,0,0,0,0,0,0,1,2,3,0,1,0,0,0,0,0,0
701,Burundi,90,516,2,Government of Burundi - CNDD-FDD,14,1,0,1,06/13/2002,06/14/2002,1,"Reuters 2002-06-14, ""Burundi leader leaves S.Africa after truce talks""",1,0,1,0,"Nelson Mandela (former President of South Africa), South Africa",12026,560,0,0,0,0,0,0,0,0,0,0,0,0,0,0,0,0,0,0,2,1,3,0,1,0,0,0,0,0,0
702,Burundi,90,516,2,Government of Burundi - Palipehutu-FNL,15,1,0,1,06/13/2002,06/14/2002,1,"Reuters 2002-06-14, ""Burundi leader leaves S.Africa after truce talks""",1,0,1,0,"Nelson Mandela (former President of South Africa), South Africa",12026,560,0,0,0,0,0,0,0,0,0,0,0,0,0,0,0,0,0,0,2,1,3,0,1,0,0,0,0,0,0
703,Burundi,90,516,2,Government of Burundi - CNDD-FDD,14,0,0,1,06/14/2002,06/14/2002,1,"AFP 2002-06-14, ""Main Burundi rebel group ready for peace talks: Tanzanian foreign minister""",1,0,0,0,Tanzania,510,0,0,0,0,0,0,0,0,0,0,0,0,0,0,0,0,0,0,0,1,1,3,0,0,1,0,0,0,0,0
704,Burundi,90,516,2,Government of Burundi - CNDD-FDD,14,0,0,1,07/06/2002,07/16/2002,1,"Xinhua 2002-07-16, ""Burundi rebel group agrees to attend peace talks""",1,0,0,0,Tanzania,510,0,0,0,0,0,0,0,0,0,0,0,0,0,0,0,0,0,0,0,1,2,3,0,0,1,0,0,0,0,0
705,Burundi,90,516,2,Government of Burundi - CNDD-FDD,14,0,0,1,08/12/2002,08/12/2002,1,"Xinhua 2002-08-12, ""Xinhua African news summary at 1815 GMT""",1,0,0,0,South Africa,560,0,0,0,0,0,0,0,0,0,0,0,0,0,0,0,0,0,0,0,1,3,2,0,1,0,0,0,0,0,0
706,Burundi,90,516,2,Government of Burundi - CNDD-FDD,14,0,0,1,08/12/2002,08/12/2002,1,"Xinhua 2002-08-13, ""Burundi grateful to Rwanda for help in bringing peace""",1,0,0,0,Rwanda,517,0,0,0,0,0,0,0,0,0,0,0,0,0,0,0,0,0,0,0,1,1,3,0,0,1,0,0,0,0,0
707,Burundi,90,516,2,Government of Burundi - CNDD-FDD,14,0,0,1,08/12/2002,08/15/2002,1,"Xinhua 2002-08-12, ""Xinhua African news summary at 1815 GMT""",1,0,0,0,Tanzania,510,0,0,0,0,0,0,0,0,0,0,0,0,0,0,0,0,0,0,0,1,3,0,0,0,0,0,1,0,0,0
708,Burundi,90,516,2,Government of Burundi - Palipehutu-FNL,15,0,0,1,08/12/2002,08/12/2002,1,"Xinhua 2002-08-13, ""Burundi grateful to Rwanda for help in bringing peace""",1,0,0,0,Rwanda,517,0,0,0,0,0,0,0,0,0,0,0,0,0,0,0,0,0,0,0,1,1,3,0,0,1,0,0,0,0,0
709,Burundi,90,516,2,Government of Burundi - CNDD-FDD,14,0,0,1,08/19/2002,08/19/2002,1,"South African Press Association/All Africa Global Media via COMTEX 2002-08-22, ""Progress On Burundi Talks Satisfactory - Zuma""",1,0,0,0,South Africa,560,0,0,0,0,0,0,0,0,0,0,0,0,0,0,0,0,0,0,0,1,2,3,0,1,0,0,0,0,0,0
710,Burundi,90,516,2,Government of Burundi - CNDD-FDD,14,0,0,1,08/19/2002,08/20/2002,1,"AFP 2002-08-20, ""Preparations under way for more Burundi ceasefire talks""",1,0,0,0,South Africa,560,0,0,0,0,0,0,0,0,0,0,0,0,0,0,0,0,0,0,0,1,1,3,0,0,1,0,0,0,0,0
711,Burundi,90,516,2,Government of Burundi - CNDD-FDD,14,0,0,1,08/19/2002,08/26/2002,1,"AFP 2002-08-20, ""Preparations under way for more Burundi ceasefire talks""; AFP 2002-08-21, ""Mediator optimistic on Burundi ceasefire talks; rebels quibble""; Xinhua 2002-08-26, ""Burundi peace process achieves progress - chief negotiator""",1,0,0,0,Tanzania,510,0,0,0,0,0,0,0,0,0,0,0,0,0,0,0,0,0,0,0,1,3,0,0,0,0,0,1,0,0,0
712,Burundi,90,516,2,Government of Burundi - CNDD-FDD,14,0,0,1,08/20/2002,08/31/2002,4,"AFP 2002-08-21, ""Mediator optimistic on Burundi ceasefire talks; rebels quibble""",1,0,0,0,South Africa,560,0,0,0,0,0,0,0,0,0,0,0,0,0,0,0,0,0,0,0,1,3,1,0,1,0,0,0,0,0,0
713,Burundi,90,516,2,Government of Burundi - CNDD-FDD,14,0,0,1,08/20/2002,08/31/2002,4,"AFP 2002-08-21, ""Mediator optimistic on Burundi ceasefire talks; rebels quibble""",1,0,0,0,South Africa,560,0,0,0,0,0,0,0,0,0,0,0,0,0,0,0,0,0,0,0,1,2,3,0,0,0,1,0,0,0,0
714,Burundi,90,516,2,Government of Burundi - CNDD-FDD,14,0,0,1,08/25/2002,08/25/2002,1,"AFP 2002-08-25, ""Burundi ceasefire discussions continue in Tanzania""",1,0,0,0,South Africa,560,0,0,0,0,0,0,0,0,0,0,0,0,0,0,0,0,0,0,0,1,3,2,0,0,0,1,0,0,0,0
715,Burundi,90,516,2,Government of Burundi - CNDD-FDD,14,0,0,1,09/21/2002,09/21/2002,1,"Xinhua 2002-09-21, ""Roundup - facilitators making painstaking efforts for restarting Burundi talks""; 2002-09-22, ""UPDATE 1-France urges Burundi truce to stabilise region""",1,0,0,0,South Africa,560,0,0,0,0,0,0,0,0,0,0,0,0,0,0,0,0,0,0,0,1,3,2,0,0,0,1,0,0,0,0
716,Burundi,90,516,2,Government of Burundi - CNDD-FDD,14,0,0,1,09/21/2002,09/22/2002,1,"Xinhua 2002-09-21, ""Roundup - facilitators making painstaking efforts for restarting Burundi talks""; AFP 2002-09-22, ""Indirect contacts in Burundi ceasefire talks""",1,0,0,0,Tanzania,510,0,0,0,0,0,0,0,0,0,0,0,0,0,0,0,0,0,0,0,1,3,0,0,0,0,0,1,0,0,0
717,Burundi,90,516,2,Government of Burundi - CNDD-FDD,14,1,0,1,09/22/2002,09/22/2002,1,"Reuters 2002-09-22, ""UPDATE 1-France urges Burundi truce to stabilise region""",1,0,0,0,France,220,0,0,0,0,0,0,0,0,0,0,0,0,0,0,0,0,0,0,0,1,1,3,0,1,0,0,0,0,0,0
718,Burundi,90,516,2,Government of Burundi - CNDD-FDD,14,0,0,1,09/22/2002,09/22/2002,1,"AFP 2002-09-22, ""Indirect contacts in Burundi ceasefire talks""",1,0,0,0,South Africa,560,0,0,0,0,0,0,0,0,0,0,0,0,0,0,0,0,0,0,0,1,3,2,0,1,0,0,0,0,0,0
719,Burundi,90,516,2,Government of Burundi - Palipehutu-FNL,15,1,0,1,09/22/2002,09/22/2002,1,"Reuters 2002-09-22, ""UPDATE 1-France urges Burundi truce to stabilise region""",1,0,0,0,France,220,0,0,0,0,0,0,0,0,0,0,0,0,0,0,0,0,0,0,0,1,1,3,0,1,0,0,0,0,0,0
720,Burundi,90,516,2,Government of Burundi - Palipehutu-FNL,15,0,0,1,09/23/2002,09/26/2002,1,"BuaNews/All Africa Global Media via COMTEX 2002-09-24, ""Positive Outcome Expected From Burundi Ceasefire Talks""; Xinhua 2002-09-27, ""S. African VP leaves Tanzania with collapse of Burundi peace talk""",1,0,0,0,South Africa,560,0,0,0,0,0,0,0,0,0,0,0,0,0,0,0,0,0,0,0,1,3,4,0,1,0,0,0,0,0,0
721,Burundi,90,516,2,Government of Burundi - Palipehutu-FNL,15,0,0,1,09/23/2002,09/26/2002,1,"BuaNews/All Africa Global Media via COMTEX 2002-09-24, ""Positive Outcome Expected From Burundi Ceasefire Talks""; Xinhua 2002-09-27, ""S. African VP leaves Tanzania with collapse of Burundi peace talk""",1,0,0,0,Tanzania,510,0,0,0,0,0,0,0,0,0,0,0,0,0,0,0,0,0,0,0,1,3,0,0,0,0,0,1,0,0,0
722,Burundi,90,516,2,Government of Burundi - CNDD-FDD,14,1,0,1,10/04/2002,10/04/2002,1,"AFP 2002-10-05, ""Burundi leader leaves South Africa for Tanzania peace talks""",1,0,0,0,South Africa,560,0,0,0,0,0,0,0,0,0,0,0,0,0,0,0,0,0,0,0,1,1,3,0,0,0,1,0,0,0,0
723,Burundi,90,516,2,Government of Burundi - Palipehutu-FNL,15,1,0,1,10/04/2002,10/04/2002,1,"AFP 2002-10-05, ""Burundi leader leaves South Africa for Tanzania peace talks""",1,0,0,0,South Africa,560,0,0,0,0,0,0,0,0,0,0,0,0,0,0,0,0,0,0,0,1,1,3,0,0,0,1,0,0,0,0
724,Burundi,90,516,2,Government of Burundi - CNDD-FDD,14,1,0,1,10/05/2002,10/05/2002,1,"AFP 2002-10-05, ""Burundi leader leaves South Africa for Tanzania peace talks""",0,0,1,0,Nelson Mandela (former President of South Africa),12026,0,0,0,0,0,0,0,0,0,0,0,0,0,0,0,0,0,0,0,1,1,3,0,0,0,1,0,0,0,0
725,Burundi,90,516,2,Government of Burundi - CNDD-FDD,14,1,0,1,10/05/2002,10/05/2002,1,"AFP 2002-10-05, ""Burundi leader leaves South Africa for Tanzania peace talks""",1,0,0,0,South Africa,560,0,0,0,0,0,0,0,0,0,0,0,0,0,0,0,0,0,0,0,1,1,0,0,0,0,0,1,0,0,0
726,Burundi,90,516,2,Government of Burundi - Palipehutu-FNL,15,1,0,1,10/05/2002,10/05/2002,1,"AFP 2002-10-05, ""Burundi leader leaves South Africa for Tanzania peace talks""",0,0,1,0,Nelson Mandela (former President of South Africa),12026,0,0,0,0,0,0,0,0,0,0,0,0,0,0,0,0,0,0,0,1,1,3,0,0,0,1,0,0,0,0
727,Burundi,90,516,2,Government of Burundi - Palipehutu-FNL,15,1,0,1,10/05/2002,10/05/2002,1,"AFP 2002-10-05, ""Burundi leader leaves South Africa for Tanzania peace talks""",1,0,0,0,South Africa,560,0,0,0,0,0,0,0,0,0,0,0,0,0,0,0,0,0,0,0,1,1,0,0,0,0,0,1,0,0,0
728,Burundi,90,516,2,Government of Burundi - CNDD-FDD,14,0,0,1,10/07/2002,10/07/2002,1,"Reuters 2002-10-07, ""UPDATE 1-African leaders fail to reach Burundi ceasefire""",4,0,1,0,"South Africa, Tanzania, Democratic Republic of the Congo, Uganda, Nelson Mandela (former President of South Africa)",560,510,490,500,12026,0,0,0,0,0,0,0,0,0,0,0,0,0,0,0,5,3,4,0,1,0,0,0,0,0,0
729,Burundi,90,516,2,Government of Burundi - CNDD-FDD,14,0,0,1,10/26/2002,10/26/2002,1,"Reuters 2002-10-26, ""UPDATE 1-Burundi leader, rebel meet in peace drive""",1,0,0,0,South Africa,560,0,0,0,0,0,0,0,0,0,0,0,0,0,0,0,0,0,0,0,1,3,1,0,1,0,0,0,0,0,0
730,Burundi,90,516,2,Government of Burundi - CNDD-FDD,14,0,0,1,10/26/2002,10/29/2002,1,"Reuters 2002-10-26, ""UPDATE 1-Burundi leader, rebel meet in peace drive""; Reuters 2002-10-29, ""Burundi rebels kill three as peace talks continue""",1,0,0,0,Tanzania,510,0,0,0,0,0,0,0,0,0,0,0,0,0,0,0,0,0,0,0,1,3,0,0,0,0,0,1,0,0,0
731,Burundi,90,516,2,Government of Burundi - CNDD-FDD,14,0,0,1,10/27/2002,10/27/2002,1,"AFP 2002-10-27, ""Burundi peace talks enter second day in Dar es Salaam""",1,0,0,0,South Africa,560,0,0,0,0,0,0,0,0,0,0,0,0,0,0,0,0,0,0,0,1,3,2,0,1,0,0,0,0,0,0
732,Burundi,90,516,2,Government of Burundi - CNDD-FDD,14,0,0,1,10/29/2002,11/08/2002,1,"Reuters 2002-10-29, ""Burundi rebels kill three as peace talks continue""",1,0,0,0,South Africa,560,0,0,0,0,0,0,0,0,0,0,0,0,0,0,0,0,0,0,0,1,3,4,0,1,0,0,0,0,0,0
733,Burundi,90,516,2,Government of Burundi - CNDD-FDD,14,1,0,1,11/21/2002,11/21/2002,1,"AFP 2002-11-21, ""Buyoya holds discussions in Pretoria on Burundi peace talks""",1,0,0,0,South Africa,560,0,0,0,0,0,0,0,0,0,0,0,0,0,0,0,0,0,0,0,1,1,3,0,0,1,0,0,0,0,0
734,Burundi,90,516,2,Government of Burundi - CNDD-FDD,14,1,0,1,11/21/2002,11/21/2002,1,"AFP 2002-11-21, ""Buyoya holds discussions in Pretoria on Burundi peace talks""",1,0,0,0,South Africa,560,0,0,0,0,0,0,0,0,0,0,0,0,0,0,0,0,0,0,0,1,1,3,0,0,1,0,0,0,0,0
735,Burundi,90,516,2,Government of Burundi - CNDD-FDD,14,0,0,1,11/21/2002,11/21/2002,1,"Xinhua 2002-11-22, ""Burundi ceasefire signatories meet in S.Africa""",1,0,0,0,South Africa,560,0,0,0,0,0,0,0,0,0,0,0,0,0,0,0,0,0,0,0,1,3,1,0,0,1,0,0,0,0,0
736,Burundi,90,516,2,Government of Burundi - Palipehutu-FNL,15,0,0,1,11/21/2002,11/21/2002,1,"Xinhua 2002-11-22, ""Burundi ceasefire signatories meet in S.Africa""",1,0,0,0,South Africa,560,0,0,0,0,0,0,0,0,0,0,0,0,0,0,0,0,0,0,0,1,3,1,0,0,1,0,0,0,0,0
737,Burundi,90,516,2,Government of Burundi - CNDD-FDD,14,0,0,1,11/27/2002,11/27/2002,1,"AFP 2002-11-28, ""Burundi government, rebels discuss draft ceasefire pact""",1,0,0,0,South Africa,560,0,0,0,0,0,0,0,0,0,0,0,0,0,0,0,0,0,0,0,1,1,3,0,1,0,0,0,0,0,0
738,Burundi,90,516,2,Government of Burundi - CNDD-FDD,14,0,0,1,11/27/2002,11/27/2002,1,"AFP 2002-11-28, ""Burundi government, rebels discuss draft ceasefire pact""",1,0,0,0,South Africa,560,0,0,0,0,0,0,0,0,0,0,0,0,0,0,0,0,0,0,0,1,2,3,0,1,0,0,0,0,0,0
739,Burundi,90,516,2,Government of Burundi - Palipehutu-FNL,15,0,0,1,11/27/2002,11/28/2002,1,"AFP 2002-11-28, ""Burundi government, rebels discuss draft ceasefire pact""; AFP 2002-11-28, ""Burundi government, rebels discuss draft ceasefire pact""",1,0,0,0,Tanzania,510,0,0,0,0,0,0,0,0,0,0,0,0,0,0,0,0,0,0,0,1,3,0,0,0,0,0,1,0,0,0
740,Burundi,90,516,2,Government of Burundi - CNDD-FDD,14,1,0,1,11/28/2002,11/28/2002,1,"AFP 2002-11-29, ""Uganda says some progress made in Burundi peace talks""",1,0,0,0,Uganda,500,0,0,0,0,0,0,0,0,0,0,0,0,0,0,0,0,0,0,0,1,1,3,0,0,1,0,0,0,0,0
741,Burundi,90,516,2,Government of Burundi - CNDD-FDD,14,0,0,1,11/28/2002,11/28/2002,1,"AFP 2002-11-28, ""Burundi government, rebels discuss draft ceasefire pact""",1,0,0,0,South Africa,560,0,0,0,0,0,0,0,0,0,0,0,0,0,0,0,0,0,0,0,1,3,1,0,1,0,0,0,0,0,0
742,Burundi,90,516,2,Government of Burundi - Palipehutu-FNL,15,1,0,1,11/28/2002,11/28/2002,1,"AFP 2002-11-29, ""Uganda says some progress made in Burundi peace talks""",1,0,0,0,Uganda,500,0,0,0,0,0,0,0,0,0,0,0,0,0,0,0,0,0,0,0,1,1,3,0,0,1,0,0,0,0,0
743,Burundi,90,516,2,Government of Burundi - CNDD-FDD,14,1,0,1,12/01/2002,12/01/2002,1,"Reuters 2002-12-01, ""African leaders meet for Burundi peace talks""",4,0,0,0,"South Africa, Uganda, Ethiopia, Tanzania",560,500,530,510,0,0,0,0,0,0,0,0,0,0,0,0,0,0,0,0,4,1,3,0,1,0,0,0,0,0,0
744,Burundi,90,516,2,Government of Burundi - Palipehutu-FNL,15,1,0,1,12/01/2002,12/01/2002,1,"Reuters 2002-12-01, ""African leaders meet for Burundi peace talks""",4,0,0,0,"South Africa, Uganda, Ethiopia, Tanzania",560,500,530,510,0,0,0,0,0,0,0,0,0,0,0,0,0,0,0,0,4,1,3,0,1,0,0,0,0,0,0
745,Burundi,90,516,2,Government of Burundi - CNDD-FDD,14,0,0,1,12/02/2002,12/02/2002,1,"Reuters 2002-12-02, ""UPDATE 1-Burundi peace deal hits last-minute snag""; Xinhua 2002-12-03, ""Burundi govt., rebels sign ceasefire in Tanzania""",1,0,0,0,Uganda,500,0,0,0,0,0,0,0,0,0,0,0,0,0,0,0,0,0,0,0,1,3,2,0,1,0,0,0,0,0,0
746,Burundi,90,516,2,Government of Burundi - CNDD-FDD,14,0,0,1,12/02/2002,12/02/2002,1,"Reuters 2002-12-02, ""UPDATE 1-Burundi peace deal hits last-minute snag""",1,0,0,0,Tanzania,510,0,0,0,0,0,0,0,0,0,0,0,0,0,0,0,0,0,0,0,1,3,0,0,0,0,0,1,0,0,0
747,Burundi,90,516,2,Government of Burundi - CNDD-FDD,14,0,0,1,01/01/2003,01/31/2003,4,"Reuters 2003-01-15, ""Mediator urges Burundi parties to respect ceasefire""",1,0,0,0,South Africa,560,0,0,0,0,0,0,0,0,0,0,0,0,0,0,0,0,0,0,0,1,2,3,0,0,0,1,0,0,0,0
748,Burundi,90,516,2,Government of Burundi - CNDD-FDD,14,0,0,1,01/19/2003,01/19/2003,1,"AFP 2003-01-19, ""New Burundi peace talks to be held in South Africa""",1,0,0,0,South Africa,560,0,0,0,0,0,0,0,0,0,0,0,0,0,0,0,0,0,0,0,1,2,3,0,0,1,0,0,0,0,0
749,Burundi,90,516,2,Government of Burundi - CNDD-FDD,14,0,0,1,01/25/2003,01/25/2003,1,"AFP 2003-01-25, ""Burundi peace talks held in Pretoria""",1,0,0,0,South Africa,560,0,0,0,0,0,0,0,0,0,0,0,0,0,0,0,0,0,0,0,1,3,1,0,1,1,0,0,0,0,0
750,Burundi,90,516,2,Government of Burundi - Palipehutu-FNL,15,0,0,1,01/25/2003,01/25/2003,1,"AFP 2003-01-25, ""Burundi peace talks held in Pretoria""",1,0,0,0,South Africa,560,0,0,0,0,0,0,0,0,0,0,0,0,0,0,0,0,0,0,0,1,3,1,0,1,1,0,0,0,0,0
751,Burundi,90,516,2,Government of Burundi - CNDD-FDD,14,0,0,1,01/26/2003,01/27/2003,1,"AFP 2003-01-26, ""Burundi peace talks between government, rebel leader extended""",1,0,0,0,South Africa,560,0,0,0,0,0,0,0,0,0,0,0,0,0,0,0,0,0,0,0,1,3,1,0,0,1,0,0,0,0,0
752,Burundi,90,516,2,Government of Burundi - CNDD-FDD,14,0,0,1,02/04/2003,02/05/2003,1,"BuaNews/All Africa Global Media via COMTEX 2003-02-04, ""Burundian Government And Rebel Teams Meet to Discuss Conflict""; AFP 2003-02-05, ""Burundi govt, main rebel group make slow progress in talks""",1,0,0,0,Tanzania,510,0,0,0,0,0,0,0,0,0,0,0,0,0,0,0,0,0,0,0,1,3,0,0,0,0,0,1,0,0,0
753,Burundi,90,516,2,Government of Burundi - CNDD-FDD,14,0,0,1,02/11/2003,02/15/2003,1,"Xinhua 2003-02-11, ""S. Africa optimistic about peace progress in Burundi""; AFP 2003-02-15, ""Burundi's Buyoya and rebel leader make progress in ceasefire talks: mediator""",1,0,0,0,South Africa,560,0,0,0,0,0,0,0,0,0,0,0,0,0,0,0,0,0,0,0,1,3,1,0,1,0,0,0,0,0,0
754,Burundi,90,516,2,Government of Burundi - CNDD-FDD,14,1,0,1,02/13/2003,05/31/2004,1,"SIPRI yearbook 2004, page175, http://www.iss.co.za/pubs/ASR/12No3/AWBoshoff.html; Africa Research Bulletin, Aug 2003, p. 15369
http://www.issafrica.org/pubs/Other/CT2_2004%20PG9-15.pdf; UN Document S/2003/1146; http://www.un.org/Depts/dpko/missions/onub/background.html",0,1,0,0,AU,11000,0,0,0,0,0,0,0,0,0,0,0,0,0,0,0,0,0,0,0,1,0,0,0,0,0,0,0,0,0,1
755,Burundi,90,516,2,Government of Burundi - Palipehutu-FNL,15,1,0,1,02/13/2003,05/31/2004,1,"SIPRI yearbook 2004, page175, http://www.iss.co.za/pubs/ASR/12No3/AWBoshoff.html; Africa Research Bulletin, Aug 2003, p. 15369
http://www.issafrica.org/pubs/Other/CT2_2004%20PG9-15.pdf; UN Document S/2003/1146; http://www.un.org/Depts/dpko/missions/onub/background.html",0,1,0,0,AU,11000,0,0,0,0,0,0,0,0,0,0,0,0,0,0,0,0,0,0,0,1,0,0,0,0,0,0,0,0,0,1
756,Burundi,90,516,2,Government of Burundi - CNDD-FDD,14,1,0,1,02/18/2003,02/18/2003,1,"Reuters 2003-02-18, ""Burundi government, rebels meet to push ceasefire""",3,0,0,0,"Ethiopia, South Africa, Mozambique",530,560,541,0,0,0,0,0,0,0,0,0,0,0,0,0,0,0,0,0,3,3,1,0,0,1,0,0,0,0,0
757,Burundi,90,516,2,Government of Burundi - Palipehutu-FNL,15,1,0,1,02/18/2003,02/18/2003,1,"Reuters 2003-02-18, ""Burundi government, rebels meet to push ceasefire""",3,0,0,0,"Ethiopia, South Africa, Mozambique",530,560,541,0,0,0,0,0,0,0,0,0,0,0,0,0,0,0,0,0,3,3,1,0,0,1,0,0,0,0,0
758,Burundi,90,516,2,Government of Burundi - CNDD-FDD,14,0,0,1,03/02/2003,03/02/2003,1,"AFP 2003-03-02, ""Meeting on Burundi's peace process opens in Tanzania""",3,0,0,0,"Tanzania, Uganda, South Africa",510,500,560,0,0,0,0,0,0,0,0,0,0,0,0,0,0,0,0,0,3,3,1,0,1,0,0,0,0,0,0
759,Burundi,90,516,2,Government of Burundi - CNDD-FDD,14,1,0,1,03/23/2003,03/23/2003,1,"AFP 2003-03-23, ""Burundi, South Africa discuss overdue deployment of African peace force""",1,0,0,0,South Africa,560,0,0,0,0,0,0,0,0,0,0,0,0,0,0,0,0,0,0,0,1,1,3,0,0,1,0,0,0,0,0
760,Burundi,90,516,2,Government of Burundi - Palipehutu-FNL,15,1,0,1,03/23/2003,03/23/2003,1,"AFP 2003-03-23, ""Burundi, South Africa discuss overdue deployment of African peace force""",1,0,0,0,South Africa,560,0,0,0,0,0,0,0,0,0,0,0,0,0,0,0,0,0,0,0,1,1,3,0,0,1,0,0,0,0,0
761,Burundi,90,516,2,Government of Burundi - CNDD-FDD,14,0,0,1,05/11/2003,05/11/2003,1,"AFP 2003-05-11, ""Burundi President discusses transition with Uganda's Museveni""",1,0,0,0,Uganda,500,0,0,0,0,0,0,0,0,0,0,0,0,0,0,0,0,0,0,0,1,1,3,0,0,1,0,0,0,0,0
762,Burundi,90,516,2,Government of Burundi - CNDD-FDD,14,0,0,1,05/12/2003,05/12/2003,1,"AFP 2003-05-12, ""Burundi's president arrives in Tanzania for talks with Mkapa""",1,0,0,0,Tanzania,510,0,0,0,0,0,0,0,0,0,0,0,0,0,0,0,0,0,0,0,1,1,3,0,0,1,0,0,0,0,0
763,Burundi,90,516,2,Government of Burundi - CNDD-FDD,14,1,0,1,05/14/2003,05/14/2003,1,"AFP 2003-05-14, ""DRCongo, Burundi presidents to meet in Tanzania""",1,0,0,0,Democratic Republic of the Congo,490,0,0,0,0,0,0,0,0,0,0,0,0,0,0,0,0,0,0,0,1,1,3,0,0,1,0,0,0,0,0
764,Burundi,90,516,2,Government of Burundi - Palipehutu-FNL,15,1,0,1,05/14/2003,05/14/2003,1,"AFP 2003-05-14, ""DRCongo, Burundi presidents to meet in Tanzania""",1,0,0,0,Democratic Republic of the Congo,490,0,0,0,0,0,0,0,0,0,0,0,0,0,0,0,0,0,0,0,1,1,3,0,0,1,0,0,0,0,0
765,Burundi,90,516,2,Government of Burundi - CNDD-FDD,14,0,0,1,06/11/2003,06/11/2003,1,"AFP 2003-06-11, ""Burundian rebel group says it is committed to peace process""",1,0,0,0,Tanzania,510,0,0,0,0,0,0,0,0,0,0,0,0,0,0,0,0,0,0,0,1,2,3,0,0,1,0,0,0,0,0
766,Burundi,90,516,2,Government of Burundi - CNDD-FDD,14,0,0,1,06/13/2003,06/16/2003,1,"AFP 2003-06-13, ""Burundi govt, rebels discuss ceasefire in Tanzania"", AFP 2003-06-16, ""Burundi peace talks end in Tanzania without progress - FDD""",3,0,0,0,"South Africa, Tanzania, Uganda",560,510,500,0,0,0,0,0,0,0,0,0,0,0,0,0,0,0,0,0,3,3,1,0,1,0,0,0,0,0,0
767,Burundi,90,516,2,Government of Burundi - CNDD-FDD,14,1,0,1,07/17/2003,07/17/2003,1,"UN Integrated Regional Information Networks/All Africa Global Media via COMTEX 2003-07-17, ""SA Deputy President Arrives in Bujumbura As UN Withdraws Nonessential Staff""",1,0,0,0,South Africa,560,0,0,0,0,0,0,0,0,0,0,0,0,0,0,0,0,0,0,0,1,1,3,0,0,1,0,0,0,0,0
768,Burundi,90,516,2,Government of Burundi - Palipehutu-FNL,15,1,0,1,07/17/2003,07/17/2003,1,"UN Integrated Regional Information Networks/All Africa Global Media via COMTEX 2003-07-17, ""SA Deputy President Arrives in Bujumbura As UN Withdraws Nonessential Staff""",1,0,0,0,South Africa,560,0,0,0,0,0,0,0,0,0,0,0,0,0,0,0,0,0,0,0,1,1,3,0,0,1,0,0,0,0,0
769,Burundi,90,516,2,Government of Burundi - CNDD-FDD,14,0,0,1,07/20/2003,07/20/2003,1,"AFP 2003-07-20, ""Burundi peace talks resume in Dar es Salaam""; AFP 2003-07-20, ""Burundi rebel group and government agree to ceasefire""",3,0,0,0,"Uganda, Tanzania, South Africa",500,510,560,0,0,0,0,0,0,0,0,0,0,0,0,0,0,0,0,0,3,3,1,0,1,0,0,0,0,0,0
770,Burundi,90,516,2,Government of Burundi - CNDD-FDD,14,0,0,1,07/30/2003,07/30/2003,1,"Xinhua 2003-07-30, ""Uganda, Burundi discuss peace process in Burundi""",1,0,0,0,Uganda,500,0,0,0,0,0,0,0,0,0,0,0,0,0,0,0,0,0,0,0,1,1,3,0,0,1,0,0,0,0,0
771,Burundi,90,516,2,Government of Burundi - CNDD-FDD,14,0,0,1,08/05/2003,08/05/2003,1,"AFP 2003-08-05, ""Burundi government, rebels consult mediators ahead of talks""",1,0,0,0,South Africa,560,0,0,0,0,0,0,0,0,0,0,0,0,0,0,0,0,0,0,0,1,3,2,0,1,0,0,0,0,0,0
772,Burundi,90,516,2,Government of Burundi - CNDD-FDD,14,0,0,1,08/06/2003,08/06/2003,1,"Reuters 2003-08-06, ""Burundi govt and rebels making progress - mediator""",1,0,0,0,South Africa,560,0,0,0,0,0,0,0,0,0,0,0,0,0,0,0,0,0,0,0,1,3,1,0,1,0,0,0,0,0,0
773,Burundi,90,516,2,Government of Burundi - CNDD-FDD,14,1,0,1,08/07/2003,08/08/2003,1,"Xinhua 2003-08-07, ""Burundian rebel factions urged to accept ceasefire""; AFP 2003-08-08, ""Mozambique's 220 peacekeepers to Burundi to be fully deployed by October""",1,0,0,0,Mozambique,541,0,0,0,0,0,0,0,0,0,0,0,0,0,0,0,0,0,0,0,1,1,3,0,1,0,0,0,0,0,0
774,Burundi,90,516,2,Government of Burundi - Palipehutu-FNL,15,1,0,1,08/07/2003,08/08/2003,1,"Xinhua 2003-08-07, ""Burundian rebel factions urged to accept ceasefire""; AFP 2003-08-08, ""Mozambique's 220 peacekeepers to Burundi to be fully deployed by October""",1,0,0,0,Mozambique,541,0,0,0,0,0,0,0,0,0,0,0,0,0,0,0,0,0,0,0,1,1,3,0,1,0,0,0,0,0,0
775,Burundi,90,516,2,Government of Burundi - CNDD-FDD,14,0,0,1,08/18/2003,08/18/2003,1,"ABP 2003-08-18, ""Burundi: Vice-president holds talks with visiting Canadian special envoy""",1,0,0,0,Canada,20,0,0,0,0,0,0,0,0,0,0,0,0,0,0,0,0,0,0,0,1,1,3,0,0,1,0,0,0,0,0
776,Burundi,90,516,2,Government of Burundi - CNDD-FDD,14,0,0,1,08/19/2003,08/19/2003,1,"AFP 2003-08-19, ""South Africa hosts talks with Burundi president, rebel leaders""",1,0,0,0,South Africa,560,0,0,0,0,0,0,0,0,0,0,0,0,0,0,0,0,0,0,0,1,3,2,0,1,0,0,0,0,0,0
777,Burundi,90,516,2,Government of Burundi - CNDD-FDD,14,0,0,1,08/20/2003,08/21/2003,1,"AFP 2003-08-20, ""South African talks try to revive Burundi ceasefire as figthing continues""; AFP 2003-08-21, ""Burundi talks in S. Africa enter third day, no breakthrough in sight""",1,0,0,0,South Africa,560,0,0,0,0,0,0,0,0,0,0,0,0,0,0,0,0,0,0,0,1,3,1,1,1,1,0,0,0,0,0
778,Burundi,90,516,2,Government of Burundi - CNDD-FDD,14,1,0,1,08/21/2003,08/21/2003,1,"ABP 2003-08-21, ""Burundi vice-president discusses peace process with visiting US army general""",1,0,0,0,USA,2,0,0,0,0,0,0,0,0,0,0,0,0,0,0,0,0,0,0,0,1,1,3,0,0,1,0,0,0,0,0
779,Burundi,90,516,2,Government of Burundi - Palipehutu-FNL,15,1,0,1,08/21/2003,08/21/2003,1,"ABP 2003-08-21, ""Burundi vice-president discusses peace process with visiting US army general""",1,0,0,0,USA,2,0,0,0,0,0,0,0,0,0,0,0,0,0,0,0,0,0,0,0,1,1,3,0,0,1,0,0,0,0,0
780,Burundi,90,516,2,Government of Burundi - CNDD-FDD,14,0,0,1,09/09/2003,09/09/2003,1,"AFP 2003-09-09, ""Burundi president in Uganda for talks with Hutu rebel chief""; AFP 2003-09-10, ""Burundi rebel leader in further talks with Ugandan president""; ABP 2003-09-11, ""Burundi: President returns from Uganda, speaks of ""huge step backward""",1,0,0,0,Uganda,500,0,0,0,0,0,0,0,0,0,0,0,0,0,0,0,0,0,0,0,1,3,2,1,0,1,0,0,0,0,0
781,Burundi,90,516,2,Government of Burundi - CNDD-FDD,14,0,0,1,09/14/2003,09/16/2003,1,"AFP 2003-09-15, ""Talks to find Burundi peace continue into night""; Xinhua 2003-09-16, ""Burundi peace talks adjourned fruitless""",4,0,0,0,"Mozambique, South Africa, Tanzania, Uganda",541,560,510,500,0,0,0,0,0,0,0,0,0,0,0,0,0,0,0,0,4,3,2,1,0,0,0,0,0,0,0
782,Burundi,90,516,2,Government of Burundi - CNDD-FDD,14,0,0,1,09/22/2003,09/22/2003,1,"Radio Burundi 2003-09-22, ""Burundi president urges UN to exert pressure on rebel group to join talks""",0,1,0,0,UN,11024,0,0,0,0,0,0,0,0,0,0,0,0,0,0,0,0,0,0,0,1,1,3,0,0,1,0,0,0,0,0
783,Burundi,90,516,2,Government of Burundi - Palipehutu-FNL,15,0,0,1,09/22/2003,09/22/2003,1,"Radio Burundi 2003-09-22, ""Burundi president urges UN to exert pressure on rebel group to join talks""",0,1,0,0,UN,11024,0,0,0,0,0,0,0,0,0,0,0,0,0,0,0,0,0,0,0,1,1,3,0,0,1,0,0,0,0,0
784,Burundi,90,516,2,Government of Burundi - CNDD-FDD,14,0,0,1,10/01/2003,10/31/2003,4,"Net Press 2003-10-15, ""Burundi: Rebel faction delegation leaves for South Africa to meet Mandela""",0,0,1,0,Nelson Mandela (former President of South Africa),12026,0,0,0,0,0,0,0,0,0,0,0,0,0,0,0,0,0,0,0,1,2,3,0,0,1,0,0,0,0,0
785,Burundi,90,516,2,Government of Burundi - CNDD-FDD,14,0,0,1,10/05/2003,10/06/2003,1,"Reuters 2003-10-06, ""Burundi peace talks stretch into Monday""; AFP 2003-10-07, ""Burundi peace talks enter third day following military agreement""",1,0,0,0,South Africa,560,0,0,0,0,0,0,0,0,0,0,0,0,0,0,0,0,0,0,0,1,3,1,1,0,0,0,0,0,0,0
786,Burundi,90,516,2,Government of Burundi - CNDD-FDD,14,0,0,1,10/30/2003,11/01/2003,1,"AFP 2003-10-30, ""Burundi peace talks start in Pretoria as summit postponed""; AFP 2003-10-31, ""Zuma rejoining Burundi peace talks in South Africa""; Reuters 2003-11-01, ""Burundi talks produce deal on key issues - rebels""",1,0,0,0,South Africa,560,0,0,0,0,0,0,0,0,0,0,0,0,0,0,0,0,0,0,0,1,3,1,1,0,0,0,0,0,0,0
787,Burundi,90,516,2,Government of Burundi - CNDD-FDD,14,1,0,1,11/07/2003,11/07/2003,1,"ABP 2003-11-07, ""Burundi president in talks with members of Arusha peace accord monitoring body""",0,1,0,0,UN,11024,0,0,0,0,0,0,0,0,0,0,0,0,0,0,0,0,0,0,0,1,1,3,0,1,1,0,0,0,0,0
788,Burundi,90,516,2,Government of Burundi - Palipehutu-FNL,15,1,0,1,11/07/2003,11/07/2003,1,"ABP 2003-11-07, ""Burundi president in talks with members of Arusha peace accord monitoring body""",0,1,0,0,UN,11024,0,0,0,0,0,0,0,0,0,0,0,0,0,0,0,0,0,0,0,1,1,3,0,1,1,0,0,0,0,0
789,Burundi,90,516,2,Government of Burundi - CNDD-FDD,14,0,0,1,11/12/2003,11/12/2003,1,"Bonesha FM 2003-11-12, ""Burundi: UN official arrives in Burundi for talks on peace process""",0,1,0,0,UN,11024,0,0,0,0,0,0,0,0,0,0,0,0,0,0,0,0,0,0,0,1,1,3,0,0,1,0,0,0,0,0
790,Burundi,90,516,2,Government of Burundi - Palipehutu-FNL,15,0,0,1,11/12/2003,11/12/2003,1,"Bonesha FM 2003-11-12, ""Burundi: UN official arrives in Burundi for talks on peace process""",0,1,0,0,UN,11024,0,0,0,0,0,0,0,0,0,0,0,0,0,0,0,0,0,0,0,1,1,3,0,0,1,0,0,0,0,0
791,Burundi,90,516,2,Government of Burundi - Palipehutu-FNL,15,0,0,1,01/13/2004,01/13/2004,1,"AFP 2004-01-13, ""Burundi leader drums up international support for peace, aid""",1,0,0,0,Belgium,211,0,0,0,0,0,0,0,0,0,0,0,0,0,0,0,0,0,0,0,1,1,0,0,0,0,0,1,0,0,0
792,Burundi,90,516,2,Government of Burundi - Palipehutu-FNL,15,0,0,1,01/18/2004,01/21/2004,1,"Radio France Internationale 2004-01-19, ""Burundi president, rebels hold first meeting, talks to officially begin today""; AFP 2004-01-20, ""Burundi president, diehard rebels make peace proposals at talks""; AFP 2004-01-21, ""Burundi president, diehard rebels agree to ""stop violence""",1,0,0,0,Netherlands,210,0,0,0,0,0,0,0,0,0,0,0,0,0,0,0,0,0,0,0,1,3,0,0,0,0,0,1,0,0,0
793,Burundi,90,516,2,Government of Burundi - Palipehutu-FNL,15,0,0,1,02/01/2004,02/28/2004,4,"Reuters 2004-02-13, ""Burundi FNL rebels suspend talks with government""",1,0,0,0,Tanzania,510,0,0,0,0,0,0,0,0,0,0,0,0,0,0,0,0,0,0,0,1,3,0,0,0,0,0,1,0,0,0
794,Burundi,90,516,0,Government of Burundi - CNDD-FDD,14,1,0,0,02/25/2004,02/25/2004,1,"ABP 2004-02-25, ""Burundi vice-president hold talks with UN, Japanese envoys""",0,1,0,0,UN,11024,0,0,0,0,0,0,0,0,0,0,0,0,0,0,0,0,0,0,0,1,1,3,0,0,1,0,0,0,0,0
795,Burundi,90,516,2,Government of Burundi - Palipehutu-FNL,15,1,0,1,02/25/2004,02/25/2004,1,"ABP 2004-02-25, ""Burundi vice-president hold talks with UN, Japanese envoys""",0,1,0,0,UN,11024,0,0,0,0,0,0,0,0,0,0,0,0,0,0,0,0,0,0,0,1,1,3,0,0,1,0,0,0,0,0
796,Burundi,90,516,2,Government of Burundi - Palipehutu-FNL,15,0,0,1,03/01/2004,03/31/2004,4,"Radio Publique Africaine 2004-03-26, ""Burundi: Rebel official satisfied with first contacts with mediator""; UN Integrated Regional Information Networks/All Africa Global Media via COMTEX 2004-03-26, ""Burundi: All Parties Favour Elections, Zuma Says""",1,0,0,0,South Africa,560,0,0,0,0,0,0,0,0,0,0,0,0,0,0,0,0,0,0,0,1,2,3,1,0,0,0,0,0,0,0
797,Burundi,90,516,0,Government of Burundi - CNDD-FDD,14,1,0,0,03/19/2004,03/19/2004,1,"Radio Ethiopia 2004-03-19, ""Ethiopia: Premier confers with Burundian Speaker""",1,0,0,0,Ethiopia,530,0,0,0,0,0,0,0,0,0,0,0,0,0,0,0,0,0,0,0,1,1,3,0,0,1,0,0,0,0,0
798,Burundi,90,516,2,Government of Burundi - Palipehutu-FNL,15,1,0,1,03/19/2004,03/19/2004,1,"Radio Ethiopia 2004-03-19, ""Ethiopia: Premier confers with Burundian Speaker""",1,0,0,0,Ethiopia,530,0,0,0,0,0,0,0,0,0,0,0,0,0,0,0,0,0,0,0,1,1,3,0,0,1,0,0,0,0,0
799,Burundi,90,516,2,Government of Burundi - Palipehutu-FNL,15,0,0,1,03/24/2004,03/24/2004,1,"UN Integrated Regional Information Networks/All Africa Global Media via COMTEX 2004-03-23, ""Burundi: Zuma Arrives in Bujumbura to Evaluate Peace Process""; ABP 2004-03-25, ""South Africa's Zuma meets Burundian politicians over elections, rebels""",1,0,0,0,South Africa,560,0,0,0,0,0,0,0,0,0,0,0,0,0,0,0,0,0,0,0,1,1,3,1,0,0,0,0,0,0,0
800,Burundi,90,516,2,Government of Burundi - Palipehutu-FNL,15,0,0,1,04/30/2004,04/30/2004,1,"UN Integrated Regional Information Networks/All Africa Global Media via COMTEX 2004-04-30, ""Burundi-Uganda: Rebels Will Not Derail Peace, Ndayizeye Says""",1,0,0,0,Uganda,500,0,0,0,0,0,0,0,0,0,0,0,0,0,0,0,0,0,0,0,1,1,3,0,1,1,0,0,0,0,0
801,Burundi,90,516,0,Government of Burundi - CNDD-FDD,14,1,0,0,05/27/2004,05/28/2004,1,"AFP 2004-05-27, ""DR Congo vice president in Burundi for talks on border security""; Radio Burundi 2004-05-28, ""DRCongo vice-president ends visit to Burundi""",1,0,0,0,Democratic Republic of the Congo,490,0,0,0,0,0,0,0,0,0,0,0,0,0,0,0,0,0,0,0,1,1,3,0,0,1,0,0,0,0,0
802,Burundi,90,516,2,Government of Burundi - Palipehutu-FNL,15,1,0,1,05/27/2004,05/28/2004,1,"AFP 2004-05-27, ""DR Congo vice president in Burundi for talks on border security""; Radio Burundi 2004-05-28, ""DRCongo vice-president ends visit to Burundi""",1,0,0,0,Democratic Republic of the Congo,490,0,0,0,0,0,0,0,0,0,0,0,0,0,0,0,0,0,0,0,1,1,3,0,0,1,0,0,0,0,0
803,Burundi,90,516,2,Government of Burundi - Palipehutu-FNL,15,0,0,1,06/03/2004,06/03/2004,1,"AFP 2004-06-03, ""Last active Burundi rebel group in South Africa for talks""",1,0,0,0,South Africa,560,0,0,0,0,0,0,0,0,0,0,0,0,0,0,0,0,0,0,0,1,2,3,0,0,1,0,0,0,0,0
804,Burundi,90,516,2,Government of Burundi - Palipehutu-FNL,15,0,0,1,06/05/2004,06/05/2004,1,"AFP 2004-06-05, ""Regional leaders' meeting on Burundi set to start in Tanzania""",6,0,0,0,"Tanzania, Uganda, South Africa, Rwanda, Zambia, Ethiopia",510,500,560,517,551,530,0,0,0,0,0,0,0,0,0,0,0,0,0,0,6,1,3,0,0,1,0,0,0,0,0
805,Burundi,90,516,2,Government of Burundi - Palipehutu-FNL,15,0,0,1,06/17/2004,06/17/2004,1,"UN Integrated Regional Information Networks/All Africa Global Media via COMTEX 2004-06-17, ""Burundi: Zuma in Post-Summit Visit to Bujumbura""",1,0,0,0,South Africa,560,0,0,0,0,0,0,0,0,0,0,0,0,0,0,0,0,0,0,0,1,1,3,0,0,1,0,0,0,0,0
806,Burundi,90,516,2,Government of Burundi - Palipehutu-FNL,15,0,0,1,07/17/2004,07/18/2004,1,"AFP 2004-07-17, ""Burundi's last rebel group, UN official meet in Nairobi""; Reuters 2004-07-18, ""Burundi factions in talks to advance peace process""; AFP 2004-08-02, ""Last Burundi rebels accuse army of breaking UN ceasefire accord""",0,1,0,0,UN,11024,0,0,0,0,0,0,0,0,0,0,0,0,0,0,0,0,0,0,0,1,2,3,0,1,1,0,0,0,0,0
807,Burundi,90,516,2,Government of Burundi - Palipehutu-FNL,15,0,0,1,07/17/2004,07/18/2004,1,"AFP 2004-07-17, ""Burundi's last rebel group, UN official meet in Nairobi""",1,0,0,0,Kenya,501,0,0,0,0,0,0,0,0,0,0,0,0,0,0,0,0,0,0,0,1,2,0,0,0,0,0,1,0,0,0
808,Burundi,90,516,2,Government of Burundi - Palipehutu-FNL,15,0,0,1,08/18/2004,08/18/2004,1,"Reuters 2004-08-18, ""UPDATE 2-Burundi FNL rebels branded ""terrorists"",no sanctions""",5,0,0,0,"Democratic Republic of the Congo, South Africa, Tanzania, Zambia, Mozambique",490,560,510,551,541,0,0,0,0,0,0,0,0,0,0,0,0,0,0,0,5,1,3,0,0,1,0,0,0,0,0
809,Burundi,90,516,2,Government of Burundi - Palipehutu-FNL,15,0,0,1,08/26/2004,08/26/2004,1,"ABP 2004-08-26, ""Burundi vice-president in talks with UK envoy""",1,0,0,0,UK,200,0,0,0,0,0,0,0,0,0,0,0,0,0,0,0,0,0,0,0,1,1,3,0,0,1,0,0,0,0,0
810,Central African Republic,222,482,0,Government of Central African Republic - Military faction (forces of Andr? Kolingba),17,1,0,0,03/11/2003,03/11/2003,1,"Reuters 2003-03-13 ""President Orders Army to Ease Up On Offensive""",1,0,0,0,Chad,483,0,0,0,0,0,0,0,0,0,0,0,0,0,0,0,0,0,0,0,1,1,3,0,0,1,0,0,0,0,0
811,Central African Republic,222,482,0,Government of Central African Republic - Forces of Francois Bozize,287,1,0,0,03/11/2003,03/11/2003,1,"Reuters 2003-03-13 ""President Orders Army to Ease Up On Offensive""",1,0,0,0,Chad,483,0,0,0,0,0,0,0,0,0,0,0,0,0,0,0,0,0,0,0,1,1,3,0,0,1,0,0,0,0,0
812,Central African Republic,222,482,0,0,9482,0,1,0,03/18/2003,03/18/2003,1,"AFP 2003-03-18 ""Visiting Africans hail coup leader in Central African Republic.""",2,0,0,0,"Congo, Gabon",484,481,0,0,0,0,0,0,0,0,0,0,0,0,0,0,0,0,0,0,2,1,3,0,0,1,0,0,0,0,0
813,Central African Republic,222,482,0,0,9482,0,1,0,05/01/2003,05/01/2003,1,"AFP 2003-05-02 ""Central African Republic thanks Chad for helping restore order.""",1,0,0,0,Chad,483,0,0,0,0,0,0,0,0,0,0,0,0,0,0,0,0,0,0,0,1,1,3,0,0,1,0,0,0,0,0
814,Central African Republic,222,482,0,0,9482,0,1,0,06/01/2003,06/30/2003,4,"AFP 2003-06-23 ""UN says positive changes in Central African Republic since coup.""",0,1,0,0,UN,11024,0,0,0,0,0,0,0,0,0,0,0,0,0,0,0,0,0,0,0,1,0,0,0,0,0,0,0,1,0,0
815,Central African Republic,222,482,0,0,9482,0,1,0,07/29/2003,07/29/2003,1,"AFP 2003-07-30 ""French minister in first post-coup visit to Central African Republic.""",1,0,0,0,France,220,0,0,0,0,0,0,0,0,0,0,0,0,0,0,0,0,0,0,0,1,1,3,0,0,1,0,0,0,0,0
816,Central African Republic,222,482,0,0,9482,0,1,0,12/30/2003,12/30/2003,1,"AFP 2003-12-30 ""CAR open to a permanent French force, Bozize says as minister visits.""",1,0,0,0,France,220,0,0,0,0,0,0,0,0,0,0,0,0,0,0,0,0,0,0,0,1,1,3,0,0,1,0,0,0,0,0
817,Chad,91,483,2,Government of Chad - CNR,22,0,0,1,08/01/1993,08/31/1993,4,"A.R.B. August 1993, p. 11117; A.R.B. October 1993, p. 11194; Keesing's August 1993, p. 39587",2,0,0,0,"Libya, Sudan",620,625,0,0,0,0,0,0,0,0,0,0,0,0,0,0,0,0,0,0,2,3,1,0,0,1,0,0,0,0,0
818,Chad,91,483,2,Government of Chad - CSNPD,21,0,0,1,02/01/1994,02/28/1994,4,"A.R.B. August 1994, p. 11551; Keesing's August 1994, p. 40130; Regional Surveys of the World 2002, p. 198.",1,0,0,0,Central African Republic,482,0,0,0,0,0,0,0,0,0,0,0,0,0,0,0,0,0,0,0,1,3,0,0,0,0,0,1,0,0,0
819,Chad,91,483,2,Government of Chad - CSNPD,21,0,0,1,08/05/1994,08/10/1994,1,"Reuters 1994-08-10 ""Chad, southern rebels, sign peace accord""",1,0,0,0,Central African Republic,482,0,0,0,0,0,0,0,0,0,0,0,0,0,0,0,0,0,0,0,1,3,0,0,0,0,0,1,0,0,0
820,Chad,91,483,2,Government of Chad - CSNPD,21,0,0,1,08/27/1994,08/28/1994,1,"Reuters 1994-08-31 ""Chad rebel leader returns home, renounces war""",2,0,0,0,"Central African Republic, Gabon",482,481,0,0,0,0,0,0,0,0,0,0,0,0,0,0,0,0,0,0,2,1,3,0,0,1,0,0,0,0,0
821,Chad,91,483,0,Government of Chad - MDD,25,1,0,0,06/09/1995,06/09/1995,1,"Reuters 1995-06-10 ""Nigeria to help Chadian factions return home.""",1,0,0,0,Nigeria,475,0,0,0,0,0,0,0,0,0,0,0,0,0,0,0,0,0,0,0,1,1,3,0,0,1,0,0,0,0,0
822,Chad,91,483,0,Government of Chad - MDD,25,1,0,0,07/01/1995,07/31/1995,1,"Reuters 1995-06-10 ""Nigeria to help Chadian factions return home."" AND 1995-12-20 ""Chadian Premier in Nigeria on two-day visit.""",1,0,0,0,Nigeria,475,0,0,0,0,0,0,0,0,0,0,0,0,0,0,0,0,0,0,0,1,1,3,0,0,1,0,0,0,0,0
823,Chad,91,483,0,Government of Chad - CSNPD,21,1,0,0,01/04/1996,01/09/1996,1,"Reuters 1996-02-02 ""Sudan, Chad, CAR to secure borders."" AND Reuters 1996-02-11 ""Chad president says June elections will go ahead."" AND Reuters 1995-11-02 ""Chad government to meet opponents in Gabon."" AND Reuters 1996-01-14 ""Chad minister says new voter census a success."" AND A.R.B. January 1996, p. 12127",3,0,0,0,"Gabon, Niger, Central African Republic",481,436,482,0,0,0,0,0,0,0,0,0,0,0,0,0,0,0,0,0,3,3,1,0,0,1,0,0,0,0,0
824,Chad,91,483,0,Government of Chad - CNR,22,1,0,0,01/04/1996,01/09/1996,1,"Reuters 1996-02-02 ""Sudan, Chad, CAR to secure borders."" AND Reuters 1996-02-11 ""Chad president says June elections will go ahead."" AND Reuters 1995-11-02 ""Chad government to meet opponents in Gabon."" AND Reuters 1996-01-14 ""Chad minister says new voter census a success."" AND A.R.B. January 1996, p. 12127",3,0,0,0,"Gabon, Niger, Central African Republic",481,436,482,0,0,0,0,0,0,0,0,0,0,0,0,0,0,0,0,0,3,3,1,0,0,1,0,0,0,0,0
825,Chad,91,483,0,Government of Chad - FNT,24,1,0,0,01/04/1996,01/09/1996,1,"Reuters 1996-02-02 ""Sudan, Chad, CAR to secure borders."" AND Reuters 1996-02-11 ""Chad president says June elections will go ahead."" AND Reuters 1995-11-02 ""Chad government to meet opponents in Gabon."" AND Reuters 1996-01-14 ""Chad minister says new voter census a success."" AND A.R.B. January 1996, p. 12127",3,0,0,0,"Gabon, Niger, Central African Republic",481,436,482,0,0,0,0,0,0,0,0,0,0,0,0,0,0,0,0,0,3,3,1,0,0,1,0,0,0,0,0
826,Chad,91,483,0,Government of Chad - MDD,25,0,0,0,01/04/1996,01/09/1996,1,"Reuters 1996-02-02 ""Sudan, Chad, CAR to secure borders."" AND Reuters 1996-02-11 ""Chad president says June elections will go ahead."" AND Reuters 1995-11-02 ""Chad government to meet opponents in Gabon."" AND Reuters 1996-01-14 ""Chad minister says new voter census a success."" AND A.R.B. January 1996, p. 12127",3,0,0,0,"Gabon, Niger, Central African Republic",481,436,482,0,0,0,0,0,0,0,0,0,0,0,0,0,0,0,0,0,3,3,1,0,0,1,0,0,0,0,0
827,Chad,91,483,0,Government of Chad - FNT,24,0,0,0,10/02/1997,10/03/1997,1,"A.R.B. October 1997, p. 12862; AND Regional Surveys of the World 2002, p. 199",1,0,0,0,Sudan,625,0,0,0,0,0,0,0,0,0,0,0,0,0,0,0,0,0,0,0,1,3,1,1,0,1,0,0,0,0,0
828,Chad,91,483,0,Government of Chad - MDD,25,0,0,0,05/01/1998,05/31/1998,4,"Voix du Sahel, Niamey, 12:00, 20 May 1998",1,0,0,0,Niger,436,0,0,0,0,0,0,0,0,0,0,0,0,0,0,0,0,0,0,0,1,3,1,0,0,1,0,0,0,0,0
829,Chad,91,483,2,Government of Chad - MDJT,27,0,0,1,09/01/2000,09/30/2000,4,"A.R.B. October 2000, p. 14162; Radio France Internationale, Paris, 6:30 p.m., 19 October, 2000",1,0,0,0,Libya,620,0,0,0,0,0,0,0,0,0,0,0,0,0,0,0,0,0,0,0,1,3,0,0,0,0,0,1,0,0,0
830,Chad,91,483,2,Government of Chad - MDJT,27,0,0,1,07/26/2001,07/26/2001,1,"Africa No 1 Radio, 26 July, 2001",1,0,0,0,Libya,620,0,0,0,0,0,0,0,0,0,0,0,0,0,0,0,0,0,0,0,1,3,0,0,0,0,0,1,0,0,0
831,Chad,91,483,2,Government of Chad - MDJT,27,0,0,1,01/04/2002,01/07/2002,1,"Reuters 2002-01-05 ""Chad holds peace talks with MDJT rebels in Tripoli"" AND Reuters 2002-01-07 ""Chad agrees on ceasefire with rebels""",1,0,0,0,Libya,620,0,0,0,0,0,0,0,0,0,0,0,0,0,0,0,0,0,0,0,1,3,1,0,1,1,0,0,0,0,0
832,Comoros (Anjouan),213,581,1,Government of Comoros - MPA/Republic of Anjouan,35,0,0,1,08/10/1997,08/10/1997,1,"Reuters 1997-08-13, ""OAU team whisked away by Comoran soldiers""",0,1,0,0,AU,11000,0,0,0,0,0,0,0,0,0,0,0,0,0,0,0,0,0,0,0,1,2,3,1,1,1,0,0,0,0,0
833,Comoros (Anjouan),213,581,1,Government of Comoros - MPA/Republic of Anjouan,35,0,0,1,08/11/1997,08/11/1997,1,"Reuters 1997-08-14, ""Comoran island separatists agree to dialogue""",0,1,0,0,AU,11000,0,0,0,0,0,0,0,0,0,0,0,0,0,0,0,0,0,0,0,1,2,3,0,0,1,0,0,0,0,0
834,Comoros (Anjouan),213,581,1,Government of Comoros - MPA/Republic of Anjouan,35,0,0,1,08/13/1997,08/13/1997,1,"Reuters 1997-08-14, ""Comoran island separatists agree to dialogue""",0,1,0,0,AU,11000,0,0,0,0,0,0,0,0,0,0,0,0,0,0,0,0,0,0,0,1,1,3,0,0,0,1,0,0,0,0
835,Comoros (Anjouan),213,581,1,Government of Comoros - MPA/Republic of Anjouan,35,0,0,1,09/01/1997,09/03/1997,2,"Reuters 1997-09-03, ""OAU envoy fears Comoro troops will invade island""",0,1,0,0,AU,11000,0,0,0,0,0,0,0,0,0,0,0,0,0,0,0,0,0,0,0,1,1,3,0,1,0,0,0,0,0,0
836,Comoros (Anjouan),213,581,1,Government of Comoros - MPA/Republic of Anjouan,35,0,0,1,09/01/1997,12/31/1997,5,"Reuters 1997-10-02, ""OAU says referendum on Comoros secession unwise""",0,1,0,0,AU,11000,0,0,0,0,0,0,0,0,0,0,0,0,0,0,0,0,0,0,0,1,3,2,0,0,0,1,0,0,0,0
837,Comoros (Anjouan),213,581,1,Government of Comoros - MPA/Republic of Anjouan,35,0,0,1,09/04/1997,09/04/1997,1,"Reuters 1997-09-05, ""Comoros asks for French help against secessionists""",0,1,0,0,AU,11000,0,0,0,0,0,0,0,0,0,0,0,0,0,0,0,0,0,0,0,1,1,3,0,1,0,0,0,0,0,0
838,Comoros (Anjouan),213,581,1,Government of Comoros - MPA/Republic of Anjouan,35,0,0,1,09/23/1997,09/23/1997,1,"Reuters 1997-09-25, ""FOCUS-Comoran prisoners of war appeal for clemency""",0,2,0,0,"AU, Arab League",11000,11001,0,0,0,0,0,0,0,0,0,0,0,0,0,0,0,0,0,0,2,2,3,1,0,0,0,0,0,0,0
839,Comoros (Anjouan),213,581,1,Government of Comoros - MPA/Republic of Anjouan,35,0,0,1,11/09/1997,11/14/1997,1,"Reuters 1997-11-14, ""Comoros secessionists disagree on OAU proposals""; Reuters 1997-11-16, ""Comoros wants preliminary talks on secession""",0,1,0,0,AU,11000,0,0,0,0,0,0,0,0,0,0,0,0,0,0,0,0,0,0,0,1,2,3,1,0,1,0,0,0,0,0
840,Comoros (Anjouan),213,581,1,Government of Comoros - MPA/Republic of Anjouan,35,0,0,1,11/25/1997,05/10/1999,6,"Heldt & Wallensteen 2005, SIPRI yearbook 1998; Africa Research Bulletin, political Series, Nov 1997: 12900; FBIS 10 May 1999",0,1,0,0,AU,11000,0,0,0,0,0,0,0,0,0,0,0,0,0,0,0,0,0,0,0,1,0,0,0,0,0,0,0,0,0,1
841,Comoros (Anjouan),213,581,1,Government of Comoros - MPA/Republic of Anjouan,35,0,0,1,12/11/1997,12/14/1997,1,"Reuters 1997-12-12, ""OAU seeks autonomy as solution to Comoros crisis""",0,1,0,0,AU,11000,0,0,0,0,0,0,0,0,0,0,0,0,0,0,0,0,0,0,0,1,3,2,1,0,0,0,0,0,0,0
842,Comoros (Anjouan),213,581,1,Government of Comoros - MPA/Republic of Anjouan,35,0,0,1,12/11/1997,12/14/1997,1,"Reuters 1997-12-10, ""OAU appeals to Comoros for national unity""; Reuters 1997-12-14, ""Comoro islanders maintain hard line on secession""",1,0,0,0,Ethiopia,530,0,0,0,0,0,0,0,0,0,0,0,0,0,0,0,0,0,0,0,1,3,0,0,0,0,0,1,0,0,0
843,Comoros (Anjouan),213,581,1,Government of Comoros - MPA/Republic of Anjouan,35,0,0,1,12/24/1997,12/27/1997,1,"Reuters 1997-12-25, ""OAU sends fresh mission to Comoros""; Reuters 1997-12-28, ""OAU mission leaves Comoros after ""encouraging"" talks""",0,1,0,0,AU,11000,0,0,0,0,0,0,0,0,0,0,0,0,0,0,0,0,0,0,0,1,1,3,0,0,1,0,0,0,0,0
844,Comoros (Anjouan),213,581,1,Government of Comoros - MPA/Republic of Anjouan,35,0,0,1,12/24/1997,12/27/1997,1,"Reuters 1997-12-25, ""OAU sends fresh mission to Comoros""; Reuters 1997-12-28, ""OAU mission leaves Comoros after ""encouraging"" talks""",0,1,0,0,AU,11000,0,0,0,0,0,0,0,0,0,0,0,0,0,0,0,0,0,0,0,1,2,3,0,0,1,0,0,0,0,0
845,Comoros (Anjouan),213,581,0,Government of Comoros - MPA/Republic of Anjouan,35,0,0,0,03/18/1998,03/18/1998,1,"Reuters 1998-03-18, ""OAU group in Comoros to ease separatist crisis""; Reuters 1998-03-19, ""OAU ministers to meet Comoros secessionist leaders""",0,1,0,0,AU,11000,0,0,0,0,0,0,0,0,0,0,0,0,0,0,0,0,0,0,0,1,1,3,1,0,0,0,0,0,0,0
846,Comoros (Anjouan),213,581,0,Government of Comoros - MPA/Republic of Anjouan,35,0,0,0,03/20/1998,03/20/1998,1,"Reuters 1998-03-21, ""OAU denounces ""chaos"" on Comoros rebel island""",0,1,0,0,AU,11000,0,0,0,0,0,0,0,0,0,0,0,0,0,0,0,0,0,0,0,1,1,3,0,0,0,1,0,0,0,0
847,Comoros (Anjouan),213,581,0,Government of Comoros - MPA/Republic of Anjouan,35,0,0,0,04/26/1998,04/26/1998,1,"Reuters 1998-04-26, ""EU delegation visits breakaway Comoros island""",0,1,0,0,EC/EU,11010,0,0,0,0,0,0,0,0,0,0,0,0,0,0,0,0,0,0,0,1,2,3,0,0,1,0,0,0,0,0
848,Comoros (Anjouan),213,581,0,Government of Comoros - MPA/Republic of Anjouan,35,0,0,0,08/20/1998,08/20/1998,1,"Reuters 1998-08-19, ""Comoran secessionist delegation heads to S.Africa""; Xinhua 1998-10-06, ""OAU Calls for Negotiated Solution to Comorian Crisis""",0,1,0,0,AU,11000,0,0,0,0,0,0,0,0,0,0,0,0,0,0,0,0,0,0,0,1,2,3,1,0,0,0,0,0,0,0
849,Comoros (Anjouan),213,581,0,Government of Comoros - MPA/Republic of Anjouan,35,0,0,0,08/20/1998,08/20/1998,1,"Reuters 1998-08-19, ""Comoran secessionist delegation heads to S.Africa""; Xinhua 1998-10-06, ""OAU Calls for Negotiated Solution to Comorian Crisis""",1,0,0,0,South Africa,560,0,0,0,0,0,0,0,0,0,0,0,0,0,0,0,0,0,0,0,1,2,0,0,0,0,0,1,0,0,0
850,Comoros (Anjouan),213,581,0,Government of Comoros - MPA/Republic of Anjouan,35,0,0,0,12/09/1998,12/11/1998,1,"Xinhua 1998-12-08, ""S. Africa to Coordinate OAU Mission to Comoros""; Reuters 1998-12-09, ""OAU mission flies in to Comoros crisis""",0,1,0,0,AU,11000,0,0,0,0,0,0,0,0,0,0,0,0,0,0,0,0,0,0,0,1,0,0,0,0,0,0,0,1,0,0
851,Comoros (Anjouan),213,581,0,Government of Comoros - MPA/Republic of Anjouan,35,0,0,0,02/01/1999,02/14/1999,4,"Reuters 1999-02-11 ""OAU peace delegation stranded on Comoran island.""",0,1,0,0,AU,11000,0,0,0,0,0,0,0,0,0,0,0,0,0,0,0,0,0,0,0,1,0,0,0,0,0,0,0,1,0,0
852,Comoros (Anjouan),213,581,0,Government of Comoros - MPA/Republic of Anjouan,35,0,0,0,04/19/1999,04/22/1999,1,"Reuters 1999-04-19 ""Walkout mars start of Comoran reconciliation talks."" AND Reuters 1999-04-21 ""Comoros talks inch ahead, secessionists give ground."" AND Reuters 1999-02-17 ""Comoros Island-EU Rocard Defends EU Peace Mission In The Comoros.""",0,2,0,0,"AU, EC/EU",11000,11010,0,0,0,0,0,0,0,0,0,0,0,0,0,0,0,0,0,0,2,3,1,1,0,0,0,0,0,0,0
853,Comoros (Anjouan),213,581,0,Government of Comoros - MPA/Republic of Anjouan,35,0,0,0,04/19/1999,04/22/1999,1,"Reuters 1999-04-19 ""Walkout mars start of Comoran reconciliation talks."" AND Reuters 1999-04-21 ""Comoros talks inch ahead, secessionists give ground."" AND Reuters 1999-02-17 ""Comoros Island-EU Rocard Defends EU Peace Mission In The Comoros.""",1,0,0,0,Madagascar,580,0,0,0,0,0,0,0,0,0,0,0,0,0,0,0,0,0,0,0,1,0,0,0,0,0,0,1,0,0,0
854,Comoros (Anjouan),213,581,0,Government of Comoros - MPA/Republic of Anjouan,35,0,0,0,07/01/1999,07/11/1999,1,"Reuters 1999-07-02 ""Comoros parties agree new deal in secession crisis.""",0,1,0,0,Arab League,11001,0,0,0,0,0,0,0,0,0,0,0,0,0,0,0,0,0,0,0,1,0,0,0,0,0,0,0,1,0,0
855,Comoros (Anjouan),213,581,0,Government of Comoros - MPA/Republic of Anjouan,35,0,0,0,06/26/2000,07/01/2000,1,"AFP 1999-07-08 ""Foreign ministers propose OAU military intervention in Anjouan.""",0,1,0,0,AU,11000,0,0,0,0,0,0,0,0,0,0,0,0,0,0,0,0,0,0,0,1,3,4,0,0,0,1,0,0,0,0
856,Comoros (Anjouan),213,581,0,Government of Comoros - MPA/Republic of Anjouan,35,0,0,0,12/30/2000,12/30/2000,1,"Reuters 2000-12-30 ""African delegation to seek Comoros settlement.""",0,1,0,0,AU,11000,0,0,0,0,0,0,0,0,0,0,0,0,0,0,0,0,0,0,0,1,1,3,0,0,1,0,0,0,0,0
857,Congo,214,484,2,Government of Congo - Ninjas,36,1,0,1,06/18/1993,06/18/1993,1,"Reuters, 1993-06-18, ""France sends mediators to mediate in Congo crisis.""",1,0,0,0,France,220,0,0,0,0,0,0,0,0,0,0,0,0,0,0,0,0,0,0,0,1,1,3,0,0,0,1,0,0,0,0
858,Congo,214,484,2,Government of Congo - Cobras,189,0,0,2,06/09/1997,06/09/1997,1,"Chirac wins agreement for Congo truce - aide. By Francois Raitberger , 540 words, 9 June 1997, Reuters News",1,0,0,0,France,220,0,0,0,0,0,0,0,0,0,0,0,0,0,0,0,0,0,0,0,1,3,2,0,1,0,0,0,0,0,0
859,Congo,214,484,2,Government of Congo - Cobras,189,0,0,2,06/14/1997,06/14/1997,1,"U.S. and France join Brazzaville peace talks. By Matthew Tostevin , 595 words , 14 June 1997, Reuters News. France, U.N., U.S. push for peace in Brazzaville. By Matthew Tostevin , 589 words , 14 June 1997, Reuters News",2,1,0,0,"USA, France, UN",2,220,11024,0,0,0,0,0,0,0,0,0,0,0,0,0,0,0,0,0,3,3,2,0,0,1,0,0,0,0,0
860,Congo,214,484,2,Government of Congo - Cobras,189,0,0,2,06/16/1997,06/16/1997,1,"French troops start leaving Congo, fresh clashes. By Matthew Tostevin , 498 words , 17 June 1997, Reuters News",0,1,0,0,UN,11024,0,0,0,0,0,0,0,0,0,0,0,0,0,0,0,0,0,0,0,1,3,2,0,0,1,0,0,0,0,0
861,Congo,214,484,2,Government of Congo - Cobras,189,0,0,2,06/18/1997,06/18/1997,1,"UN envoy presses on as Congo truce holds. By Richard Meares , 558 words, 18 June 1997, Reuters News",0,1,0,0,UN,11024,0,0,0,0,0,0,0,0,0,0,0,0,0,0,0,0,0,0,0,1,3,2,0,1,0,0,0,0,0,0
862,Congo,214,484,2,Government of Congo - Cobras,189,0,0,2,07/12/1997,07/12/1997,1,"Congo factions sign ceasefire agreement - UN envoy. 193 words , 12 July 1997, Reuters News",0,1,0,0,UN,11024,0,0,0,0,0,0,0,0,0,0,0,0,0,0,0,0,0,0,0,1,3,2,0,1,0,0,0,0,0,0
863,Congo,214,484,2,Government of Congo - Cobras,189,0,0,2,07/15/1997,07/15/1997,1,"U.N. envoy meets Brazzaville rivals, truce holds. By William Wallis , 391 words , 15 July 1997, Reuters News",0,1,0,0,UN,11024,0,0,0,0,0,0,0,0,0,0,0,0,0,0,0,0,0,0,0,1,3,2,0,0,0,1,0,0,0,0
864,Congo,214,484,2,Government of Congo - Cobras,189,0,0,2,07/18/1997,07/19/1997,1,"Brazzaville peace talks adjourned to Monday. 332 words , 19 July 1997, Reuters News",1,2,0,0,"Gabon, UN, AU",481,11024,11000,0,0,0,0,0,0,0,0,0,0,0,0,0,0,0,0,0,3,3,2,1,1,0,0,0,0,0,0
865,Congo,214,484,2,Government of Congo - Cobras,189,0,0,2,07/22/1997,07/22/1997,1,"Gabon's Bongo holds fresh Brazzaville peace talks. 269 words , 22 July 1997, Reuters News",1,0,0,0,Gabon,481,0,0,0,0,0,0,0,0,0,0,0,0,0,0,0,0,0,0,0,1,1,3,0,0,0,1,0,0,0,0
866,Congo,214,484,2,Government of Congo - Cobras,189,0,0,2,07/22/1997,07/22/1997,1,"Gabon's Bongo holds fresh Brazzaville peace talks. 269 words , 22 July 1997, Reuters News",1,0,0,0,Gabon,481,0,0,0,0,0,0,0,0,0,0,0,0,0,0,0,0,0,0,0,1,2,3,0,0,0,1,0,0,0,0
867,Congo,214,484,2,Government of Congo - Cobras,189,0,0,2,07/23/1997,07/24/1997,1,"Fresh delay at Congo Brazzaville talks. 239 words , 23 July 1997, Reuters News",1,2,0,0,"Gabon, UN, AU",481,11024,11000,0,0,0,0,0,0,0,0,0,0,0,0,0,0,0,0,0,3,3,2,1,0,0,0,0,0,0,0
868,Congo,214,484,2,Government of Congo - Cobras,189,0,0,2,07/25/1997,07/25/1997,1,"Congo Brazzaville rivals meet face-to-face. 259 words , 25 July 1997, Reuters News",1,2,0,0,"Gabon, UN, AU",481,11024,11000,0,0,0,0,0,0,0,0,0,0,0,0,0,0,0,0,0,3,3,1,1,0,0,0,0,0,0,0
869,Congo,214,484,2,Government of Congo - Cobras,189,0,0,2,08/01/1997,08/01/1997,1,"UN envoy reports progress in Congo peace talks. 373 words, 3 August 1997, Reuters News",0,2,0,0,"UN, AU",11024,11000,0,0,0,0,0,0,0,0,0,0,0,0,0,0,0,0,0,0,2,1,3,0,0,1,0,0,0,0,0
870,Congo,214,484,2,Government of Congo - Cobras,189,0,0,2,08/01/1997,08/01/1997,1,"UN envoy reports progress in Congo peace talks. 373 words, 3 August 1997, Reuters News",0,2,0,0,"UN, AU",11024,11000,0,0,0,0,0,0,0,0,0,0,0,0,0,0,0,0,0,0,2,2,3,0,0,1,0,0,0,0,0
871,Congo,214,484,2,Government of Congo - Cobras,189,0,0,2,08/30/1997,08/30/1997,1,"Congo's Lissouba holds peace talks in Gabon. By Gregory Mintsa , 499 words , 30 August 1997, Reuters News",1,0,0,0,Gabon,481,0,0,0,0,0,0,0,0,0,0,0,0,0,0,0,0,0,0,0,1,1,3,1,0,0,0,0,0,0,0
872,Congo,214,484,2,Government of Congo - Cobras,189,0,0,2,09/01/1997,09/04/1997,1,"Gabon's Bongo awaits Congo Brazzaville peace reply. By Gregory Mintsa , 451 words , 2 September 1997, Reuters News",1,2,0,0,"Gabon, UN, AU",481,11024,11000,0,0,0,0,0,0,0,0,0,0,0,0,0,0,0,0,0,3,3,2,1,0,0,0,0,0,0,0
873,Congo,214,484,2,Government of Congo - Cobras,189,0,0,2,09/14/1997,09/14/1997,1,"Leaders in Gabon for Congo Brazzaville peace talks. By Yvette Bivigou , 498 words , 14 September 1997, Reuters News. African leaders to seek Congo Brazzaville peace. By Yvette Bivigou , 475 words , 13 September 1997,Reuters News. Summit to end Brazzaville unrest hears rivals. By Yvette Bivigou , 625 words ,14 September 1997, Reuters News",8,0,0,0,"Gabon, Benin, Burkina Faso, Central African Republic, Chad, Togo, Equatorial Guinea, Senegal",481,434,439,482,483,461,411,433,0,0,0,0,0,0,0,0,0,0,0,0,8,3,1,1,0,0,0,0,0,0,0
874,Congo,214,484,2,Government of Congo - Cobras,189,0,0,2,09/15/1997,09/15/1997,1,"No sign of breakthrough at Congo crisis summit. By Yvette Bivigou, 641 words, 15 September 1997, Reuters News",8,0,0,0,"Gabon, Benin, Burkina Faso, Central African Republic, Chad, Togo, Equatorial Guinea, Senegal",481,434,439,482,483,461,411,433,0,0,0,0,0,0,0,0,0,0,0,0,8,3,2,1,0,0,0,0,0,0,0
875,Congo,214,484,2,Government of Congo - Cobras,189,0,0,2,09/28/1997,09/28/1997,1,"Congo president, PM ask Sassou to sign ceasefire.286 words, 29 September 1997, Reuters News",1,0,0,0,Gabon,481,0,0,0,0,0,0,0,0,0,0,0,0,0,0,0,0,0,0,0,1,1,3,0,1,0,0,0,0,0,0
876,Congo,214,484,2,Government of Congo - Cobras,189,0,0,2,10/03/1997,10/03/1997,1,"Brazzaville's Lissouba holds talks in Togo. 182 words , 3 October 1997, Reuters News",1,0,0,0,Togo,461,0,0,0,0,0,0,0,0,0,0,0,0,0,0,0,0,0,0,0,1,1,3,0,0,0,1,0,0,0,0
877,Congo,214,484,2,Government of Congo - Cobras,189,0,0,2,10/09/1997,10/09/1997,1,"Congo's Lissouba seeks support to end fighting. 292 words, 8 October 1997, Reuters News",1,0,0,0,Namibia,565,0,0,0,0,0,0,0,0,0,0,0,0,0,0,0,0,0,0,0,1,1,3,0,0,1,0,0,0,0,0
878,Congo,214,484,2,Government of Congo - Cocoyes,37,0,0,1,11/30/1998,07/31/1999,6,"Reuters, 1999-08-06, ""Congo-Rebellion Over 280 Rebels Surrender To Congolese Army.""",0,0,1,0,"NGO, domestic or local ",12028,0,0,0,0,0,0,0,0,0,0,0,0,0,0,0,0,0,0,0,1,3,2,0,0,1,0,0,0,0,0
879,Congo,214,484,2,Government of Congo - Ninjas,36,0,0,1,02/03/1999,02/03/1999,1,"Reuters 1999-02-03 ""Central African leader hints at mediation in Congo.""",1,0,0,0,Central African Republic,482,0,0,0,0,0,0,0,0,0,0,0,0,0,0,0,0,0,0,0,1,1,3,0,0,1,0,0,0,0,0
880,Congo,214,484,2,Government of Congo - Ninjas,36,0,0,1,12/01/1999,12/29/1999,4,UCDP database,1,0,0,0,Gabon,481,0,0,0,0,0,0,0,0,0,0,0,0,0,0,0,0,0,0,0,1,3,1,0,0,0,1,0,0,0,0
881,Congo,214,484,2,Government of Congo - Cocoyes,37,0,0,1,12/01/1999,12/29/1999,4,UCDP database,1,0,0,0,Gabon,481,0,0,0,0,0,0,0,0,0,0,0,0,0,0,0,0,0,0,0,1,3,1,0,0,0,1,0,0,0,0
882,Congo,214,484,2,Government of Congo - Ntsiloulous,38,0,0,1,12/01/1999,12/29/1999,4,UCDP database,1,0,0,0,Gabon,481,0,0,0,0,0,0,0,0,0,0,0,0,0,0,0,0,0,0,0,1,3,1,0,0,0,1,0,0,0,0
883,Congo,214,484,0,Government of Congo - Ninjas,36,0,0,0,03/17/2001,03/26/2001,4,"Reuters 2001-03-17 ""Congo Republic peace talks begin, few exiles join."" AND Reuters 2001-03-26 ""Congo Republic takes step towards new constitution."" Also see UCDP database.",1,0,0,0,Gabon,481,0,0,0,0,0,0,0,0,0,0,0,0,0,0,0,0,0,0,0,1,3,1,1,0,0,0,0,0,0,0
884,Congo,214,484,0,Government of Congo - Cocoyes,37,0,0,0,03/17/2001,03/26/2001,4,"Reuters 2001-03-17 ""Congo Republic peace talks begin, few exiles join."" AND Reuters 2001-03-26 ""Congo Republic takes step towards new constitution."" Also see UCDP database.",1,0,0,0,Gabon,481,0,0,0,0,0,0,0,0,0,0,0,0,0,0,0,0,0,0,0,1,3,1,1,0,0,0,0,0,0,0
885,Congo,214,484,0,Government of Congo - Ninjas,36,0,0,0,04/11/2001,04/14/2001,1,"Reuters 2001-04-06 ""Exiled Congo Republic PM to return, backs talks."" AND Reuters 2001-04-14 ""Congo Republic burns guns as post-war talks close."" AND UCDP",1,0,0,0,Gabon,481,0,0,0,0,0,0,0,0,0,0,0,0,0,0,0,0,0,0,0,1,3,1,1,0,0,0,0,0,0,0
886,Congo,214,484,0,Government of Congo - Cocoyes,37,0,0,0,04/11/2001,04/14/2001,1,"Reuters 2001-04-06 ""Exiled Congo Republic PM to return, backs talks."" AND Reuters 2001-04-14 ""Congo Republic burns guns as post-war talks close."" AND UCDP",1,0,0,0,Gabon,481,0,0,0,0,0,0,0,0,0,0,0,0,0,0,0,0,0,0,0,1,3,1,1,0,0,0,0,0,0,0
887,DR Congo (Zaire),86,490,2,Government of DR Congo (Zaire) - AFDL,39,0,0,2,10/01/1996,10/31/1996,4,Two arrested at London protest against Zairean PM. Oct 21 (Reuter),1,0,0,0,UK,200,0,0,0,0,0,0,0,0,0,0,0,0,0,0,0,0,0,0,0,1,1,3,0,0,0,1,0,0,0,0
888,DR Congo (Zaire),86,490,2,Government of DR Congo (Zaire) - AFDL,39,0,0,2,10/30/1996,10/31/1996,2,OAU tries to defuse Zaire-Rwanda tensions.Oct 30 (Reuter),0,1,0,0,AU,11000,0,0,0,0,0,0,0,0,0,0,0,0,0,0,0,0,0,0,0,1,1,3,0,0,0,1,0,0,0,0
889,DR Congo (Zaire),86,490,2,Government of DR Congo (Zaire) - AFDL,39,0,0,2,11/01/1996,11/30/1996,4,"Zairean president, prime minister meet in France. Nov 16 (Reuter",1,0,0,0,Congo,484,0,0,0,0,0,0,0,0,0,0,0,0,0,0,0,0,0,0,0,1,1,3,0,0,0,1,0,0,0,0
890,DR Congo (Zaire),86,490,2,Government of DR Congo (Zaire) - AFDL,39,0,0,2,11/01/1996,11/30/1996,4,"Zairean president, prime minister meet in France. Nov 16 (Reuter",1,0,0,0,South Africa,560,0,0,0,0,0,0,0,0,0,0,0,0,0,0,0,0,0,0,0,1,1,3,0,0,0,1,0,0,0,0
891,DR Congo (Zaire),86,490,2,Government of DR Congo (Zaire) - AFDL,39,0,0,2,11/01/1996,11/30/1996,4,"Zairean president, prime minister meet in France. Nov 16 (Reuter",0,1,0,0,UN,11024,0,0,0,0,0,0,0,0,0,0,0,0,0,0,0,0,0,0,0,1,1,3,0,0,0,1,0,0,0,0
892,DR Congo (Zaire),86,490,2,Government of DR Congo (Zaire) - AFDL,39,0,0,2,11/11/1996,11/11/1996,1,"Shelling interrupts first U.N. aid handout in Goma. Nov 13 (Reuter), Canada willing to lead multi-nation force in Zaire. Nov 11 (Reuter)",0,1,0,0,UN,11024,0,0,0,0,0,0,0,0,0,0,0,0,0,0,0,0,0,0,0,1,1,3,0,0,1,0,0,0,0,0
893,DR Congo (Zaire),86,490,2,Government of DR Congo (Zaire) - AFDL,39,0,0,2,11/17/1996,11/17/1996,1,Zairean leader meets Gabon head of state in France. Nov 17 (Reuter),1,0,0,0,Gabon,481,0,0,0,0,0,0,0,0,0,0,0,0,0,0,0,0,0,0,0,1,1,3,0,0,1,0,0,0,0,0
894,DR Congo (Zaire),86,490,2,Government of DR Congo (Zaire) - AFDL,39,0,0,2,11/28/1996,11/28/1996,1,"Aid workers doubt wisdom of Zaire airdrop plan. Nov 28 (Reuter), Zaire, rebels set conditions for rescue force. Nov 30 (Reuter)",1,0,0,0,Canada,20,0,0,0,0,0,0,0,0,0,0,0,0,0,0,0,0,0,0,0,1,2,3,0,0,1,0,0,0,0,0
895,DR Congo (Zaire),86,490,2,Government of DR Congo (Zaire) - AFDL,39,0,0,2,11/30/1996,11/30/1996,1,Zaire stands firm against latest U.N. force plan.,1,0,0,0,Canada,20,0,0,0,0,0,0,0,0,0,0,0,0,0,0,0,0,0,0,0,1,1,3,0,0,1,0,0,0,0,0
896,DR Congo (Zaire),86,490,2,Government of DR Congo (Zaire) - AFDL,39,0,0,2,01/28/1997,01/30/1997,1,"EU envoy says food must reach Zaire refugees. 197 words , 31 January 1997, Reuters News",0,1,0,0,EC/EU,11010,0,0,0,0,0,0,0,0,0,0,0,0,0,0,0,0,0,0,0,1,1,3,0,0,1,0,0,0,0,0
897,DR Congo (Zaire),86,490,2,Government of DR Congo (Zaire) - AFDL,39,0,0,2,02/08/1997,02/09/1997,1,"Zaire welcomes EU meeting proposal. 429 words, 10 February 1997, Reuters News",0,1,0,0,EC/EU,11010,0,0,0,0,0,0,0,0,0,0,0,0,0,0,0,0,0,0,0,1,1,3,0,0,1,0,0,0,0,0
898,DR Congo (Zaire),86,490,2,Government of DR Congo (Zaire) - AFDL,39,0,0,2,02/17/1997,02/17/1997,1,"Zairean air attack as U.N. seeks end to rebel war. By Arthur Malu-Malu, 614 words, 17 February 1997, Reuters News",0,2,0,0,"AU, UN",11000,11024,0,0,0,0,0,0,0,0,0,0,0,0,0,0,0,0,0,0,2,1,3,0,0,0,1,0,0,0,0
899,DR Congo (Zaire),86,490,2,Government of DR Congo (Zaire) - AFDL,39,0,0,2,02/18/1997,02/18/1997,1,"Zaire says it launched new air raids on east. By Arthur Malu-Malu , 557 words, 18 February 1997, Reuters News",0,2,0,0,"AU, UN",11000,11024,0,0,0,0,0,0,0,0,0,0,0,0,0,0,0,0,0,0,2,1,3,0,0,0,1,0,0,0,0
900,DR Congo (Zaire),86,490,2,Government of DR Congo (Zaire) - AFDL,39,0,0,2,02/19/1997,02/19/1997,1,"Zaire says it launched new air raids on east. By Arthur Malu-Malu , 557 words, 18 February 1997, Reuters News. Zaire says it favours regional summit on war. 273 words, 21 February 1997, Reuters News",3,0,0,0,"Tanzania, Kenya, South Africa",510,501,560,0,0,0,0,0,0,0,0,0,0,0,0,0,0,0,0,0,3,1,3,0,0,0,1,0,0,0,0
901,DR Congo (Zaire),86,490,2,Government of DR Congo (Zaire) - AFDL,39,0,0,2,02/19/1997,02/19/1997,1,"U.N. envoy and Zaire rebel leader exchanged views. By Matthew Tostevin , 464 words, 20 February 1997, Reuters News",0,2,0,0,"AU, UN",11000,11024,0,0,0,0,0,0,0,0,0,0,0,0,0,0,0,0,0,0,2,2,3,0,0,0,1,0,0,0,0
902,DR Congo (Zaire),86,490,2,Government of DR Congo (Zaire) - AFDL,39,0,0,2,02/25/1997,02/25/1997,1,"Zairean rebel chief holds S.African talks -diplomat. By Richard Meares, 583 words, 26 February 1997, Reuters News",1,0,0,0,South Africa,560,0,0,0,0,0,0,0,0,0,0,0,0,0,0,0,0,0,0,0,1,2,3,0,1,0,0,0,0,0,0
903,DR Congo (Zaire),86,490,2,Government of DR Congo (Zaire) - AFDL,39,0,0,2,02/25/1997,02/26/1997,1,"African ministers set summit on Zaire conflict. 342 words, 26 February 1997, Reuters News",0,2,0,0,"AU, UN",11000,11024,0,0,0,0,0,0,0,0,0,0,0,0,0,0,0,0,0,0,2,2,3,0,0,0,1,0,0,0,0
904,DR Congo (Zaire),86,490,2,Government of DR Congo (Zaire) - AFDL,39,0,0,2,02/26/1997,02/26/1997,1,"Zaire's Kabila says hopes for peace talks soon. 238 words , 26 February 1997, Reuters News",1,0,0,0,South Africa,560,0,0,0,0,0,0,0,0,0,0,0,0,0,0,0,0,0,0,0,1,2,3,0,0,1,0,0,0,0,0
905,DR Congo (Zaire),86,490,2,Government of DR Congo (Zaire) - AFDL,39,0,0,2,02/27/1997,02/27/1997,1,"Mobutu envoy meets Mandela in Zaire peace move. 308 words, 27 February 1997, Reuters News",1,0,0,0,South Africa,560,0,0,0,0,0,0,0,0,0,0,0,0,0,0,0,0,0,0,0,1,1,3,0,0,1,0,0,0,0,0
906,DR Congo (Zaire),86,490,2,Government of DR Congo (Zaire) - AFDL,39,0,0,2,03/13/1997,03/13/1997,1,"Zaire rebel leader meets U.N. envoy, again rejects ceasefire. 91 words, 14 March 1997, Reuters News",0,2,0,0,"AU, UN",11000,11024,0,0,0,0,0,0,0,0,0,0,0,0,0,0,0,0,0,0,2,2,3,0,1,0,0,0,0,0,0
907,DR Congo (Zaire),86,490,2,Government of DR Congo (Zaire) - AFDL,39,0,0,2,03/15/1997,03/15/1997,1,"U.N. envoy Sahnoun arrives in rebel Zaire. By Matthew Tostevin, 428 words, 15 March 1997, Reuters News",0,2,0,0,"AU, UN",11000,11024,0,0,0,0,0,0,0,0,0,0,0,0,0,0,0,0,0,0,2,2,3,0,1,1,0,0,0,0,0
908,DR Congo (Zaire),86,490,2,Government of DR Congo (Zaire) - AFDL,39,0,0,2,03/18/1997,03/18/1997,1,"Zairean prime minister in Kenya for talks. By Buchizya Mseteka, 612 words , 18 March 1997, Reuters News",1,0,0,0,Kenya,501,0,0,0,0,0,0,0,0,0,0,0,0,0,0,0,0,0,0,0,1,1,3,0,0,0,1,0,0,0,0
909,DR Congo (Zaire),86,490,2,Government of DR Congo (Zaire) - AFDL,39,0,0,2,03/19/1997,03/19/1997,1,"Zairean prime minister in Kenya for talks. By Buchizya Mseteka, 612 words , 18 March 1997, Reuters News. South Africa, EU push for Zaire ceasefire. By Buchizya Mseteka, 563 words , 19 March 1997, Reuters News",5,1,0,0,"Cameroon, EC/EU, Kenya, Zimbabwe, Congo, South Africa",471,11010,501,552,484,560,0,0,0,0,0,0,0,0,0,0,0,0,0,0,6,1,3,0,1,1,0,0,0,0,0
910,DR Congo (Zaire),86,490,2,Government of DR Congo (Zaire) - AFDL,39,0,0,2,03/22/1997,03/22/1997,1,"U.N. envoy to meet Zaire rebel leader. By Buchizya Mseteka , 548 words, 22 March 1997, Reuters News",0,2,0,0,"AU, UN",11000,11024,0,0,0,0,0,0,0,0,0,0,0,0,0,0,0,0,0,0,2,1,3,0,1,0,0,0,0,0,0
911,DR Congo (Zaire),86,490,2,Government of DR Congo (Zaire) - AFDL,39,0,0,2,03/23/1997,03/25/1997,1,"S.Africa's Mbeki to talk peace with Zaire's Mobutu. 340 words, 22 March 1997, Reuters News. OAU foreign ministers seek Zaire solution. By Nicholas Phythian, 536 words , 25 March 1997, Reuters News",1,0,0,0,South Africa,560,0,0,0,0,0,0,0,0,0,0,0,0,0,0,0,0,0,0,0,1,1,3,0,1,1,0,0,0,0,0
912,DR Congo (Zaire),86,490,2,Government of DR Congo (Zaire) - AFDL,39,0,0,2,03/25/1997,03/25/1997,1,"South Africans hold talks in rebel-held Zaire. By Matthew Bigg, 682 words, 25 March 1997, Reuters News",1,0,0,0,Belgium,211,0,0,0,0,0,0,0,0,0,0,0,0,0,0,0,0,0,0,0,1,2,3,0,0,1,0,0,0,0,0
913,DR Congo (Zaire),86,490,2,Government of DR Congo (Zaire) - AFDL,39,0,0,2,03/26/1997,03/27/1997,1,"Mobutu, Kabila stay silent on Zaire peace ideas.By William Wallis , 724 words, 25 March 1997, Reuters News. LOME SUMMIT COULD MAKE PROGRESS TOWARD ZAIRE PEACE. By Nicholas Phythian, 693 words, 26 March 1997, Reuters News. Zaire talks in next days but no prior ceasefire. By Nicholas Phythian , 790 words, 27 March 1997, Reuters News",2,2,0,0,"UN, AU, France, USA",11024,11000,220,2,0,0,0,0,0,0,0,0,0,0,0,0,0,0,0,0,4,3,4,0,1,1,0,0,0,0,0
914,DR Congo (Zaire),86,490,2,Government of DR Congo (Zaire) - AFDL,39,0,0,2,03/26/1997,03/27/1997,1,"Mobutu, Kabila stay silent on Zaire peace ideas.By William Wallis , 724 words, 25 March 1997, Reuters News",1,0,0,0,Togo,461,0,0,0,0,0,0,0,0,0,0,0,0,0,0,0,0,0,0,0,1,3,0,0,0,0,0,1,0,0,0
915,DR Congo (Zaire),86,490,2,Government of DR Congo (Zaire) - AFDL,39,0,0,2,04/05/1997,04/08/1997,1,"Zaire peace talks start in South Africa. By Rex Merrifield, 515 words, 5 April 1997, Reuters News. Zaire peace talks in shaky start, rebels advance. By Douglas Hamilton, 567 words, 5 April 1997, Reuters News. Mobutu gives olive branch to rebels as talks start. By Douglas Hamilton, 528 words, 6 April 1997, Reuters News. Zaireans agree need for ceasefire, consult leaders. By Rex Merrifield, 488 words , 8 April 1997, Reuters News",1,2,0,0,"South Africa, UN, AU",560,11024,11000,0,0,0,0,0,0,0,0,0,0,0,0,0,0,0,0,0,3,3,1,1,1,0,0,0,0,0,0
916,DR Congo (Zaire),86,490,2,Government of DR Congo (Zaire) - AFDL,39,0,0,2,04/12/1997,04/12/1997,1,"Mandela sees negotiated end to Zaire civil war. By Anton Ferreira, 539 words, 17 April 1997, Reuters News",1,0,0,0,South Africa,560,0,0,0,0,0,0,0,0,0,0,0,0,0,0,0,0,0,0,0,1,1,3,0,0,0,1,0,0,0,0
917,DR Congo (Zaire),86,490,2,Government of DR Congo (Zaire) - AFDL,39,0,0,2,04/13/1997,04/13/1997,1,"Mandela sees negotiated end to Zaire civil war. By Anton Ferreira, 539 words, 17 April 1997, Reuters News",1,0,0,0,South Africa,560,0,0,0,0,0,0,0,0,0,0,0,0,0,0,0,0,0,0,0,1,1,3,0,0,0,1,0,0,0,0
918,DR Congo (Zaire),86,490,2,Government of DR Congo (Zaire) - AFDL,39,0,0,2,04/14/1997,04/14/1997,1,"Mandela sees negotiated end to Zaire civil war. By Anton Ferreira, 539 words, 17 April 1997, Reuters News",1,0,0,0,South Africa,560,0,0,0,0,0,0,0,0,0,0,0,0,0,0,0,0,0,0,0,1,1,3,0,0,0,1,0,0,0,0
919,DR Congo (Zaire),86,490,2,Government of DR Congo (Zaire) - AFDL,39,0,0,2,04/16/1997,04/16/1997,1,"Mandela opens talks with Zaire's Kabila in S.Africa.171 words, 16 April 1997, Reuters News. Kabila returns to Zaire after S.Africa talks. 221 words , 17 April 1997, Reuters News",1,2,0,0,"South Africa, UN, AU",560,11024,11000,0,0,0,0,0,0,0,0,0,0,0,0,0,0,0,0,0,3,2,3,0,0,0,1,0,0,0,0
920,DR Congo (Zaire),86,490,2,Government of DR Congo (Zaire) - AFDL,39,0,0,2,04/19/1997,04/19/1997,1,"S.Africa sees delay in Zairean peace talks.By Brendan Boyle , 418 words, 21 April 1997, Reuters News",1,0,0,0,South Africa,560,0,0,0,0,0,0,0,0,0,0,0,0,0,0,0,0,0,0,0,1,1,3,0,0,1,0,0,0,0,0
921,DR Congo (Zaire),86,490,2,Government of DR Congo (Zaire) - AFDL,39,0,0,2,04/26/1997,04/26/1997,1,"Zaire rebel leader in Kisangani for refugee talks. By Buchizya Mseteka, 581 words, 26 April 1997, Reuters News. Zaire rebel Kabila returns after refugee crisis. By Buchizya Mseteka , 659 words, 28 April 1997 Reuters News",1,0,0,0,Japan,740,0,0,0,0,0,0,0,0,0,0,0,0,0,0,0,0,0,0,0,1,2,3,0,0,1,0,0,0,0,0
922,DR Congo (Zaire),86,490,2,Government of DR Congo (Zaire) - AFDL,39,0,0,2,04/29/1997,04/29/1997,1,"U.S. envoy visits Mobutu for Zaire crisis talks. 93 words, 29 April 1997 Reuters News. Mobutu refuses to hold Zaire peace talks at sea. By Buchizya Mseteka, 692 words, 29 April 1997, Reuters News. Zaire's Kabila, Mobutu agree to meet, U.S. says. By Buchizya Mseteka, 749 words, 29 April 1997, Reuters News",1,0,0,0,USA,2,0,0,0,0,0,0,0,0,0,0,0,0,0,0,0,0,0,0,0,1,3,2,0,0,1,0,0,0,0,0
923,DR Congo (Zaire),86,490,2,Government of DR Congo (Zaire) - AFDL,39,0,0,2,04/30/1997,04/30/1997,1,"Zaire's Mobutu-Kabila to meet on Friday-U.S. envoy. By Nicholas Kotch, 540 words, 30 April 1997, Reuters News",1,0,0,0,USA,2,0,0,0,0,0,0,0,0,0,0,0,0,0,0,0,0,0,0,0,1,1,3,0,0,1,0,0,0,0,0
924,DR Congo (Zaire),86,490,2,Government of DR Congo (Zaire) - AFDL,39,0,0,2,05/04/1997,05/04/1997,1,"Kabila rule out Zaire ceasefire this week. 222 words , 4 May 1997, Reuters News. Text of communique after Zaire talks.355 words, 5 May 1997, Reuters News",1,0,0,0,South Africa,560,0,0,0,0,0,0,0,0,0,0,0,0,0,0,0,0,0,0,0,1,3,1,1,1,0,0,0,0,0,0
925,DR Congo (Zaire),86,490,2,Government of DR Congo (Zaire) - AFDL,39,0,0,2,05/05/1997,05/05/1997,1,"U.S. envoy in talks with Zaire rebel chief. 147 words, 5 May 1997, Reuters News",1,2,0,0,"USA, UN, AU",2,11024,11000,0,0,0,0,0,0,0,0,0,0,0,0,0,0,0,0,0,3,2,3,0,0,1,0,0,0,0,0
926,DR Congo (Zaire),86,490,2,Government of DR Congo (Zaire) - AFDL,39,0,0,2,05/08/1997,05/08/1997,1,"Mobutu to attend Gabon peace summit. By John Chiahemen, 452 words, 6 May 1997, Reuters News. Gabon mini-summit will discuss future Zaire talks. 185 words, 7 May 1997, Reuters News",6,0,0,0,"Cameroon, Chad, Central African Republic, Congo, Equatorial Guinea, Gabon",471,483,482,484,411,481,0,0,0,0,0,0,0,0,0,0,0,0,0,0,6,1,3,0,0,1,0,0,0,0,0
927,DR Congo (Zaire),86,490,2,Government of DR Congo (Zaire) - AFDL,39,0,0,2,05/09/1997,05/09/1997,1,"Zaire rebel leader gives diplomacy a chance, Mbeki. By Buchizya Mseteka, 488 words, 9 May 1997, Reuters News. Mobutu heads for home, agrees fresh Zaire talks. By Matthew Bunce , 564 words, 10 May 1997, Reuters News",1,0,0,0,South Africa,560,0,0,0,0,0,0,0,0,0,0,0,0,0,0,0,0,0,0,0,1,3,2,0,0,1,0,0,0,0,0
928,DR Congo (Zaire),86,490,2,Government of DR Congo (Zaire) - AFDL,39,0,0,2,05/09/1997,05/09/1997,1,"Zaire rebel leader meets Kenyan president's envoy. 254 words, 9 May 1997, Reuters News",1,0,0,0,Kenya,501,0,0,0,0,0,0,0,0,0,0,0,0,0,0,0,0,0,0,0,1,2,3,0,0,0,1,0,0,0,0
929,DR Congo (Zaire),86,490,2,Government of DR Congo (Zaire) - AFDL,39,0,0,2,05/15/1997,05/15/1997,1,"Zaire's Kabila meets S.Africa's Mandela for talks. 229 words, 15 May 1997, Reuters News",1,0,0,0,South Africa,560,0,0,0,0,0,0,0,0,0,0,0,0,0,0,0,0,0,0,0,1,2,3,0,0,0,1,0,0,0,0
930,DR Congo (Zaire),86,490,2,Government of DR Congo (Zaire) - RCD,40,0,0,2,08/08/1998,08/08/1998,1,S.Africa says still supports embattled Kabila. Aug 7 (Reuters),3,0,0,0,"Zambia, Tanzania, South Africa",551,510,560,0,0,0,0,0,0,0,0,0,0,0,0,0,0,0,0,0,3,1,3,0,0,0,1,0,0,0,0
931,DR Congo (Zaire),86,490,2,Government of DR Congo (Zaire) - RCD,40,0,0,2,08/08/1998,08/19/1998,1,SADC Defense Ministers's Meet over Congo (K) Crisis. August 18 (Xinhua),0,1,0,0,South African Development Community,11019,0,0,0,0,0,0,0,0,0,0,0,0,0,0,0,0,0,0,0,1,0,0,0,0,0,0,0,1,0,0
932,DR Congo (Zaire),86,490,2,Government of DR Congo (Zaire) - RCD,40,0,0,2,08/13/1998,08/13/1998,1,OAU Mission Visits Rwanda for Political Settlement in Dem. Congo. August 13 (Xinhua),0,1,0,0,AU,11000,0,0,0,0,0,0,0,0,0,0,0,0,0,0,0,0,0,0,0,1,1,3,0,0,0,1,0,0,0,0
933,DR Congo (Zaire),86,490,2,Government of DR Congo (Zaire) - RCD,40,0,0,2,08/17/1998,08/17/1998,1,FOCUS-African ministers meet on Congo crisis. Aug 17 (Reuters),1,0,0,0,Zambia,551,0,0,0,0,0,0,0,0,0,0,0,0,0,0,0,0,0,0,0,1,1,3,0,0,0,1,0,0,0,0
934,DR Congo (Zaire),86,490,2,Government of DR Congo (Zaire) - RCD,40,0,0,2,08/17/1998,08/23/1998,1,"OAU, southern Africa differ on Congo truce call. ADDIS ABABA, Aug 27 (Reuters)",0,1,0,0,AU,11000,0,0,0,0,0,0,0,0,0,0,0,0,0,0,0,0,0,0,0,1,0,0,0,0,0,0,0,1,0,0
935,DR Congo (Zaire),86,490,2,Government of DR Congo (Zaire) - RCD,40,0,0,2,08/18/1998,08/18/1998,1,SADC Defense Ministers's Meet over Congo (K) Crisis. August 18 (Xinhua),0,1,0,0,South African Development Community,11019,0,0,0,0,0,0,0,0,0,0,0,0,0,0,0,0,0,0,0,1,1,3,0,0,0,1,0,0,0,0
936,DR Congo (Zaire),86,490,2,Government of DR Congo (Zaire) - RCD,40,0,0,2,08/22/1998,08/23/1998,1,"Congo delegates arrive for Mandela summit. PRETORIA, Aug 22 (Reuters)",1,0,0,0,South Africa,560,0,0,0,0,0,0,0,0,0,0,0,0,0,0,0,0,0,0,0,1,1,3,0,0,0,1,0,0,0,0
937,DR Congo (Zaire),86,490,2,Government of DR Congo (Zaire) - RCD,40,0,0,2,08/23/1998,08/23/1998,1,"Reuters 1998-08-23 ""SADC Urges Immediate Ceasefire in Congo (k). JOHANNESBURG, August 23 (Xinhua)""",0,1,0,0,South African Development Community,11019,0,0,0,0,0,0,0,0,0,0,0,0,0,0,0,0,0,0,0,1,1,3,0,1,0,0,0,0,0,0
938,DR Congo (Zaire),86,490,2,Government of DR Congo (Zaire) - RCD,40,0,0,2,09/02/1998,09/02/1998,1,"Military Allies/Congo War -2: Kabila Condemns Rwanda, Uganda Dow Jones Newswires 02-09-98",2,0,0,0,"Namibia, Angola",565,540,0,0,0,0,0,0,0,0,0,0,0,0,0,0,0,0,0,0,2,1,3,0,0,0,1,0,0,0,0
939,DR Congo (Zaire),86,490,2,Government of DR Congo (Zaire) - RCD,40,0,0,2,09/02/1998,09/02/1998,1,"Military Allies/Congo War -2: Kabila Condemns Rwanda, Uganda Dow Jones Newswires 02-09-99",0,1,0,0,UN,11024,0,0,0,0,0,0,0,0,0,0,0,0,0,0,0,0,0,0,0,1,1,3,0,0,0,1,0,0,0,0
940,DR Congo (Zaire),86,490,2,Government of DR Congo (Zaire) - RCD,40,0,0,2,09/06/1998,09/08/1998,1,"Reuters 8 September FOCUS-Congo rebels - no truce before political pact. VICTORIA FALLS, Zimbabwe, Sept 7 (Reuters)",1,0,0,0,Zambia,551,0,0,0,0,0,0,0,0,0,0,0,0,0,0,0,0,0,0,0,1,3,2,1,1,0,0,0,0,0,0
941,DR Congo (Zaire),86,490,2,Government of DR Congo (Zaire) - RCD,40,0,0,2,09/06/1998,09/08/1998,1,"European Union Tries to Help Resolve DRC Crisis.NAIROBI, September 10 (Xinhua)",0,1,0,0,EC/EU,11010,0,0,0,0,0,0,0,0,0,0,0,0,0,0,0,0,0,0,0,1,1,3,0,0,0,1,0,0,0,0
942,DR Congo (Zaire),86,490,2,Government of DR Congo (Zaire) - RCD,40,0,0,2,09/10/1998,09/12/1998,1,"Congo rebels scorn talks, claim fresh victories. GOMA, Congo, Sept 10 (Reuters)",0,2,0,0,"UN, AU",11024,11000,0,0,0,0,0,0,0,0,0,0,0,0,0,0,0,0,0,0,2,1,3,0,1,1,0,0,0,0,0
943,DR Congo (Zaire),86,490,2,Government of DR Congo (Zaire) - RCD,40,0,0,2,09/10/1998,09/12/1998,1,"Congo rebels scorn talks, claim fresh victories. GOMA, Congo, Sept 10 (Reuters)",1,0,0,0,Zambia,551,0,0,0,0,0,0,0,0,0,0,0,0,0,0,0,0,0,0,0,1,1,3,0,1,1,0,0,0,0,0
944,DR Congo (Zaire),86,490,2,Government of DR Congo (Zaire) - RCD,40,0,0,2,09/13/1998,09/14/1998,1,"SADC summit fails to move Congo forward. GRAND BAIE, Mauritius, Sept 15 (Reuters)",0,1,0,0,South African Development Community,11019,0,0,0,0,0,0,0,0,0,0,0,0,0,0,0,0,0,0,0,1,1,3,0,0,0,1,0,0,0,0
945,DR Congo (Zaire),86,490,2,Government of DR Congo (Zaire) - RCD,40,0,0,2,09/22/1998,09/22/1998,1,"Congo's Kabila in Gabon for talks. LIBREVILLE, Sept 22 (Reuters)",1,0,0,0,Gabon,481,0,0,0,0,0,0,0,0,0,0,0,0,0,0,0,0,0,0,0,1,1,3,0,0,0,1,0,0,0,0
946,DR Congo (Zaire),86,490,2,Government of DR Congo (Zaire) - RCD,40,0,0,2,09/24/1998,09/24/1998,1,"C. African States Meet in Gabon on Congo Crisis.NAIROBI, September 24 (Xinhua)",4,0,0,0,"Gabon, Congo, Central African Republic, Equatorial Guinea",481,484,482,411,0,0,0,0,0,0,0,0,0,0,0,0,0,0,0,0,4,1,3,0,0,0,1,0,0,0,0
947,DR Congo (Zaire),86,490,2,Government of DR Congo (Zaire) - RCD,40,0,0,2,10/06/1998,10/07/1998,1,"Kabila leaves Nigeria without open promise of help. ABUJA, Oct 7 (Reuters)",1,0,0,0,Nigeria,475,0,0,0,0,0,0,0,0,0,0,0,0,0,0,0,0,0,0,0,1,1,3,0,0,0,1,0,0,0,0
948,DR Congo (Zaire),86,490,2,Government of DR Congo (Zaire) - RCD,40,0,0,2,10/11/1998,10/11/1998,1,"Tanzania's Mkapa meets Congo rebel leaders. DAR ES SALAAM, Oct 11 (Reuters)",1,0,0,0,Tanzania,510,0,0,0,0,0,0,0,0,0,0,0,0,0,0,0,0,0,0,0,1,2,3,0,0,0,1,0,0,0,0
949,DR Congo (Zaire),86,490,2,Government of DR Congo (Zaire) - RCD,40,0,0,2,10/17/1998,10/17/1998,1,"Kabila back in Kinshasa after talks in Sudan. KINSHASA, Oct 18 (Reuters)",1,0,0,0,Sudan,625,0,0,0,0,0,0,0,0,0,0,0,0,0,0,0,0,0,0,0,1,1,3,0,0,1,0,0,0,0,0
950,DR Congo (Zaire),86,490,2,Government of DR Congo (Zaire) - RCD,40,0,0,2,10/26/1998,10/28/1998,1,"Salim Urges End of Congo (K) War. LUSAKA, October 26 (Xinhua)",3,2,0,0,"AU, UN, Libya, Gabon, Kenya",11000,11024,620,481,501,0,0,0,0,0,0,0,0,0,0,0,0,0,0,0,5,3,2,0,1,1,0,0,0,0,0
951,DR Congo (Zaire),86,490,2,Government of DR Congo (Zaire) - RCD,40,0,0,2,10/26/1998,10/28/1998,1,"Salim Urges End of Congo (K) War. LUSAKA, October 26 (Xinhua)",1,0,0,0,Zambia,551,0,0,0,0,0,0,0,0,0,0,0,0,0,0,0,0,0,0,0,1,3,0,0,0,0,0,1,0,0,0
952,DR Congo (Zaire),86,490,2,Government of DR Congo (Zaire) - RCD,40,0,0,2,10/28/1998,10/28/1998,1,"Mandela meets rebels, renews Congo peace bid.JOHANNESBURG, Oct 29 (Reuters)",1,0,0,0,South Africa,560,0,0,0,0,0,0,0,0,0,0,0,0,0,0,0,0,0,0,0,1,2,3,0,0,0,1,0,0,0,0
953,DR Congo (Zaire),86,490,2,Government of DR Congo (Zaire) - RCD,40,0,0,2,10/29/1998,10/31/1998,1,"Africa ministers seek Congo truce, arms trade end. YAOUNDE, Oct 31 (Reuters)",7,0,0,0,"Burundi, Cameroon, Central African Republic, Congo, Gabon, Equatorial Guinea, Sao Tome and Principe",516,471,482,484,481,411,403,0,0,0,0,0,0,0,0,0,0,0,0,0,7,1,3,0,0,0,1,0,0,0,0
954,DR Congo (Zaire),86,490,2,Government of DR Congo (Zaire) - RCD,40,0,0,2,10/30/1998,11/02/1998,1,"FOCUS-U.S. team challenged in Congo on war mediation. KINSHASA, Oct 30 (Reuters), Congo allies vow to step up war, US visit fails. KINSHASA, Nov 2 (Reuters)",1,0,0,0,USA,2,0,0,0,0,0,0,0,0,0,0,0,0,0,0,0,0,0,0,0,1,1,3,0,0,0,1,0,0,0,0
955,DR Congo (Zaire),86,490,2,Government of DR Congo (Zaire) - RCD,40,0,0,2,11/02/1998,11/04/1998,1,"Come clean about Congo, EU and SADC tell Rwanda. VIENNA, Nov 4 (Reuters)",0,2,0,0,"EC/EU, South African Development Community",11010,11019,0,0,0,0,0,0,0,0,0,0,0,0,0,0,0,0,0,0,2,1,3,0,1,1,0,0,0,0,0
956,DR Congo (Zaire),86,490,2,Government of DR Congo (Zaire) - RCD,40,0,0,2,11/02/1998,11/04/1998,1,"Come clean about Congo, EU and SADC tell Rwanda. VIENNA, Nov 4 (Reuters)",1,0,0,0,Australia,900,0,0,0,0,0,0,0,0,0,0,0,0,0,0,0,0,0,0,0,1,1,0,0,0,0,0,1,0,0,0
957,DR Congo (Zaire),86,490,2,Government of DR Congo (Zaire) - RCD,40,0,0,2,11/06/1998,11/06/1998,1,"Congo's Church urges Kabila to talk with opponents.KINSHASA, Nov 7 (Reuters)",0,0,1,1,"Christian representatives (catholics, lutherans, russian orthodox etc.)",12007,0,0,0,0,0,0,0,0,0,0,0,0,0,0,0,0,0,0,0,1,1,3,0,0,0,1,0,0,0,0
958,DR Congo (Zaire),86,490,2,Government of DR Congo (Zaire) - RCD,40,0,0,2,11/20/1998,11/20/1998,1,"FOCUS-Congo peace talks to resume in Botswana.GABORONE, Nov 19 (Reuters)",5,2,0,0,"AU, UN, Botswana, Zambia, Mozambique, Tanzania, South Africa",11000,11024,571,551,541,510,560,0,0,0,0,0,0,0,0,0,0,0,0,0,7,2,3,0,1,0,0,0,0,0,0
959,DR Congo (Zaire),86,490,2,Government of DR Congo (Zaire) - RCD,40,0,0,2,11/22/1998,11/27/1998,1,"Italy to explore Congo talks with Kabila-diplomats. KINSHASA, Nov 16 (Reuters)",1,0,0,0,Italy,325,0,0,0,0,0,0,0,0,0,0,0,0,0,0,0,0,0,0,0,1,1,3,0,0,0,1,0,0,0,0
960,DR Congo (Zaire),86,490,2,Government of DR Congo (Zaire) - MLC,41,0,0,1,11/22/1998,11/27/1998,1,"Italy to explore Congo talks with Kabila-diplomats. KINSHASA, Nov 16 (Reuters)",1,0,0,0,Italy,325,0,0,0,0,0,0,0,0,0,0,0,0,0,0,0,0,0,0,0,1,1,3,0,0,0,1,0,0,0,0
961,DR Congo (Zaire),86,490,2,Government of DR Congo (Zaire) - RCD,40,0,0,2,11/24/1998,11/24/1998,1,"FOCUS - Dialogue must end Congo war, Pope tells Kabila. VATICAN CITY, Nov 24 (Reuters)",0,0,1,0,Vatican,12029,0,0,0,0,0,0,0,0,0,0,0,0,0,0,0,0,0,0,0,1,1,3,0,1,1,0,0,0,0,0
962,DR Congo (Zaire),86,490,2,Government of DR Congo (Zaire) - MLC,41,0,0,1,11/24/1998,11/24/1998,1,"FOCUS - Dialogue must end Congo war, Pope tells Kabila. VATICAN CITY, Nov 24 (Reuters)",0,0,1,0,Vatican,12029,0,0,0,0,0,0,0,0,0,0,0,0,0,0,0,0,0,0,0,1,1,3,0,1,1,0,0,0,0,0
963,DR Congo (Zaire),86,490,2,Government of DR Congo (Zaire) - RCD,40,0,0,2,11/26/1998,11/26/1998,1,Kabila says Congo falsely accused of genocide. Nov 26 (Reuters),1,0,0,0,Belgium,211,0,0,0,0,0,0,0,0,0,0,0,0,0,0,0,0,0,0,0,1,1,3,0,0,1,0,0,0,0,0
964,DR Congo (Zaire),86,490,2,Government of DR Congo (Zaire) - MLC,41,0,0,1,11/26/1998,11/26/1998,1,Kabila says Congo falsely accused of genocide. Nov 26 (Reuters),1,0,0,0,Belgium,211,0,0,0,0,0,0,0,0,0,0,0,0,0,0,0,0,0,0,0,1,1,3,0,0,1,0,0,0,0,0
965,DR Congo (Zaire),86,490,2,Government of DR Congo (Zaire) - RCD,40,0,0,2,11/27/1998,11/28/1998,1,"France hopes for ceasefire in Congo next month. PARIS, Nov 27 (Reuters), Ceasefire agreed in Congo war. PARIS, Nov 28 (Reuters)",1,2,0,0,"France, AU, UN",220,11000,11024,0,0,0,0,0,0,0,0,0,0,0,0,0,0,0,0,0,3,1,3,0,1,0,0,0,0,0,0
966,DR Congo (Zaire),86,490,2,Government of DR Congo (Zaire) - MLC,41,0,0,1,11/27/1998,11/28/1998,1,"France hopes for ceasefire in Congo next month. PARIS, Nov 27 (Reuters), Ceasefire agreed in Congo war. PARIS, Nov 28 (Reuters)",1,2,0,0,"France, AU, UN",220,11000,11024,0,0,0,0,0,0,0,0,0,0,0,0,0,0,0,0,0,3,1,3,0,1,0,0,0,0,0,0
967,DR Congo (Zaire),86,490,2,Government of DR Congo (Zaire) - RCD,40,0,0,2,11/30/1998,11/30/1998,1,"FOCUS-Kabila back home, links truce to withdrawal. KINSHASA, Nov 30 (Reuters)",2,0,0,0,"Libya, Gambia",620,420,0,0,0,0,0,0,0,0,0,0,0,0,0,0,0,0,0,0,2,1,3,0,0,0,1,0,0,0,0
968,DR Congo (Zaire),86,490,2,Government of DR Congo (Zaire) - MLC,41,0,0,1,11/30/1998,11/30/1998,1,"FOCUS-Kabila back home, links truce to withdrawal. KINSHASA, Nov 30 (Reuters)",2,0,0,0,"Libya, Gambia",620,420,0,0,0,0,0,0,0,0,0,0,0,0,0,0,0,0,0,0,2,1,3,0,0,0,1,0,0,0,0
969,DR Congo (Zaire),86,490,2,Government of DR Congo (Zaire) - RCD,40,0,0,2,12/09/1998,12/09/1998,1,"Congo's Kabila ready to talk, but not to rebels.Dec 9 (Reuters)",0,1,0,0,South African Development Community,11019,0,0,0,0,0,0,0,0,0,0,0,0,0,0,0,0,0,0,0,1,1,3,0,0,1,0,0,0,0,0
970,DR Congo (Zaire),86,490,2,Government of DR Congo (Zaire) - RCD,40,0,0,2,12/09/1998,12/09/1998,1,"Congo's Kabila ready to talk, but not to rebels.Dec 9 (Reuters)",1,0,0,0,Zambia,551,0,0,0,0,0,0,0,0,0,0,0,0,0,0,0,0,0,0,0,1,1,3,0,0,1,0,0,0,0,0
971,DR Congo (Zaire),86,490,2,Government of DR Congo (Zaire) - MLC,41,0,0,1,12/09/1998,12/09/1998,1,"Congo's Kabila ready to talk, but not to rebels.Dec 9 (Reuters)",0,1,0,0,South African Development Community,11019,0,0,0,0,0,0,0,0,0,0,0,0,0,0,0,0,0,0,0,1,1,3,0,0,1,0,0,0,0,0
972,DR Congo (Zaire),86,490,2,Government of DR Congo (Zaire) - MLC,41,0,0,1,12/09/1998,12/09/1998,1,"Congo's Kabila ready to talk, but not to rebels.Dec 9 (Reuters)",1,0,0,0,Zambia,551,0,0,0,0,0,0,0,0,0,0,0,0,0,0,0,0,0,0,0,1,1,3,0,0,1,0,0,0,0,0
973,DR Congo (Zaire),86,490,2,Government of DR Congo (Zaire) - RCD,40,0,0,2,12/10/1998,12/10/1998,1,Kabila Ends Visit to Kenya.December 10 (Xinhua),1,0,0,0,Kenya,501,0,0,0,0,0,0,0,0,0,0,0,0,0,0,0,0,0,0,0,1,1,3,0,1,1,0,0,0,0,0
974,DR Congo (Zaire),86,490,2,Government of DR Congo (Zaire) - MLC,41,0,0,1,12/10/1998,12/10/1998,1,Kabila Ends Visit to Kenya.December 10 (Xinhua),1,0,0,0,Kenya,501,0,0,0,0,0,0,0,0,0,0,0,0,0,0,0,0,0,0,0,1,1,3,0,1,1,0,0,0,0,0
975,DR Congo (Zaire),86,490,2,Government of DR Congo (Zaire) - RCD,40,0,0,2,12/12/1998,12/14/1998,1,Mubarak holds talks with Congo's Kabila. Dec 13 (Reuters),1,0,0,0,Egypt,651,0,0,0,0,0,0,0,0,0,0,0,0,0,0,0,0,0,0,0,1,1,3,0,0,1,0,0,0,0,0
976,DR Congo (Zaire),86,490,2,Government of DR Congo (Zaire) - MLC,41,0,0,1,12/12/1998,12/14/1998,1,Mubarak holds talks with Congo's Kabila. Dec 13 (Reuters),1,0,0,0,Egypt,651,0,0,0,0,0,0,0,0,0,0,0,0,0,0,0,0,0,0,0,1,1,3,0,0,1,0,0,0,0,0
977,DR Congo (Zaire),86,490,2,Government of DR Congo (Zaire) - MLC,41,0,0,1,12/12/1998,12/14/1998,1,Mubarak holds talks with Congo's Kabila. Dec 13 (Reuters),1,0,0,0,Egypt,651,0,0,0,0,0,0,0,0,0,0,0,0,0,0,0,0,0,0,0,1,1,3,0,0,1,0,0,0,0,0
978,DR Congo (Zaire),86,490,2,Government of DR Congo (Zaire) - RCD,40,0,0,2,12/18/1998,12/18/1998,1,Democratic Congo peace talks set for Lusaka Dec 28.  Dec 18 (Reuters),0,1,0,0,AU,11000,0,0,0,0,0,0,0,0,0,0,0,0,0,0,0,0,0,0,0,1,1,3,0,1,1,0,0,0,0,0
979,DR Congo (Zaire),86,490,2,Government of DR Congo (Zaire) - RCD,40,0,0,2,12/18/1998,12/18/1998,1,Democratic Congo peace talks set for Lusaka Dec 28.  Dec 18 (Reuters),0,1,0,0,AU,11000,0,0,0,0,0,0,0,0,0,0,0,0,0,0,0,0,0,0,0,1,2,3,0,1,1,0,0,0,0,0
980,DR Congo (Zaire),86,490,2,Government of DR Congo (Zaire) - RCD,40,0,0,2,12/18/1998,12/18/1998,1,Democratic Congo peace talks set for Lusaka Dec 28.  Dec 18 (Reuters),1,0,0,0,Burkina Faso,439,0,0,0,0,0,0,0,0,0,0,0,0,0,0,0,0,0,0,0,1,3,0,0,0,0,0,1,0,0,0
981,DR Congo (Zaire),86,490,2,Government of DR Congo (Zaire) - RCD,40,0,0,2,12/21/1998,12/21/1998,1,Congo rebels in talks with Libyan leader Gaddafi. Dec 21 (Reuters),1,0,0,0,Libya,620,0,0,0,0,0,0,0,0,0,0,0,0,0,0,0,0,0,0,0,1,2,3,0,0,0,1,0,0,0,0
982,DR Congo (Zaire),86,490,2,Government of DR Congo (Zaire) - RCD,40,1,0,2,01/16/1999,01/16/1999,1,"FOCUS-Congo peace efforts end in failure. Lusaka, Jan 16 (Reuters)",3,1,0,0,"South African Development Community, Kenya, Libya, Gabon",11019,501,620,481,0,0,0,0,0,0,0,0,0,0,0,0,0,0,0,0,4,1,3,0,0,0,1,0,0,0,0
983,DR Congo (Zaire),86,490,2,Government of DR Congo (Zaire) - RCD,40,1,0,2,01/16/1999,01/16/1999,1,"FOCUS-Congo peace efforts end in failure. Lusaka, Jan 16 (Reuters)",1,0,0,0,Zambia,551,0,0,0,0,0,0,0,0,0,0,0,0,0,0,0,0,0,0,0,1,1,0,0,0,0,0,1,0,0,0
984,DR Congo (Zaire),86,490,2,Government of DR Congo (Zaire) - MLC,41,1,0,2,01/16/1999,01/16/1999,1,"FOCUS-Congo peace efforts end in failure. Lusaka, Jan 16 (Reuters)",3,1,0,0,"South African Development Community, Kenya, Libya, Gabon",11019,501,620,481,0,0,0,0,0,0,0,0,0,0,0,0,0,0,0,0,4,1,3,0,0,0,1,0,0,0,0
985,DR Congo (Zaire),86,490,2,Government of DR Congo (Zaire) - MLC,41,1,0,2,01/16/1999,01/16/1999,1,"FOCUS-Congo peace efforts end in failure. Lusaka, Jan 16 (Reuters)",1,0,0,0,Zambia,551,0,0,0,0,0,0,0,0,0,0,0,0,0,0,0,0,0,0,0,1,1,0,0,0,0,0,1,0,0,0
986,,,490,0,,42,1,0,0,01/16/1999,01/16/1999,1,"FOCUS-Congo peace efforts end in failure. Lusaka, Jan 16 (Reuters)",3,1,0,0,"South African Development Community, Kenya, Libya, Gabon",11019,501,620,481,0,0,0,0,0,0,0,0,0,0,0,0,0,0,0,0,4,1,3,0,0,0,1,0,0,0,0
987,,,490,0,,42,1,0,0,01/16/1999,01/16/1999,1,"FOCUS-Congo peace efforts end in failure. Lusaka, Jan 16 (Reuters)",1,0,0,0,Zambia,551,0,0,0,0,0,0,0,0,0,0,0,0,0,0,0,0,0,0,0,1,1,0,0,0,0,0,1,0,0,0
988,DR Congo (Zaire),86,490,2,Government of DR Congo (Zaire) - RCD,40,1,0,2,02/02/1999,02/02/1999,1,"Fresh Kabila offer to meet rebels in Kinshasa.KINSHASA, Feb 2 (Reuters)",0,1,0,0,South African Development Community,11019,0,0,0,0,0,0,0,0,0,0,0,0,0,0,0,0,0,0,0,1,1,3,0,1,1,0,0,0,0,0
989,DR Congo (Zaire),86,490,2,Government of DR Congo (Zaire) - MLC,41,1,0,2,02/02/1999,02/02/1999,1,"Fresh Kabila offer to meet rebels in Kinshasa.KINSHASA, Feb 2 (Reuters)",0,1,0,0,South African Development Community,11019,0,0,0,0,0,0,0,0,0,0,0,0,0,0,0,0,0,0,0,1,1,3,0,1,1,0,0,0,0,0
990,,,490,0,,42,1,0,0,02/02/1999,02/02/1999,1,"Fresh Kabila offer to meet rebels in Kinshasa.KINSHASA, Feb 2 (Reuters)",0,1,0,0,South African Development Community,11019,0,0,0,0,0,0,0,0,0,0,0,0,0,0,0,0,0,0,0,1,1,3,0,1,1,0,0,0,0,0
991,DR Congo (Zaire),86,490,2,Government of DR Congo (Zaire) - RCD,40,1,0,2,02/03/1999,02/04/1999,1,"African officials talk Congo truce, border security. JOHANNESBURG, Feb 3 (Reuters)",0,2,0,0,"AU, South African Development Community",11000,11019,0,0,0,0,0,0,0,0,0,0,0,0,0,0,0,0,0,0,2,1,3,0,1,0,0,0,0,0,0
992,DR Congo (Zaire),86,490,2,Government of DR Congo (Zaire) - RCD,40,1,0,2,02/03/1999,02/04/1999,1,"African officials talk Congo truce, border security. JOHANNESBURG, Feb 3 (Reuters)",1,0,0,0,Zambia,551,0,0,0,0,0,0,0,0,0,0,0,0,0,0,0,0,0,0,0,1,1,0,0,0,0,0,1,0,0,0
993,DR Congo (Zaire),86,490,2,Government of DR Congo (Zaire) - MLC,41,1,0,2,02/03/1999,02/04/1999,1,"African officials talk Congo truce, border security. JOHANNESBURG, Feb 3 (Reuters)",0,2,0,0,"AU, South African Development Community",11000,11019,0,0,0,0,0,0,0,0,0,0,0,0,0,0,0,0,0,0,2,1,3,0,1,0,0,0,0,0,0
994,DR Congo (Zaire),86,490,2,Government of DR Congo (Zaire) - MLC,41,1,0,2,02/03/1999,02/04/1999,1,"African officials talk Congo truce, border security. JOHANNESBURG, Feb 3 (Reuters)",1,0,0,0,Zambia,551,0,0,0,0,0,0,0,0,0,0,0,0,0,0,0,0,0,0,0,1,1,0,0,0,0,0,1,0,0,0
995,,,490,0,,42,1,0,0,02/03/1999,02/04/1999,1,"African officials talk Congo truce, border security. JOHANNESBURG, Feb 3 (Reuters)",0,2,0,0,"AU, South African Development Community",11000,11019,0,0,0,0,0,0,0,0,0,0,0,0,0,0,0,0,0,0,2,1,3,0,1,0,0,0,0,0,0
996,,,490,0,,42,1,0,0,02/03/1999,02/04/1999,1,"African officials talk Congo truce, border security. JOHANNESBURG, Feb 3 (Reuters)",1,0,0,0,Zambia,551,0,0,0,0,0,0,0,0,0,0,0,0,0,0,0,0,0,0,0,1,1,0,0,0,0,0,1,0,0,0
997,DR Congo (Zaire),86,490,2,Government of DR Congo (Zaire) - RCD,40,1,0,2,02/23/1999,02/23/1999,1,"Mozambican president, UK minister visit Kabila. KINSHASA, Feb 23 (Reuters)",1,0,0,0,UK,200,0,0,0,0,0,0,0,0,0,0,0,0,0,0,0,0,0,0,0,1,1,3,0,1,1,0,0,0,0,0
998,DR Congo (Zaire),86,490,2,Government of DR Congo (Zaire) - RCD,40,1,0,2,02/23/1999,02/23/1999,1,"Mozambican president, UK minister visit Kabila. KINSHASA, Feb 23 (Reuters)",1,0,0,0,Mozambique,541,0,0,0,0,0,0,0,0,0,0,0,0,0,0,0,0,0,0,0,1,1,3,0,0,0,1,0,0,0,0
999,DR Congo (Zaire),86,490,2,Government of DR Congo (Zaire) - MLC,41,1,0,2,02/23/1999,02/23/1999,1,"Mozambican president, UK minister visit Kabila. KINSHASA, Feb 23 (Reuters)",1,0,0,0,UK,200,0,0,0,0,0,0,0,0,0,0,0,0,0,0,0,0,0,0,0,1,1,3,0,1,1,0,0,0,0,0
1000,DR Congo (Zaire),86,490,2,Government of DR Congo (Zaire) - MLC,41,1,0,2,02/23/1999,02/23/1999,1,"Mozambican president, UK minister visit Kabila. KINSHASA, Feb 23 (Reuters)",1,0,0,0,Mozambique,541,0,0,0,0,0,0,0,0,0,0,0,0,0,0,0,0,0,0,0,1,1,3,0,0,0,1,0,0,0,0
1001,,,490,0,,42,1,0,0,02/23/1999,02/23/1999,1,"Mozambican president, UK minister visit Kabila. KINSHASA, Feb 23 (Reuters)",1,0,0,0,UK,200,0,0,0,0,0,0,0,0,0,0,0,0,0,0,0,0,0,0,0,1,1,3,0,1,1,0,0,0,0,0
1002,,,490,0,,42,1,0,0,02/23/1999,02/23/1999,1,"Mozambican president, UK minister visit Kabila. KINSHASA, Feb 23 (Reuters)",1,0,0,0,Mozambique,541,0,0,0,0,0,0,0,0,0,0,0,0,0,0,0,0,0,0,0,1,1,3,0,0,0,1,0,0,0,0
1003,DR Congo (Zaire),86,490,2,Government of DR Congo (Zaire) - RCD,40,1,0,2,02/25/1999,02/25/1999,1,"African states call for Democratic Congo ceasefire.YAOUNDE, Feb 26 (Reuters)",6,0,0,0,"Central African Republic, Congo, Sao Tome and Principe, Cameroon, Gabon, Equatorial Guinea",482,484,403,471,481,411,0,0,0,0,0,0,0,0,0,0,0,0,0,0,6,1,3,0,1,0,0,0,0,0,0
1004,DR Congo (Zaire),86,490,2,Government of DR Congo (Zaire) - MLC,41,1,0,2,02/25/1999,02/25/1999,1,"African states call for Democratic Congo ceasefire.YAOUNDE, Feb 26 (Reuters)",6,0,0,0,"Central African Republic, Congo, Sao Tome and Principe, Cameroon, Gabon, Equatorial Guinea",482,484,403,471,481,411,0,0,0,0,0,0,0,0,0,0,0,0,0,0,6,1,3,0,1,0,0,0,0,0,0
1005,,,490,0,,42,1,0,0,02/25/1999,02/25/1999,1,"African states call for Democratic Congo ceasefire.YAOUNDE, Feb 26 (Reuters)",6,0,0,0,"Central African Republic, Congo, Sao Tome and Principe, Cameroon, Gabon, Equatorial Guinea",482,484,403,471,481,411,0,0,0,0,0,0,0,0,0,0,0,0,0,0,6,1,3,0,1,0,0,0,0,0,0
1006,DR Congo (Zaire),86,490,2,Government of DR Congo (Zaire) - RCD,40,1,0,2,03/05/1999,03/05/1999,1,"Kabila in Zambia for Talks With Chiluba. LUSAKA, March 5 (xinhua)",0,1,0,0,South African Development Community,11019,0,0,0,0,0,0,0,0,0,0,0,0,0,0,0,0,0,0,0,1,1,3,0,0,0,1,0,0,0,0
1007,DR Congo (Zaire),86,490,2,Government of DR Congo (Zaire) - RCD,40,1,0,2,03/05/1999,03/05/1999,1,"Kabila in Zambia for Talks With Chiluba. LUSAKA, March 5 (xinhua)",1,0,0,0,Zambia,551,0,0,0,0,0,0,0,0,0,0,0,0,0,0,0,0,0,0,0,1,1,0,0,0,0,0,1,0,0,0
1008,DR Congo (Zaire),86,490,2,Government of DR Congo (Zaire) - MLC,41,1,0,2,03/05/1999,03/05/1999,1,"Kabila in Zambia for Talks With Chiluba. LUSAKA, March 5 (xinhua)",0,1,0,0,South African Development Community,11019,0,0,0,0,0,0,0,0,0,0,0,0,0,0,0,0,0,0,0,1,1,3,0,0,0,1,0,0,0,0
1009,DR Congo (Zaire),86,490,2,Government of DR Congo (Zaire) - MLC,41,1,0,2,03/05/1999,03/05/1999,1,"Kabila in Zambia for Talks With Chiluba. LUSAKA, March 5 (xinhua)",1,0,0,0,Zambia,551,0,0,0,0,0,0,0,0,0,0,0,0,0,0,0,0,0,0,0,1,1,0,0,0,0,0,1,0,0,0
1010,,,490,0,,42,1,0,0,03/05/1999,03/05/1999,1,"Kabila in Zambia for Talks With Chiluba. LUSAKA, March 5 (xinhua)",0,1,0,0,South African Development Community,11019,0,0,0,0,0,0,0,0,0,0,0,0,0,0,0,0,0,0,0,1,1,3,0,0,0,1,0,0,0,0
1011,,,490,0,,42,1,0,0,03/05/1999,03/05/1999,1,"Kabila in Zambia for Talks With Chiluba. LUSAKA, March 5 (xinhua)",1,0,0,0,Zambia,551,0,0,0,0,0,0,0,0,0,0,0,0,0,0,0,0,0,0,0,1,1,0,0,0,0,0,1,0,0,0
1012,DR Congo (Zaire),86,490,2,Government of DR Congo (Zaire) - RCD,40,1,0,2,03/23/1999,03/23/1999,1,"Kabila to Allow Rebels to Attend Peace Talks. LUSAKA, March 23 (Xinhua)",0,1,0,0,South African Development Community,11019,0,0,0,0,0,0,0,0,0,0,0,0,0,0,0,0,0,0,0,1,1,3,0,0,1,0,0,0,0,0
1013,DR Congo (Zaire),86,490,2,Government of DR Congo (Zaire) - MLC,41,1,0,2,03/23/1999,03/23/1999,1,"Kabila to Allow Rebels to Attend Peace Talks. LUSAKA, March 23 (Xinhua)",0,1,0,0,South African Development Community,11019,0,0,0,0,0,0,0,0,0,0,0,0,0,0,0,0,0,0,0,1,1,3,0,0,1,0,0,0,0,0
1014,,,490,0,,42,1,0,0,03/23/1999,03/23/1999,1,"Kabila to Allow Rebels to Attend Peace Talks. LUSAKA, March 23 (Xinhua)",0,1,0,0,South African Development Community,11019,0,0,0,0,0,0,0,0,0,0,0,0,0,0,0,0,0,0,0,1,1,3,0,0,1,0,0,0,0,0
1015,DR Congo (Zaire),86,490,2,Government of DR Congo (Zaire) - RCD,40,1,0,2,03/30/1999,03/30/1999,1,"Kabila's Congo seeks Togolese mediation.LOME, March 30 (Reuters)",1,0,0,0,Togo,461,0,0,0,0,0,0,0,0,0,0,0,0,0,0,0,0,0,0,0,1,1,3,0,0,1,0,0,0,0,0
1016,DR Congo (Zaire),86,490,2,Government of DR Congo (Zaire) - MLC,41,1,0,2,03/30/1999,03/30/1999,1,"Kabila's Congo seeks Togolese mediation.LOME, March 30 (Reuters)",1,0,0,0,Togo,461,0,0,0,0,0,0,0,0,0,0,0,0,0,0,0,0,0,0,0,1,1,3,0,0,1,0,0,0,0,0
1017,,,490,0,,42,1,0,0,03/30/1999,03/30/1999,1,"Kabila's Congo seeks Togolese mediation.LOME, March 30 (Reuters)",1,0,0,0,Togo,461,0,0,0,0,0,0,0,0,0,0,0,0,0,0,0,0,0,0,0,1,1,3,0,0,1,0,0,0,0,0
1018,DR Congo (Zaire),86,490,2,Government of DR Congo (Zaire) - RCD,40,1,0,2,04/15/1999,04/17/1999,1,"UN envoy leaves Kinshasa for Congo talks in Lusaka. KINSHASA, April 17 (Reuters)",0,1,0,0,UN,11024,0,0,0,0,0,0,0,0,0,0,0,0,0,0,0,0,0,0,0,1,1,3,0,0,0,1,0,0,0,0
1019,DR Congo (Zaire),86,490,2,Government of DR Congo (Zaire) - MLC,41,1,0,2,04/15/1999,04/17/1999,1,"UN envoy leaves Kinshasa for Congo talks in Lusaka. KINSHASA, April 17 (Reuters)",0,1,0,0,UN,11024,0,0,0,0,0,0,0,0,0,0,0,0,0,0,0,0,0,0,0,1,1,3,0,0,0,1,0,0,0,0
1020,,,490,0,,42,1,0,0,04/15/1999,04/17/1999,1,"UN envoy leaves Kinshasa for Congo talks in Lusaka. KINSHASA, April 17 (Reuters)",0,1,0,0,UN,11024,0,0,0,0,0,0,0,0,0,0,0,0,0,0,0,0,0,0,0,1,1,3,0,0,0,1,0,0,0,0
1021,DR Congo (Zaire),86,490,2,Government of DR Congo (Zaire) - RCD,40,1,0,2,04/16/1999,04/16/1999,1,"Congo combatants in Zambia for talks. LUSAKA, April 16 (Reuters)",1,0,0,0,Zambia,551,0,0,0,0,0,0,0,0,0,0,0,0,0,0,0,0,0,0,0,1,2,3,0,0,0,1,0,0,0,0
1022,DR Congo (Zaire),86,490,2,Government of DR Congo (Zaire) - MLC,41,1,0,2,04/16/1999,04/16/1999,1,"Congo combatants in Zambia for talks. LUSAKA, April 16 (Reuters)",1,0,0,0,Zambia,551,0,0,0,0,0,0,0,0,0,0,0,0,0,0,0,0,0,0,0,1,2,3,0,0,0,1,0,0,0,0
1023,,,490,0,,42,1,0,0,04/16/1999,04/16/1999,1,"Congo combatants in Zambia for talks. LUSAKA, April 16 (Reuters)",1,0,0,0,Zambia,551,0,0,0,0,0,0,0,0,0,0,0,0,0,0,0,0,0,0,0,1,2,3,0,0,0,1,0,0,0,0
1024,DR Congo (Zaire),86,490,2,Government of DR Congo (Zaire) - MLC,41,0,0,2,04/18/1999,04/19/1999,1,Kabila says accord on Congo conflict signed. April 19 (Reuters),2,0,0,0,"Libya, Eritrea",620,531,0,0,0,0,0,0,0,0,0,0,0,0,0,0,0,0,0,0,2,1,3,0,1,1,0,0,0,0,0
1025,,,490,0,,42,0,0,0,04/18/1999,04/19/1999,1,Kabila says accord on Congo conflict signed. April 19 (Reuters),2,0,0,0,"Libya, Eritrea",620,531,0,0,0,0,0,0,0,0,0,0,0,0,0,0,0,0,0,0,2,1,3,0,1,1,0,0,0,0,0
1026,DR Congo (Zaire),86,490,2,Government of DR Congo (Zaire) - RCD,40,1,0,2,05/08/1999,05/08/1999,1,"Angola Supports Sirte Peace Deal on DRC, Libyan Official. May 10 (Xinhua)",2,0,1,0,"Libya, Central African Republic, Julius Nyerere",620,482,12019,0,0,0,0,0,0,0,0,0,0,0,0,0,0,0,0,0,3,1,3,0,0,1,0,0,0,0,0
1027,DR Congo (Zaire),86,490,2,Government of DR Congo (Zaire) - MLC,41,1,0,2,05/08/1999,05/08/1999,1,"Angola Supports Sirte Peace Deal on DRC, Libyan Official. May 10 (Xinhua)",2,0,1,0,"Libya, Central African Republic, Julius Nyerere",620,482,12019,0,0,0,0,0,0,0,0,0,0,0,0,0,0,0,0,0,3,1,3,0,0,1,0,0,0,0,0
1028,,,490,0,,42,1,0,0,05/08/1999,05/08/1999,1,"Angola Supports Sirte Peace Deal on DRC, Libyan Official. May 10 (Xinhua)",2,0,1,0,"Libya, Central African Republic, Julius Nyerere",620,482,12019,0,0,0,0,0,0,0,0,0,0,0,0,0,0,0,0,0,3,1,3,0,0,1,0,0,0,0,0
1029,DR Congo (Zaire),86,490,2,Government of DR Congo (Zaire) - RCD,40,1,0,2,05/12/1999,05/12/1999,1,Consensus building up among the stakeholders of the Democratic Republic of Congo / Zaire (DRC). May 13 (Xinhua),0,1,0,0,South African Development Community,11019,0,0,0,0,0,0,0,0,0,0,0,0,0,0,0,0,0,0,0,1,1,3,0,0,0,1,0,0,0,0
1030,DR Congo (Zaire),86,490,2,Government of DR Congo (Zaire) - MLC,41,1,0,2,05/12/1999,05/12/1999,1,Consensus building up among the stakeholders of the Democratic Republic of Congo / Zaire (DRC). May 13 (Xinhua),0,1,0,0,South African Development Community,11019,0,0,0,0,0,0,0,0,0,0,0,0,0,0,0,0,0,0,0,1,1,3,0,0,0,1,0,0,0,0
1031,,,490,0,,42,1,0,0,05/12/1999,05/12/1999,1,Consensus building up among the stakeholders of the Democratic Republic of Congo / Zaire (DRC). May 13 (Xinhua),0,1,0,0,South African Development Community,11019,0,0,0,0,0,0,0,0,0,0,0,0,0,0,0,0,0,0,0,1,1,3,0,0,0,1,0,0,0,0
1032,DR Congo (Zaire),86,490,2,Government of DR Congo (Zaire) - RCD,40,1,0,2,05/15/1999,05/15/1999,1,Six African leaders in Libya for Congo talks. May 15 (Reuters),4,2,1,0,"Libya, Central African Republic, Eritrea, Gambia, AU, UN, Julius Nyerere",620,482,531,420,11000,11024,12019,0,0,0,0,0,0,0,0,0,0,0,0,0,7,1,3,0,1,1,0,0,0,0,0
1033,DR Congo (Zaire),86,490,2,Government of DR Congo (Zaire) - MLC,41,1,0,2,05/15/1999,05/15/1999,1,Six African leaders in Libya for Congo talks. May 15 (Reuters),4,2,1,0,"Libya, Central African Republic, Eritrea, Gambia, AU, UN, Julius Nyerere",620,482,531,420,11000,11024,12019,0,0,0,0,0,0,0,0,0,0,0,0,0,7,1,3,0,1,1,0,0,0,0,0
1034,,,490,0,,42,1,0,0,05/15/1999,05/15/1999,1,Six African leaders in Libya for Congo talks. May 15 (Reuters),4,2,1,0,"Libya, Central African Republic, Eritrea, Gambia, AU, UN, Julius Nyerere",620,482,531,420,11000,11024,12019,0,0,0,0,0,0,0,0,0,0,0,0,0,7,1,3,0,1,1,0,0,0,0,0
1035,DR Congo (Zaire),86,490,2,Government of DR Congo (Zaire) - RCD,40,1,0,2,06/14/1999,06/14/1999,1,Kinshasa holds pre-summit talks on Congo conflict. June 14 (Reuters),0,1,0,0,South African Development Community,11019,0,0,0,0,0,0,0,0,0,0,0,0,0,0,0,0,0,0,0,1,1,3,0,0,1,0,0,0,0,0
1036,DR Congo (Zaire),86,490,2,Government of DR Congo (Zaire) - RCD,40,1,0,2,06/14/1999,06/14/1999,1,Kinshasa holds pre-summit talks on Congo conflict. June 14 (Reuters),0,1,0,0,South African Development Community,11019,0,0,0,0,0,0,0,0,0,0,0,0,0,0,0,0,0,0,0,1,1,3,0,0,1,0,0,0,0,0
1037,DR Congo (Zaire),86,490,2,Government of DR Congo (Zaire) - MLC,41,1,0,2,06/14/1999,06/14/1999,1,Kinshasa holds pre-summit talks on Congo conflict. June 14 (Reuters),0,1,0,0,South African Development Community,11019,0,0,0,0,0,0,0,0,0,0,0,0,0,0,0,0,0,0,0,1,1,3,0,0,1,0,0,0,0,0
1038,,,490,0,,42,1,0,0,06/14/1999,06/14/1999,1,Kinshasa holds pre-summit talks on Congo conflict. June 14 (Reuters),0,1,0,0,South African Development Community,11019,0,0,0,0,0,0,0,0,0,0,0,0,0,0,0,0,0,0,0,1,1,3,0,0,1,0,0,0,0,0
1039,,,490,0,,42,1,0,0,06/14/1999,06/14/1999,1,Kinshasa holds pre-summit talks on Congo conflict. June 14 (Reuters),0,1,0,0,South African Development Community,11019,0,0,0,0,0,0,0,0,0,0,0,0,0,0,0,0,0,0,0,1,1,3,0,0,1,0,0,0,0,0
1040,DR Congo (Zaire),86,490,2,Government of DR Congo (Zaire) - RCD,40,0,0,2,06/24/1999,06/28/1999,1,FOCUS-Rebel split threatens to derail Congo peace.  June 26 (Reuters) FOCUS-Draft deal puts Congo talks back on track. June 27 (Reuters),0,3,0,0,"South African Development Community, AU, UN",11019,11000,11024,0,0,0,0,0,0,0,0,0,0,0,0,0,0,0,0,0,3,3,2,0,1,1,0,0,0,0,0
1041,DR Congo (Zaire),86,490,2,Government of DR Congo (Zaire) - RCD,40,0,0,2,06/24/1999,07/10/1999,1,FOCUS-Rebel split threatens to derail Congo peace.  June 26 (Reuters) FOCUS-Draft deal puts Congo talks back on track. June 27 (Reuters),1,0,0,0,Zambia,551,0,0,0,0,0,0,0,0,0,0,0,0,0,0,0,0,0,0,0,1,3,0,0,0,0,0,1,0,0,0
1042,DR Congo (Zaire),86,490,2,Government of DR Congo (Zaire) - MLC,41,0,0,2,06/24/1999,07/10/1999,1,FOCUS-Rebel split threatens to derail Congo peace.  June 26 (Reuters) FOCUS-Draft deal puts Congo talks back on track. June 27 (Reuters),1,0,0,0,Zambia,551,0,0,0,0,0,0,0,0,0,0,0,0,0,0,0,0,0,0,0,1,3,0,0,0,0,0,1,0,0,0
1043,,,490,0,,42,0,0,0,06/24/1999,06/28/1999,1,FOCUS-Rebel split threatens to derail Congo peace.  June 26 (Reuters) FOCUS-Draft deal puts Congo talks back on track. June 27 (Reuters),0,3,0,0,"South African Development Community, AU, UN",11019,11000,11024,0,0,0,0,0,0,0,0,0,0,0,0,0,0,0,0,0,3,3,2,0,1,1,0,0,0,0,0
1044,,,490,0,,42,0,0,0,06/24/1999,07/10/1999,1,FOCUS-Rebel split threatens to derail Congo peace.  June 26 (Reuters) FOCUS-Draft deal puts Congo talks back on track. June 27 (Reuters),1,0,0,0,Zambia,551,0,0,0,0,0,0,0,0,0,0,0,0,0,0,0,0,0,0,0,1,3,0,0,0,0,0,1,0,0,0
1045,DR Congo (Zaire),86,490,2,Government of DR Congo (Zaire) - RCD,40,0,0,2,06/28/1999,07/01/1999,1,News Analysis - Why Congo (K) Peace Talks Delayed.July 1 (Xinhua),0,1,0,0,South African Development Community,11019,0,0,0,0,0,0,0,0,0,0,0,0,0,0,0,0,0,0,0,1,3,2,0,1,0,0,0,0,0,0
1046,DR Congo (Zaire),86,490,2,Government of DR Congo (Zaire) - MLC,41,0,0,2,06/28/1999,07/01/1999,1,News Analysis - Why Congo (K) Peace Talks Delayed.July 1 (Xinhua),0,1,0,0,South African Development Community,11019,0,0,0,0,0,0,0,0,0,0,0,0,0,0,0,0,0,0,0,1,3,2,0,1,0,0,0,0,0,0
1047,,,490,0,,42,0,0,0,06/28/1999,07/01/1999,1,News Analysis - Why Congo (K) Peace Talks Delayed.July 1 (Xinhua),0,1,0,0,South African Development Community,11019,0,0,0,0,0,0,0,0,0,0,0,0,0,0,0,0,0,0,0,1,3,2,0,1,0,0,0,0,0,0
1048,DR Congo (Zaire),86,490,2,Government of DR Congo (Zaire) - RCD,40,0,0,2,07/02/1999,07/02/1999,1,Congo rebels say breakthrough in peace talks. July 2 (Reuters),0,1,0,0,South African Development Community,11019,0,0,0,0,0,0,0,0,0,0,0,0,0,0,0,0,0,0,0,1,3,1,1,1,0,0,0,0,0,0
1049,DR Congo (Zaire),86,490,2,Government of DR Congo (Zaire) - MLC,41,0,0,2,07/02/1999,07/02/1999,1,Congo rebels say breakthrough in peace talks. July 2 (Reuters),0,1,0,0,South African Development Community,11019,0,0,0,0,0,0,0,0,0,0,0,0,0,0,0,0,0,0,0,1,3,1,1,1,0,0,0,0,0,0
1050,,,490,0,,42,0,0,0,07/02/1999,07/02/1999,1,Congo rebels say breakthrough in peace talks. July 2 (Reuters),0,1,0,0,South African Development Community,11019,0,0,0,0,0,0,0,0,0,0,0,0,0,0,0,0,0,0,0,1,3,1,1,1,0,0,0,0,0,0
1051,DR Congo (Zaire),86,490,2,Government of DR Congo (Zaire) - RCD,40,0,0,2,07/03/1999,07/07/1999,1,Zambia presses for Congo ceasefire summit.July 8 (Reuters),0,1,0,0,South African Development Community,11019,0,0,0,0,0,0,0,0,0,0,0,0,0,0,0,0,0,0,0,1,3,2,1,1,0,0,0,0,0,0
1052,DR Congo (Zaire),86,490,2,Government of DR Congo (Zaire) - MLC,41,0,0,2,07/03/1999,07/07/1999,1,Zambia presses for Congo ceasefire summit.July 8 (Reuters),0,1,0,0,South African Development Community,11019,0,0,0,0,0,0,0,0,0,0,0,0,0,0,0,0,0,0,0,1,3,2,1,1,0,0,0,0,0,0
1053,,,490,0,,42,0,0,0,07/03/1999,07/07/1999,1,Zambia presses for Congo ceasefire summit.July 8 (Reuters),0,1,0,0,South African Development Community,11019,0,0,0,0,0,0,0,0,0,0,0,0,0,0,0,0,0,0,0,1,3,2,1,1,0,0,0,0,0,0
1054,DR Congo (Zaire),86,490,2,Government of DR Congo (Zaire) - RCD,40,0,0,2,07/10/1999,07/10/1999,1,FACTBOX-Highlights of Congo peace accord. 7/10/1999 Reuters,0,1,0,0,South African Development Community,11019,0,0,0,0,0,0,0,0,0,0,0,0,0,0,0,0,0,0,0,1,1,3,1,1,0,0,0,0,0,0
1055,DR Congo (Zaire),86,490,2,Government of DR Congo (Zaire) - RCD,40,0,0,2,07/10/1999,07/10/1999,1,ROUNDUP - Give and Take Lead to Congo Peace Agreement July 10 (Xinhua),0,1,0,0,South African Development Community,11019,0,0,0,0,0,0,0,0,0,0,0,0,0,0,0,0,0,0,0,1,2,3,0,0,1,0,0,0,0,0
1056,DR Congo (Zaire),86,490,2,Government of DR Congo (Zaire) - MLC,41,0,0,2,07/10/1999,07/10/1999,1,FACTBOX-Highlights of Congo peace accord. 7/10/1999 Reuters,0,1,0,0,South African Development Community,11019,0,0,0,0,0,0,0,0,0,0,0,0,0,0,0,0,0,0,0,1,1,3,1,1,0,0,0,0,0,0
1057,DR Congo (Zaire),86,490,2,Government of DR Congo (Zaire) - MLC,41,0,0,2,07/10/1999,07/10/1999,1,ROUNDUP - Give and Take Lead to Congo Peace Agreement July 10 (Xinhua),0,1,0,0,South African Development Community,11019,0,0,0,0,0,0,0,0,0,0,0,0,0,0,0,0,0,0,0,1,2,3,0,0,1,0,0,0,0,0
1058,,,490,0,,42,0,0,0,07/10/1999,07/10/1999,1,FACTBOX-Highlights of Congo peace accord. 7/10/1999 Reuters,0,1,0,0,South African Development Community,11019,0,0,0,0,0,0,0,0,0,0,0,0,0,0,0,0,0,0,0,1,1,3,1,1,0,0,0,0,0,0
1059,,,490,0,,42,0,0,0,07/10/1999,07/10/1999,1,ROUNDUP - Give and Take Lead to Congo Peace Agreement July 10 (Xinhua),0,1,0,0,South African Development Community,11019,0,0,0,0,0,0,0,0,0,0,0,0,0,0,0,0,0,0,0,1,2,3,0,0,1,0,0,0,0,0
1060,DR Congo (Zaire),86,490,2,Government of DR Congo (Zaire) - RCD,40,0,0,2,07/20/1999,07/20/1999,1,Ministers set up Congo ceasefire monitoring bodies. July 20 (Reuters),0,2,0,0,"UN, South African Development Community",11024,11019,0,0,0,0,0,0,0,0,0,0,0,0,0,0,0,0,0,0,2,1,3,0,1,0,0,0,0,0,0
1061,DR Congo (Zaire),86,490,2,Government of DR Congo (Zaire) - MLC,41,0,0,2,07/20/1999,07/20/1999,1,Ministers set up Congo ceasefire monitoring bodies. July 20 (Reuters),0,2,0,0,"UN, South African Development Community",11024,11019,0,0,0,0,0,0,0,0,0,0,0,0,0,0,0,0,0,0,2,1,3,0,1,0,0,0,0,0,0
1062,,,490,0,,42,0,0,0,07/20/1999,07/20/1999,1,Ministers set up Congo ceasefire monitoring bodies. July 20 (Reuters),0,2,0,0,"UN, South African Development Community",11024,11019,0,0,0,0,0,0,0,0,0,0,0,0,0,0,0,0,0,0,2,1,3,0,1,0,0,0,0,0,0
1063,DR Congo (Zaire),86,490,2,Government of DR Congo (Zaire) - RCD,40,0,0,2,07/22/1999,07/26/1999,1,DRC Rebels to Continue Cease-fire Talks in Tanzania July 25 (Xinhua),2,0,0,0,"Tanzania, Zambia",510,551,0,0,0,0,0,0,0,0,0,0,0,0,0,0,0,0,0,0,2,2,3,0,0,1,0,0,0,0,0
1064,,,490,0,,42,0,0,0,07/22/1999,07/26/1999,1,DRC Rebels to Continue Cease-fire Talks in Tanzania July 25 (Xinhua),2,0,0,0,"Tanzania, Zambia",510,551,0,0,0,0,0,0,0,0,0,0,0,0,0,0,0,0,0,0,2,2,3,0,0,1,0,0,0,0,0
1065,DR Congo (Zaire),86,490,2,Government of DR Congo (Zaire) - MLC,41,0,0,2,08/02/1999,08/02/1999,1,Congo rebel leader meets SAfrica's Mbeki. Aug 2 (Reuters),1,0,0,0,South Africa,560,0,0,0,0,0,0,0,0,0,0,0,0,0,0,0,0,0,0,0,1,2,3,0,0,0,1,0,0,0,0
1066,,,490,0,,42,0,0,0,08/11/1999,08/11/1999,1,South African minister wraps up Congo talks. Aug 12 (Reuters),2,0,0,0,"South Africa, Zambia",560,551,0,0,0,0,0,0,0,0,0,0,0,0,0,0,0,0,0,0,2,2,3,0,0,0,1,0,0,0,0
1067,,,490,0,,42,0,0,0,08/18/1999,08/18/1999,1,"Rwandan, Ugandan leaders arrive for SADC talks.Aug 18 (Reuters)",0,1,0,0,South African Development Community,11019,0,0,0,0,0,0,0,0,0,0,0,0,0,0,0,0,0,0,0,1,1,3,0,0,1,0,0,0,0,0
1068,,,490,0,,42,0,0,0,08/18/1999,08/18/1999,1,Congolese Rebels to Sign Cease-Fire Agreement. August 24 (Xinhua),1,0,0,0,Mozambique,541,0,0,0,0,0,0,0,0,0,0,0,0,0,0,0,0,0,0,0,1,1,0,0,0,0,0,1,0,0,0
1069,DR Congo (Zaire),86,490,2,Government of DR Congo (Zaire) - MLC,41,0,0,2,08/31/1999,08/31/1999,1,Last Congo Rebel Factions Sign Truce Pact in Lusaka. August 31 (Xinhua),1,0,0,0,Zambia,551,0,0,0,0,0,0,0,0,0,0,0,0,0,0,0,0,0,0,0,1,3,0,0,0,0,0,1,0,0,0
1070,,,490,0,,42,0,0,0,08/31/1999,08/31/1999,1,Last Congo Rebel Factions Sign Truce Pact in Lusaka. August 31 (Xinhua),1,0,0,0,Zambia,551,0,0,0,0,0,0,0,0,0,0,0,0,0,0,0,0,0,0,0,1,3,0,0,0,0,0,1,0,0,0
1071,DR Congo (Zaire),86,490,2,Government of DR Congo (Zaire) - RCD,40,0,0,2,09/02/1999,09/02/1999,1,Zambia President In Talks To Save Congo Peace Deal. 9/2/1999 (Reuters),0,1,0,0,South African Development Community,11019,0,0,0,0,0,0,0,0,0,0,0,0,0,0,0,0,0,0,0,1,2,3,0,1,0,0,0,0,0,0
1072,,,490,0,,42,0,0,0,09/02/1999,09/02/1999,1,Zambia President In Talks To Save Congo Peace Deal. 9/2/1999 (Reuters),0,1,0,0,South African Development Community,11019,0,0,0,0,0,0,0,0,0,0,0,0,0,0,0,0,0,0,0,1,2,3,0,1,0,0,0,0,0,0
1073,DR Congo (Zaire),86,490,2,Government of DR Congo (Zaire) - MLC,41,0,0,2,09/03/1999,07/01/2010,6,"Heldt & Wallensteen 2005, SIPRI yearbook 2000, page 139, http://www.un.org/Depts/dpko/missions/monuc/index.html; http://www.monuc.org/news.aspx?newsID=9564, UN Security Council res 1925",0,1,0,0,UN,11024,0,0,0,0,0,0,0,0,0,0,0,0,0,0,0,0,0,0,0,1,0,0,0,0,0,0,0,0,0,1
1074,,,490,0,,42,0,0,0,09/03/1999,07/01/2010,6,"Heldt & Wallensteen 2005, SIPRI yearbook 2000, page 139, http://www.un.org/Depts/dpko/missions/monuc/index.html; http://www.monuc.org/news.aspx?newsID=9564, UN Security Council res 1925",0,1,0,0,UN,11024,0,0,0,0,0,0,0,0,0,0,0,0,0,0,0,0,0,0,0,1,0,0,0,0,0,0,0,0,0,1
1075,,,490,0,,42,0,0,0,09/06/1999,09/06/1999,1,Congo rebel faction head sees peace deal holding.Sept 6 (Reuters),1,0,0,0,South Africa,560,0,0,0,0,0,0,0,0,0,0,0,0,0,0,0,0,0,0,0,1,2,3,0,0,0,1,0,0,0,0
1076,DR Congo (Zaire),86,490,2,Government of DR Congo (Zaire) - MLC,41,0,0,2,10/01/1999,11/30/2000,6,Heldt & Wallensteen 2006; S/1999/1116; S/2000/1156,0,1,0,0,AU,11000,0,0,0,0,0,0,0,0,0,0,0,0,0,0,0,0,0,0,0,1,0,0,0,0,0,0,0,0,0,1
1077,,,490,0,,42,0,0,0,10/01/1999,11/30/2000,6,Heldt & Wallensteen 2006; S/1999/1116; S/2000/1156,0,1,0,0,AU,11000,0,0,0,0,0,0,0,0,0,0,0,0,0,0,0,0,0,0,0,1,0,0,0,0,0,0,0,0,0,1
1078,DR Congo (Zaire),86,490,2,Government of DR Congo (Zaire) - RCD,40,1,0,2,11/08/1999,11/10/1999,1,U.N. Congo assessment team to deploy Thursday.  Nov 10 (Reuters,0,1,0,0,UN,11024,0,0,0,0,0,0,0,0,0,0,0,0,0,0,0,0,0,0,0,1,1,3,0,0,1,0,0,0,0,0
1079,DR Congo (Zaire),86,490,2,Government of DR Congo (Zaire) - MLC,41,1,0,2,11/08/1999,11/10/1999,1,U.N. Congo assessment team to deploy Thursday.  Nov 10 (Reuters,0,1,0,0,UN,11024,0,0,0,0,0,0,0,0,0,0,0,0,0,0,0,0,0,0,0,1,1,3,0,0,1,0,0,0,0,0
1080,,,490,0,,42,1,0,0,11/08/1999,11/10/1999,1,U.N. Congo assessment team to deploy Thursday.  Nov 10 (Reuters,0,1,0,0,UN,11024,0,0,0,0,0,0,0,0,0,0,0,0,0,0,0,0,0,0,0,1,1,3,0,0,1,0,0,0,0,0
1081,DR Congo (Zaire),86,490,2,Government of DR Congo (Zaire) - RCD,40,0,0,2,12/10/1999,12/10/1999,1,Reuters 12/10/1999,1,0,0,0,USA,2,0,0,0,0,0,0,0,0,0,0,0,0,0,0,0,0,0,0,0,1,2,3,0,0,1,0,0,0,0,0
1082,DR Congo (Zaire),86,490,2,Government of DR Congo (Zaire) - MLC,41,0,0,2,12/10/1999,12/10/1999,1,Reuters 12/10/1999,1,0,0,0,USA,2,0,0,0,0,0,0,0,0,0,0,0,0,0,0,0,0,0,0,0,1,2,3,0,0,1,0,0,0,0,0
1083,,,490,0,,42,0,0,0,12/10/1999,12/10/1999,1,Reuters 12/10/1999,1,0,0,0,USA,2,0,0,0,0,0,0,0,0,0,0,0,0,0,0,0,0,0,0,0,1,2,3,0,0,1,0,0,0,0,0
1084,DR Congo (Zaire),86,490,2,Government of DR Congo (Zaire) - RCD,40,1,0,2,12/11/1999,12/11/1999,1,UN envoy deplores Congo truce breaches but hopeful. Dec 17 (Reuters),0,1,0,0,UN,11024,0,0,0,0,0,0,0,0,0,0,0,0,0,0,0,0,0,0,0,1,1,3,0,0,1,0,0,0,0,0
1085,DR Congo (Zaire),86,490,2,Government of DR Congo (Zaire) - RCD,40,0,0,2,12/11/1999,12/11/1999,1,FOCUS-U.S. rules out role in Congo without truce Dec 11 (Reuters),1,0,0,0,USA,2,0,0,0,0,0,0,0,0,0,0,0,0,0,0,0,0,0,0,0,1,1,3,0,0,1,0,0,0,0,0
1086,DR Congo (Zaire),86,490,2,Government of DR Congo (Zaire) - MLC,41,1,0,2,12/11/1999,12/11/1999,1,UN envoy deplores Congo truce breaches but hopeful. Dec 17 (Reuters),0,1,0,0,UN,11024,0,0,0,0,0,0,0,0,0,0,0,0,0,0,0,0,0,0,0,1,1,3,0,0,1,0,0,0,0,0
1087,DR Congo (Zaire),86,490,2,Government of DR Congo (Zaire) - MLC,41,0,0,2,12/11/1999,12/11/1999,1,FOCUS-U.S. rules out role in Congo without truce Dec 11 (Reuters),1,0,0,0,USA,2,0,0,0,0,0,0,0,0,0,0,0,0,0,0,0,0,0,0,0,1,1,3,0,0,1,0,0,0,0,0
1088,,,490,0,,42,1,0,0,12/11/1999,12/11/1999,1,UN envoy deplores Congo truce breaches but hopeful. Dec 17 (Reuters),0,1,0,0,UN,11024,0,0,0,0,0,0,0,0,0,0,0,0,0,0,0,0,0,0,0,1,1,3,0,0,1,0,0,0,0,0
1089,,,490,0,,42,0,0,0,12/11/1999,12/11/1999,1,FOCUS-U.S. rules out role in Congo without truce Dec 11 (Reuters),1,0,0,0,USA,2,0,0,0,0,0,0,0,0,0,0,0,0,0,0,0,0,0,0,0,1,1,3,0,0,1,0,0,0,0,0
1090,DR Congo (Zaire),86,490,2,Government of DR Congo (Zaire) - RCD,40,0,0,1,01/20/2000,01/20/2000,1,"President Kabila discusses peace talks with UN envoy.366 words, 24 January 2000, BBC Monitoring Service: Africa",0,1,0,0,UN,11024,0,0,0,0,0,0,0,0,0,0,0,0,0,0,0,0,0,0,0,1,1,3,0,0,1,0,0,0,0,0
1091,DR Congo (Zaire),86,490,2,Government of DR Congo (Zaire) - MLC,41,0,0,2,01/20/2000,01/20/2000,1,"President Kabila discusses peace talks with UN envoy.366 words, 24 January 2000, BBC Monitoring Service: Africa",0,1,0,0,UN,11024,0,0,0,0,0,0,0,0,0,0,0,0,0,0,0,0,0,0,0,1,1,3,0,0,1,0,0,0,0,0
1092,,,490,0,,42,0,0,0,01/20/2000,01/20/2000,1,"President Kabila discusses peace talks with UN envoy.366 words, 24 January 2000, BBC Monitoring Service: Africa",0,1,0,0,UN,11024,0,0,0,0,0,0,0,0,0,0,0,0,0,0,0,0,0,0,0,1,1,3,0,0,1,0,0,0,0,0
1093,DR Congo (Zaire),86,490,2,Government of DR Congo (Zaire) - RCD,40,0,0,1,01/24/2000,01/24/2000,1,"CORRECTED-UN Council tries to get Congo peace deal on track. 786 words, 23 January 2000, 21:09 Reuters News",5,0,0,0,"Burundi, Mali, South Africa, Mozambique, Zambia",516,432,560,541,551,0,0,0,0,0,0,0,0,0,0,0,0,0,0,0,5,1,3,0,0,0,1,0,0,0,0
1094,DR Congo (Zaire),86,490,2,Government of DR Congo (Zaire) - MLC,41,0,0,2,01/24/2000,01/24/2000,1,"CORRECTED-UN Council tries to get Congo peace deal on track. 786 words, 23 January 2000, 21:09 Reuters News",6,0,0,0,"Burundi, Mali, South Africa, Rwanda, Mozambique, Zambia",516,432,560,517,541,551,0,0,0,0,0,0,0,0,0,0,0,0,0,0,6,1,3,0,0,0,1,0,0,0,0
1095,,,490,0,,42,0,0,0,01/24/2000,01/24/2000,1,"CORRECTED-UN Council tries to get Congo peace deal on track. 786 words, 23 January 2000, 21:09 Reuters News",6,0,0,0,"Burundi, Mali, South Africa, Rwanda, Mozambique, Zambia",516,432,560,517,541,551,0,0,0,0,0,0,0,0,0,0,0,0,0,0,6,1,3,0,0,0,1,0,0,0,0
1096,DR Congo (Zaire),86,490,2,Government of DR Congo (Zaire) - RCD,40,0,0,1,01/25/2000,01/25/2000,1,"U.N. Begins Talks on Peace-Keeping Operations in DRC. 461 words, 25 January 2000, Xinhua News Agency. UN Council told to get peacekeepers to Congo soon. By Evelyn Leopold , 779 words, 25 January 2000, 02:21, Reuters News",5,1,0,0,"Canada, Belgium, Burundi, Mozambique, Zambia, UN",20,211,516,541,551,11024,0,0,0,0,0,0,0,0,0,0,0,0,0,0,6,1,3,0,0,1,0,0,0,0,0
1097,DR Congo (Zaire),86,490,2,Government of DR Congo (Zaire) - MLC,41,0,0,2,01/25/2000,01/25/2000,1,"U.N. Begins Talks on Peace-Keeping Operations in DRC. 461 words, 25 January 2000, Xinhua News Agency. UN Council told to get peacekeepers to Congo soon. By Evelyn Leopold , 779 words, 25 January 2000, 02:21, Reuters News",6,1,0,0,"Canada, Belgium, Burundi, Rwanda, Mozambique, Zambia, UN",20,211,516,517,541,551,11024,0,0,0,0,0,0,0,0,0,0,0,0,0,7,1,3,0,0,1,0,0,0,0,0
1098,,,490,0,,42,0,0,0,01/25/2000,01/25/2000,1,"U.N. Begins Talks on Peace-Keeping Operations in DRC. 461 words, 25 January 2000, Xinhua News Agency. UN Council told to get peacekeepers to Congo soon. By Evelyn Leopold , 779 words, 25 January 2000, 02:21, Reuters News",6,1,0,0,"Canada, Belgium, Burundi, Rwanda, Mozambique, Zambia, UN",20,211,516,517,541,551,11024,0,0,0,0,0,0,0,0,0,0,0,0,0,7,1,3,0,0,1,0,0,0,0,0
1099,DR Congo (Zaire),86,490,2,Government of DR Congo (Zaire) - RCD,40,1,0,1,01/31/2000,01/31/2000,1,"""UN, US still hesitate on peacekeepers for Congo."", By Evelyn Leopold, 27 January 2000; ""Uganda To Withdraw Troops From Congo, But Not Yet"", 1 February 2000, Dow Jones International News",2,1,0,0,"Mozambique, Zambia, UN",541,551,11024,0,0,0,0,0,0,0,0,0,0,0,0,0,0,0,0,0,3,1,3,0,0,1,0,0,0,0,0
1100,DR Congo (Zaire),86,490,2,Government of DR Congo (Zaire) - MLC,41,1,0,2,01/31/2000,01/31/2000,1,"""UN, US still hesitate on peacekeepers for Congo."", By Evelyn Leopold, 27 January 2000; ""Uganda To Withdraw Troops From Congo, But Not Yet"", 1 February 2000, Dow Jones International News",2,1,0,0,"Mozambique, Zambia, UN",541,551,11024,0,0,0,0,0,0,0,0,0,0,0,0,0,0,0,0,0,3,1,3,0,0,1,0,0,0,0,0
1101,,,490,0,,42,1,0,0,01/31/2000,01/31/2000,1,"""UN, US still hesitate on peacekeepers for Congo."", By Evelyn Leopold, 27 January 2000; ""Uganda To Withdraw Troops From Congo, But Not Yet"", 1 February 2000, Dow Jones International News",2,1,0,0,"Mozambique, Zambia, UN",541,551,11024,0,0,0,0,0,0,0,0,0,0,0,0,0,0,0,0,0,3,1,3,0,0,1,0,0,0,0,0
1102,DR Congo (Zaire),86,490,2,Government of DR Congo (Zaire) - RCD,40,0,0,1,02/12/2000,02/12/2000,1,"Mediator meets Kabila to discuss Congo peace talks. 192 words , 13 February 2000, 16:50, Reuters News",0,1,0,0,AU,11000,0,0,0,0,0,0,0,0,0,0,0,0,0,0,0,0,0,0,0,1,1,3,0,0,0,1,0,0,0,0
1103,DR Congo (Zaire),86,490,2,Government of DR Congo (Zaire) - MLC,41,0,0,2,02/12/2000,02/12/2000,1,"Mediator meets Kabila to discuss Congo peace talks. 192 words , 13 February 2000, 16:50, Reuters News",0,1,0,0,AU,11000,0,0,0,0,0,0,0,0,0,0,0,0,0,0,0,0,0,0,0,1,1,3,0,0,0,1,0,0,0,0
1104,,,490,0,,42,0,0,0,02/12/2000,02/12/2000,1,"Mediator meets Kabila to discuss Congo peace talks. 192 words , 13 February 2000, 16:50, Reuters News",0,1,0,0,AU,11000,0,0,0,0,0,0,0,0,0,0,0,0,0,0,0,0,0,0,0,1,1,3,0,0,0,1,0,0,0,0
1105,,,490,0,,42,0,0,0,02/12/2000,02/12/2000,1,"""Mediator meets Kabila to discuss Congo peace talks."", 13 February 2000, Reuters News",0,1,0,0,AU,11000,0,0,0,0,0,0,0,0,0,0,0,0,0,0,0,0,0,0,0,1,1,3,0,0,0,1,0,0,0,0
1106,DR Congo (Zaire),86,490,2,Government of DR Congo (Zaire) - MLC,41,0,0,2,02/22/2000,02/23/2000,1,"FOCUS-Ceasefire problems dominate Congo summit. By Manoah Esipisu , 530 words , 22 February 2000, 17:49 Reuters News. FOCUS-African leaders end Congo peace talks. By Manoah Esipisu, 558 words , 23 February 2000, 20:33, Reuters News",3,2,0,0,"Rwanda, Mozambique, Zambia, UN, AU",517,541,551,11024,11000,0,0,0,0,0,0,0,0,0,0,0,0,0,0,0,5,3,4,0,0,0,1,0,0,0,0
1107,,,490,0,,42,0,0,0,02/22/2000,02/23/2000,1,"FOCUS-Ceasefire problems dominate Congo summit. By Manoah Esipisu , 530 words , 22 February 2000, 17:49 Reuters News. FOCUS-African leaders end Congo peace talks. By Manoah Esipisu, 558 words , 23 February 2000, 20:33, Reuters News",3,2,0,0,"Rwanda, Mozambique, Zambia, UN, AU",517,541,551,11024,11000,0,0,0,0,0,0,0,0,0,0,0,0,0,0,0,5,3,4,0,0,0,1,0,0,0,0
1108,,,490,0,,42,0,0,0,02/23/2000,02/23/2000,1,"""FOCUS-Ceasefire problems dominate Congo summit."", By Manoah Esipisu, 22 February 2000, Reuters News; ""FOCUS-African leaders end Congo peace talks."", By Manoah Esipisu, 23 February 2000, Reuters News",2,2,0,0,"Mozambique, Zambia, UN, AU",541,551,11024,11000,0,0,0,0,0,0,0,0,0,0,0,0,0,0,0,0,4,3,1,0,0,1,0,0,0,0,0
1109,DR Congo (Zaire),86,490,2,Government of DR Congo (Zaire) - RCD,40,0,0,1,04/04/2000,04/06/2000,1,"""Uganda to Withdraw Troops in Congo - Minister."", by Feng Jian, 4 April 2000, Xinhua News Agency; ""Congo ceasefire talks open with some optimism."", 4 April 2000; ""Signatories to the DR Congo truce agree total ceasefire ATTENTION - ADDS details, quotes, background ///"", 8 April 2000, Agence France-Presse",0,2,0,0,"UN, AU",11024,11000,0,0,0,0,0,0,0,0,0,0,0,0,0,0,0,0,0,0,2,3,1,0,1,1,0,0,0,0,0
1110,DR Congo (Zaire),86,490,2,Government of DR Congo (Zaire) - MLC,41,0,0,2,04/04/2000,04/06/2000,1,"""Uganda to Withdraw Troops in Congo - Minister."", by Feng Jian, 4 April 2000, Xinhua News Agency; ""Congo ceasefire talks open with some optimism."", 4 April 2000; ""Signatories to the DR Congo truce agree total ceasefire ATTENTION - ADDS details, quotes, background ///"", 8 April 2000, Agence France-Presse",0,2,0,0,"UN, AU",11024,11000,0,0,0,0,0,0,0,0,0,0,0,0,0,0,0,0,0,0,2,3,1,0,1,1,0,0,0,0,0
1111,,,490,0,,42,0,0,0,04/04/2000,04/06/2000,1,"""Uganda to Withdraw Troops in Congo - Minister."", by Feng Jian, 4 April 2000, Xinhua News Agency; ""Congo ceasefire talks open with some optimism."", 4 April 2000; ""Signatories to the DR Congo truce agree total ceasefire ATTENTION - ADDS details, quotes, background ///"", 8 April 2000, Agence France-Presse",0,2,0,0,"UN, AU",11024,11000,0,0,0,0,0,0,0,0,0,0,0,0,0,0,0,0,0,0,2,3,1,0,1,1,0,0,0,0,0
1112,DR Congo (Zaire),86,490,2,Government of DR Congo (Zaire) - MLC,41,0,0,2,04/30/2000,04/30/2000,1,"UPDATE 1-African leaders urge U.N. to deploy Congo force. By Haider Haidoura, 421 words, 30 April 2000, 20:28, Reuters News",5,1,0,0,"Zambia, Mali, Mozambique, South Africa, Nigeria, AU",551,432,541,560,475,11000,0,0,0,0,0,0,0,0,0,0,0,0,0,0,6,1,3,0,0,1,0,0,0,0,0
1113,,,490,0,,42,0,0,0,04/30/2000,04/30/2000,1,"UPDATE 1-African leaders urge U.N. to deploy Congo force. By Haider Haidoura, 421 words, 30 April 2000, 20:28, Reuters News",5,1,0,0,"Zambia, Mali, Mozambique, South Africa, Nigeria, AU",551,432,541,560,475,11000,0,0,0,0,0,0,0,0,0,0,0,0,0,0,6,1,3,0,0,1,0,0,0,0,0
1114,DR Congo (Zaire),86,490,2,Government of DR Congo (Zaire) - RCD,40,0,0,1,05/04/2000,05/04/2000,1,"""UN and Kinshasa sign agreement on peace-keeping force"", 4 May 2000, Agence France-Presse; 
""Security Council envoys visit Kabila's Congo."", 4 May 2000, Reuters News; ""Accord signing brings UN Congo mission step closer."", By Alistair Thomson, 4 May 2000",0,1,0,0,UN,11024,0,0,0,0,0,0,0,0,0,0,0,0,0,0,0,0,0,0,0,1,1,3,0,0,1,0,0,0,0,0
1115,DR Congo (Zaire),86,490,2,Government of DR Congo (Zaire) - MLC,41,0,0,2,05/04/2000,05/04/2000,1,"""UN and Kinshasa sign agreement on peace-keeping force"", 4 May 2000, Agence France-Presse; 
""Security Council envoys visit Kabila's Congo."", 4 May 2000, Reuters News; ""Accord signing brings UN Congo mission step closer."", By Alistair Thomson, 4 May 2000",0,1,0,0,UN,11024,0,0,0,0,0,0,0,0,0,0,0,0,0,0,0,0,0,0,0,1,1,3,0,0,1,0,0,0,0,0
1116,,,490,0,,42,0,0,0,05/04/2000,05/04/2000,1,"""UN and Kinshasa sign agreement on peace-keeping force"", 4 May 2000, Agence France-Presse; 
""Security Council envoys visit Kabila's Congo."", 4 May 2000, Reuters News; ""Accord signing brings UN Congo mission step closer."", By Alistair Thomson, 4 May 2000",0,1,0,0,UN,11024,0,0,0,0,0,0,0,0,0,0,0,0,0,0,0,0,0,0,0,1,1,3,0,0,1,0,0,0,0,0
1117,DR Congo (Zaire),86,490,2,Government of DR Congo (Zaire) - RCD,40,0,0,1,05/13/2000,05/13/2000,1,"No progress on Democratic Congo political talks. 239 words, 14 May 2000, 17:16, Reuters News",0,1,0,0,AU,11000,0,0,0,0,0,0,0,0,0,0,0,0,0,0,0,0,0,0,0,1,1,3,0,0,0,1,0,0,0,0
1118,DR Congo (Zaire),86,490,2,Government of DR Congo (Zaire) - MLC,41,0,0,2,05/13/2000,05/13/2000,1,"No progress on Democratic Congo political talks. 239 words, 14 May 2000, 17:16, Reuters News",0,1,0,0,AU,11000,0,0,0,0,0,0,0,0,0,0,0,0,0,0,0,0,0,0,0,1,1,3,0,0,0,1,0,0,0,0
1119,,,490,0,,42,0,0,0,05/13/2000,05/13/2000,1,"No progress on Democratic Congo political talks. 239 words, 14 May 2000, 17:16, Reuters News",0,1,0,0,AU,11000,0,0,0,0,0,0,0,0,0,0,0,0,0,0,0,0,0,0,0,1,1,3,0,0,0,1,0,0,0,0
1120,,,490,0,,42,0,0,0,06/03/2000,06/05/2000,1,"""DRCongo talks on track for July 3: Masire"", 3 June 2000, Agence France-Presse; ""Zambian leader Chiluba slams Bemba, praises Kabila ATTENTION - RECASTS and UPDATES with Chiluba's comments on return"", 5 June 2000, Agence France-Presse",1,2,0,0,"UN, AU, Zambia",11024,11000,551,0,0,0,0,0,0,0,0,0,0,0,0,0,0,0,0,0,3,3,1,0,0,1,0,0,0,0,0
1121,DR Congo (Zaire),86,490,2,Government of DR Congo (Zaire) - RCD,40,0,0,1,06/05/2000,06/05/2000,1,"Zambian leader Chiluba slams Bemba, praises Kabila ATTENTION - RECASTS and UPDATES with Chiluba's comments on return /// 317 words, 5 June 2000, Agence France-Presse",1,0,0,0,Zambia,551,0,0,0,0,0,0,0,0,0,0,0,0,0,0,0,0,0,0,0,1,1,3,0,0,0,1,0,0,0,0
1122,DR Congo (Zaire),86,490,2,Government of DR Congo (Zaire) - RCD,40,0,0,1,06/05/2000,06/05/2000,1,"""UPDATE 2-Zambia's Chiluba urges U.N. deployment in Congo."", By Manoah Esipisu, 5 June 2000, Reuters News",1,0,0,0,Zambia,551,0,0,0,0,0,0,0,0,0,0,0,0,0,0,0,0,0,0,0,1,1,3,0,0,1,0,0,0,0,0
1123,DR Congo (Zaire),86,490,2,Government of DR Congo (Zaire) - MLC,41,0,0,2,06/05/2000,06/05/2000,1,"Zambian leader Chiluba slams Bemba, praises Kabila ATTENTION - RECASTS and UPDATES with Chiluba's comments on return /// 317 words, 5 June 2000, Agence France-Presse",1,0,0,0,Zambia,551,0,0,0,0,0,0,0,0,0,0,0,0,0,0,0,0,0,0,0,1,1,3,0,0,0,1,0,0,0,0
1124,DR Congo (Zaire),86,490,2,Government of DR Congo (Zaire) - MLC,41,0,0,2,06/05/2000,06/05/2000,1,"""UPDATE 2-Zambia's Chiluba urges U.N. deployment in Congo."", By Manoah Esipisu, 5 June 2000, Reuters News",1,0,0,0,Zambia,551,0,0,0,0,0,0,0,0,0,0,0,0,0,0,0,0,0,0,0,1,1,3,0,0,1,0,0,0,0,0
1125,,,490,0,,42,0,0,0,06/05/2000,06/05/2000,1,"Zambian leader Chiluba slams Bemba, praises Kabila ATTENTION - RECASTS and UPDATES with Chiluba's comments on return /// 317 words, 5 June 2000, Agence France-Presse",1,0,0,0,Zambia,551,0,0,0,0,0,0,0,0,0,0,0,0,0,0,0,0,0,0,0,1,1,3,0,0,0,1,0,0,0,0
1126,,,490,0,,42,0,0,0,06/05/2000,06/05/2000,1,"""UPDATE 2-Zambia's Chiluba urges U.N. deployment in Congo."", By Manoah Esipisu, 5 June 2000, Reuters News",1,0,0,0,Zambia,551,0,0,0,0,0,0,0,0,0,0,0,0,0,0,0,0,0,0,0,1,1,3,0,0,1,0,0,0,0,0
1127,DR Congo (Zaire),86,490,2,Government of DR Congo (Zaire) - RCD,40,0,0,1,06/14/2000,06/15/2000,1,"UN Demands Rwanda, Uganda, Others Withdraw From Congo. 389 words , 16 June 2000, 23:50 Dow Jones International News",0,1,0,0,UN,11024,0,0,0,0,0,0,0,0,0,0,0,0,0,0,0,0,0,0,0,1,3,4,0,0,1,0,0,0,0,0
1128,DR Congo (Zaire),86,490,2,Government of DR Congo (Zaire) - MLC,41,0,0,2,06/14/2000,06/15/2000,1,"UN Demands Rwanda, Uganda, Others Withdraw From Congo. 389 words , 16 June 2000, 23:50 Dow Jones International News",1,1,0,0,"Rwanda, UN",517,11024,0,0,0,0,0,0,0,0,0,0,0,0,0,0,0,0,0,0,2,3,4,0,0,1,0,0,0,0,0
1129,,,490,0,,42,0,0,0,06/14/2000,06/15/2000,1,"UN Demands Rwanda, Uganda, Others Withdraw From Congo. 389 words , 16 June 2000, 23:50 Dow Jones International News",1,1,0,0,"Rwanda, UN",517,11024,0,0,0,0,0,0,0,0,0,0,0,0,0,0,0,0,0,0,2,3,4,0,0,1,0,0,0,0,0
1130,DR Congo (Zaire),86,490,2,Government of DR Congo (Zaire) - RCD,40,0,0,1,07/11/2000,07/12/2000,1,"African foreign ministers demand withdrawal of foreign troops from DRCongo. 172 words, 13 July 2000, BBC Monitoring Service: Africa",0,1,0,0,AU,11000,0,0,0,0,0,0,0,0,0,0,0,0,0,0,0,0,0,0,0,1,1,3,0,0,1,0,0,0,0,0
1131,DR Congo (Zaire),86,490,2,Government of DR Congo (Zaire) - MLC,41,0,0,2,07/11/2000,07/12/2000,1,"African foreign ministers demand withdrawal of foreign troops from DRCongo. 172 words, 13 July 2000, BBC Monitoring Service: Africa",0,1,0,0,AU,11000,0,0,0,0,0,0,0,0,0,0,0,0,0,0,0,0,0,0,0,1,1,3,0,0,1,0,0,0,0,0
1132,,,490,0,,42,0,0,0,07/11/2000,07/12/2000,1,"African foreign ministers demand withdrawal of foreign troops from DRCongo. 172 words, 13 July 2000, BBC Monitoring Service: Africa",0,1,0,0,AU,11000,0,0,0,0,0,0,0,0,0,0,0,0,0,0,0,0,0,0,0,1,1,3,0,0,1,0,0,0,0,0
1133,DR Congo (Zaire),86,490,2,Government of DR Congo (Zaire) - RCD,40,0,0,1,08/01/2000,08/31/2000,4,"Congo's Kabila visits war ally Namibia - television. 

191 words 
29 September 2000
19:20
Reuters News",0,1,0,0,AU,11000,0,0,0,0,0,0,0,0,0,0,0,0,0,0,0,0,0,0,0,1,1,3,0,0,0,1,0,0,0,0
1134,DR Congo (Zaire),86,490,2,Government of DR Congo (Zaire) - MLC,41,0,0,2,08/01/2000,08/31/2000,4,"Congo's Kabila visits war ally Namibia - television. 

191 words 
29 September 2000
19:20
Reuters News",0,1,0,0,AU,11000,0,0,0,0,0,0,0,0,0,0,0,0,0,0,0,0,0,0,0,1,1,3,0,0,0,1,0,0,0,0
1135,,,490,0,,42,0,0,0,08/01/2000,08/31/2000,4,"Congo's Kabila visits war ally Namibia - television. 

191 words 
29 September 2000
19:20
Reuters News",0,1,0,0,AU,11000,0,0,0,0,0,0,0,0,0,0,0,0,0,0,0,0,0,0,0,1,1,3,0,0,0,1,0,0,0,0
1136,DR Congo (Zaire),86,490,2,Government of DR Congo (Zaire) - RCD,40,0,0,1,08/05/2000,08/06/2000,1,"Former Botswana President to Push Congolese Peace Talks. 175 words, 4 August 2000, Xinhua News Agency",0,2,0,0,"South African Development Community, AU",11019,11000,0,0,0,0,0,0,0,0,0,0,0,0,0,0,0,0,0,0,2,1,3,0,0,1,0,0,0,0,0
1137,DR Congo (Zaire),86,490,2,Government of DR Congo (Zaire) - MLC,41,0,0,2,08/05/2000,08/06/2000,1,"Former Botswana President to Push Congolese Peace Talks. 175 words, 4 August 2000, Xinhua News Agency",0,2,0,0,"South African Development Community, AU",11019,11000,0,0,0,0,0,0,0,0,0,0,0,0,0,0,0,0,0,0,2,1,3,0,0,1,0,0,0,0,0
1138,,,490,0,,42,0,0,0,08/05/2000,08/06/2000,1,"Former Botswana President to Push Congolese Peace Talks. 175 words, 4 August 2000, Xinhua News Agency",0,2,0,0,"South African Development Community, AU",11019,11000,0,0,0,0,0,0,0,0,0,0,0,0,0,0,0,0,0,0,2,1,3,0,0,1,0,0,0,0,0
1139,DR Congo (Zaire),86,490,2,Government of DR Congo (Zaire) - MLC,41,0,0,2,08/14/2000,08/15/2000,1,"African leaders gather for make-or-break Congo talks. By Manoah Esipisu and Mike Lawrence, 537 words, 13 August 2000, 17:13, Reuters News. Democratic Congo peace talks end in failure. 198 words, 15 August 2000, 07:09, Reuters News",4,0,0,0,"Zambia, Rwanda, South Africa, Tanzania",551,517,560,510,0,0,0,0,0,0,0,0,0,0,0,0,0,0,0,0,4,3,1,0,0,1,0,0,0,0,0
1140,DR Congo (Zaire),86,490,2,Government of DR Congo (Zaire) - RCD,40,0,0,1,08/22/2000,08/22/2000,1,"""DRC Signals Readiness to Allow Deployment of U.N. Troops."", 24 August 2000
Xinhua News Agency",0,1,0,0,UN,11024,0,0,0,0,0,0,0,0,0,0,0,0,0,0,0,0,0,0,0,1,1,3,0,0,1,0,0,0,0,0
1141,DR Congo (Zaire),86,490,2,Government of DR Congo (Zaire) - MLC,41,0,0,2,08/22/2000,08/22/2000,1,"""DRC Signals Readiness to Allow Deployment of U.N. Troops."", 24 August 2000
Xinhua News Agency",0,1,0,0,UN,11024,0,0,0,0,0,0,0,0,0,0,0,0,0,0,0,0,0,0,0,1,1,3,0,0,1,0,0,0,0,0
1142,,,490,0,,42,0,0,0,08/22/2000,08/22/2000,1,"""DRC Signals Readiness to Allow Deployment of U.N. Troops."", 24 August 2000
Xinhua News Agency",0,1,0,0,UN,11024,0,0,0,0,0,0,0,0,0,0,0,0,0,0,0,0,0,0,0,1,1,3,0,0,1,0,0,0,0,0
1143,DR Congo (Zaire),86,490,2,Government of DR Congo (Zaire) - RCD,40,0,0,1,10/01/2000,10/01/2000,1,"U.N. human rights chief visits Kabila's Congo. 

239 words 
1 October 2000
20:03
Reuters News",0,1,0,0,UN,11024,0,0,0,0,0,0,0,0,0,0,0,0,0,0,0,0,0,0,0,1,1,3,0,0,0,1,0,0,0,0
1144,DR Congo (Zaire),86,490,2,Government of DR Congo (Zaire) - MLC,41,0,0,2,10/01/2000,10/01/2000,1,"U.N. human rights chief visits Kabila's Congo. 

239 words 
1 October 2000
20:03
Reuters News",0,1,0,0,UN,11024,0,0,0,0,0,0,0,0,0,0,0,0,0,0,0,0,0,0,0,1,1,3,0,0,0,1,0,0,0,0
1145,,,490,0,,42,0,0,0,10/01/2000,10/01/2000,1,"U.N. human rights chief visits Kabila's Congo. 

239 words 
1 October 2000
20:03
Reuters News",0,1,0,0,UN,11024,0,0,0,0,0,0,0,0,0,0,0,0,0,0,0,0,0,0,0,1,1,3,0,0,0,1,0,0,0,0
1146,DR Congo (Zaire),86,490,2,Government of DR Congo (Zaire) - RCD,40,0,0,1,10/10/2000,10/10/2000,1,"EU urges quick U.N. deployment in Kabila's Congo. 
402 words
11 October 2000
15:33
Reuters News",0,1,0,0,EC/EU,11010,0,0,0,0,0,0,0,0,0,0,0,0,0,0,0,0,0,0,0,1,1,3,0,0,1,0,0,0,0,0
1147,DR Congo (Zaire),86,490,2,Government of DR Congo (Zaire) - MLC,41,0,0,2,10/10/2000,10/10/2000,1,"EU urges quick U.N. deployment in Kabila's Congo. 
402 words
11 October 2000
15:33
Reuters News",0,1,0,0,EC/EU,11010,0,0,0,0,0,0,0,0,0,0,0,0,0,0,0,0,0,0,0,1,1,3,0,0,1,0,0,0,0,0
1148,,,490,0,,42,0,0,0,10/10/2000,10/10/2000,1,"EU urges quick U.N. deployment in Kabila's Congo. 
402 words
11 October 2000
15:33
Reuters News",0,1,0,0,EC/EU,11010,0,0,0,0,0,0,0,0,0,0,0,0,0,0,0,0,0,0,0,1,1,3,0,0,1,0,0,0,0,0
1149,DR Congo (Zaire),86,490,2,Government of DR Congo (Zaire) - RCD,40,0,0,1,10/16/2000,10/16/2000,1,"""UPDATE 1-S.Africa's Mbeki in fresh Congo peace bid."", By Buchizya Mseteka, 15 October 2000, Reuters News; ""African leaders agree to pull back troops in DRCongo by Evaristo Cumbane ATTENTION - REPEATING, adding dropped words in 2nd para ///"", 17 October 2000, Agence France-Presse",2,0,0,0,"South Africa, Mozambique",560,541,0,0,0,0,0,0,0,0,0,0,0,0,0,0,0,0,0,0,2,1,3,0,1,1,0,0,0,0,0
1150,DR Congo (Zaire),86,490,2,Government of DR Congo (Zaire) - MLC,41,0,0,2,10/16/2000,10/16/2000,1,"""UPDATE 1-S.Africa's Mbeki in fresh Congo peace bid."", By Buchizya Mseteka, 15 October 2000, Reuters News; ""African leaders agree to pull back troops in DRCongo by Evaristo Cumbane ATTENTION - REPEATING, adding dropped words in 2nd para ///"", 17 October 2000, Agence France-Presse",2,0,0,0,"South Africa, Mozambique",560,541,0,0,0,0,0,0,0,0,0,0,0,0,0,0,0,0,0,0,2,1,3,0,1,1,0,0,0,0,0
1151,,,490,0,,42,0,0,0,10/16/2000,10/16/2000,1,"""UPDATE 1-S.Africa's Mbeki in fresh Congo peace bid."", By Buchizya Mseteka, 15 October 2000, Reuters News; ""African leaders agree to pull back troops in DRCongo by Evaristo Cumbane ATTENTION - REPEATING, adding dropped words in 2nd para ///"", 17 October 2000, Agence France-Presse",2,0,0,0,"South Africa, Mozambique",560,541,0,0,0,0,0,0,0,0,0,0,0,0,0,0,0,0,0,0,2,1,3,0,1,1,0,0,0,0,0
1152,DR Congo (Zaire),86,490,2,Government of DR Congo (Zaire) - RCD,40,0,0,1,10/20/2000,10/21/2000,1,"Four African ministers meet over DR Congo troop pullback 
320 words
20 October 2000
Agence France-Presse",1,0,0,0,South Africa,560,0,0,0,0,0,0,0,0,0,0,0,0,0,0,0,0,0,0,0,1,1,3,0,0,1,0,0,0,0,0
1153,DR Congo (Zaire),86,490,2,Government of DR Congo (Zaire) - MLC,41,0,0,2,10/20/2000,10/21/2000,1,"Four African ministers meet over DR Congo troop pullback 
320 words
20 October 2000
Agence France-Presse",1,0,0,0,South Africa,560,0,0,0,0,0,0,0,0,0,0,0,0,0,0,0,0,0,0,0,1,1,3,0,0,1,0,0,0,0,0
1154,,,490,0,,42,0,0,0,10/20/2000,10/21/2000,1,"Four African ministers meet over DR Congo troop pullback 
320 words
20 October 2000
Agence France-Presse",1,0,0,0,South Africa,560,0,0,0,0,0,0,0,0,0,0,0,0,0,0,0,0,0,0,0,1,1,3,0,0,1,0,0,0,0,0
1155,DR Congo (Zaire),86,490,2,Government of DR Congo (Zaire) - RCD,40,0,0,1,10/27/2000,10/27/2000,1,"Central African leaders want to alter Congo accord. 
301 words
28 October 2000
14:20
Reuters News",2,0,0,0,"Congo, Gabon",484,481,0,0,0,0,0,0,0,0,0,0,0,0,0,0,0,0,0,0,2,1,3,0,1,0,0,0,0,0,0
1156,DR Congo (Zaire),86,490,2,Government of DR Congo (Zaire) - MLC,41,0,0,2,10/27/2000,10/27/2000,1,"Central African leaders want to alter Congo accord. 
301 words
28 October 2000
14:20
Reuters News",2,0,0,0,"Congo, Gabon",484,481,0,0,0,0,0,0,0,0,0,0,0,0,0,0,0,0,0,0,2,1,3,0,1,0,0,0,0,0,0
1157,,,490,0,,42,0,0,0,10/27/2000,10/27/2000,1,"Central African leaders want to alter Congo accord. 
301 words
28 October 2000
14:20
Reuters News",2,0,0,0,"Congo, Gabon",484,481,0,0,0,0,0,0,0,0,0,0,0,0,0,0,0,0,0,0,2,1,3,0,1,0,0,0,0,0,0
1158,DR Congo (Zaire),86,490,2,Government of DR Congo (Zaire) - RCD,40,0,0,1,11/02/2000,11/02/2000,1,"Senior U.S. military official meets Congo's Kabila. 
262 words
2 November 2000
16:52
Reuters News",1,0,0,0,USA,2,0,0,0,0,0,0,0,0,0,0,0,0,0,0,0,0,0,0,0,1,1,3,0,0,1,0,0,0,0,0
1159,DR Congo (Zaire),86,490,2,Government of DR Congo (Zaire) - MLC,41,0,0,2,11/02/2000,11/02/2000,1,"Senior U.S. military official meets Congo's Kabila. 
262 words
2 November 2000
16:52
Reuters News",1,0,0,0,USA,2,0,0,0,0,0,0,0,0,0,0,0,0,0,0,0,0,0,0,0,1,1,3,0,0,1,0,0,0,0,0
1160,,,490,0,,42,0,0,0,11/02/2000,11/02/2000,1,"Senior U.S. military official meets Congo's Kabila. 
262 words
2 November 2000
16:52
Reuters News",1,0,0,0,USA,2,0,0,0,0,0,0,0,0,0,0,0,0,0,0,0,0,0,0,0,1,1,3,0,0,1,0,0,0,0,0
1161,DR Congo (Zaire),86,490,2,Government of DR Congo (Zaire) - RCD,40,0,0,1,11/07/2000,11/08/2000,1,"Heads of state meet in Libya on Congo civil war. 
146 words
7 November 2000
18:08
Reuters News & African Countries Agree to Deploy Peacekeeping Force in DRC. 
218 words
8 November 2000
Xinhua News Agency",3,0,0,0,"Libya, South Africa, Mali",620,560,432,0,0,0,0,0,0,0,0,0,0,0,0,0,0,0,0,0,3,1,3,0,0,1,0,0,0,0,0
1162,DR Congo (Zaire),86,490,2,Government of DR Congo (Zaire) - MLC,41,0,0,2,11/07/2000,11/08/2000,1,"Heads of state meet in Libya on Congo civil war. 
146 words
7 November 2000
18:08
Reuters News & African Countries Agree to Deploy Peacekeeping Force in DRC. 
218 words
8 November 2000
Xinhua News Agency",3,0,0,0,"Libya, South Africa, Mali",620,560,432,0,0,0,0,0,0,0,0,0,0,0,0,0,0,0,0,0,3,1,3,0,0,1,0,0,0,0,0
1163,,,490,0,,42,0,0,0,11/07/2000,11/08/2000,1,"Heads of state meet in Libya on Congo civil war. 
146 words
7 November 2000
18:08
Reuters News & African Countries Agree to Deploy Peacekeeping Force in DRC. 
218 words
8 November 2000
Xinhua News Agency",3,0,0,0,"Libya, South Africa, Mali",620,560,432,0,0,0,0,0,0,0,0,0,0,0,0,0,0,0,0,0,3,1,3,0,0,1,0,0,0,0,0
1164,DR Congo (Zaire),86,490,2,Government of DR Congo (Zaire) - RCD,40,0,0,1,11/19/2000,11/19/2000,1,"Belgium offers to help Congo peace process. 

224 words 
19 November 2000
15:42
Reuters News",1,0,0,0,Belgium,211,0,0,0,0,0,0,0,0,0,0,0,0,0,0,0,0,0,0,0,1,1,3,0,0,1,0,0,0,0,0
1165,DR Congo (Zaire),86,490,2,Government of DR Congo (Zaire) - MLC,41,0,0,2,11/19/2000,11/19/2000,1,"Belgium offers to help Congo peace process. 

224 words 
19 November 2000
15:42
Reuters News",1,0,0,0,Belgium,211,0,0,0,0,0,0,0,0,0,0,0,0,0,0,0,0,0,0,0,1,1,3,0,0,1,0,0,0,0,0
1166,,,490,0,,42,0,0,0,11/19/2000,11/19/2000,1,"Belgium offers to help Congo peace process. 

224 words 
19 November 2000
15:42
Reuters News",1,0,0,0,Belgium,211,0,0,0,0,0,0,0,0,0,0,0,0,0,0,0,0,0,0,0,1,1,3,0,0,1,0,0,0,0,0
1167,DR Congo (Zaire),86,490,2,Government of DR Congo (Zaire) - RCD,40,0,0,1,11/27/2000,11/27/2000,1,"ANALYSIS-More words on Congo peace but little action. 
By Buchizya Mseteka 
782 words
28 November 2000
11:21
Reuters News",2,0,0,0,"Mozambique, South Africa",541,560,0,0,0,0,0,0,0,0,0,0,0,0,0,0,0,0,0,0,2,1,3,0,1,1,0,0,0,0,0
1168,DR Congo (Zaire),86,490,2,Government of DR Congo (Zaire) - MLC,41,0,0,2,11/27/2000,11/27/2000,1,"ANALYSIS-More words on Congo peace but little action. 
By Buchizya Mseteka 
782 words
28 November 2000
11:21
Reuters News",2,0,0,0,"Mozambique, South Africa",541,560,0,0,0,0,0,0,0,0,0,0,0,0,0,0,0,0,0,0,2,1,3,0,1,1,0,0,0,0,0
1169,,,490,0,,42,0,0,0,11/27/2000,11/27/2000,1,"ANALYSIS-More words on Congo peace but little action. 
By Buchizya Mseteka 
782 words
28 November 2000
11:21
Reuters News",2,0,0,0,"Mozambique, South Africa",541,560,0,0,0,0,0,0,0,0,0,0,0,0,0,0,0,0,0,0,2,1,3,0,1,1,0,0,0,0,0
1170,DR Congo (Zaire),86,490,2,Government of DR Congo (Zaire) - RCD,40,1,0,1,01/04/2001,01/04/2001,1,"""Chiluba holds 'successful' meeting with Kabila ATTENTION - RECASTS with Chiluba's statement, ADDS details "", 4 January 2001, Agence France-Presse",1,0,0,0,Zambia,551,0,0,0,0,0,0,0,0,0,0,0,0,0,0,0,0,0,0,0,1,1,3,0,1,0,0,0,0,0,0
1171,DR Congo (Zaire),86,490,2,Government of DR Congo (Zaire) - MLC,41,1,0,1,01/04/2001,01/04/2001,1,"""Chiluba holds 'successful' meeting with Kabila ATTENTION - RECASTS with Chiluba's statement, ADDS details "", 4 January 2001, Agence France-Presse",1,0,0,0,Zambia,551,0,0,0,0,0,0,0,0,0,0,0,0,0,0,0,0,0,0,0,1,1,3,0,1,0,0,0,0,0,0
1172,,,490,0,,42,1,0,0,01/04/2001,01/04/2001,1,"""Chiluba holds 'successful' meeting with Kabila ATTENTION - RECASTS with Chiluba's statement, ADDS details "", 4 January 2001, Agence France-Presse",1,0,0,0,Zambia,551,0,0,0,0,0,0,0,0,0,0,0,0,0,0,0,0,0,0,0,1,1,3,0,1,0,0,0,0,0,0
1173,DR Congo (Zaire),86,490,2,Government of DR Congo (Zaire) - RCD,40,0,0,1,01/10/2001,01/10/2001,1,"""UPDATE 1-Congo says Burundian army, rebels to withdraw"", By Tom Tshibangu, 10 January 2001, Reuters News",1,0,0,0,Burundi,516,0,0,0,0,0,0,0,0,0,0,0,0,0,0,0,0,0,0,0,1,1,3,0,0,1,0,0,0,0,0
1174,DR Congo (Zaire),86,490,2,Government of DR Congo (Zaire) - RCD,40,0,0,1,01/10/2001,01/10/2001,1,"""UPDATE 1-Congo says Burundian army, rebels to withdraw"", By Tom Tshibangu, 10 January 2001, Reuters News",1,0,0,0,Gabon,481,0,0,0,0,0,0,0,0,0,0,0,0,0,0,0,0,0,0,0,1,1,0,0,0,0,0,1,0,0,0
1175,DR Congo (Zaire),86,490,2,Government of DR Congo (Zaire) - RCD,40,1,0,1,01/28/2001,01/28/2001,1,"""Foreign troops must pull out of Congo-EU envoy"", 29 January 2001, Reuters News",0,1,0,0,EC/EU,11010,0,0,0,0,0,0,0,0,0,0,0,0,0,0,0,0,0,0,0,1,1,3,0,0,1,0,0,0,0,0
1176,DR Congo (Zaire),86,490,2,Government of DR Congo (Zaire) - MLC,41,1,0,1,01/28/2001,01/28/2001,1,"""Foreign troops must pull out of Congo-EU envoy"", 29 January 2001, Reuters News",0,1,0,0,EC/EU,11010,0,0,0,0,0,0,0,0,0,0,0,0,0,0,0,0,0,0,0,1,1,3,0,0,1,0,0,0,0,0
1177,,,490,0,,42,1,0,0,01/28/2001,01/28/2001,1,"""Foreign troops must pull out of Congo-EU envoy"", 29 January 2001, Reuters News",0,1,0,0,EC/EU,11010,0,0,0,0,0,0,0,0,0,0,0,0,0,0,0,0,0,0,0,1,1,3,0,0,1,0,0,0,0,0
1178,DR Congo (Zaire),86,490,2,Government of DR Congo (Zaire) - RCD,40,1,0,1,01/30/2001,01/30/2001,1,"""UNHCR reminds Kabila of ""human cost of war"", 30 January 2001, Reuters News",0,1,0,0,UN,11024,0,0,0,0,0,0,0,0,0,0,0,0,0,0,0,0,0,0,0,1,1,3,0,0,1,0,0,0,0,0
1179,DR Congo (Zaire),86,490,2,Government of DR Congo (Zaire) - RCD,40,1,0,1,01/30/2001,01/30/2001,1,"""Mbeki arrives in Kinshasa for talks with Kabila on DR Congo war ATTENTION - ADDS details, background /// "", 30 January 2001, Agence France-Presse",1,0,0,0,South Africa,560,0,0,0,0,0,0,0,0,0,0,0,0,0,0,0,0,0,0,0,1,1,3,0,0,0,1,0,0,0,0
1180,DR Congo (Zaire),86,490,2,Government of DR Congo (Zaire) - MLC,41,1,0,1,01/30/2001,01/30/2001,1,"""UNHCR reminds Kabila of ""human cost of war"", 30 January 2001, Reuters News",0,1,0,0,UN,11024,0,0,0,0,0,0,0,0,0,0,0,0,0,0,0,0,0,0,0,1,1,3,0,0,1,0,0,0,0,0
1181,DR Congo (Zaire),86,490,2,Government of DR Congo (Zaire) - MLC,41,1,0,1,01/30/2001,01/30/2001,1,"""Mbeki arrives in Kinshasa for talks with Kabila on DR Congo war ATTENTION - ADDS details, background /// "", 30 January 2001, Agence France-Presse",1,0,0,0,South Africa,560,0,0,0,0,0,0,0,0,0,0,0,0,0,0,0,0,0,0,0,1,1,3,0,0,0,1,0,0,0,0
1182,,,490,0,,42,1,0,0,01/30/2001,01/30/2001,1,"""UNHCR reminds Kabila of ""human cost of war"", 30 January 2001, Reuters News",0,1,0,0,UN,11024,0,0,0,0,0,0,0,0,0,0,0,0,0,0,0,0,0,0,0,1,1,3,0,0,1,0,0,0,0,0
1183,,,490,0,,42,1,0,0,01/30/2001,01/30/2001,1,"""Mbeki arrives in Kinshasa for talks with Kabila on DR Congo war ATTENTION - ADDS details, background /// "", 30 January 2001, Agence France-Presse",1,0,0,0,South Africa,560,0,0,0,0,0,0,0,0,0,0,0,0,0,0,0,0,0,0,0,1,1,3,0,0,0,1,0,0,0,0
1184,DR Congo (Zaire),86,490,2,Government of DR Congo (Zaire) - RCD,40,1,0,1,01/31/2001,01/31/2001,1,"""UNHCR reminds Kabila of ""human cost of war"", 30 January 2001, Reuters News",1,0,0,0,France,220,0,0,0,0,0,0,0,0,0,0,0,0,0,0,0,0,0,0,0,1,1,3,0,0,0,1,0,0,0,0
1185,DR Congo (Zaire),86,490,2,Government of DR Congo (Zaire) - MLC,41,1,0,1,01/31/2001,01/31/2001,1,"""UNHCR reminds Kabila of ""human cost of war"", 30 January 2001, Reuters News",1,0,0,0,France,220,0,0,0,0,0,0,0,0,0,0,0,0,0,0,0,0,0,0,0,1,1,3,0,0,0,1,0,0,0,0
1186,,,490,0,,42,1,0,0,01/31/2001,01/31/2001,1,"""UNHCR reminds Kabila of ""human cost of war"", 30 January 2001, Reuters News",1,0,0,0,France,220,0,0,0,0,0,0,0,0,0,0,0,0,0,0,0,0,0,0,0,1,1,3,0,0,0,1,0,0,0,0
1187,DR Congo (Zaire),86,490,2,Government of DR Congo (Zaire) - RCD,40,1,0,1,02/01/2001,02/01/2001,1,"""UNHCR reminds Kabila of ""human cost of war"", 30 January 2001, Reuters News",1,0,0,0,USA,2,0,0,0,0,0,0,0,0,0,0,0,0,0,0,0,0,0,0,0,1,1,3,0,0,0,1,0,0,0,0
1188,DR Congo (Zaire),86,490,2,Government of DR Congo (Zaire) - MLC,41,1,0,1,02/01/2001,02/01/2001,1,"""UNHCR reminds Kabila of ""human cost of war"", 30 January 2001, Reuters News",1,0,0,0,USA,2,0,0,0,0,0,0,0,0,0,0,0,0,0,0,0,0,0,0,0,1,1,3,0,0,0,1,0,0,0,0
1189,,,490,0,,42,1,0,0,02/01/2001,02/01/2001,1,"""UNHCR reminds Kabila of ""human cost of war"", 30 January 2001, Reuters News",1,0,0,0,USA,2,0,0,0,0,0,0,0,0,0,0,0,0,0,0,0,0,0,0,0,1,1,3,0,0,0,1,0,0,0,0
1190,DR Congo (Zaire),86,490,2,Government of DR Congo (Zaire) - RCD,40,1,0,1,02/02/2001,02/02/2001,1,"""UNHCR reminds Kabila of ""human cost of war"", 30 January 2001, Reuters News",0,1,0,0,UN,11024,0,0,0,0,0,0,0,0,0,0,0,0,0,0,0,0,0,0,0,1,1,3,0,0,0,1,0,0,0,0
1191,DR Congo (Zaire),86,490,2,Government of DR Congo (Zaire) - MLC,41,1,0,1,02/02/2001,02/02/2001,1,"""UNHCR reminds Kabila of ""human cost of war"", 30 January 2001, Reuters News",0,1,0,0,UN,11024,0,0,0,0,0,0,0,0,0,0,0,0,0,0,0,0,0,0,0,1,1,3,0,0,0,1,0,0,0,0
1192,,,490,0,,42,1,0,0,02/02/2001,02/02/2001,1,"""UNHCR reminds Kabila of ""human cost of war"", 30 January 2001, Reuters News",0,1,0,0,UN,11024,0,0,0,0,0,0,0,0,0,0,0,0,0,0,0,0,0,0,0,1,1,3,0,0,0,1,0,0,0,0
1193,DR Congo (Zaire),86,490,2,Government of DR Congo (Zaire) - RCD,40,1,0,1,02/03/2001,02/03/2001,1,"""Congo's Kabila in Belgium, PM calls for peace talks."", 3 February 2001, Reuters News",1,0,0,0,Belgium,211,0,0,0,0,0,0,0,0,0,0,0,0,0,0,0,0,0,0,0,1,1,3,0,0,0,1,0,0,0,0
1194,DR Congo (Zaire),86,490,2,Government of DR Congo (Zaire) - MLC,41,1,0,1,02/03/2001,02/03/2001,1,"""Congo's Kabila in Belgium, PM calls for peace talks."", 3 February 2001, Reuters News",1,0,0,0,Belgium,211,0,0,0,0,0,0,0,0,0,0,0,0,0,0,0,0,0,0,0,1,1,3,0,0,0,1,0,0,0,0
1195,,,490,0,,42,1,0,0,02/03/2001,02/03/2001,1,"""Congo's Kabila in Belgium, PM calls for peace talks."", 3 February 2001, Reuters News",1,0,0,0,Belgium,211,0,0,0,0,0,0,0,0,0,0,0,0,0,0,0,0,0,0,0,1,1,3,0,0,0,1,0,0,0,0
1196,DR Congo (Zaire),86,490,2,Government of DR Congo (Zaire) - RCD,40,1,0,1,02/14/2001,02/14/2001,1,"""Senior UN official on Congo assessment mission"", 14 February 2001, Reuters News",0,1,0,0,UN,11024,0,0,0,0,0,0,0,0,0,0,0,0,0,0,0,0,0,0,0,1,1,3,0,0,0,1,0,0,0,0
1197,DR Congo (Zaire),86,490,2,Government of DR Congo (Zaire) - MLC,41,1,0,1,02/14/2001,02/14/2001,1,"""Senior UN official on Congo assessment mission"", 14 February 2001, Reuters News",0,1,0,0,UN,11024,0,0,0,0,0,0,0,0,0,0,0,0,0,0,0,0,0,0,0,1,1,3,0,0,0,1,0,0,0,0
1198,,,490,0,,42,1,0,0,02/14/2001,02/14/2001,1,"""Senior UN official on Congo assessment mission"", 14 February 2001, Reuters News",0,1,0,0,UN,11024,0,0,0,0,0,0,0,0,0,0,0,0,0,0,0,0,0,0,0,1,1,3,0,0,0,1,0,0,0,0
1199,DR Congo (Zaire),86,490,2,Government of DR Congo (Zaire) - RCD,40,0,0,1,02/15/2001,02/15/2001,1,"""African Rebel, Govt Heads Make Gains In Congo Peace Talks"", 15 February 2001, Dow Jones International News AND ""Congo Summit Welcomes Deployment of More UN Observers"", by Chai Shikuan, Xiong Sihao, 16 February 2001, Xinhua News Agency",0,3,0,0,"UN, AU, South African Development Community",11024,11000,11019,0,0,0,0,0,0,0,0,0,0,0,0,0,0,0,0,0,3,3,1,1,1,1,0,0,0,0,0
1200,DR Congo (Zaire),86,490,2,Government of DR Congo (Zaire) - MLC,41,0,0,1,02/15/2001,02/15/2001,1,"""African Rebel, Govt Heads Make Gains In Congo Peace Talks"", 15 February 2001, Dow Jones International News AND ""Congo Summit Welcomes Deployment of More UN Observers"", by Chai Shikuan, Xiong Sihao, 16 February 2001, Xinhua News Agency",0,3,0,0,"UN, AU, South African Development Community",11024,11000,11019,0,0,0,0,0,0,0,0,0,0,0,0,0,0,0,0,0,3,3,1,1,1,1,0,0,0,0,0
1201,,,490,0,,42,0,0,0,02/15/2001,02/15/2001,1,"""African Rebel, Govt Heads Make Gains In Congo Peace Talks"", 15 February 2001, Dow Jones International News AND ""Congo Summit Welcomes Deployment of More UN Observers"", by Chai Shikuan, Xiong Sihao, 16 February 2001, Xinhua News Agency",0,3,0,0,"UN, AU, South African Development Community",11024,11000,11019,0,0,0,0,0,0,0,0,0,0,0,0,0,0,0,0,0,3,3,1,1,1,1,0,0,0,0,0
1202,DR Congo (Zaire),86,490,2,Government of DR Congo (Zaire) - RCD,40,0,0,1,02/21/2001,02/22/2001,1,"""UN Chief: Congo's Warring Sides Must Implement Cease-fire "", 20 February 2001, Dow Jones International News AND ""UN endorse retreat of DRC belligerents"", 22 February 2001, Agence France-Presse",0,1,0,0,UN,11024,0,0,0,0,0,0,0,0,0,0,0,0,0,0,0,0,0,0,0,1,3,1,1,0,1,0,0,0,0,0
1203,DR Congo (Zaire),86,490,2,Government of DR Congo (Zaire) - MLC,41,0,0,1,02/21/2001,02/22/2001,1,"""UN Chief: Congo's Warring Sides Must Implement Cease-fire "", 20 February 2001, Dow Jones International News AND ""UN endorse retreat of DRC belligerents"", 22 February 2001, Agence France-Presse",0,1,0,0,UN,11024,0,0,0,0,0,0,0,0,0,0,0,0,0,0,0,0,0,0,0,1,3,1,1,0,1,0,0,0,0,0
1204,,,490,0,,42,0,0,0,02/21/2001,02/22/2001,1,"""UN Chief: Congo's Warring Sides Must Implement Cease-fire "", 20 February 2001, Dow Jones International News AND ""UN endorse retreat of DRC belligerents"", 22 February 2001, Agence France-Presse",0,1,0,0,UN,11024,0,0,0,0,0,0,0,0,0,0,0,0,0,0,0,0,0,0,0,1,3,1,1,0,1,0,0,0,0,0
1205,DR Congo (Zaire),86,490,2,Government of DR Congo (Zaire) - RCD,40,1,0,1,03/16/2001,03/16/2001,1,"""Congo mediator meets Kabila in Kinshasa."", 18 March 2001, Reuters News",0,1,0,0,EC/EU,11010,0,0,0,0,0,0,0,0,0,0,0,0,0,0,0,0,0,0,0,1,1,3,0,0,0,1,0,0,0,0
1206,DR Congo (Zaire),86,490,2,Government of DR Congo (Zaire) - RCD,40,1,0,1,03/16/2001,03/16/2001,1,"""Congo mediator meets Kabila in Kinshasa."", 18 March 2001, Reuters News",1,0,0,0,Belgium,211,0,0,0,0,0,0,0,0,0,0,0,0,0,0,0,0,0,0,0,1,1,0,0,0,0,0,1,0,0,0
1207,DR Congo (Zaire),86,490,2,Government of DR Congo (Zaire) - MLC,41,1,0,1,03/16/2001,03/16/2001,1,"""Congo mediator meets Kabila in Kinshasa."", 18 March 2001, Reuters News",0,1,0,0,EC/EU,11010,0,0,0,0,0,0,0,0,0,0,0,0,0,0,0,0,0,0,0,1,1,3,0,0,0,1,0,0,0,0
1208,DR Congo (Zaire),86,490,2,Government of DR Congo (Zaire) - MLC,41,1,0,1,03/16/2001,03/16/2001,1,"""Congo mediator meets Kabila in Kinshasa."", 18 March 2001, Reuters News",1,0,0,0,Belgium,211,0,0,0,0,0,0,0,0,0,0,0,0,0,0,0,0,0,0,0,1,1,0,0,0,0,0,1,0,0,0
1209,,,490,0,,42,1,0,0,03/16/2001,03/16/2001,1,"""Congo mediator meets Kabila in Kinshasa."", 18 March 2001, Reuters News",0,1,0,0,EC/EU,11010,0,0,0,0,0,0,0,0,0,0,0,0,0,0,0,0,0,0,0,1,1,3,0,0,0,1,0,0,0,0
1210,,,490,0,,42,1,0,0,03/16/2001,03/16/2001,1,"""Congo mediator meets Kabila in Kinshasa."", 18 March 2001, Reuters News",1,0,0,0,Belgium,211,0,0,0,0,0,0,0,0,0,0,0,0,0,0,0,0,0,0,0,1,1,0,0,0,0,0,1,0,0,0
1211,DR Congo (Zaire),86,490,2,Government of DR Congo (Zaire) - RCD,40,1,0,1,03/18/2001,03/18/2001,1,"""Congo mediator meets Kabila in Kinshasa."", 18 March 2001, Reuters News",0,1,0,0,AU,11000,0,0,0,0,0,0,0,0,0,0,0,0,0,0,0,0,0,0,0,1,1,3,0,0,0,1,0,0,0,0
1212,DR Congo (Zaire),86,490,2,Government of DR Congo (Zaire) - MLC,41,1,0,1,03/18/2001,03/18/2001,1,"""Congo mediator meets Kabila in Kinshasa."", 18 March 2001, Reuters News",0,1,0,0,AU,11000,0,0,0,0,0,0,0,0,0,0,0,0,0,0,0,0,0,0,0,1,1,3,0,0,0,1,0,0,0,0
1213,,,490,0,,42,1,0,0,03/18/2001,03/18/2001,1,"""Congo mediator meets Kabila in Kinshasa."", 18 March 2001, Reuters News",0,1,0,0,AU,11000,0,0,0,0,0,0,0,0,0,0,0,0,0,0,0,0,0,0,0,1,1,3,0,0,0,1,0,0,0,0
1214,DR Congo (Zaire),86,490,2,Government of DR Congo (Zaire) - RCD,40,1,0,1,03/29/2001,03/30/2001,1,"""Kabila arrives in Geneva for UN rights session on DR Congo "", 29 March 2001, Agence France-Presse",0,1,0,0,UN,11024,0,0,0,0,0,0,0,0,0,0,0,0,0,0,0,0,0,0,0,1,1,3,0,0,1,0,0,0,0,0
1215,DR Congo (Zaire),86,490,2,Government of DR Congo (Zaire) - RCD,40,1,0,1,03/29/2001,03/30/2001,1,"""Kabila arrives in Geneva for UN rights session on DR Congo "", 29 March 2001, Agence France-Presse",1,0,0,0,Switzerland,225,0,0,0,0,0,0,0,0,0,0,0,0,0,0,0,0,0,0,0,1,1,0,0,0,0,0,1,0,0,0
1216,DR Congo (Zaire),86,490,2,Government of DR Congo (Zaire) - MLC,41,1,0,1,03/29/2001,03/30/2001,1,"""Kabila arrives in Geneva for UN rights session on DR Congo "", 29 March 2001, Agence France-Presse",0,1,0,0,UN,11024,0,0,0,0,0,0,0,0,0,0,0,0,0,0,0,0,0,0,0,1,1,3,0,0,1,0,0,0,0,0
1217,DR Congo (Zaire),86,490,2,Government of DR Congo (Zaire) - MLC,41,1,0,1,03/29/2001,03/30/2001,1,"""Kabila arrives in Geneva for UN rights session on DR Congo "", 29 March 2001, Agence France-Presse",1,0,0,0,Switzerland,225,0,0,0,0,0,0,0,0,0,0,0,0,0,0,0,0,0,0,0,1,1,0,0,0,0,0,1,0,0,0
1218,,,490,0,,42,1,0,0,03/29/2001,03/30/2001,1,"""Kabila arrives in Geneva for UN rights session on DR Congo "", 29 March 2001, Agence France-Presse",0,1,0,0,UN,11024,0,0,0,0,0,0,0,0,0,0,0,0,0,0,0,0,0,0,0,1,1,3,0,0,1,0,0,0,0,0
1219,,,490,0,,42,1,0,0,03/29/2001,03/30/2001,1,"""Kabila arrives in Geneva for UN rights session on DR Congo "", 29 March 2001, Agence France-Presse",1,0,0,0,Switzerland,225,0,0,0,0,0,0,0,0,0,0,0,0,0,0,0,0,0,0,0,1,1,0,0,0,0,0,1,0,0,0
1220,DR Congo (Zaire),86,490,2,Government of DR Congo (Zaire) - RCD,40,1,0,1,03/30/2001,03/30/2001,1,"""Kabila arrives in Geneva for UN rights session on DR Congo "", 29 March 2001, Agence France-Presse",1,0,0,0,France,220,0,0,0,0,0,0,0,0,0,0,0,0,0,0,0,0,0,0,0,1,1,3,0,0,0,1,0,0,0,0
1221,DR Congo (Zaire),86,490,2,Government of DR Congo (Zaire) - MLC,41,1,0,1,03/30/2001,03/30/2001,1,"""Kabila arrives in Geneva for UN rights session on DR Congo "", 29 March 2001, Agence France-Presse",1,0,0,0,France,220,0,0,0,0,0,0,0,0,0,0,0,0,0,0,0,0,0,0,0,1,1,3,0,0,0,1,0,0,0,0
1222,,,490,0,,42,1,0,0,03/30/2001,03/30/2001,1,"""Kabila arrives in Geneva for UN rights session on DR Congo "", 29 March 2001, Agence France-Presse",1,0,0,0,France,220,0,0,0,0,0,0,0,0,0,0,0,0,0,0,0,0,0,0,0,1,1,3,0,0,0,1,0,0,0,0
1223,DR Congo (Zaire),86,490,2,Government of DR Congo (Zaire) - RCD,40,0,0,1,04/04/2001,04/04/2001,1,"""Military experts on DRC peace assess troop disengagement"", 4 April 2001, Agence France-Presse",0,1,0,0,AU,11000,0,0,0,0,0,0,0,0,0,0,0,0,0,0,0,0,0,0,0,1,3,1,0,0,1,0,0,0,0,0
1224,DR Congo (Zaire),86,490,2,Government of DR Congo (Zaire) - RCD,40,0,0,1,04/04/2001,04/04/2001,1,"""Military experts on DRC peace assess troop disengagement"", 4 April 2001, Agence France-Presse",1,0,0,0,Zambia,551,0,0,0,0,0,0,0,0,0,0,0,0,0,0,0,0,0,0,0,1,3,0,0,0,0,0,1,0,0,0
1225,DR Congo (Zaire),86,490,2,Government of DR Congo (Zaire) - MLC,41,0,0,1,04/04/2001,04/04/2001,1,"""Military experts on DRC peace assess troop disengagement"", 4 April 2001, Agence France-Presse",0,1,0,0,AU,11000,0,0,0,0,0,0,0,0,0,0,0,0,0,0,0,0,0,0,0,1,3,1,0,0,1,0,0,0,0,0
1226,DR Congo (Zaire),86,490,2,Government of DR Congo (Zaire) - MLC,41,0,0,1,04/04/2001,04/04/2001,1,"""Military experts on DRC peace assess troop disengagement"", 4 April 2001, Agence France-Presse",1,0,0,0,Zambia,551,0,0,0,0,0,0,0,0,0,0,0,0,0,0,0,0,0,0,0,1,3,0,0,0,0,0,1,0,0,0
1227,,,490,0,,42,0,0,0,04/04/2001,04/04/2001,1,"""Military experts on DRC peace assess troop disengagement"", 4 April 2001, Agence France-Presse",0,1,0,0,AU,11000,0,0,0,0,0,0,0,0,0,0,0,0,0,0,0,0,0,0,0,1,3,1,0,0,1,0,0,0,0,0
1228,,,490,0,,42,0,0,0,04/04/2001,04/04/2001,1,"""Military experts on DRC peace assess troop disengagement"", 4 April 2001, Agence France-Presse",1,0,0,0,Zambia,551,0,0,0,0,0,0,0,0,0,0,0,0,0,0,0,0,0,0,0,1,3,0,0,0,0,0,1,0,0,0
1229,DR Congo (Zaire),86,490,2,Government of DR Congo (Zaire) - RCD,40,1,0,1,04/08/2001,04/08/2001,1,"""Congo mediator in Kinshasa, upbeat on dialogue"", 8 April 2001, Reuters News",0,1,0,0,AU,11000,0,0,0,0,0,0,0,0,0,0,0,0,0,0,0,0,0,0,0,1,1,3,0,0,0,1,0,0,0,0
1230,DR Congo (Zaire),86,490,2,Government of DR Congo (Zaire) - MLC,41,1,0,1,04/08/2001,04/08/2001,1,"""Congo mediator in Kinshasa, upbeat on dialogue"", 8 April 2001, Reuters News",0,1,0,0,AU,11000,0,0,0,0,0,0,0,0,0,0,0,0,0,0,0,0,0,0,0,1,1,3,0,0,0,1,0,0,0,0
1231,,,490,0,,42,1,0,0,04/08/2001,04/08/2001,1,"""Congo mediator in Kinshasa, upbeat on dialogue"", 8 April 2001, Reuters News",0,1,0,0,AU,11000,0,0,0,0,0,0,0,0,0,0,0,0,0,0,0,0,0,0,0,1,1,3,0,0,0,1,0,0,0,0
1232,DR Congo (Zaire),86,490,2,Government of DR Congo (Zaire) - RCD,40,1,0,1,04/12/2001,04/12/2001,1,"""UPDATE 1-Congo's Kabila holds talks with Nigeria's Obasanjo."", 12 April 2001, Reuters News",1,0,0,0,Nigeria,475,0,0,0,0,0,0,0,0,0,0,0,0,0,0,0,0,0,0,0,1,1,3,0,0,0,1,0,0,0,0
1233,DR Congo (Zaire),86,490,2,Government of DR Congo (Zaire) - MLC,41,1,0,1,04/12/2001,04/12/2001,1,"""UPDATE 1-Congo's Kabila holds talks with Nigeria's Obasanjo."", 12 April 2001, Reuters News",1,0,0,0,Nigeria,475,0,0,0,0,0,0,0,0,0,0,0,0,0,0,0,0,0,0,0,1,1,3,0,0,0,1,0,0,0,0
1234,,,490,0,,42,1,0,0,04/12/2001,04/12/2001,1,"""UPDATE 1-Congo's Kabila holds talks with Nigeria's Obasanjo."", 12 April 2001, Reuters News",1,0,0,0,Nigeria,475,0,0,0,0,0,0,0,0,0,0,0,0,0,0,0,0,0,0,0,1,1,3,0,0,0,1,0,0,0,0
1235,DR Congo (Zaire),86,490,2,Government of DR Congo (Zaire) - RCD,40,0,0,1,04/17/2001,04/17/2001,1,"""Kabila demands Burundi rebels leave DRCongo"", 18 April 2001, Agence France-Presse",1,0,0,0,Burundi,516,0,0,0,0,0,0,0,0,0,0,0,0,0,0,0,0,0,0,0,1,1,3,0,0,1,0,0,0,0,0
1236,DR Congo (Zaire),86,490,2,Government of DR Congo (Zaire) - RCD,40,0,0,1,04/17/2001,04/17/2001,1,"""Kabila demands Burundi rebels leave DRCongo"", 18 April 2001, Agence France-Presse",1,0,0,0,Gabon,481,0,0,0,0,0,0,0,0,0,0,0,0,0,0,0,0,0,0,0,1,1,0,0,0,0,0,1,0,0,0
1237,DR Congo (Zaire),86,490,2,Government of DR Congo (Zaire) - RCD,40,1,0,1,05/05/2001,05/07/2001,1,"""Tanzania's Mkapa praises Kabila's peace moves in DRC "", 6 May 2001, Agence France-Presse",1,0,0,0,Tanzania,510,0,0,0,0,0,0,0,0,0,0,0,0,0,0,0,0,0,0,0,1,1,3,0,0,0,1,0,0,0,0
1238,DR Congo (Zaire),86,490,2,Government of DR Congo (Zaire) - MLC,41,1,0,1,05/05/2001,05/07/2001,1,"""Tanzania's Mkapa praises Kabila's peace moves in DRC "", 6 May 2001, Agence France-Presse",1,0,0,0,Tanzania,510,0,0,0,0,0,0,0,0,0,0,0,0,0,0,0,0,0,0,0,1,1,3,0,0,0,1,0,0,0,0
1239,,,490,0,,42,1,0,0,05/05/2001,05/07/2001,1,"""Tanzania's Mkapa praises Kabila's peace moves in DRC "", 6 May 2001, Agence France-Presse",1,0,0,0,Tanzania,510,0,0,0,0,0,0,0,0,0,0,0,0,0,0,0,0,0,0,0,1,1,3,0,0,0,1,0,0,0,0
1240,DR Congo (Zaire),86,490,2,Government of DR Congo (Zaire) - RCD,40,1,0,1,05/08/2001,05/08/2001,1,"""Nigerian president to visit DRCongo, Rwanda, US and Belgium "", 7 May 2001, Agence France-Presse",1,0,0,0,Nigeria,475,0,0,0,0,0,0,0,0,0,0,0,0,0,0,0,0,0,0,0,1,1,3,0,0,0,1,0,0,0,0
1241,DR Congo (Zaire),86,490,2,Government of DR Congo (Zaire) - MLC,41,1,0,1,05/08/2001,05/08/2001,1,"""Nigerian president to visit DRCongo, Rwanda, US and Belgium "", 7 May 2001, Agence France-Presse",1,0,0,0,Nigeria,475,0,0,0,0,0,0,0,0,0,0,0,0,0,0,0,0,0,0,0,1,1,3,0,0,0,1,0,0,0,0
1242,,,490,0,,42,1,0,0,05/08/2001,05/08/2001,1,"""Nigerian president to visit DRCongo, Rwanda, US and Belgium "", 7 May 2001, Agence France-Presse",1,0,0,0,Nigeria,475,0,0,0,0,0,0,0,0,0,0,0,0,0,0,0,0,0,0,0,1,1,3,0,0,0,1,0,0,0,0
1243,DR Congo (Zaire),86,490,2,Government of DR Congo (Zaire) - RCD,40,0,0,1,05/16/2001,05/17/2001,1,"""UPDATE 1-Congo commission meets on disarming militias. , By Manoah Esipisu, 16 May 2001, Reuters News",0,1,0,0,AU,11000,0,0,0,0,0,0,0,0,0,0,0,0,0,0,0,0,0,0,0,1,3,1,0,1,1,0,0,0,0,0
1244,DR Congo (Zaire),86,490,2,Government of DR Congo (Zaire) - MLC,41,0,0,1,05/16/2001,05/17/2001,1,"""UPDATE 1-Congo commission meets on disarming militias. , By Manoah Esipisu, 16 May 2001, Reuters News",0,1,0,0,AU,11000,0,0,0,0,0,0,0,0,0,0,0,0,0,0,0,0,0,0,0,1,3,1,0,1,1,0,0,0,0,0
1245,,,490,0,,42,0,0,0,05/16/2001,05/17/2001,1,"""UPDATE 1-Congo commission meets on disarming militias. , By Manoah Esipisu, 16 May 2001, Reuters News",0,1,0,0,AU,11000,0,0,0,0,0,0,0,0,0,0,0,0,0,0,0,0,0,0,0,1,3,1,0,1,1,0,0,0,0,0
1246,DR Congo (Zaire),86,490,2,Government of DR Congo (Zaire) - RCD,40,1,0,1,05/19/2001,05/19/2001,1,"""Congo allies to hold key talks with UN mission. "", By Buchizya Mseteka , 18 May 2001, Reuters News",0,1,0,0,UN,11024,0,0,0,0,0,0,0,0,0,0,0,0,0,0,0,0,0,0,0,1,1,3,0,1,1,0,0,0,0,0
1247,DR Congo (Zaire),86,490,2,Government of DR Congo (Zaire) - MLC,41,1,0,1,05/19/2001,05/19/2001,1,"""Congo allies to hold key talks with UN mission. "", By Buchizya Mseteka , 18 May 2001, Reuters News",0,1,0,0,UN,11024,0,0,0,0,0,0,0,0,0,0,0,0,0,0,0,0,0,0,0,1,1,3,0,1,1,0,0,0,0,0
1248,,,490,0,,42,1,0,0,05/19/2001,05/19/2001,1,"""Congo allies to hold key talks with UN mission. "", By Buchizya Mseteka , 18 May 2001, Reuters News",0,1,0,0,UN,11024,0,0,0,0,0,0,0,0,0,0,0,0,0,0,0,0,0,0,0,1,1,3,0,1,1,0,0,0,0,0
1249,DR Congo (Zaire),86,490,2,Government of DR Congo (Zaire) - RCD,40,0,0,1,05/21/2001,05/21/2001,1,"""UPDATE 1-African ministers discuss Congo peace plan."", By Manoah Esipisu, 21 May 2001, Reuters News",0,1,0,0,AU,11000,0,0,0,0,0,0,0,0,0,0,0,0,0,0,0,0,0,0,0,1,3,1,0,1,1,0,0,0,0,0
1250,DR Congo (Zaire),86,490,2,Government of DR Congo (Zaire) - MLC,41,0,0,1,05/21/2001,05/21/2001,1,"""UPDATE 1-African ministers discuss Congo peace plan."", By Manoah Esipisu, 21 May 2001, Reuters News",0,1,0,0,AU,11000,0,0,0,0,0,0,0,0,0,0,0,0,0,0,0,0,0,0,0,1,3,1,0,1,1,0,0,0,0,0
1251,,,490,0,,42,0,0,0,05/21/2001,05/21/2001,1,"""UPDATE 1-African ministers discuss Congo peace plan."", By Manoah Esipisu, 21 May 2001, Reuters News",0,1,0,0,AU,11000,0,0,0,0,0,0,0,0,0,0,0,0,0,0,0,0,0,0,0,1,3,1,0,1,1,0,0,0,0,0
1252,DR Congo (Zaire),86,490,2,Government of DR Congo (Zaire) - RCD,40,0,0,1,07/09/2001,07/09/2001,1,"""Annan in talks on disarming Congo militia. "", 10 July 2001, Reuters News",0,1,0,0,UN,11024,0,0,0,0,0,0,0,0,0,0,0,0,0,0,0,0,0,0,0,1,1,3,0,1,1,0,0,0,0,0
1253,DR Congo (Zaire),86,490,2,Government of DR Congo (Zaire) - RCD,40,1,0,1,08/08/2001,08/08/2001,1,"""Britain promises Congo help to disarm Hutus"", 9 August 2001, Reuters News",1,0,0,0,UK,200,0,0,0,0,0,0,0,0,0,0,0,0,0,0,0,0,0,0,0,1,1,3,0,1,1,0,0,0,0,0
1254,DR Congo (Zaire),86,490,2,Government of DR Congo (Zaire) - MLC,41,1,0,1,08/08/2001,08/08/2001,1,"""Britain promises Congo help to disarm Hutus"", 9 August 2001, Reuters News",1,0,0,0,UK,200,0,0,0,0,0,0,0,0,0,0,0,0,0,0,0,0,0,0,0,1,1,3,0,1,1,0,0,0,0,0
1255,,,490,0,,42,1,0,0,08/08/2001,08/08/2001,1,"""Britain promises Congo help to disarm Hutus"", 9 August 2001, Reuters News",1,0,0,0,UK,200,0,0,0,0,0,0,0,0,0,0,0,0,0,0,0,0,0,0,0,1,1,3,0,1,1,0,0,0,0,0
1256,DR Congo (Zaire),86,490,2,Government of DR Congo (Zaire) - RCD,40,1,0,1,08/16/2001,08/17/2001,1,"""Kabila says UN ""too silent"" on Congo peace effort."", 17 August 2001, Reuters News",0,1,0,0,South African Development Community,11019,0,0,0,0,0,0,0,0,0,0,0,0,0,0,0,0,0,0,0,1,1,3,0,0,0,1,0,0,0,0
1257,DR Congo (Zaire),86,490,2,Government of DR Congo (Zaire) - MLC,41,1,0,1,08/16/2001,08/17/2001,1,"""Kabila says UN ""too silent"" on Congo peace effort."", 17 August 2001, Reuters News",0,1,0,0,South African Development Community,11019,0,0,0,0,0,0,0,0,0,0,0,0,0,0,0,0,0,0,0,1,1,3,0,0,0,1,0,0,0,0
1258,,,490,0,,42,1,0,0,08/16/2001,08/17/2001,1,"""Kabila says UN ""too silent"" on Congo peace effort."", 17 August 2001, Reuters News",0,1,0,0,South African Development Community,11019,0,0,0,0,0,0,0,0,0,0,0,0,0,0,0,0,0,0,0,1,1,3,0,0,0,1,0,0,0,0
1259,DR Congo (Zaire),86,490,2,Government of DR Congo (Zaire) - RCD,40,1,0,1,08/17/2001,08/17/2001,1,"""Congo's Kabila arrives in Mozambique."", 17 August 2001, Reuters News",1,0,0,0,Mozambique,541,0,0,0,0,0,0,0,0,0,0,0,0,0,0,0,0,0,0,0,1,1,3,0,0,0,1,0,0,0,0
1260,DR Congo (Zaire),86,490,2,Government of DR Congo (Zaire) - MLC,41,1,0,1,08/17/2001,08/17/2001,1,"""Congo's Kabila arrives in Mozambique."", 17 August 2001, Reuters News",1,0,0,0,Mozambique,541,0,0,0,0,0,0,0,0,0,0,0,0,0,0,0,0,0,0,0,1,1,3,0,0,0,1,0,0,0,0
1261,,,490,0,,42,1,0,0,08/17/2001,08/17/2001,1,"""Congo's Kabila arrives in Mozambique."", 17 August 2001, Reuters News",1,0,0,0,Mozambique,541,0,0,0,0,0,0,0,0,0,0,0,0,0,0,0,0,0,0,0,1,1,3,0,0,0,1,0,0,0,0
1262,DR Congo (Zaire),86,490,2,Government of DR Congo (Zaire) - RCD,40,0,0,1,08/20/2001,08/24/2001,1,"""Congolese Parties at Loggerheads Over Withdrawal of Foreign Troops."", 22 August 2001, Xinhua News Agency",2,1,0,0,"Botswana, Zambia, AU",571,551,11000,0,0,0,0,0,0,0,0,0,0,0,0,0,0,0,0,0,3,3,1,0,0,1,0,0,0,0,0
1263,DR Congo (Zaire),86,490,2,Government of DR Congo (Zaire) - MLC,41,0,0,1,08/20/2001,08/24/2001,1,"""Congolese Parties at Loggerheads Over Withdrawal of Foreign Troops."", 22 August 2001, Xinhua News Agency",2,1,0,0,"Botswana, Zambia, AU",571,551,11000,0,0,0,0,0,0,0,0,0,0,0,0,0,0,0,0,0,3,3,1,0,0,1,0,0,0,0,0
1264,,,490,0,,42,0,0,0,08/20/2001,08/24/2001,1,"""Congolese Parties at Loggerheads Over Withdrawal of Foreign Troops."", 22 August 2001, Xinhua News Agency",2,1,0,0,"Botswana, Zambia, AU",571,551,11000,0,0,0,0,0,0,0,0,0,0,0,0,0,0,0,0,0,3,3,1,0,0,1,0,0,0,0,0
1265,DR Congo (Zaire),86,490,2,Government of DR Congo (Zaire) - RCD,40,1,0,1,08/29/2001,08/30/2001,1,"""Congo's Kabila to visit South Africa"", 24 August 2001, Reuters News",1,0,0,0,South Africa,560,0,0,0,0,0,0,0,0,0,0,0,0,0,0,0,0,0,0,0,1,1,3,0,0,0,1,0,0,0,0
1266,DR Congo (Zaire),86,490,2,Government of DR Congo (Zaire) - MLC,41,1,0,1,08/29/2001,08/30/2001,1,"""Congo's Kabila to visit South Africa"", 24 August 2001, Reuters News",1,0,0,0,South Africa,560,0,0,0,0,0,0,0,0,0,0,0,0,0,0,0,0,0,0,0,1,1,3,0,0,0,1,0,0,0,0
1267,,,490,0,,42,1,0,0,08/29/2001,08/30/2001,1,"""Congo's Kabila to visit South Africa"", 24 August 2001, Reuters News",1,0,0,0,South Africa,560,0,0,0,0,0,0,0,0,0,0,0,0,0,0,0,0,0,0,0,1,1,3,0,0,0,1,0,0,0,0
1268,DR Congo (Zaire),86,490,2,Government of DR Congo (Zaire) - RCD,40,1,0,1,09/02/2001,09/02/2001,1,"""UN chief goes to rebel-held town in DR Congo "", 3 September 2001, Agence France-Presse",0,1,0,0,UN,11024,0,0,0,0,0,0,0,0,0,0,0,0,0,0,0,0,0,0,0,1,1,3,0,0,0,1,0,0,0,0
1269,DR Congo (Zaire),86,490,2,Government of DR Congo (Zaire) - MLC,41,1,0,1,09/02/2001,09/02/2001,1,"""UN chief goes to rebel-held town in DR Congo "", 3 September 2001, Agence France-Presse",0,1,0,0,UN,11024,0,0,0,0,0,0,0,0,0,0,0,0,0,0,0,0,0,0,0,1,1,3,0,0,0,1,0,0,0,0
1270,,,490,0,,42,1,0,0,09/02/2001,09/02/2001,1,"""UN chief goes to rebel-held town in DR Congo "", 3 September 2001, Agence France-Presse",0,1,0,0,UN,11024,0,0,0,0,0,0,0,0,0,0,0,0,0,0,0,0,0,0,0,1,1,3,0,0,0,1,0,0,0,0
1271,DR Congo (Zaire),86,490,2,Government of DR Congo (Zaire) - RCD,40,1,0,1,10/02/2001,10/02/2001,1,"""Congo's Kabila holds talks with Nigerian president"", 2 October 2001, Reuters News",1,0,0,0,Nigeria,475,0,0,0,0,0,0,0,0,0,0,0,0,0,0,0,0,0,0,0,1,1,3,0,0,0,1,0,0,0,0
1272,DR Congo (Zaire),86,490,2,Government of DR Congo (Zaire) - MLC,41,1,0,1,10/02/2001,10/02/2001,1,"""Congo's Kabila holds talks with Nigerian president"", 2 October 2001, Reuters News",1,0,0,0,Nigeria,475,0,0,0,0,0,0,0,0,0,0,0,0,0,0,0,0,0,0,0,1,1,3,0,0,0,1,0,0,0,0
1273,,,490,0,,42,1,0,0,10/02/2001,10/02/2001,1,"""Congo's Kabila holds talks with Nigerian president"", 2 October 2001, Reuters News",1,0,0,0,Nigeria,475,0,0,0,0,0,0,0,0,0,0,0,0,0,0,0,0,0,0,0,1,1,3,0,0,0,1,0,0,0,0
1274,DR Congo (Zaire),86,490,2,Government of DR Congo (Zaire) - RCD,40,0,0,1,11/09/2001,11/09/2001,1,"""African leaders to review Congo peace at U.N."", 7 November 2001, Reuters News",1,0,0,0,Zambia,551,0,0,0,0,0,0,0,0,0,0,0,0,0,0,0,0,0,0,0,1,1,3,0,0,0,1,0,0,0,0
1275,DR Congo (Zaire),86,490,2,Government of DR Congo (Zaire) - MLC,41,0,0,1,11/09/2001,11/09/2001,1,"""African leaders to review Congo peace at U.N."", 7 November 2001, Reuters News",1,0,0,0,Zambia,551,0,0,0,0,0,0,0,0,0,0,0,0,0,0,0,0,0,0,0,1,1,3,0,0,0,1,0,0,0,0
1276,,,490,0,,42,0,0,0,11/09/2001,11/09/2001,1,"""African leaders to review Congo peace at U.N."", 7 November 2001, Reuters News",1,0,0,0,Zambia,551,0,0,0,0,0,0,0,0,0,0,0,0,0,0,0,0,0,0,0,1,1,3,0,0,0,1,0,0,0,0
1277,DR Congo (Zaire),86,490,2,Government of DR Congo (Zaire) - RCD,40,1,0,1,11/22/2001,11/22/2001,1,"""Congolese peace talks to resume in January: EU "", 22 November 2001, Agence France-Presse",0,2,0,0,"EC/EU, AU",11010,11000,0,0,0,0,0,0,0,0,0,0,0,0,0,0,0,0,0,0,2,1,3,0,0,0,1,0,0,0,0
1278,DR Congo (Zaire),86,490,2,Government of DR Congo (Zaire) - MLC,41,1,0,1,11/22/2001,11/22/2001,1,"""Congolese peace talks to resume in January: EU "", 22 November 2001, Agence France-Presse",0,2,0,0,"EC/EU, AU",11010,11000,0,0,0,0,0,0,0,0,0,0,0,0,0,0,0,0,0,0,2,1,3,0,0,0,1,0,0,0,0
1279,,,490,0,,42,1,0,0,11/22/2001,11/22/2001,1,"""Congolese peace talks to resume in January: EU "", 22 November 2001, Agence France-Presse",0,2,0,0,"EC/EU, AU",11010,11000,0,0,0,0,0,0,0,0,0,0,0,0,0,0,0,0,0,0,2,1,3,0,0,0,1,0,0,0,0
1280,DR Congo (Zaire),86,490,2,Government of DR Congo (Zaire) - RCD,40,1,0,1,12/17/2001,12/17/2001,1,"""Southern African ministers meet for conflict talks"", By Buchizya Mseteka , 17 December 2001, Reuters News",0,1,0,0,South African Development Community,11019,0,0,0,0,0,0,0,0,0,0,0,0,0,0,0,0,0,0,0,1,1,3,0,0,0,1,0,0,0,0
1281,DR Congo (Zaire),86,490,2,Government of DR Congo (Zaire) - MLC,41,1,0,1,12/17/2001,12/17/2001,1,"""Southern African ministers meet for conflict talks"", By Buchizya Mseteka , 17 December 2001, Reuters News",0,1,0,0,South African Development Community,11019,0,0,0,0,0,0,0,0,0,0,0,0,0,0,0,0,0,0,0,1,1,3,0,0,0,1,0,0,0,0
1282,,,490,0,,42,1,0,0,12/17/2001,12/17/2001,1,"""Southern African ministers meet for conflict talks"", By Buchizya Mseteka , 17 December 2001, Reuters News",0,1,0,0,South African Development Community,11019,0,0,0,0,0,0,0,0,0,0,0,0,0,0,0,0,0,0,0,1,1,3,0,0,0,1,0,0,0,0
1283,DR Congo (Zaire),86,490,0,Government of DR Congo (Zaire) - RCD,40,1,0,0,01/07/2002,01/08/2002,1,"""Burundi Decides to Withdraw Troops From DRC"", 8 January 2002, Xinhua News Agency",1,0,0,0,Burundi,516,0,0,0,0,0,0,0,0,0,0,0,0,0,0,0,0,0,0,0,1,1,3,0,0,1,0,0,0,0,0
1284,DR Congo (Zaire),86,490,0,Government of DR Congo (Zaire) - RCD,40,1,0,0,01/14/2002,01/14/2002,1,"""SADC Summit Promotes Peace Agenda."", 18 January 2002, All Africa",0,1,0,0,South African Development Community,11019,0,0,0,0,0,0,0,0,0,0,0,0,0,0,0,0,0,0,0,1,1,3,0,0,0,1,0,0,0,0
1285,DR Congo (Zaire),86,490,0,Government of DR Congo (Zaire) - RCD,40,1,0,0,01/14/2002,01/14/2002,1,"""SADC Summit Promotes Peace Agenda."", 18 January 2002, All Africa",1,0,0,0,Malawi,553,0,0,0,0,0,0,0,0,0,0,0,0,0,0,0,0,0,0,0,1,1,0,0,0,0,0,1,0,0,0
1286,DR Congo (Zaire),86,490,0,Government of DR Congo (Zaire) - MLC,41,1,0,0,01/14/2002,01/14/2002,1,"""SADC Summit Promotes Peace Agenda."", 18 January 2002, All Africa",0,1,0,0,South African Development Community,11019,0,0,0,0,0,0,0,0,0,0,0,0,0,0,0,0,0,0,0,1,1,3,0,0,0,1,0,0,0,0
1287,DR Congo (Zaire),86,490,0,Government of DR Congo (Zaire) - MLC,41,1,0,0,01/14/2002,01/14/2002,1,"""SADC Summit Promotes Peace Agenda."", 18 January 2002, All Africa",1,0,0,0,Malawi,553,0,0,0,0,0,0,0,0,0,0,0,0,0,0,0,0,0,0,0,1,1,0,0,0,0,0,1,0,0,0
1288,,,490,0,,42,1,0,0,01/14/2002,01/14/2002,1,"""SADC Summit Promotes Peace Agenda."", 18 January 2002, All Africa",0,1,0,0,South African Development Community,11019,0,0,0,0,0,0,0,0,0,0,0,0,0,0,0,0,0,0,0,1,1,3,0,0,0,1,0,0,0,0
1289,,,490,0,,42,1,0,0,01/14/2002,01/14/2002,1,"""SADC Summit Promotes Peace Agenda."", 18 January 2002, All Africa",1,0,0,0,Malawi,553,0,0,0,0,0,0,0,0,0,0,0,0,0,0,0,0,0,0,0,1,1,0,0,0,0,0,1,0,0,0
1290,DR Congo (Zaire),86,490,0,Government of DR Congo (Zaire) - RCD,40,1,0,0,01/22/2002,01/22/2002,1,"""French, British FMs want foreign armies withdrawn from DRCongo [Corrected 01/23/02]"", 22 January 2002, Agence France-Presse",2,0,0,0,"France, UK",220,200,0,0,0,0,0,0,0,0,0,0,0,0,0,0,0,0,0,0,2,1,3,0,0,1,0,0,0,0,0
1291,DR Congo (Zaire),86,490,0,Government of DR Congo (Zaire) - RCD,40,1,0,0,01/22/2002,01/22/2002,1,"""French, British FMs want foreign armies withdrawn from DRCongo [Corrected 01/23/02]"", 22 January 2002, Agence France-Presse",2,0,0,0,"France, UK",220,200,0,0,0,0,0,0,0,0,0,0,0,0,0,0,0,0,0,0,2,2,3,0,0,1,0,0,0,0,0
1292,DR Congo (Zaire),86,490,0,Government of DR Congo (Zaire) - MLC,41,1,0,0,01/22/2002,01/22/2002,1,"""French, British FMs want foreign armies withdrawn from DRCongo [Corrected 01/23/02]"", 22 January 2002, Agence France-Presse",2,0,0,0,"France, UK",220,200,0,0,0,0,0,0,0,0,0,0,0,0,0,0,0,0,0,0,2,1,3,0,0,1,0,0,0,0,0
1293,DR Congo (Zaire),86,490,0,Government of DR Congo (Zaire) - MLC,41,1,0,0,01/22/2002,01/22/2002,1,"""French, British FMs want foreign armies withdrawn from DRCongo [Corrected 01/23/02]"", 22 January 2002, Agence France-Presse",2,0,0,0,"France, UK",220,200,0,0,0,0,0,0,0,0,0,0,0,0,0,0,0,0,0,0,2,2,3,0,0,1,0,0,0,0,0
1294,,,490,0,,42,1,0,0,01/22/2002,01/22/2002,1,"""French, British FMs want foreign armies withdrawn from DRCongo [Corrected 01/23/02]"", 22 January 2002, Agence France-Presse",2,0,0,0,"France, UK",220,200,0,0,0,0,0,0,0,0,0,0,0,0,0,0,0,0,0,0,2,1,3,0,0,1,0,0,0,0,0
1295,,,490,0,,42,1,0,0,01/22/2002,01/22/2002,1,"""French, British FMs want foreign armies withdrawn from DRCongo [Corrected 01/23/02]"", 22 January 2002, Agence France-Presse",2,0,0,0,"France, UK",220,200,0,0,0,0,0,0,0,0,0,0,0,0,0,0,0,0,0,0,2,2,3,0,0,1,0,0,0,0,0
1296,DR Congo (Zaire),86,490,0,Government of DR Congo (Zaire) - RCD,40,1,0,0,02/12/2002,02/12/2002,1,"""Congo has ""real opportunity"" for peace-UK's Short"", By Finbarr O'Reilly , 12 February 2002, Reuters News",1,0,0,0,UK,200,0,0,0,0,0,0,0,0,0,0,0,0,0,0,0,0,0,0,0,1,1,3,0,0,0,1,0,0,0,0
1297,DR Congo (Zaire),86,490,0,Government of DR Congo (Zaire) - MLC,41,1,0,0,02/12/2002,02/12/2002,1,"""Congo has ""real opportunity"" for peace-UK's Short"", By Finbarr O'Reilly , 12 February 2002, Reuters News",1,0,0,0,UK,200,0,0,0,0,0,0,0,0,0,0,0,0,0,0,0,0,0,0,0,1,1,3,0,0,0,1,0,0,0,0
1298,,,490,0,,42,1,0,0,02/12/2002,02/12/2002,1,"""Congo has ""real opportunity"" for peace-UK's Short"", By Finbarr O'Reilly , 12 February 2002, Reuters News",1,0,0,0,UK,200,0,0,0,0,0,0,0,0,0,0,0,0,0,0,0,0,0,0,0,1,1,3,0,0,0,1,0,0,0,0
1299,,,490,0,,42,0,0,0,02/25/2002,03/14/2002,1,"""UPDATE 3-Congo peace talks start despite absentees"", By Finbarr O'Reilly, 25 February 2002, Reuters News AND ""DR Congo government suspends participation in peace talks [Corrected 03/14/02]"", 14 March 2002, Agence France-Presse",1,2,0,0,"AU, South African Development Community, South Africa",11000,11019,560,0,0,0,0,0,0,0,0,0,0,0,0,0,0,0,0,0,3,3,1,1,0,1,0,0,0,0,0
1300,,,490,0,,42,0,0,0,03/21/2002,03/25/2002,1,"""DR Congo peace talks resume amid pleas for progress [Corrected 03/ 21/02]"", Philippe Bernes-Lasserre, 21 March 2002, Agence France-Presse AND ""Summit on DR Congo postponed: source at talks"", 25 March 2002, Agence France-Presse",1,2,0,0,"South Africa, AU, South African Development Community",560,11000,11019,0,0,0,0,0,0,0,0,0,0,0,0,0,0,0,0,0,3,3,1,1,0,1,0,0,0,0,0
1301,DR Congo (Zaire),86,490,0,Government of DR Congo (Zaire) - RCD,40,0,0,0,04/03/2002,04/03/2002,1,"""Five African leaders in Zambia for DR Congo peace talks"", 3 April 2002, Agence France-Presse",2,2,0,0,"Zambia, South Africa, AU, UN",551,560,11000,11024,0,0,0,0,0,0,0,0,0,0,0,0,0,0,0,0,4,1,3,0,1,1,0,0,0,0,0
1302,DR Congo (Zaire),86,490,0,Government of DR Congo (Zaire) - MLC,41,0,0,0,04/03/2002,04/03/2002,1,"""Five African leaders in Zambia for DR Congo peace talks"", 3 April 2002, Agence France-Presse",2,2,0,0,"Zambia, South Africa, AU, UN",551,560,11000,11024,0,0,0,0,0,0,0,0,0,0,0,0,0,0,0,0,4,1,3,0,1,1,0,0,0,0,0
1303,,,490,0,,42,0,0,0,04/03/2002,04/03/2002,1,"""Five African leaders in Zambia for DR Congo peace talks"", 3 April 2002, Agence France-Presse",2,2,0,0,"Zambia, South Africa, AU, UN",551,560,11000,11024,0,0,0,0,0,0,0,0,0,0,0,0,0,0,0,0,4,1,3,0,1,1,0,0,0,0,0
1304,,,490,0,,42,0,0,0,04/05/2002,04/19/2002,1,"""Party to DRC peace talks seeks to end deadlock, backs Kabila "", 5 April 2002, Agence France-Presse AND ""DR Congo peace talks collapse [Corrected 04/18/02"",  Emsie Ferreira, 19 April 2002, Agence France-Presse",1,2,1,0,"Civil society / community activists, AU, UN, South Africa",12008,11000,11024,560,0,0,0,0,0,0,0,0,0,0,0,0,0,0,0,0,4,3,2,1,0,0,0,0,0,0,0
1305,DR Congo (Zaire),86,490,0,Government of DR Congo (Zaire) - RCD,40,1,0,0,04/30/2002,04/30/2002,1,"""UPDATE 5-UN envoys hopeful after talks with Congo's Kabila"", By William Maclean, 30 April 2002, Reuters News",0,1,0,0,UN,11024,0,0,0,0,0,0,0,0,0,0,0,0,0,0,0,0,0,0,0,1,1,3,0,0,1,0,0,0,0,0
1306,DR Congo (Zaire),86,490,0,Government of DR Congo (Zaire) - MLC,41,1,0,0,04/30/2002,04/30/2002,1,"""UPDATE 5-UN envoys hopeful after talks with Congo's Kabila"", By William Maclean, 30 April 2002, Reuters News",0,1,0,0,UN,11024,0,0,0,0,0,0,0,0,0,0,0,0,0,0,0,0,0,0,0,1,1,3,0,0,1,0,0,0,0,0
1307,,,490,0,,42,1,0,0,04/30/2002,04/30/2002,1,"""UPDATE 5-UN envoys hopeful after talks with Congo's Kabila"", By William Maclean, 30 April 2002, Reuters News",0,1,0,0,UN,11024,0,0,0,0,0,0,0,0,0,0,0,0,0,0,0,0,0,0,0,1,1,3,0,0,1,0,0,0,0,0
1308,DR Congo (Zaire),86,490,0,Government of DR Congo (Zaire) - MLC,41,1,0,0,06/29/2002,06/29/2002,1,"""Mbeki in Kinshasa visit over DRC peace process "", 30 June 2002, Agence France-Presse",1,0,0,0,South Africa,560,0,0,0,0,0,0,0,0,0,0,0,0,0,0,0,0,0,0,0,1,1,3,0,0,1,0,0,0,0,0
1309,DR Congo (Zaire),86,490,0,Government of DR Congo (Zaire) - RCD,40,1,0,0,06/30/2002,06/30/2002,1,"""African leaders press Congo on peace before summit."", By Manoah Esipisu , 1 July 2002, Reuters News",1,0,0,0,Zambia,551,0,0,0,0,0,0,0,0,0,0,0,0,0,0,0,0,0,0,0,1,1,3,0,0,0,1,0,0,0,0
1310,DR Congo (Zaire),86,490,0,Government of DR Congo (Zaire) - MLC,41,1,0,0,06/30/2002,06/30/2002,1,"""African leaders press Congo on peace before summit."", By Manoah Esipisu , 1 July 2002, Reuters News",1,0,0,0,Zambia,551,0,0,0,0,0,0,0,0,0,0,0,0,0,0,0,0,0,0,0,1,1,3,0,0,0,1,0,0,0,0
1311,,,490,0,,42,1,0,0,06/30/2002,06/30/2002,1,"""African leaders press Congo on peace before summit."", By Manoah Esipisu , 1 July 2002, Reuters News",1,0,0,0,Zambia,551,0,0,0,0,0,0,0,0,0,0,0,0,0,0,0,0,0,0,0,1,1,3,0,0,0,1,0,0,0,0
1312,DR Congo (Zaire),86,490,0,Government of DR Congo (Zaire) - RCD,40,1,0,0,09/13/2002,09/13/2002,1,"""Kabila hails Rwandan pledge to pull out of Congo"", By Irwin Arieff, 14 September 2002, Reuters News",1,1,0,0,"UN, South Africa",11024,560,0,0,0,0,0,0,0,0,0,0,0,0,0,0,0,0,0,0,2,1,3,0,0,1,0,0,0,0,0
1313,DR Congo (Zaire),86,490,0,Government of DR Congo (Zaire) - MLC,41,1,0,0,09/13/2002,09/13/2002,1,"""Kabila hails Rwandan pledge to pull out of Congo"", By Irwin Arieff, 14 September 2002, Reuters News",1,1,0,0,"UN, South Africa",11024,560,0,0,0,0,0,0,0,0,0,0,0,0,0,0,0,0,0,0,2,1,3,0,0,1,0,0,0,0,0
1314,,,490,0,,42,1,0,0,09/13/2002,09/13/2002,1,"""Kabila hails Rwandan pledge to pull out of Congo"", By Irwin Arieff, 14 September 2002, Reuters News",1,1,0,0,"UN, South Africa",11024,560,0,0,0,0,0,0,0,0,0,0,0,0,0,0,0,0,0,0,2,1,3,0,0,1,0,0,0,0,0
1315,DR Congo (Zaire),86,490,0,Government of DR Congo (Zaire) - RCD,40,1,0,0,09/16/2002,09/16/2002,1,"""Belgian PM says Congolese peace possible soon."", 16 September 2002, Reuters News,",1,0,0,0,Belgium,211,0,0,0,0,0,0,0,0,0,0,0,0,0,0,0,0,0,0,0,1,1,3,0,0,0,1,0,0,0,0
1316,DR Congo (Zaire),86,490,0,Government of DR Congo (Zaire) - MLC,41,1,0,0,09/16/2002,09/16/2002,1,"""Belgian PM says Congolese peace possible soon."", 16 September 2002, Reuters News,",1,0,0,0,Belgium,211,0,0,0,0,0,0,0,0,0,0,0,0,0,0,0,0,0,0,0,1,1,3,0,0,0,1,0,0,0,0
1317,,,490,0,,42,1,0,0,09/16/2002,09/16/2002,1,"""Belgian PM says Congolese peace possible soon."", 16 September 2002, Reuters News,",1,0,0,0,Belgium,211,0,0,0,0,0,0,0,0,0,0,0,0,0,0,0,0,0,0,0,1,1,3,0,0,0,1,0,0,0,0
1318,,,490,0,,42,0,0,0,11/16/2002,11/23/2002,1,"""DR Congo delegates map out path for a week of peace talks"", 16 November 2002, Agence France-Presse AND ""DR Congo peace talks adjourn, set December 14 deadline "", Jean-Jacques Cornish , 23 November 2002, Agence France-Presse",1,1,1,0,"UN, South Africa, Civil society / community activists",11024,560,12008,0,0,0,0,0,0,0,0,0,0,0,0,0,0,0,0,0,3,3,1,1,0,1,0,0,0,0,0
1319,,,490,0,,42,0,0,0,11/16/2002,11/23/2002,1,"""DR Congo delegates map out path for a week of peace talks"", 16 November 2002, Agence France-Presse AND ""DR Congo peace talks adjourn, set December 14 deadline "", Jean-Jacques Cornish , 23 November 2002, Agence France-Presse",1,1,1,0,"UN, South Africa, Civil society / community activists",11024,560,12008,0,0,0,0,0,0,0,0,0,0,0,0,0,0,0,0,0,3,3,2,1,0,1,0,0,0,0,0
1320,DR Congo (Zaire),86,490,0,Government of DR Congo (Zaire) - RCD,40,1,0,0,11/28/2002,11/28/2002,1,"""Bishops Appeal to Leaders for Peace"", 29 November 2002, All Africa",0,0,1,1,"Christian representatives (catholics, lutherans, russian orthodox etc.)",12007,0,0,0,0,0,0,0,0,0,0,0,0,0,0,0,0,0,0,0,1,1,3,0,0,0,1,0,0,0,0
1321,DR Congo (Zaire),86,490,0,Government of DR Congo (Zaire) - MLC,41,1,0,0,11/28/2002,11/28/2002,1,"""Bishops Appeal to Leaders for Peace"", 29 November 2002, All Africa",0,0,1,1,"Christian representatives (catholics, lutherans, russian orthodox etc.)",12007,0,0,0,0,0,0,0,0,0,0,0,0,0,0,0,0,0,0,0,1,1,3,0,0,0,1,0,0,0,0
1322,,,490,0,,42,1,0,0,11/28/2002,11/28/2002,1,"""Bishops Appeal to Leaders for Peace"", 29 November 2002, All Africa",0,0,1,1,"Christian representatives (catholics, lutherans, russian orthodox etc.)",12007,0,0,0,0,0,0,0,0,0,0,0,0,0,0,0,0,0,0,0,1,1,3,0,0,0,1,0,0,0,0
1323,,,490,0,,42,0,0,0,12/09/2002,12/16/2002,1,"""Congo power sharing talks resume in S.Africa. "", 9 December 2002, Xinhua News Agency AND ""DR Congo peace talks to resume Monday after overnight session "", 16 December 2002, Agence France-Presse",1,1,1,0,"South Africa, UN, Civil society / community activists",560,11024,12008,0,0,0,0,0,0,0,0,0,0,0,0,0,0,0,0,0,3,3,1,1,0,0,0,0,0,0,0
1324,,,490,0,,42,0,0,0,12/09/2002,12/16/2002,1,"""Congo power sharing talks resume in S.Africa. "", 9 December 2002, Xinhua News Agency AND ""DR Congo peace talks to resume Monday after overnight session "", 16 December 2002, Agence France-Presse",1,1,1,0,"South Africa, UN, Civil society / community activists",560,11024,12008,0,0,0,0,0,0,0,0,0,0,0,0,0,0,0,0,0,3,3,2,1,0,0,0,0,0,0,0
1325,,,490,0,,42,0,0,0,12/18/2002,12/18/2002,1,"""Uganda: regional meeting on ceasefire in DRCongo [Corrected 12/18/ 02] "", 19 December 2002, Agence France-Presse",2,2,0,0,"Zambia, South Africa, AU, UN",551,560,11000,11024,0,0,0,0,0,0,0,0,0,0,0,0,0,0,0,0,4,1,3,0,1,0,0,0,0,0,0
1326,Djibouti,184,522,0,Government of Djibouti - FRUD-AD,44,0,0,0,02/07/2000,02/07/2000,1,"Reuters, 2000-02-07, ""Djibouti government, rebels sign peace accord."", UCDP Database",1,0,0,0,France,220,0,0,0,0,0,0,0,0,0,0,0,0,0,0,0,0,0,0,0,1,0,0,0,0,0,0,1,0,0,0
1327,DR Congo (Zaire),86,490,2,Government of DR Congo (Zaire) - RCD,40,0,0,2,03/10/1999,03/12/1999,2,"Reuters 1999-03-10 ""Congo's Kabila rejects peace talks in South Africa.""",0,0,1,0,ACCORD,12045,0,0,0,0,0,0,0,0,0,0,0,0,0,0,0,0,0,0,0,1,2,3,0,0,0,1,0,0,0,0
1328,DR Congo (Zaire),86,490,2,Government of DR Congo (Zaire) - RCD,40,0,0,2,06/16/1999,06/16/1999,1,"Reuters 1999-06-16 ""Congo rebels in S.Africa ahead of leaders' talks."" Reuters 1999-06-17 ""African leaders end Congo talks, set for truce.""",2,0,0,0,"Zambia, South Africa",551,560,0,0,0,0,0,0,0,0,0,0,0,0,0,0,0,0,0,0,2,2,3,0,0,0,1,0,0,0,0
1329,DR Congo (Zaire),86,490,2,Government of DR Congo (Zaire) - RCD,40,0,0,2,06/21/1999,06/23/1999,2,"Reuters 1999-06-21 ""Congo rebels in Zambia ahead of peace summit.""",1,0,0,0,Zambia,551,0,0,0,0,0,0,0,0,0,0,0,0,0,0,0,0,0,0,0,1,2,3,0,0,0,1,0,0,0,0
1330,DR Congo (Zaire),86,490,2,Government of DR Congo (Zaire) - RCD,40,0,0,2,08/31/1999,08/31/1999,1,"Reuters 1999-08-31 ""Congo rebels ready to sign truce, peace hopes rise.""",1,0,0,0,Zambia,551,0,0,0,0,0,0,0,0,0,0,0,0,0,0,0,0,0,0,0,1,2,3,0,0,0,1,0,0,0,0
1331,DR Congo (Zaire),86,490,2,Government of DR Congo (Zaire) - RCD,40,0,0,2,09/03/1999,09/03/1999,1,"Xinhua 1999-09-04 ""S. Africa to Send Military Observer to Congo.""",1,0,0,0,South Africa,560,0,0,0,0,0,0,0,0,0,0,0,0,0,0,0,0,0,0,0,1,2,3,0,0,1,0,0,0,0,0
1332,DR Congo (Zaire),86,490,2,Government of DR Congo (Zaire) - RCD,40,0,0,2,09/18/1999,09/21/1999,2,"Xinhua 1999-09-21 ""Congolese Rebels Start Contacts with Int'l Mediators.""",0,0,1,0,The Sant' Egidio Community,12033,0,0,0,0,0,0,0,0,0,0,0,0,0,0,0,0,0,0,0,1,2,3,0,0,1,0,0,0,0,0
1333,DR Congo (Zaire),86,490,2,Government of DR Congo (Zaire) - RCD,40,0,0,2,09/30/1999,10/02/1999,2,"Reuters 1999-10-02 ""Mediator says regrets violation of Congo truce.""",1,0,0,0,Zambia,551,0,0,0,0,0,0,0,0,0,0,0,0,0,0,0,0,0,0,0,1,2,3,0,1,0,0,0,0,0,0
1334,DR Congo (Zaire),86,490,2,Government of DR Congo (Zaire) - RCD,40,0,0,1,03/15/2001,03/15/2001,1,"Reuters 2001-03-16 ""Congo rebel group agrees UN deployment in 3 towns.""",0,1,0,0,UN,11024,0,0,0,0,0,0,0,0,0,0,0,0,0,0,0,0,0,0,0,1,2,3,0,0,1,0,0,0,0,0
1335,DR Congo (Zaire),86,490,2,Government of DR Congo (Zaire) - RCD,40,1,0,1,03/15/2001,03/25/2001,3,"AFP 2001-03-15 ""DRC rebels rebuff charges of human rights abuses""",0,1,0,0,UN,11024,0,0,0,0,0,0,0,0,0,0,0,0,0,0,0,0,0,0,0,1,0,0,0,0,0,0,0,1,0,0
1336,DR Congo (Zaire),86,490,2,Government of DR Congo (Zaire) - MLC,41,0,0,1,03/28/2001,04/01/2001,2,"Reuters 2001-04-01 ""Congo rebel yet to assure on withdrawal - diplomat.""",0,1,0,0,UN,11024,0,0,0,0,0,0,0,0,0,0,0,0,0,0,0,0,0,0,0,1,2,3,0,1,0,0,0,0,0,0
1337,DR Congo (Zaire),86,490,2,Government of DR Congo (Zaire) - RCD,40,0,0,1,03/30/2001,03/30/2001,1,"Reuters 2001-03-30 ""UPDATE 1-Congo mediator meets Rwandan-backed rebels.""",0,1,0,0,UN,11024,0,0,0,0,0,0,0,0,0,0,0,0,0,0,0,0,0,0,0,1,2,3,0,0,1,0,0,0,0,0
1338,DR Congo (Zaire),86,490,2,Government of DR Congo (Zaire) - MLC,41,0,0,1,04/22/2001,04/22/2001,1,"Reuters 2001-04-22 ""Congo rebel agrees with U.N. to pull back forces.""",0,1,0,0,UN,11024,0,0,0,0,0,0,0,0,0,0,0,0,0,0,0,0,0,0,0,1,2,3,0,1,1,0,0,0,0,0
1339,DR Congo (Zaire),86,490,2,Government of DR Congo (Zaire) - MLC,41,0,0,1,05/03/2001,05/03/2001,1,"Reuters 2001-05-04 ""Congo rebel makes about-turn, to withdraw troops.""",1,1,0,0,"Zambia, UN",551,11024,0,0,0,0,0,0,0,0,0,0,0,0,0,0,0,0,0,0,2,2,3,0,1,0,0,0,0,0,0
1340,DR Congo (Zaire),86,490,2,Government of DR Congo (Zaire) - RCD,40,0,0,1,09/03/2001,09/03/2001,1,"Reuters 2001-09-03 ""UPDATE 1-Annan urges rebels to quit key Congolese town.""",0,1,0,0,UN,11024,0,0,0,0,0,0,0,0,0,0,0,0,0,0,0,0,0,0,0,1,2,3,0,0,0,1,0,0,0,0
1341,DR Congo (Zaire),86,490,2,Government of DR Congo (Zaire) - RCD,40,0,0,1,10/15/2001,10/21/2001,1,"Reuters 2001-10-21 ""Congo mediator formally adjourns Addis meeting.""",0,1,0,0,UN,11024,0,0,0,0,0,0,0,0,0,0,0,0,0,0,0,0,0,0,0,1,3,1,0,0,1,0,0,0,0,0
1342,DR Congo (Zaire),86,490,2,Government of DR Congo (Zaire) - RCD,40,0,0,1,10/15/2001,10/21/2001,1,"Reuters 2001-10-21 ""Congo mediator formally adjourns Addis meeting.""",1,0,0,0,Ethiopia,530,0,0,0,0,0,0,0,0,0,0,0,0,0,0,0,0,0,0,0,1,3,0,0,0,0,0,1,0,0,0
1343,DR Congo (Zaire),86,490,2,Government of DR Congo (Zaire) - MLC,41,0,0,1,10/15/2001,10/21/2001,1,"Reuters 2001-10-21 ""Congo mediator formally adjourns Addis meeting.""",0,1,0,0,UN,11024,0,0,0,0,0,0,0,0,0,0,0,0,0,0,0,0,0,0,0,1,3,1,0,0,1,0,0,0,0,0
1344,DR Congo (Zaire),86,490,2,Government of DR Congo (Zaire) - MLC,41,0,0,1,10/15/2001,10/21/2001,1,"Reuters 2001-10-21 ""Congo mediator formally adjourns Addis meeting.""",1,0,0,0,Ethiopia,530,0,0,0,0,0,0,0,0,0,0,0,0,0,0,0,0,0,0,0,1,3,0,0,0,0,0,1,0,0,0
1345,DR Congo (Zaire),86,490,2,Government of DR Congo (Zaire) - RCD,40,0,0,1,11/24/2001,11/24/2001,1,"AFP 2001-11-24 ""Disarming Hutus in east DR Congo 'could be key' to peace: EU
[Corrected 11/24/01]""",0,1,0,0,EC/EU,11010,0,0,0,0,0,0,0,0,0,0,0,0,0,0,0,0,0,0,0,1,2,3,0,0,0,1,0,0,0,0
1346,DR Congo (Zaire),86,490,2,Government of DR Congo (Zaire) - RCD,40,0,0,1,12/06/2001,12/09/2001,1,"Reuters 2001-12-06 ""UPDATE 1-Congo's warring factions discuss new government."" AND  Xinhua 2001-12-08 ""Peace Talks on DRC Held in Nigeria Enters Deadlock."" AND Reuters 2001-12-+9 ""Congolese to make major decisions at Durban talks.""",0,1,0,0,UN,11024,0,0,0,0,0,0,0,0,0,0,0,0,0,0,0,0,0,0,0,1,3,1,0,0,1,0,0,0,0,0
1347,DR Congo (Zaire),86,490,2,Government of DR Congo (Zaire) - RCD,40,0,0,1,12/06/2001,12/09/2001,1,"Reuters 2001-12-06 ""UPDATE 1-Congo's warring factions discuss new government."" AND  Xinhua 2001-12-08 ""Peace Talks on DRC Held in Nigeria Enters Deadlock."" AND Reuters 2001-12-+9 ""Congolese to make major decisions at Durban talks.""",1,0,0,0,Nigeria,475,0,0,0,0,0,0,0,0,0,0,0,0,0,0,0,0,0,0,0,1,0,0,0,0,0,0,1,0,0,0
1348,DR Congo (Zaire),86,490,2,Government of DR Congo (Zaire) - MLC,41,0,0,1,12/06/2001,12/09/2001,1,"Reuters 2001-12-06 ""UPDATE 1-Congo's warring factions discuss new government."" AND  Xinhua 2001-12-08 ""Peace Talks on DRC Held in Nigeria Enters Deadlock."" AND Reuters 2001-12-09 ""Congolese to make major decisions at Durban talks.""",0,1,0,0,UN,11024,0,0,0,0,0,0,0,0,0,0,0,0,0,0,0,0,0,0,0,1,3,1,0,0,1,0,0,0,0,0
1349,DR Congo (Zaire),86,490,2,Government of DR Congo (Zaire) - MLC,41,0,0,1,12/06/2001,12/09/2001,1,"Reuters 2001-12-06 ""UPDATE 1-Congo's warring factions discuss new government."" AND  Xinhua 2001-12-08 ""Peace Talks on DRC Held in Nigeria Enters Deadlock."" AND Reuters 2001-12-+9 ""Congolese to make major decisions at Durban talks.""",1,0,0,0,Nigeria,475,0,0,0,0,0,0,0,0,0,0,0,0,0,0,0,0,0,0,0,1,0,0,0,0,0,0,1,0,0,0
1350,DR Congo (Zaire),86,490,2,Government of DR Congo (Zaire) - RCD,40,0,0,1,12/10/2001,12/12/2001,1,Reuters 2001-12-12,1,0,0,0,Kenya,501,0,0,0,0,0,0,0,0,0,0,0,0,0,0,0,0,0,0,0,1,0,0,0,0,0,0,1,0,0,0
1351,DR Congo (Zaire),86,490,2,Government of DR Congo (Zaire) - MLC,41,0,0,1,12/10/2001,12/12/2001,1,Reuters 2001-12-12,1,0,0,0,Kenya,501,0,0,0,0,0,0,0,0,0,0,0,0,0,0,0,0,0,0,0,1,0,0,0,0,0,0,1,0,0,0
1352,DR Congo (Zaire),86,490,0,Government of DR Congo (Zaire) - RCD,40,0,0,0,02/04/2002,02/07/2002,1,"AFP 2002-02-08 ""DR Congo rebel group refuses to join talks over ceasefire
demands [Corrected 02/07/02]"" AFP 2002-02-08 ""UN-sponsored talks on DR Congo falter over ceasefire""",1,0,0,0,Switzerland,225,0,0,0,0,0,0,0,0,0,0,0,0,0,0,0,0,0,0,0,1,3,1,1,0,1,0,0,0,0,0
1353,DR Congo (Zaire),86,490,0,Government of DR Congo (Zaire) - RCD,40,0,0,0,02/04/2002,02/07/2002,1,"AFP 2002-02-08 ""DR Congo rebel group refuses to join talks over ceasefire
demands [Corrected 02/07/02]"" AFP 2002-02-08 ""UN-sponsored talks on DR Congo falter over ceasefire""",0,1,0,0,UN,11024,0,0,0,0,0,0,0,0,0,0,0,0,0,0,0,0,0,0,0,1,3,1,1,0,1,0,0,0,0,0
1354,DR Congo (Zaire),86,490,0,Government of DR Congo (Zaire) - MLC,41,0,0,0,02/04/2002,02/08/2002,1,"AFP 2002-02-08 ""DR Congo rebel group refuses to join talks over ceasefire
demands [Corrected 02/07/02]"" AFP 2002-02-08 ""UN-sponsored talks on DR Congo falter over ceasefire""",1,0,0,0,Switzerland,225,0,0,0,0,0,0,0,0,0,0,0,0,0,0,0,0,0,0,0,1,3,1,1,0,1,0,0,0,0,0
1355,DR Congo (Zaire),86,490,0,Government of DR Congo (Zaire) - MLC,41,0,0,0,02/04/2002,02/08/2002,1,"AFP 2002-02-08 ""DR Congo rebel group refuses to join talks over ceasefire
demands [Corrected 02/07/02]"" AFP 2002-02-08 ""UN-sponsored talks on DR Congo falter over ceasefire""",0,1,0,0,UN,11024,0,0,0,0,0,0,0,0,0,0,0,0,0,0,0,0,0,0,0,1,3,1,1,0,1,0,0,0,0,0
1356,DR Congo (Zaire),86,490,0,Government of DR Congo (Zaire) - RCD,40,0,0,0,02/25/2002,03/14/2002,1,"Reuters 2002-02-27 ""Congo peace talks now stalled over attack claims.""",1,3,0,0,"UN, AU, South Africa, South African Development Community",11024,11000,560,11019,0,0,0,0,0,0,0,0,0,0,0,0,0,0,0,0,4,3,1,1,0,1,0,0,0,0,0
1357,DR Congo (Zaire),86,490,0,Government of DR Congo (Zaire) - MLC,41,0,0,0,03/05/2002,03/14/2002,1,"AFP 2002-03-06 ""DRCongo peace talks resume [Corrected 03/06/02]""",1,3,0,0,"UN, AU, South Africa, South African Development Community",11024,11000,560,11019,0,0,0,0,0,0,0,0,0,0,0,0,0,0,0,0,4,3,1,1,0,1,0,0,0,0,0
1358,DR Congo (Zaire),86,490,0,Government of DR Congo (Zaire) - RCD,40,0,0,0,03/21/2002,04/19/2002,1,"AFP 2002-03-21 ""URGENT DR Congo peace talks resume in South Africa"" AND AFP 2002-04-19 ""DR Congo peace talks collapse [Corrected 04/18/02]""",1,3,0,0,"UN, AU, South Africa, South African Development Community",11024,11000,560,11019,0,0,0,0,0,0,0,0,0,0,0,0,0,0,0,0,4,3,1,1,0,1,0,0,0,0,0
1359,DR Congo (Zaire),86,490,0,Government of DR Congo (Zaire) - MLC,41,0,0,0,03/21/2002,04/19/2002,1,"AFP 2002-03-21 ""URGENT DR Congo peace talks resume in South Africa"" AND AFP 2002-04-19 ""DR Congo peace talks collapse [Corrected 04/18/02]""",1,3,0,0,"UN, AU, South Africa, South African Development Community",11024,11000,560,11019,0,0,0,0,0,0,0,0,0,0,0,0,0,0,0,0,4,3,1,1,0,1,0,0,0,0,0
1360,DR Congo (Zaire),86,490,0,Government of DR Congo (Zaire) - MLC,41,0,0,0,04/28/2002,04/28/2002,1,"AFP 2002-04-28 ""Belgian foreign minister in Kinshasa for peace talks [Corrected 04/ 28/02]""",1,0,0,0,Belgium,211,0,0,0,0,0,0,0,0,0,0,0,0,0,0,0,0,0,0,0,1,1,3,0,0,0,1,0,0,0,0
1361,DR Congo (Zaire),86,490,0,Government of DR Congo (Zaire) - MLC,41,0,0,0,04/28/2002,04/28/2002,1,"AFP 2002-04-28 ""Belgian foreign minister in Kinshasa for peace talks [Corrected 04/ 28/02]""",1,0,0,0,Belgium,211,0,0,0,0,0,0,0,0,0,0,0,0,0,0,0,0,0,0,0,1,1,3,0,0,0,1,0,0,0,0
1362,DR Congo (Zaire),86,490,0,Government of DR Congo (Zaire) - RCD,40,0,0,0,05/02/2002,05/02/2002,1,"Reuters 2002-05-02 ""Congo combatants meet, fail to settle rift.""",1,0,0,0,Angola,540,0,0,0,0,0,0,0,0,0,0,0,0,0,0,0,0,0,0,0,1,0,0,0,0,0,0,1,0,0,0
1363,DR Congo (Zaire),86,490,0,Government of DR Congo (Zaire) - RCD,40,0,0,0,05/07/2002,05/07/2002,1,"AFP 2002-05-08 ""DR Congo role players in South Africa for peace talks with Mbeki""",1,0,0,0,South Africa,560,0,0,0,0,0,0,0,0,0,0,0,0,0,0,0,0,0,0,0,1,1,3,0,0,0,1,0,0,0,0
1364,DR Congo (Zaire),86,490,0,Government of DR Congo (Zaire) - MLC,41,0,0,0,05/07/2002,05/07/2002,1,"AFP 2002-05-08 ""DR Congo role players in South Africa for peace talks with Mbeki""",1,0,0,0,South Africa,560,0,0,0,0,0,0,0,0,0,0,0,0,0,0,0,0,0,0,0,1,1,3,0,0,0,1,0,0,0,0
1365,DR Congo (Zaire),86,490,0,Government of DR Congo (Zaire) - RCD,40,0,0,0,05/09/2002,05/09/2002,1,"AFP 2002-05-09 ""Informal DR Congo peace talks begin in South Africa"" AND Reuters 2002-05-10 ""Congo groups ask S.Africa, Zambia to help end war.""",1,0,0,0,South Africa,560,0,0,0,0,0,0,0,0,0,0,0,0,0,0,0,0,0,0,0,1,2,3,1,0,0,0,0,0,0,0
1366,DR Congo (Zaire),86,490,0,Government of DR Congo (Zaire) - RCD,40,0,0,0,10/27/2002,11/23/2002,1,"AFP 2002-10-27 ""DR Congo peace talks resume"" AND AFP 2002-11-23 ""DR Congo peace talks adjourn, set December 14 deadline""",1,1,1,0,"UN, South Africa, Civil society / community activists",11024,560,12008,0,0,0,0,0,0,0,0,0,0,0,0,0,0,0,0,0,3,3,1,1,0,0,0,0,0,0,0
1367,DR Congo (Zaire),86,490,0,Government of DR Congo (Zaire) - MLC,41,0,0,0,10/27/2002,11/23/2002,1,"AFP 2002-10-27 ""DR Congo peace talks resume"" AND AFP 2002-11-23 ""DR Congo peace talks adjourn, set December 14 deadline""",1,1,1,0,"UN, South Africa, Civil society / community activists",11024,560,12008,0,0,0,0,0,0,0,0,0,0,0,0,0,0,0,0,0,3,3,1,1,0,0,0,0,0,0,0
1368,DR Congo (Zaire),86,490,0,Government of DR Congo (Zaire) - RCD,40,0,0,0,12/09/2002,12/16/2002,1,"Congo power sharing talks resume in S.Africa. , 9 December 2002, Xinhua News Agency AND ""DR Congo peace talks to resume Monday after overnight session "", 16 December 2002, Agence France-Presse",1,1,1,0,"UN, South Africa, Civil society / community activists",11024,560,12008,0,0,0,0,0,0,0,0,0,0,0,0,0,0,0,0,0,3,3,1,1,0,1,0,0,0,0,0
1369,DR Congo (Zaire),86,490,0,Government of DR Congo (Zaire) - MLC,41,0,0,0,12/09/2002,12/16/2002,1,"Congo power sharing talks resume in S.Africa. , 9 December 2002, Xinhua News Agency AND ""DR Congo peace talks to resume Monday after overnight session "", 16 December 2002, Agence France-Presse",1,1,1,0,"UN, South Africa, Civil society / community activists",11024,560,12008,0,0,0,0,0,0,0,0,0,0,0,0,0,0,0,0,0,3,3,1,1,0,1,0,0,0,0,0
1370,DR Congo (Zaire),86,490,0,Government of DR Congo (Zaire) - RCD,40,0,0,0,12/19/2002,12/19/2002,1,"Xinhua 2002-12-19 ""Meeting on returning peace to Congo held in Uganda.""",2,2,0,0,"Zambia, South Africa, UN, AU",551,560,11024,11000,0,0,0,0,0,0,0,0,0,0,0,0,0,0,0,0,4,3,1,0,1,0,0,0,0,0,0
1371,DR Congo (Zaire),86,490,0,Government of DR Congo (Zaire) - MLC,41,0,0,0,12/19/2002,12/19/2002,1,"Xinhua 2002-12-19 ""Meeting on returning peace to Congo held in Uganda.""",2,2,0,0,"Zambia, South Africa, UN, AU",551,560,11024,11000,0,0,0,0,0,0,0,0,0,0,0,0,0,0,0,0,4,3,1,0,1,0,0,0,0,0,0
1372,Ethiopia (Ogaden),133,530,1,Government of Ethiopia - ONLF,54,0,0,1,09/01/2003,10/31/2003,5,"""Ethiopia: Delegation of ethnic Somali rebel group tours USA"", 15 October 2003, BBC Monitoring Africa; ""Ethiopia: Delegation of ethnic Somali rebel group tours USA"", 15 October 2003, BBC Monitoring Africa",2,0,0,0,"USA, Somalia",2,520,0,0,0,0,0,0,0,0,0,0,0,0,0,0,0,0,0,0,2,2,3,0,0,1,0,0,0,0,0
1373,Ethiopia (Ogaden),133,530,1,Government of Ethiopia - ONLF,54,0,0,1,06/02/2004,06/02/2004,2,"""Ethiopian ONLF rebel movement ""on the verge of being disbanded"", 2 June 2004, BBC Monitoring Africa",1,0,0,0,Somalia,520,0,0,0,0,0,0,0,0,0,0,0,0,0,0,0,0,0,0,0,1,2,3,0,0,1,0,0,0,0,0
1374,Ethiopia (Ogaden),133,530,1,Government of Ethiopia - ONLF,54,0,0,1,06/02/2004,06/02/2004,2,"""Ethiopian ONLF rebel movement ""on the verge of being disbanded"", 2 June 2004, BBC Monitoring Africa",1,0,0,0,UK,200,0,0,0,0,0,0,0,0,0,0,0,0,0,0,0,0,0,0,0,1,3,0,0,0,0,0,1,0,0,0
1375,Ethiopia (Ogaden),133,530,1,Government of Ethiopia - ONLF,54,0,0,1,06/02/2004,06/02/2004,2,"""Ethiopian ONLF rebel movement ""on the verge of being disbanded"", 2 June 2004, BBC Monitoring Africa",1,0,0,0,Kenya,501,0,0,0,0,0,0,0,0,0,0,0,0,0,0,0,0,0,0,0,1,3,0,0,0,0,0,1,0,0,0
1376,Ethiopia (Ogaden),133,530,1,Government of Ethiopia - ONLF,54,0,0,1,06/02/2004,06/02/2004,2,"""Ethiopian ONLF rebel movement ""on the verge of being disbanded"", 2 June 2004, BBC Monitoring Africa",1,0,0,0,UK,200,0,0,0,0,0,0,0,0,0,0,0,0,0,0,0,0,0,0,0,1,2,0,0,0,0,0,1,0,0,0
1377,Ethiopia (Oromiya),219,530,1,Government of Ethiopia - OLF,55,0,0,1,10/06/1998,10/09/1998,2,"All Africa 1998-10-23 ""War of Words.""",1,0,0,0,Eritrea,531,0,0,0,0,0,0,0,0,0,0,0,0,0,0,0,0,0,0,0,1,2,3,0,0,1,0,0,0,0,0
1378,Ethiopia (Oromiya),219,530,1,Government of Ethiopia - OLF,55,0,0,1,07/22/2004,07/23/2004,1,"""Kenya asks Ethiopia to ""act speedily"" against Oromo rebels"", 22 July 2004, BBC Monitoring Africa",1,0,0,0,Kenya,501,0,0,0,0,0,0,0,0,0,0,0,0,0,0,0,0,0,0,0,1,1,3,0,0,1,0,0,0,0,0
1379,Guinea,111,438,2,Government of Guinea - RFDG,57,0,0,1,10/04/2000,10/04/2000,1,"Reuters 2000-10-04, ""W.Africa security body starts talks on flashpoints""; Reuters 2000-10-05, ""Group says Ivorian crisis threatens whole region""",0,1,0,0,ECOWAS,11006,0,0,0,0,0,0,0,0,0,0,0,0,0,0,0,0,0,0,0,1,1,3,0,0,1,0,0,0,0,0
1380,Guinea,111,438,2,Government of Guinea - RFDG,57,0,0,1,10/04/2000,10/04/2000,1,"Reuters 2000-10-04, ""W.Africa security body starts talks on flashpoints""; Reuters 2000-10-05, ""Group says Ivorian crisis threatens whole region""",1,0,0,0,Nigeria,475,0,0,0,0,0,0,0,0,0,0,0,0,0,0,0,0,0,0,0,1,1,0,0,0,0,0,1,0,0,0
1381,Guinea,111,438,2,Government of Guinea - RFDG,57,0,0,1,10/08/2000,10/08/2000,1,"Reuters 2000-10-07, ""U.N. Council mission goes to Sierra Leone""; Reuters 2000-10-12, ""UN team wraps up S.Leone trip, urges robust force""; Reuters 2000-10-17, ""Liberia's Taylor said reconsidering role in S.Leone""",0,1,0,0,UN,11024,0,0,0,0,0,0,0,0,0,0,0,0,0,0,0,0,0,0,0,1,1,3,0,0,1,0,0,0,0,0
1382,Guinea,111,438,2,Government of Guinea - RFDG,57,0,0,1,11/01/2000,11/30/2000,4,"Reuters 2000-11-12, ""Guinea postpones Nov 26 parliamentary elections""; Reuters 2000-11-13, ""Gunmen launch new border attacks on Guinea-sources""; Reuters 2000-11-19, ""INTERVIEW-ECOWAS team wants Liberia-Guinea border monitors""",0,1,0,0,ECOWAS,11006,0,0,0,0,0,0,0,0,0,0,0,0,0,0,0,0,0,0,0,1,1,0,0,0,0,0,0,1,0,0
1383,Guinea,111,438,2,Government of Guinea - RFDG,57,0,0,1,12/27/2000,12/28/2000,1,"Reuters 2000-12-27, ""West Africa army chiefs meet on Guinea deployment""; Reuters 2000-12-28, ""W.African force of 1,600 to police Guinea border""; Xinhua 2000-12-28, ""ECOWAS to Deploy Peacekeepers for Mano River Union""",0,1,0,0,ECOWAS,11006,0,0,0,0,0,0,0,0,0,0,0,0,0,0,0,0,0,0,0,1,1,3,0,0,1,0,0,0,0,0
1384,Guinea,111,438,2,Government of Guinea - RFDG,57,0,0,1,12/27/2000,12/28/2000,1,"Reuters 2000-12-27, ""West Africa army chiefs meet on Guinea deployment""; Reuters 2000-12-28, ""W.African force of 1,600 to police Guinea border""; Xinhua 2000-12-28, ""ECOWAS to Deploy Peacekeepers for Mano River Union""",1,0,0,0,Nigeria,475,0,0,0,0,0,0,0,0,0,0,0,0,0,0,0,0,0,0,0,1,1,0,0,0,0,0,1,0,0,0
1385,Guinea,111,438,2,Government of Guinea - RFDG,57,0,0,1,02/12/2001,02/12/2001,1,"Reuters 2001-02-13, ""UNHCR chief wins Guinea pledge on refugee security""",0,1,0,0,UN,11024,0,0,0,0,0,0,0,0,0,0,0,0,0,0,0,0,0,0,0,1,1,3,0,0,1,0,0,0,0,0
1386,Guinea,111,438,2,Government of Guinea - RFDG,57,0,0,1,03/19/2001,03/19/2001,1,"AFP 2001-03-19, ""Nigeria is striving for peace in west Africa: Obasanjo ATTENTION - UPDATES with meeting end""",1,0,0,0,Nigeria,475,0,0,0,0,0,0,0,0,0,0,0,0,0,0,0,0,0,0,0,1,1,3,1,0,0,0,0,0,0,0
1387,Guinea,111,438,2,Government of Guinea - RFDG,57,0,0,1,04/01/2001,04/05/2001,3,"Reuters 2001-04-05, ""Refugees in Guinea harmed by all sides-Amnesty""",0,0,1,0,Amnesty,12003,0,0,0,0,0,0,0,0,0,0,0,0,0,0,0,0,0,0,0,1,0,0,0,0,0,0,0,1,0,0
1388,Guinea,111,438,2,Government of Guinea - RFDG,57,0,0,1,04/10/2001,04/10/2001,1,"AFP 2001-04-10, ""UN, ECOWAS meeting opens on Sierra Leone""",0,1,0,0,ECOWAS,11006,0,0,0,0,0,0,0,0,0,0,0,0,0,0,0,0,0,0,0,1,1,3,0,0,1,0,0,0,0,0
1389,Guinea,111,438,2,Government of Guinea - RFDG,57,0,0,1,04/10/2001,04/11/2001,1,"AFP 2001-04-10, ""UN, ECOWAS meeting opens on Sierra Leone""",1,0,0,0,Nigeria,475,0,0,0,0,0,0,0,0,0,0,0,0,0,0,0,0,0,0,0,1,1,0,0,0,0,0,1,0,0,0
1390,Guinea,111,438,2,Government of Guinea - RFDG,57,0,0,1,04/11/2001,04/11/2001,1,"Reuters 2001-04-11, ""CORRECTED - West African leaders begin emergency summit""; AFP 2001-04-11, ""ECOWAS asks UN nod for west African troops in conflict zone""",0,1,0,0,ECOWAS,11006,0,0,0,0,0,0,0,0,0,0,0,0,0,0,0,0,0,0,0,1,1,3,0,0,1,0,0,0,0,0
1391,Guinea,111,438,2,Government of Guinea - RFDG,57,0,0,1,08/14/2001,08/14/2001,1,"Reuters 2001-08-14, ""Ministers plan summit to end West African war""; Xinhua 2001-08-15, ""Sierra Leone, Guinea, Liberia Agree to Address Armed Groups""",2,0,0,0,"Liberia, Sierra Leone",450,451,0,0,0,0,0,0,0,0,0,0,0,0,0,0,0,0,0,0,2,1,3,0,0,1,0,0,0,0,0
1392,Guinea,111,438,2,Government of Guinea - RFDG,57,0,0,1,09/08/2001,09/08/2001,1,"Reuters 2001-09-08, ""West African talks focus on stopping armed rebels""; Reuters 2001-09-10, ""Guinea's Conte says ready to meet Taylor over war""; Reuters 2001-09-10, ""UPDATE 1-Guinea's Conte to meet Taylor in January - sources""",2,0,0,0,"Liberia, Sierra Leone",450,451,0,0,0,0,0,0,0,0,0,0,0,0,0,0,0,0,0,0,2,1,3,0,0,1,0,0,0,0,0
1393,Guinea-Bissau,216,404,2,"Government of Guinea-Bissau - Military Junta for the Consolidation of Democracy, Peace and Justice",58,0,0,1,06/01/1998,06/30/1998,4,"Reuters 1998-06-14, ""Gambia offers to mediate in Guinea-Bissau crisis""",1,0,0,0,Gambia,420,0,0,0,0,0,0,0,0,0,0,0,0,0,0,0,0,0,0,0,1,1,3,0,0,1,0,0,0,0,0
1394,Guinea-Bissau,216,404,2,"Government of Guinea-Bissau - Military Junta for the Consolidation of Democracy, Peace and Justice",58,0,0,1,06/01/1998,06/30/1998,4,"Reuters 1998-06-26, ""EU negotiates to send aid to Guinea-Bissau""",0,1,0,0,EC/EU,11010,0,0,0,0,0,0,0,0,0,0,0,0,0,0,0,0,0,0,0,1,1,4,0,0,1,0,0,0,0,0
1395,Guinea-Bissau,216,404,2,"Government of Guinea-Bissau - Military Junta for the Consolidation of Democracy, Peace and Justice",58,0,0,1,06/01/1998,06/30/1998,4,"Reuters 1998-06-26, ""EU negotiates to send aid to Guinea-Bissau""",0,1,0,0,EC/EU,11010,0,0,0,0,0,0,0,0,0,0,0,0,0,0,0,0,0,0,0,1,2,4,0,0,1,0,0,0,0,0
1396,Guinea-Bissau,216,404,2,"Government of Guinea-Bissau - Military Junta for the Consolidation of Democracy, Peace and Justice",58,0,0,1,06/12/1998,06/12/1998,1,"Reuters 1998-06-12, ""Bissau rebels give foreign troops 48-hours to go""",1,0,0,0,France,220,0,0,0,0,0,0,0,0,0,0,0,0,0,0,0,0,0,0,0,1,2,3,1,0,1,0,0,0,0,0
1397,Guinea-Bissau,216,404,2,"Government of Guinea-Bissau - Military Junta for the Consolidation of Democracy, Peace and Justice",58,0,0,1,06/12/1998,06/12/1998,1,"Reuters 1998-06-12, ""Bissau government ready to talk to rebels - radio""; Reuters 1998-06-13, ""Bissau mediation bid continues despite shelling""",0,0,2,1,"Christian representatives (catholics, lutherans, russian orthodox etc.), Muslim / Islamic Religious Representatives (shiite, sunni etc.)",12007,12025,0,0,0,0,0,0,0,0,0,0,0,0,0,0,0,0,0,0,2,1,3,0,1,0,0,0,0,0,0
1398,Guinea-Bissau,216,404,2,"Government of Guinea-Bissau - Military Junta for the Consolidation of Democracy, Peace and Justice",58,0,0,1,06/17/1998,06/17/1998,1,"Reuters 1998-06-17, ""Gambian minister begins mediation bid in Bissau""; Reuters 1998-06-17, ""FOCUS-Gambia seeks Bissau truce, fighting eases""",1,0,0,0,Gambia,420,0,0,0,0,0,0,0,0,0,0,0,0,0,0,0,0,0,0,0,1,1,3,0,0,1,0,0,0,0,0
1399,Guinea-Bissau,216,404,2,"Government of Guinea-Bissau - Military Junta for the Consolidation of Democracy, Peace and Justice",58,0,0,1,06/17/1998,06/17/1998,1,"Reuters 1998-06-18, ""Bissau bishop says Vieira set against rebel talks""",0,0,1,1,"Christian representatives (catholics, lutherans, russian orthodox etc.)",12007,0,0,0,0,0,0,0,0,0,0,0,0,0,0,0,0,0,0,0,1,1,3,0,0,1,0,0,0,0,0
1400,Guinea-Bissau,216,404,2,"Government of Guinea-Bissau - Military Junta for the Consolidation of Democracy, Peace and Justice",58,0,0,1,06/27/1998,06/27/1998,1,"Reuters 1998-06-27, ""Portuguese, Angolan mediators meet Bissau minister""",2,0,0,0,"Portugal, Angola",235,540,0,0,0,0,0,0,0,0,0,0,0,0,0,0,0,0,0,0,2,1,3,0,0,1,0,0,0,0,0
1401,Guinea-Bissau,216,404,2,"Government of Guinea-Bissau - Military Junta for the Consolidation of Democracy, Peace and Justice",58,0,0,1,06/27/1998,06/27/1998,1,"Reuters 1998-06-28, ""Portuguese, Angolan ministers meet Bissau rebels""; Reuters 1998-06-28, ""FOCUS-Bissau loyalists, rebels hold first talks""",2,0,0,0,"Portugal, Angola",235,540,0,0,0,0,0,0,0,0,0,0,0,0,0,0,0,0,0,0,2,2,3,0,0,0,1,0,0,0,0
1402,Guinea-Bissau,216,404,2,"Government of Guinea-Bissau - Military Junta for the Consolidation of Democracy, Peace and Justice",58,0,0,1,06/28/1998,06/28/1998,1,"Reuters 1998-06-29, ""Sporadic shooting in Bissau before peace talks""",2,0,0,0,"Portugal, Angola",235,540,0,0,0,0,0,0,0,0,0,0,0,0,0,0,0,0,0,0,2,3,1,0,1,1,0,0,0,0,0
1403,Guinea-Bissau,216,404,2,"Government of Guinea-Bissau - Military Junta for the Consolidation of Democracy, Peace and Justice",58,0,0,1,06/28/1998,06/28/1998,1,"Reuters 1998-06-28, ""FOCUS-Bissau loyalists, rebels to hold talks""",2,0,0,0,"Portugal, Angola",235,540,0,0,0,0,0,0,0,0,0,0,0,0,0,0,0,0,0,0,2,1,3,0,0,1,0,0,0,0,0
1404,Guinea-Bissau,216,404,2,"Government of Guinea-Bissau - Military Junta for the Consolidation of Democracy, Peace and Justice",58,0,0,1,06/28/1998,06/28/1998,1,"Reuters 1998-06-29, ""FOCUS - Mediators say Bissau peace moves positive""",2,0,0,0,"Portugal, Angola",235,540,0,0,0,0,0,0,0,0,0,0,0,0,0,0,0,0,0,0,2,2,3,0,0,0,1,0,0,0,0
1405,Guinea-Bissau,216,404,2,"Government of Guinea-Bissau - Military Junta for the Consolidation of Democracy, Peace and Justice",58,0,0,1,06/28/1998,06/28/1998,1,"Reuters 1998-06-29, ""FOCUS - Mediators say Bissau peace moves positive""",1,0,0,0,Gambia,420,0,0,0,0,0,0,0,0,0,0,0,0,0,0,0,0,0,0,0,1,2,3,0,1,1,0,0,0,0,0
1406,Guinea-Bissau,216,404,2,"Government of Guinea-Bissau - Military Junta for the Consolidation of Democracy, Peace and Justice",58,0,0,1,06/30/1998,07/01/1998,1,"Reuters 1998-07-01, ""Guinea-Bissau peacekeeping plans in doubt""",0,1,0,0,ECOWAS,11006,0,0,0,0,0,0,0,0,0,0,0,0,0,0,0,0,0,0,0,1,1,3,0,0,1,0,0,0,0,0
1407,Guinea-Bissau,216,404,2,"Government of Guinea-Bissau - Military Junta for the Consolidation of Democracy, Peace and Justice",58,0,0,1,06/30/1998,07/03/1998,1,"Reuters 1998-07-01, ""Guinea-Bissau peacekeeping plans in doubt""; Reuters 1998-07-03, ""Bissau peace force gets cautious approval at talks""",1,0,0,0,Ivory Coast,437,0,0,0,0,0,0,0,0,0,0,0,0,0,0,0,0,0,0,0,1,1,0,0,0,0,0,1,0,0,0
1408,Guinea-Bissau,216,404,2,"Government of Guinea-Bissau - Military Junta for the Consolidation of Democracy, Peace and Justice",58,0,0,1,07/03/1998,07/03/1998,1,"Reuters 1998-07-03, ""Bissau peace force gets cautious approval at talks""",0,1,0,0,ECOWAS,11006,0,0,0,0,0,0,0,0,0,0,0,0,0,0,0,0,0,0,0,1,1,3,0,0,1,0,0,0,0,0
1409,Guinea-Bissau,216,404,2,"Government of Guinea-Bissau - Military Junta for the Consolidation of Democracy, Peace and Justice",58,0,0,1,07/26/1998,07/26/1998,1,"Xinhua 1998-07-17, ""Portuguese-Speaking Community to Send Contact Team to Bissau""; Reuters 1998-07-26, ""FOCUS-Guinea Bissau govt and rebels agree truce""; Reuters 1998-07-26, ""Guinea Bissau govt, rebels sign ceasefire-media""; Reuters 1998-07-26, ""FOCUS-Truce in Guinea Bissau, fresh talks planned""; Reuters 1998-08-06, ""Rebels in Guinea-Bissau threaten to end truce""; Reuters 1998-08-07, ""Bissau mediators hope to meet West African states""",0,1,0,0,Commonwealth of Portugese Speaking States,11005,0,0,0,0,0,0,0,0,0,0,0,0,0,0,0,0,0,0,0,1,3,2,0,1,1,0,0,0,0,0
1410,Guinea-Bissau,216,404,2,"Government of Guinea-Bissau - Military Junta for the Consolidation of Democracy, Peace and Justice",58,0,0,1,07/26/1998,07/26/1998,1,"Xinhua 1998-07-17, ""Portuguese-Speaking Community to Send Contact Team to Bissau""; Reuters 1998-07-26, ""FOCUS-Guinea Bissau govt and rebels agree truce""",1,0,0,0,Portugal,235,0,0,0,0,0,0,0,0,0,0,0,0,0,0,0,0,0,0,0,1,3,0,0,0,0,0,1,0,0,0
1411,Guinea-Bissau,216,404,2,"Government of Guinea-Bissau - Military Junta for the Consolidation of Democracy, Peace and Justice",58,0,0,1,08/08/1998,08/08/1998,1,"Reuters 1998-08-08, ""FOCUS-Bissau govt, rebels agree to meet again""; Reuters 1998-08-09, ""West African mediators head for talks in Bissau""",0,1,0,0,Commonwealth of Portugese Speaking States,11005,0,0,0,0,0,0,0,0,0,0,0,0,0,0,0,0,0,0,0,1,3,1,0,0,1,0,0,0,0,0
1412,Guinea-Bissau,216,404,2,"Government of Guinea-Bissau - Military Junta for the Consolidation of Democracy, Peace and Justice",58,0,0,1,08/08/1998,08/08/1998,1,"Reuters 1998-08-08, ""FOCUS-Bissau govt, rebels agree to meet again""",1,0,0,0,Portugal,235,0,0,0,0,0,0,0,0,0,0,0,0,0,0,0,0,0,0,0,1,3,0,0,0,0,0,1,0,0,0
1413,Guinea-Bissau,216,404,2,"Government of Guinea-Bissau - Military Junta for the Consolidation of Democracy, Peace and Justice",58,0,0,1,08/09/1998,08/09/1998,1,"Reuters 1998-08-10, ""Bissau mediators to meet in Abidjan on Tuesday""; Reuters 1998-08-11, ""Bissau peace mediators join efforts in Ivory Coast""",0,1,0,0,ECOWAS,11006,0,0,0,0,0,0,0,0,0,0,0,0,0,0,0,0,0,0,0,1,3,4,0,0,1,0,0,0,0,0
1414,Guinea-Bissau,216,404,2,"Government of Guinea-Bissau - Military Junta for the Consolidation of Democracy, Peace and Justice",58,0,0,1,08/17/1998,08/17/1998,1,"Reuters 1998-08-17, ""West African mediators arrive in Bissau"", Reuters 1998-08-19, ""Bissau govt, rebels to hold talks in Cape Verde""",0,1,0,0,ECOWAS,11006,0,0,0,0,0,0,0,0,0,0,0,0,0,0,0,0,0,0,0,1,1,4,0,1,1,0,0,0,0,0
1415,Guinea-Bissau,216,404,2,"Government of Guinea-Bissau - Military Junta for the Consolidation of Democracy, Peace and Justice",58,0,0,1,08/17/1998,08/17/1998,1,"Reuters 1998-08-19, ""Bissau govt, rebels to hold talks in Cape Verde""",0,1,0,0,ECOWAS,11006,0,0,0,0,0,0,0,0,0,0,0,0,0,0,0,0,0,0,0,1,2,4,0,1,1,0,0,0,0,0
1416,Guinea-Bissau,216,404,2,"Government of Guinea-Bissau - Military Junta for the Consolidation of Democracy, Peace and Justice",58,0,0,1,08/19/1998,08/19/1998,1,"Reuters 1998-08-19, ""FOCUS-Bissau talks end with accord to meet again""",0,1,0,0,Commonwealth of Portugese Speaking States,11005,0,0,0,0,0,0,0,0,0,0,0,0,0,0,0,0,0,0,0,1,3,1,0,0,1,0,0,0,0,0
1417,Guinea-Bissau,216,404,2,"Government of Guinea-Bissau - Military Junta for the Consolidation of Democracy, Peace and Justice",58,0,0,1,08/19/1998,08/19/1998,1,"Reuters 1998-08-19, ""FOCUS-Bissau talks end with accord to meet again""",1,0,0,0,Cape Verde,402,0,0,0,0,0,0,0,0,0,0,0,0,0,0,0,0,0,0,0,1,3,0,0,0,0,0,1,0,0,0
1418,Guinea-Bissau,216,404,2,"Government of Guinea-Bissau - Military Junta for the Consolidation of Democracy, Peace and Justice",58,0,0,1,08/25/1998,08/25/1998,1,"Reuters 1998-08-25, ""Bissau govt,rebels arrive in Cape Verde for talks""",0,2,0,0,"Commonwealth of Portugese Speaking States, ECOWAS",11005,11006,0,0,0,0,0,0,0,0,0,0,0,0,0,0,0,0,0,0,2,3,1,1,1,1,0,0,0,0,0
1419,Guinea-Bissau,216,404,2,"Government of Guinea-Bissau - Military Junta for the Consolidation of Democracy, Peace and Justice",58,0,0,1,08/25/1998,08/26/1998,1,"Reuters 1998-08-25, ""Bissau govt,rebels arrive in Cape Verde for talks""; Reuters 1998-08-26, ""FOCUS-Government and rebels endorse Bissau truce""",1,0,0,0,Cape Verde,402,0,0,0,0,0,0,0,0,0,0,0,0,0,0,0,0,0,0,0,1,3,0,0,0,0,0,1,0,0,0
1420,Guinea-Bissau,216,404,2,"Government of Guinea-Bissau - Military Junta for the Consolidation of Democracy, Peace and Justice",58,0,0,1,09/17/1998,09/17/1998,1,"Xinhua 1998-09-18, ""Peace Talks Agreed on G. Bissau Crisis""",0,1,0,0,ECOWAS,11006,0,0,0,0,0,0,0,0,0,0,0,0,0,0,0,0,0,0,0,1,3,4,0,0,1,0,0,0,0,0
1421,Guinea-Bissau,216,404,2,"Government of Guinea-Bissau - Military Junta for the Consolidation of Democracy, Peace and Justice",58,0,0,1,09/17/1998,09/17/1998,1,"Reuters 1998-09-10, ""Guinea-Bissau peace talks in Ivory Coast next week""; Xinhua 1998-09-18, ""Peace Talks Agreed on G. Bissau Crisis""",1,0,0,0,Ivory Coast,437,0,0,0,0,0,0,0,0,0,0,0,0,0,0,0,0,0,0,0,1,3,0,0,0,0,0,1,0,0,0
1422,Guinea-Bissau,216,404,2,"Government of Guinea-Bissau - Military Junta for the Consolidation of Democracy, Peace and Justice",58,0,0,1,10/01/1998,10/31/1998,4,"Reuters 1998-10-29, ""Bissau peace talks set to go ahead in Gambia""",1,0,0,0,Portugal,235,0,0,0,0,0,0,0,0,0,0,0,0,0,0,0,0,0,0,0,1,3,2,0,0,1,0,0,0,0,0
1423,Guinea-Bissau,216,404,2,"Government of Guinea-Bissau - Military Junta for the Consolidation of Democracy, Peace and Justice",58,0,0,1,10/21/1998,10/21/1998,1,"Reuters 1998-10-22, ""FOCUS - Fighting in Bissau despite peace offer""",3,0,0,0,"Portugal, France, Sweden",235,220,380,0,0,0,0,0,0,0,0,0,0,0,0,0,0,0,0,0,3,1,3,0,1,0,0,0,0,0,0
1424,Guinea-Bissau,216,404,2,"Government of Guinea-Bissau - Military Junta for the Consolidation of Democracy, Peace and Justice",58,0,0,1,10/22/1998,10/22/1998,1,"Reuters 1998-10-22, ""FOCUS - Fighting in Bissau despite peace offer""",3,0,0,0,"Portugal, France, Sweden",235,220,380,0,0,0,0,0,0,0,0,0,0,0,0,0,0,0,0,0,3,2,3,0,1,0,0,0,0,0,0
1425,Guinea-Bissau,216,404,2,"Government of Guinea-Bissau - Military Junta for the Consolidation of Democracy, Peace and Justice",58,0,0,1,10/27/1998,10/27/1998,1,"Reuters 1998-10-27, ""Bissau president, rebels to meet in Gambia-agency""",3,0,0,0,"Portugal, France, Sweden",235,220,380,0,0,0,0,0,0,0,0,0,0,0,0,0,0,0,0,0,3,3,2,0,1,1,0,0,0,0,0
1426,Guinea-Bissau,216,404,2,"Government of Guinea-Bissau - Military Junta for the Consolidation of Democracy, Peace and Justice",58,0,0,1,10/29/1998,10/29/1998,1,"Reuters 1998-10-29, ""FOCUS - Bissau foes open peace talks in Gambia""; Reuters 1998-10-30, ""Reconciliation Plan for Bissau to Be Tabled at ECOWAS Summit""; Reuters 1998-10-30, ""FOCUS-Bissau rivals plead at West African summit""",1,0,0,0,Gambia,420,0,0,0,0,0,0,0,0,0,0,0,0,0,0,0,0,0,0,0,1,3,1,1,1,1,0,0,0,0,0
1427,Guinea-Bissau,216,404,2,"Government of Guinea-Bissau - Military Junta for the Consolidation of Democracy, Peace and Justice",58,0,0,1,10/29/1998,10/29/1998,1,"Reuters 1998-10-29, ""Bissau foes tackle details of peace pact in Gambia""; Reuters 1998-10-30, ""Reconciliation Plan for Bissau to Be Tabled at ECOWAS Summit""; Reuters 1998-10-30, ""FOCUS-Bissau rivals plead at West African summit""",4,0,0,0,"Gambia, Senegal, Nigeria, Guinea",420,433,475,438,0,0,0,0,0,0,0,0,0,0,0,0,0,0,0,0,4,3,1,1,1,1,0,0,0,0,0
1428,Guinea-Bissau,216,404,2,"Government of Guinea-Bissau - Military Junta for the Consolidation of Democracy, Peace and Justice",58,0,0,1,10/29/1998,10/29/1998,1,"Reuters 1998-10-29, ""FOCUS - Bissau foes open peace talks in Gambia""",1,0,0,0,Gambia,420,0,0,0,0,0,0,0,0,0,0,0,0,0,0,0,0,0,0,0,1,1,3,0,0,0,1,0,0,0,0
1429,Guinea-Bissau,216,404,2,"Government of Guinea-Bissau - Military Junta for the Consolidation of Democracy, Peace and Justice",58,0,0,1,10/29/1998,10/29/1998,1,"Reuters 1998-10-29, ""FOCUS - Bissau foes open peace talks in Gambia""",1,0,0,0,Gambia,420,0,0,0,0,0,0,0,0,0,0,0,0,0,0,0,0,0,0,0,1,2,3,0,0,0,1,0,0,0,0
1430,Guinea-Bissau,216,404,2,"Government of Guinea-Bissau - Military Junta for the Consolidation of Democracy, Peace and Justice",58,0,0,1,10/30/1998,10/31/1998,1,"Reuters 1998-10-30, ""FOCUS-Bissau rivals plead at West African summit""; Reuters 1998-10-31, ""Africa summit fails to clinch Bissau accord""",0,1,0,0,ECOWAS,11006,0,0,0,0,0,0,0,0,0,0,0,0,0,0,0,0,0,0,0,1,3,1,0,1,0,0,0,0,0,0
1431,Guinea-Bissau,216,404,2,"Government of Guinea-Bissau - Military Junta for the Consolidation of Democracy, Peace and Justice",58,0,0,1,10/30/1998,10/31/1998,1,"Reuters 1998-10-30, ""FOCUS-Bissau rivals plead at West African summit""; Reuters 1998-10-31, ""Africa summit fails to clinch Bissau accord""",1,0,0,0,Nigeria,475,0,0,0,0,0,0,0,0,0,0,0,0,0,0,0,0,0,0,0,1,3,0,0,0,0,0,1,0,0,0
1432,Guinea-Bissau,216,404,2,"Government of Guinea-Bissau - Military Junta for the Consolidation of Democracy, Peace and Justice",58,0,0,1,11/01/1998,11/01/1998,1,"Reuters 1998-10-31, ""Mediators make fresh bid for peace in Bissau""",0,1,0,0,ECOWAS,11006,0,0,0,0,0,0,0,0,0,0,0,0,0,0,0,0,0,0,0,1,3,4,1,0,1,0,0,0,0,0
1433,Guinea-Bissau,216,404,2,"Government of Guinea-Bissau - Military Junta for the Consolidation of Democracy, Peace and Justice",58,0,0,1,12/14/1998,12/14/1998,1,"Reuters 1998-12-14, ""FOCUS-Guinea-Bissau civil war rivals meet in Togo""",1,0,0,0,Togo,461,0,0,0,0,0,0,0,0,0,0,0,0,0,0,0,0,0,0,0,1,3,1,0,1,1,0,0,0,0,0
1434,Guinea-Bissau,216,404,2,"Government of Guinea-Bissau - Military Junta for the Consolidation of Democracy, Peace and Justice",58,0,0,1,12/14/1998,12/14/1998,1,"Reuters 1998-12-14, ""FOCUS-Guinea-Bissau civil war rivals meet in Togo""",1,0,0,0,Togo,461,0,0,0,0,0,0,0,0,0,0,0,0,0,0,0,0,0,0,0,1,1,3,0,1,1,0,0,0,0,0
1435,Guinea-Bissau,216,404,2,"Government of Guinea-Bissau - Military Junta for the Consolidation of Democracy, Peace and Justice",58,0,0,1,12/14/1998,12/14/1998,1,"Reuters 1998-12-14, ""FOCUS-Guinea-Bissau civil war rivals meet in Togo""",1,0,0,0,Togo,461,0,0,0,0,0,0,0,0,0,0,0,0,0,0,0,0,0,0,0,1,2,3,0,1,1,0,0,0,0,0
1436,Guinea-Bissau,216,404,2,"Government of Guinea-Bissau - Military Junta for the Consolidation of Democracy, Peace and Justice",58,0,0,1,12/26/1998,06/07/1999,6,"Heldt & Wallensteen 2005; S/1999/294; http://www.africa.upenn.edu/Newsletters/irinw481.html
U N I T E D N A T I O N S Office for the Coordination of Humanitarian Affairs Integrated Regional Information Network for West Africa
Tel: +225 21 73 54 Fax: +225 21 63 35 e-mail: irin-wa@ocha.unon.org
IRIN-WA Update 481 of events in West Africa (Tuesday 8 June)",0,1,0,0,ECOWAS,11006,0,0,0,0,0,0,0,0,0,0,0,0,0,0,0,0,0,0,0,1,0,0,0,0,0,0,0,0,0,1
1437,Guinea-Bissau,216,404,2,"Government of Guinea-Bissau - Military Junta for the Consolidation of Democracy, Peace and Justice",58,0,0,1,02/03/1999,02/03/1999,1,"Reuters 1999-02-03 ""Bissau president, rebels sign ceasefire, Lusa says."" AND Reuters 1999-02-03 ""Warring sides sign ceasefire in Bissau.""",0,1,0,0,ECOWAS,11006,0,0,0,0,0,0,0,0,0,0,0,0,0,0,0,0,0,0,0,1,3,1,0,1,0,0,0,0,0,0
1438,Guinea-Bissau,216,404,2,"Government of Guinea-Bissau - Military Junta for the Consolidation of Democracy, Peace and Justice",58,0,0,1,02/17/1999,02/17/1999,1,"Reuters 1999-02-18 ""Guinea-Bissau war rivals fly home on same plane.""",0,1,0,0,ECOWAS,11006,0,0,0,0,0,0,0,0,0,0,0,0,0,0,0,0,0,0,0,1,3,1,1,0,0,0,0,0,0,0
1439,Ivory Coast,225,437,2,Government of Ivory Coast - MPCI,89,0,0,1,09/29/2002,09/29/2002,1,"AFP 2002-09-29 ""West African peacekeepers heading to Ivory Coast after uprising""",0,2,0,0,"AU, ECOWAS",11000,11006,0,0,0,0,0,0,0,0,0,0,0,0,0,0,0,0,0,0,2,1,3,0,0,1,0,0,0,0,0
1440,Ivory Coast,225,437,2,Government of Ivory Coast - MPCI,89,0,0,1,09/30/2002,10/06/2002,1,"Reuters 2002-10-01 ""UPDATE 4-Ivory Coast rebels say advance blocked by French"" AND AFP 2002-10-03 ""West African mediators start talks with I. Coast rebels on truce by Jacques Lhuillery [Corrected 11/18/02]"" AND Reuters 2002-10-03 ""UPDATE 6-Ivory Coast rebels agree truce in bloody conflict"" AND AFP 2002-10-04 ""Negotiations continue on Ivory Coast ceasefire accord [Corrected 10/ 04/02] "" AND Reuters 2002-10-05 ""UPDATE 4-Ivory Coast truce off again as war drums beat"" AND Reuters 2002-10-06 ""Ivory Coast ceasefire talks fail - mediator""",0,1,0,0,ECOWAS,11006,0,0,0,0,0,0,0,0,0,0,0,0,0,0,0,0,0,0,0,1,3,2,0,1,0,0,0,0,0,0
1441,Ivory Coast,225,437,2,Government of Ivory Coast - MPCI,89,0,0,1,10/10/2002,10/10/2002,1,"Reuters 2002-10-10 ""Ivory Coast army softens tone, rebels vow war""",1,0,0,0,France,220,0,0,0,0,0,0,0,0,0,0,0,0,0,0,0,0,0,0,0,1,1,3,0,0,1,0,0,0,0,0
1442,Ivory Coast,225,437,2,Government of Ivory Coast - MPCI,89,0,0,1,10/10/2002,10/10/2002,1,"AFP 2002-10-10 ""Ivory Coast rebels vow offensive, Gbagbo pressured to make peace by Emmanuel Goujon [Corrected 10/10/02]""",1,0,0,0,USA,2,0,0,0,0,0,0,0,0,0,0,0,0,0,0,0,0,0,0,0,1,1,3,0,0,0,1,0,0,0,0
1443,Ivory Coast,225,437,2,Government of Ivory Coast - MPCI,89,0,0,1,10/12/2002,10/13/2002,1,"Xinhua 2002-10-12 ""Loyalist troops of Ivory Coast, rebels trade fire near key town"" AND Xinhua 2002-10-12 ""ECOWAS envoy in Ivory Coast on new mediation mission"" AND Reuters 2002-10-13 ""UPDATE 5-Ivory Coast rebels storm key town, mull peace plan"" AND AFP 2002-10-13 ""Only two options in Ivory Coast: talks or all-out war""",0,1,0,0,ECOWAS,11006,0,0,0,0,0,0,0,0,0,0,0,0,0,0,0,0,0,0,0,1,3,2,0,1,1,0,0,0,0,0
1444,Ivory Coast,225,437,2,Government of Ivory Coast - MPCI,89,0,0,1,10/17/2002,10/17/2002,1,"Xinhua 2002-10-17 ""Ivory Coast rebels sign ECOWAS-brokered ceasefire"" AND allAfrica.com/All Africa Global Media via COMTEX) 2002-10-17 ""West African Envoys Optimistic Ahead Of Scheduled Truce in Ivory Coast"" AND AFP 2002-10-18 ""Paris to help maintain ceasefire in Ivory Coast""",0,1,0,0,ECOWAS,11006,0,0,0,0,0,0,0,0,0,0,0,0,0,0,0,0,0,0,0,1,3,2,0,1,0,0,0,0,0,0
1445,Ivory Coast,225,437,2,Government of Ivory Coast - MPCI,89,0,0,1,10/18/2002,10/18/2002,1,"AFP 2002-10-18 ""France to monitor Ivory Coast truce, rebels refuse to lay down arms [Corrected 10/18/02]""",1,0,0,0,France,220,0,0,0,0,0,0,0,0,0,0,0,0,0,0,0,0,0,0,0,1,1,3,0,1,0,0,0,0,0,0
1446,Ivory Coast,225,437,2,Government of Ivory Coast - MPCI,89,0,0,1,10/20/2002,10/20/2002,1,"AFP 2002-10-20 ""French soldiers hold first meeting in Ivory Coast rebel stronghold""",1,0,0,0,France,220,0,0,0,0,0,0,0,0,0,0,0,0,0,0,0,0,0,0,0,1,2,3,0,0,1,0,0,0,0,0
1447,Ivory Coast,225,437,2,Government of Ivory Coast - MPCI,89,0,0,1,10/23/2002,10/23/2002,1,"Reuters 2002-10-23 ""France demands Ivory Coast end anti-French demos""",1,0,0,0,France,220,0,0,0,0,0,0,0,0,0,0,0,0,0,0,0,0,0,0,0,1,1,3,0,0,1,0,0,0,0,0
1448,Ivory Coast,225,437,2,Government of Ivory Coast - MPCI,89,0,0,1,10/24/2002,10/24/2002,1,"AFP 2002-10-24 ""West African military team meets Ivory Coast army, rebels""",3,1,0,0,"ECOWAS, France, UK, USA",11006,220,200,2,0,0,0,0,0,0,0,0,0,0,0,0,0,0,0,0,4,3,2,0,1,0,0,0,0,0,0
1449,Ivory Coast,225,437,2,Government of Ivory Coast - MPCI,89,0,0,1,10/28/2002,10/28/2002,1,"AFP 2002-10-28 ""Ivory Coast government, rebels prepare for talks""",0,1,0,0,ECOWAS,11006,0,0,0,0,0,0,0,0,0,0,0,0,0,0,0,0,0,0,0,1,2,3,0,0,0,1,0,0,0,0
1450,Ivory Coast,225,437,2,Government of Ivory Coast - MPCI,89,0,0,1,10/28/2002,10/28/2002,1,"AFP 2002-10-28 ""ECOWAS head urges Senegal to lead Ivory Coast peace mission""",1,0,0,0,Senegal,433,0,0,0,0,0,0,0,0,0,0,0,0,0,0,0,0,0,0,0,1,1,3,0,0,1,0,0,0,0,0
1451,Ivory Coast,225,437,2,Government of Ivory Coast - MPCI,89,0,0,1,10/28/2002,10/28/2002,1,"AFP 2002-10-28 ""Ivory Coast government, rebels prepare for talks""",1,0,0,0,Togo,461,0,0,0,0,0,0,0,0,0,0,0,0,0,0,0,0,0,0,0,1,2,0,0,0,0,0,1,0,0,0
1452,Ivory Coast,225,437,2,Government of Ivory Coast - MPCI,89,0,0,1,10/29/2002,10/29/2002,1,"Reuters 2002-10-29 ""UPDATE 2-Ivory Coast enemies make contact ahead of talks""",0,1,0,0,ECOWAS,11006,0,0,0,0,0,0,0,0,0,0,0,0,0,0,0,0,0,0,0,1,3,1,0,0,0,1,0,0,0,0
1453,Ivory Coast,225,437,2,Government of Ivory Coast - MPCI,89,0,0,1,10/29/2002,10/29/2002,1,"Reuters 2002-10-29 ""UPDATE 2-Ivory Coast enemies make contact ahead of talks""",1,0,0,0,Togo,461,0,0,0,0,0,0,0,0,0,0,0,0,0,0,0,0,0,0,0,1,3,0,0,0,0,0,1,0,0,0
1454,Ivory Coast,225,437,2,Government of Ivory Coast - MPCI,89,0,0,1,10/30/2002,10/30/2002,1,"Dow Jones 2002-10-30 ""Ivory Coast Govt, Rebels Open Peace Talks In Togo - BBC"" AND AFP 2002-10-30 ""Ivory Coast government, rebels open peace talks [Corrected 10/30/ 02]""",0,1,0,0,ECOWAS,11006,0,0,0,0,0,0,0,0,0,0,0,0,0,0,0,0,0,0,0,1,1,3,0,0,0,1,0,0,0,0
1455,Ivory Coast,225,437,2,Government of Ivory Coast - MPCI,89,0,0,1,10/30/2002,10/30/2002,1,"Dow Jones 2002-10-30 ""Ivory Coast Govt, Rebels Open Peace Talks In Togo - BBC"" AND AFP 2002-10-30 ""Ivory Coast government, rebels open peace talks [Corrected 10/30/ 02]""",0,1,0,0,ECOWAS,11006,0,0,0,0,0,0,0,0,0,0,0,0,0,0,0,0,0,0,0,1,2,3,0,0,0,1,0,0,0,0
1456,Ivory Coast,225,437,2,Government of Ivory Coast - MPCI,89,0,0,1,10/30/2002,11/01/2002,1,"Dow Jones 2002-10-30 ""Ivory Coast Govt, Rebels Open Peace Talks In Togo - BBC"" AND AFP 2002-10-30 ""Ivory Coast government, rebels open peace talks [Corrected 10/30/ 02]"" AND Reuters 2002-10-31 ""Ivory Coast peace talks to broach tough issues"" AND AFP 2002-11-01 ""Two negotiators leave as Ivory Coast peace talks resume""",0,1,0,0,ECOWAS,11006,0,0,0,0,0,0,0,0,0,0,0,0,0,0,0,0,0,0,0,1,3,1,1,1,1,0,0,0,0,0
1457,Ivory Coast,225,437,2,Government of Ivory Coast - MPCI,89,0,0,1,10/30/2002,11/01/2002,1,"Dow Jones 2002-10-30 ""Ivory Coast Govt, Rebels Open Peace Talks In Togo - BBC"" AND AFP 2002-10-30 ""Ivory Coast government, rebels open peace talks [Corrected 10/30/ 02]"" AND Reuters 2002-10-31 ""Ivory Coast peace talks to broach tough issues"" AND AFP 2002-11-01 ""Two negotiators leave as Ivory Coast peace talks resume""",1,0,0,0,Togo,461,0,0,0,0,0,0,0,0,0,0,0,0,0,0,0,0,0,0,0,1,3,0,0,0,0,0,1,0,0,0
1458,Ivory Coast,225,437,2,Government of Ivory Coast - MPCI,89,0,0,1,11/01/2002,11/30/2002,4,"Reuters 2002-11-15 ""UPDATE 1-France sends envoy to speed Ivory Coast peace talks""",1,0,0,0,Senegal,433,0,0,0,0,0,0,0,0,0,0,0,0,0,0,0,0,0,0,0,1,1,3,0,0,0,1,0,0,0,0
1459,Ivory Coast,225,437,2,Government of Ivory Coast - MPCI,89,0,0,1,11/01/2002,11/30/2002,4,"Reuters 2002-11-15 ""UPDATE 1-France sends envoy to speed Ivory Coast peace talks""",1,0,0,0,Senegal,433,0,0,0,0,0,0,0,0,0,0,0,0,0,0,0,0,0,0,0,1,2,3,0,0,0,1,0,0,0,0
1460,Ivory Coast,225,437,2,Government of Ivory Coast - MPCI,89,0,0,1,11/06/2002,11/09/2002,1,"AFP 2002-11-06 ""Ivory Coast peace talks re-open amid fears of fresh violence [Corrected 11/06/02]"" AND Reuters 2002-11-06 ""UPDATE 3-Little headway in Ivory Coast peace talks"" AND AFP 2002-11-06 ""Ivory Coast peace talks adjourn to Friday"" AFP 2002-11-09 ""Ivory Coast mediator asks rebels to keep talking""",0,1,0,0,ECOWAS,11006,0,0,0,0,0,0,0,0,0,0,0,0,0,0,0,0,0,0,0,1,3,2,0,0,0,1,0,0,0,0
1461,Ivory Coast,225,437,2,Government of Ivory Coast - MPCI,89,0,0,1,11/06/2002,11/10/2002,1,"AFP 2002-11-06 ""Ivory Coast peace talks re-open amid fears of fresh violence [Corrected 11/06/02]"" AND Reuters 2002-11-06 ""UPDATE 3-Little headway in Ivory Coast peace talks"" AND AFP 2002-11-06 ""Ivory Coast peace talks adjourn to Friday"" AND Reuters 2002-11-08 ""West Africans work on Ivory Coast peace proposal"" AND AFP 2002-11-10 ""Ivory Coast rebels tell Eyadema suspension of talks ""only temporary"" [Corrected 11/10/02] """,1,0,0,0,Togo,461,0,0,0,0,0,0,0,0,0,0,0,0,0,0,0,0,0,0,0,1,3,0,0,0,0,0,1,0,0,0
1462,Ivory Coast,225,437,2,Government of Ivory Coast - MPCI,89,0,0,1,11/07/2002,11/07/2002,1,"AFP 2002-11-07 ""Ivory Coast peace talks adjourn to Friday""",0,1,0,0,ECOWAS,11006,0,0,0,0,0,0,0,0,0,0,0,0,0,0,0,0,0,0,0,1,3,1,0,0,0,1,0,0,0,0
1463,Ivory Coast,225,437,2,Government of Ivory Coast - MPCI,89,0,0,1,11/10/2002,11/10/2002,1,"AFP 2002-11-10 ""Ivory Coast rebels tell Eyadema suspension of talks ""only temporary"" [Corrected 11/10/02] """,0,1,0,0,ECOWAS,11006,0,0,0,0,0,0,0,0,0,0,0,0,0,0,0,0,0,0,0,1,2,3,0,0,1,0,0,0,0,0
1464,Ivory Coast,225,437,2,Government of Ivory Coast - MPCI,89,0,0,1,11/12/2002,11/12/2002,1,"Reuters 2002-11-12 ""Ivory Coast rebels resume peace talks in Togo""",0,1,0,0,ECOWAS,11006,0,0,0,0,0,0,0,0,0,0,0,0,0,0,0,0,0,0,0,1,2,3,0,0,0,1,0,0,0,0
1465,Ivory Coast,225,437,2,Government of Ivory Coast - MPCI,89,0,0,1,11/12/2002,11/14/2002,1,"Reuters 2002-11-12 ""Ivory Coast rebels resume peace talks in Togo"" AND AFP 2002-11-14 ""Ivory Coast rebels reject peace plan, say it favours Gbagbo [Corrected 11/14/02] """,1,0,0,0,Togo,461,0,0,0,0,0,0,0,0,0,0,0,0,0,0,0,0,0,0,0,1,3,0,0,0,0,0,1,0,0,0
1466,Ivory Coast,225,437,2,Government of Ivory Coast - MPCI,89,0,0,1,11/14/2002,11/14/2002,1,"AFP 2002-11-14 ""Ivory Coast rebels reject peace plan, say it favours Gbagbo [Corrected 11/14/02] """,0,1,0,0,ECOWAS,11006,0,0,0,0,0,0,0,0,0,0,0,0,0,0,0,0,0,0,0,1,2,3,0,0,0,1,0,0,0,0
1467,Ivory Coast,225,437,2,Government of Ivory Coast - MPCI,89,0,0,1,11/19/2002,11/19/2002,1,"AFP 2002-11-20 ""I.Coast president makes referendum concession in peace talks [Corrected 11/20/02]""",0,0,1,0,Businessmen,12005,0,0,0,0,0,0,0,0,0,0,0,0,0,0,0,0,0,0,0,1,1,3,1,0,0,0,0,0,0,0
1468,Ivory Coast,225,437,2,Government of Ivory Coast - MPCI,89,0,0,1,11/21/2002,11/22/2002,1,"AFP 2002-11-22 ""Ivory Coastmediator meets rebels, seeks to save peace talks [Corrected 11/22/02]"" AND allAfrica.com/All Africa Global Media via COMTEX) 2002-11-22 ""Ivory Coast New Peace Plan, UN Launches Multimillion Dollar Aid Appeal""",0,1,0,0,ECOWAS,11006,0,0,0,0,0,0,0,0,0,0,0,0,0,0,0,0,0,0,0,1,3,2,0,0,0,1,0,0,0,0
1469,Ivory Coast,225,437,2,Government of Ivory Coast - MPCI,89,0,0,1,11/24/2002,11/24/2002,1,"Reuters 2002-11-24 ""UPDATE 1-Ivory Coast peace talks hit new snag""",0,1,0,0,ECOWAS,11006,0,0,0,0,0,0,0,0,0,0,0,0,0,0,0,0,0,0,0,1,3,1,0,0,0,1,0,0,0,0
1470,Ivory Coast,225,437,2,Government of Ivory Coast - MPCI,89,0,0,1,11/24/2002,11/24/2002,1,"Reuters 2002-11-24 ""UPDATE 1-Ivory Coast peace talks hit new snag""",1,0,0,0,Togo,461,0,0,0,0,0,0,0,0,0,0,0,0,0,0,0,0,0,0,0,1,0,0,0,0,0,0,1,0,0,0
1471,Ivory Coast,225,437,2,Government of Ivory Coast - MPCI,89,0,0,1,11/26/2002,11/26/2002,1,"AFP 2002-11-27 ""French FM in Ivory Coast on peace mission [Corrected 11/27/02] """,1,0,0,0,France,220,0,0,0,0,0,0,0,0,0,0,0,0,0,0,0,0,0,0,0,1,3,1,0,0,0,1,0,0,0,0
1472,Ivory Coast,225,437,2,Government of Ivory Coast - MPCI,89,0,0,1,11/27/2002,11/27/2002,1,"AFP 2002-11-27 ""French FM in Ivory Coast on peace mission [Corrected 11/27/02]""",1,0,0,0,France,220,0,0,0,0,0,0,0,0,0,0,0,0,0,0,0,0,0,0,0,1,2,3,0,0,1,0,0,0,0,0
1473,Ivory Coast,225,437,2,Government of Ivory Coast - MPCI,89,0,0,1,11/27/2002,11/27/2002,1,"AFP 2002-11-27 ""Ivory Coast rebels deny violating ceasefire""",1,0,0,0,France,220,0,0,0,0,0,0,0,0,0,0,0,0,0,0,0,0,0,0,0,1,1,3,0,0,0,1,0,0,0,0
1474,Ivory Coast,225,437,2,Government of Ivory Coast - MPCI,89,0,0,1,11/27/2002,11/27/2002,1,"AFP 2002-11-27 ""French FM in Ivory Coast on peace mission [Corrected 11/27/02] """,1,0,0,0,Togo,461,0,0,0,0,0,0,0,0,0,0,0,0,0,0,0,0,0,0,0,1,2,0,0,0,0,0,1,0,0,0
1475,Ivory Coast,225,437,2,Government of Ivory Coast - MPCI,89,0,0,1,11/30/2002,12/22/2002,4,"UN Integrated Regional Information Networks/All Africa Global Media via COMTEX 2002-12-23 ""Lome Talks Suspended""",0,1,0,0,ECOWAS,11006,0,0,0,0,0,0,0,0,0,0,0,0,0,0,0,0,0,0,0,1,3,4,0,0,0,1,0,0,0,0
1476,Ivory Coast,225,437,2,Government of Ivory Coast - MPCI,89,1,0,1,12/03/2002,12/03/2002,1,"AFP 2002-12-03 ""Ivory Coast, Burkina presidents seek end to Ivory Coast conflict [Corrected 12/03/02]""",2,0,0,0,"Burkina Faso, Mali",439,432,0,0,0,0,0,0,0,0,0,0,0,0,0,0,0,0,0,0,2,1,3,0,0,1,0,0,0,0,0
1477,Ivory Coast,225,437,2,Government of Ivory Coast - MPIGO,91,1,0,1,12/03/2002,12/03/2002,1,"AFP 2002-12-03 ""Ivory Coast, Burkina presidents seek end to Ivory Coast conflict [Corrected 12/03/02]""",2,0,0,0,"Burkina Faso, Mali",439,432,0,0,0,0,0,0,0,0,0,0,0,0,0,0,0,0,0,0,2,1,3,0,0,1,0,0,0,0,0
1478,Ivory Coast,225,437,0,Government of Ivory Coast - MJP,245,1,0,0,12/03/2002,12/03/2002,1,"AFP 2002-12-03 ""Ivory Coast, Burkina presidents seek end to Ivory Coast conflict [Corrected 12/03/02]""",2,0,0,0,"Burkina Faso, Mali",439,432,0,0,0,0,0,0,0,0,0,0,0,0,0,0,0,0,0,0,2,1,3,0,0,1,0,0,0,0,0
1479,Ivory Coast,225,437,2,Government of Ivory Coast - MPIGO,91,0,0,1,12/12/2002,12/12/2002,1,"AFP 2002-12-02 ""Ivorians enlist to fight, France to send more troops to Ivory Coast""",1,0,0,0,France,220,0,0,0,0,0,0,0,0,0,0,0,0,0,0,0,0,0,0,0,1,2,3,0,0,1,0,0,0,0,0
1480,Ivory Coast,225,437,2,Government of Ivory Coast - MPIGO,91,0,0,1,12/12/2002,12/12/2002,1,"AFP 2002-12-02 ""Ivorians enlist to fight, France to send more troops to Ivory Coast""",1,0,0,0,Togo,461,0,0,0,0,0,0,0,0,0,0,0,0,0,0,0,0,0,0,0,1,2,0,0,0,0,0,1,0,0,0
1481,Ivory Coast,225,437,2,Government of Ivory Coast - MPCI,89,0,0,1,12/16/2002,12/16/2002,1,"Daily Trust/All Africa Global Media via COMTEX 2002-12-18 ""Obasanjo, Others Meet On Ivorien Crisis""",5,0,0,0,"Nigeria, Togo, Ghana, Senegal, Liberia",475,461,452,433,450,0,0,0,0,0,0,0,0,0,0,0,0,0,0,0,5,3,1,0,1,0,0,0,0,0,0
1482,Ivory Coast,225,437,2,Government of Ivory Coast - MPCI,89,0,0,1,12/17/2002,12/17/2002,1,"AFP 2002-12-18 ""Renewed fighting breaks out in Ivory Coast""",1,0,0,0,France,220,0,0,0,0,0,0,0,0,0,0,0,0,0,0,0,0,0,0,0,1,2,3,0,0,1,0,0,0,0,0
1483,Ivory Coast,225,437,2,Government of Ivory Coast - MPCI,89,1,0,1,12/18/2002,12/19/2002,1,"AFP 2002-12-19 ""Fighting mars West African leaders' attempts to forge peace in Ivory Coast""",0,2,0,0,"ECOWAS, UN",11006,11024,0,0,0,0,0,0,0,0,0,0,0,0,0,0,0,0,0,0,2,1,3,0,0,1,0,0,0,0,0
1484,Ivory Coast,225,437,2,Government of Ivory Coast - MPCI,89,1,0,1,12/18/2002,12/19/2002,1,"AFP 2002-12-19 ""Fighting mars West African leaders' attempts to forge peace in Ivory Coast""",1,0,0,0,Senegal,433,0,0,0,0,0,0,0,0,0,0,0,0,0,0,0,0,0,0,0,1,1,0,0,0,0,0,1,0,0,0
1485,Ivory Coast,225,437,2,Government of Ivory Coast - MPIGO,91,1,0,1,12/18/2002,12/19/2002,1,"AFP 2002-12-19 ""Fighting mars West African leaders' attempts to forge peace in Ivory Coast""",0,2,0,0,"ECOWAS, UN",11006,11024,0,0,0,0,0,0,0,0,0,0,0,0,0,0,0,0,0,0,2,1,3,0,0,1,0,0,0,0,0
1486,Ivory Coast,225,437,2,Government of Ivory Coast - MPIGO,91,1,0,1,12/18/2002,12/19/2002,1,"AFP 2002-12-19 ""Fighting mars West African leaders' attempts to forge peace in Ivory Coast""",1,0,0,0,Senegal,433,0,0,0,0,0,0,0,0,0,0,0,0,0,0,0,0,0,0,0,1,1,0,0,0,0,0,1,0,0,0
1487,Ivory Coast,225,437,0,Government of Ivory Coast - MJP,245,1,0,0,12/18/2002,12/19/2002,1,"AFP 2002-12-19 ""Fighting mars West African leaders' attempts to forge peace in Ivory Coast""",0,2,0,0,"ECOWAS, UN",11006,11024,0,0,0,0,0,0,0,0,0,0,0,0,0,0,0,0,0,0,2,1,3,0,0,1,0,0,0,0,0
1488,Ivory Coast,225,437,0,Government of Ivory Coast - MJP,245,1,0,0,12/18/2002,12/19/2002,1,"AFP 2002-12-19 ""Fighting mars West African leaders' attempts to forge peace in Ivory Coast""",1,0,0,0,Senegal,433,0,0,0,0,0,0,0,0,0,0,0,0,0,0,0,0,0,0,0,1,1,0,0,0,0,0,1,0,0,0
1489,Ivory Coast,225,437,2,Government of Ivory Coast - MPIGO,91,0,0,1,12/24/2002,12/24/2002,1,"AFP 2002-12-24 ""Ivory Coast rebels ease off after threatening war on French troops""",1,0,0,0,Togo,461,0,0,0,0,0,0,0,0,0,0,0,0,0,0,0,0,0,0,0,1,2,3,0,0,1,0,0,0,0,0
1490,Ivory Coast,225,437,0,Government of Ivory Coast - MJP,245,0,0,0,12/24/2002,12/24/2002,1,"AFP 2002-12-24 ""Ivory Coast rebels ease off after threatening war on French troops""",1,0,0,0,Togo,461,0,0,0,0,0,0,0,0,0,0,0,0,0,0,0,0,0,0,0,1,2,3,0,0,1,0,0,0,0,0
1491,Ivory Coast,225,437,2,Government of Ivory Coast - MPIGO,91,0,0,1,12/30/2002,12/30/2002,1,"Reuters 2002-12-30 ""UPDATE 1-French troops meet Ivory Coast rebels in cocoa west"" AND AFP 2002-12-30 ""French troops hold talks with Ivory Coast rebels after clashes [Corrected 12/30/02]""",1,0,0,0,France,220,0,0,0,0,0,0,0,0,0,0,0,0,0,0,0,0,0,0,0,1,2,3,0,0,1,0,0,0,0,0
1492,Ivory Coast,225,437,0,Government of Ivory Coast - MJP,245,0,0,0,12/30/2002,12/30/2002,1,"Reuters 2002-12-30 ""UPDATE 1-French troops meet Ivory Coast rebels in cocoa west"" AND AFP 2002-12-30 ""French troops hold talks with Ivory Coast rebels after clashes [Corrected 12/30/02]""",1,0,0,0,France,220,0,0,0,0,0,0,0,0,0,0,0,0,0,0,0,0,0,0,0,1,2,3,0,0,1,0,0,0,0,0
1493,Ivory Coast,225,437,0,Government of Ivory Coast - MPCI,89,1,0,0,01/03/2003,01/03/2003,1,"Reuters 2003-01-03 ""UPDATE 3-France piles on pressure to end Ivory Coast war"" AND AFP 2003-01-03 ""Ivory Coast president pledges to observe 'total ceasefire' [Corrected 01/03/03] """,1,0,0,0,France,220,0,0,0,0,0,0,0,0,0,0,0,0,0,0,0,0,0,0,0,1,1,3,0,1,0,0,0,0,0,0
1494,Ivory Coast,225,437,2,Government of Ivory Coast - MPIGO,91,1,0,1,01/03/2003,01/03/2003,1,"Reuters 2003-01-03 ""UPDATE 3-France piles on pressure to end Ivory Coast war"" AND AFP 2003-01-03 ""Ivory Coast president pledges to observe 'total ceasefire' [Corrected 01/03/03] """,1,0,0,0,France,220,0,0,0,0,0,0,0,0,0,0,0,0,0,0,0,0,0,0,0,1,1,3,0,1,0,0,0,0,0,0
1495,Ivory Coast,225,437,2,Government of Ivory Coast - MJP,245,1,0,1,01/03/2003,01/03/2003,1,"Reuters 2003-01-03 ""UPDATE 3-France piles on pressure to end Ivory Coast war"" AND AFP 2003-01-03 ""Ivory Coast president pledges to observe 'total ceasefire' [Corrected 01/03/03] """,1,0,0,0,France,220,0,0,0,0,0,0,0,0,0,0,0,0,0,0,0,0,0,0,0,1,1,3,0,1,0,0,0,0,0,0
1496,Ivory Coast,225,437,0,Government of Ivory Coast - MPCI,89,0,0,0,01/04/2003,01/04/2003,1,"Reuters 2003-01-04 ""UPDATE 2-Ivory Coast rebels to join Paris peace talks""",1,0,0,0,France,220,0,0,0,0,0,0,0,0,0,0,0,0,0,0,0,0,0,0,0,1,2,3,0,0,1,0,0,0,0,0
1497,Ivory Coast,225,437,2,Government of Ivory Coast - MPIGO,91,0,0,1,01/08/2003,01/08/2003,1,"AFP 2003-01-08 ""Western Ivory Coast rebels sign truce with France but snub government [Corrected 01/08/03]"" AND AFP 2003-01-08 ""Western Ivory Coast rebels sign truce with France but snub government [Corrected 01/08/03]""",1,0,0,0,France,220,0,0,0,0,0,0,0,0,0,0,0,0,0,0,0,0,0,0,0,1,2,3,0,1,1,0,0,0,0,0
1498,Ivory Coast,225,437,2,Government of Ivory Coast - MJP,245,0,0,1,01/08/2003,01/08/2003,1,"AFP 2003-01-08 ""Western Ivory Coast rebels sign truce with France but snub government [Corrected 01/08/03]"" AND AFP 2003-01-08 ""Western Ivory Coast rebels sign truce with France but snub government [Corrected 01/08/03]""",1,0,0,0,France,220,0,0,0,0,0,0,0,0,0,0,0,0,0,0,0,0,0,0,0,1,2,3,0,1,1,0,0,0,0,0
1499,Ivory Coast,225,437,2,Government of Ivory Coast - MPIGO,91,0,0,1,01/09/2003,01/09/2003,1,"Reuters 2003-01-09 ""UPDATE 2-Ivory Coast rebels say gov't attacks after truce."" AFP 2003-01-10 ""Ivorian rebels allege new government attacks, pull out of talks [Corrected 01/10/03]""",1,0,0,0,France,220,0,0,0,0,0,0,0,0,0,0,0,0,0,0,0,0,0,0,0,1,2,3,0,1,1,0,0,0,0,0
1500,Ivory Coast,225,437,2,Government of Ivory Coast - MPIGO,91,0,0,1,01/12/2003,01/12/2003,1,"AFP 2003-01-12 ""Western Ivorian rebels arrive in Togo to sign truce, raising peace hopes""",1,0,0,0,France,220,0,0,0,0,0,0,0,0,0,0,0,0,0,0,0,0,0,0,0,1,2,3,0,1,0,0,0,0,0,0
1501,Ivory Coast,225,437,2,Government of Ivory Coast - MPIGO,91,0,0,1,01/12/2003,01/12/2003,1,"AFP 2003-01-12 ""Western Ivorian rebels arrive in Togo to sign truce, raising peace hopes""",1,0,0,0,Togo,461,0,0,0,0,0,0,0,0,0,0,0,0,0,0,0,0,0,0,0,1,2,0,0,0,0,0,1,0,0,0
1502,Ivory Coast,225,437,2,Government of Ivory Coast - MJP,245,0,0,1,01/12/2003,01/12/2003,1,"AFP 2003-01-12 ""Western Ivorian rebels arrive in Togo to sign truce, raising peace hopes""",1,0,0,0,France,220,0,0,0,0,0,0,0,0,0,0,0,0,0,0,0,0,0,0,0,1,2,3,0,1,0,0,0,0,0,0
1503,Ivory Coast,225,437,2,Government of Ivory Coast - MJP,245,0,0,1,01/12/2003,01/12/2003,1,"AFP 2003-01-12 ""Western Ivorian rebels arrive in Togo to sign truce, raising peace hopes""",1,0,0,0,Togo,461,0,0,0,0,0,0,0,0,0,0,0,0,0,0,0,0,0,0,0,1,2,0,0,0,0,0,1,0,0,0
1504,Ivory Coast,225,437,0,Government of Ivory Coast - MPCI,89,0,0,0,01/14/2003,01/14/2003,1,"AFP 2003-01-14 ""Ivorian rebels to meet Senegal's Wade before Paris talks"" AND AFP 2003-01-15 ""Ivory Coast peace talks to start in Paris amid little sign of compromise by Marc Burleigh [Corrected 01/15/03]""",0,1,0,0,ECOWAS,11006,0,0,0,0,0,0,0,0,0,0,0,0,0,0,0,0,0,0,0,1,2,3,0,0,0,1,0,0,0,0
1505,Ivory Coast,225,437,0,Government of Ivory Coast - MPCI,89,0,0,0,01/14/2003,01/14/2003,1,"AFP 2003-01-14 ""Ivorian rebels to meet Senegal's Wade before Paris talks"" AND AFP 2003-01-15 ""Ivory Coast peace talks to start in Paris amid little sign of compromise by Marc Burleigh [Corrected 01/15/03]""",1,0,0,0,Senegal,433,0,0,0,0,0,0,0,0,0,0,0,0,0,0,0,0,0,0,0,1,2,0,0,0,0,0,1,0,0,0
1506,Ivory Coast,225,437,2,Government of Ivory Coast - MPIGO,91,0,0,1,01/14/2003,01/14/2003,1,"AFP 2003-01-14 ""Ivorian rebels to meet Senegal's Wade before Paris talks"" AND AFP 2003-01-15 ""Ivory Coast peace talks to start in Paris amid little sign of compromise by Marc Burleigh [Corrected 01/15/03]""",0,1,0,0,ECOWAS,11006,0,0,0,0,0,0,0,0,0,0,0,0,0,0,0,0,0,0,0,1,2,3,0,0,0,1,0,0,0,0
1507,Ivory Coast,225,437,2,Government of Ivory Coast - MPIGO,91,0,0,1,01/14/2003,01/14/2003,1,"AFP 2003-01-14 ""Ivorian rebels to meet Senegal's Wade before Paris talks"" AND AFP 2003-01-15 ""Ivory Coast peace talks to start in Paris amid little sign of compromise by Marc Burleigh [Corrected 01/15/03]""",1,0,0,0,Senegal,433,0,0,0,0,0,0,0,0,0,0,0,0,0,0,0,0,0,0,0,1,2,0,0,0,0,0,1,0,0,0
1508,Ivory Coast,225,437,2,Government of Ivory Coast - MJP,245,0,0,1,01/14/2003,01/14/2003,1,"AFP 2003-01-14 ""Ivorian rebels to meet Senegal's Wade before Paris talks"" AND AFP 2003-01-15 ""Ivory Coast peace talks to start in Paris amid little sign of compromise by Marc Burleigh [Corrected 01/15/03]""",0,1,0,0,ECOWAS,11006,0,0,0,0,0,0,0,0,0,0,0,0,0,0,0,0,0,0,0,1,2,3,0,0,0,1,0,0,0,0
1509,Ivory Coast,225,437,2,Government of Ivory Coast - MJP,245,0,0,1,01/14/2003,01/14/2003,1,"AFP 2003-01-14 ""Ivorian rebels to meet Senegal's Wade before Paris talks"" AND AFP 2003-01-15 ""Ivory Coast peace talks to start in Paris amid little sign of compromise by Marc Burleigh [Corrected 01/15/03]""",1,0,0,0,Senegal,433,0,0,0,0,0,0,0,0,0,0,0,0,0,0,0,0,0,0,0,1,2,0,0,0,0,0,1,0,0,0
1510,Ivory Coast,225,437,0,Government of Ivory Coast - MPCI,89,0,0,0,01/15/2003,01/16/2003,1,"AFP 2003-01-15 ""Ivory Coast peace talks start in Paris [Corrected 01/15/03]""",1,0,0,0,France,220,0,0,0,0,0,0,0,0,0,0,0,0,0,0,0,0,0,0,0,1,3,1,1,0,0,0,0,0,0,0
1511,Ivory Coast,225,437,2,Government of Ivory Coast - MPIGO,91,0,0,1,01/15/2003,01/16/2003,1,"AFP 2003-01-15 ""Ivory Coast peace talks start in Paris [Corrected 01/15/03]""",1,0,0,0,France,220,0,0,0,0,0,0,0,0,0,0,0,0,0,0,0,0,0,0,0,1,3,1,1,0,0,0,0,0,0,0
1512,Ivory Coast,225,437,2,Government of Ivory Coast - MJP,245,0,0,1,01/15/2003,01/16/2003,1,"AFP 2003-01-15 ""Ivory Coast peace talks start in Paris [Corrected 01/15/03]""",1,0,0,0,France,220,0,0,0,0,0,0,0,0,0,0,0,0,0,0,0,0,0,0,0,1,3,1,1,0,0,0,0,0,0,0
1513,Ivory Coast,225,437,0,Government of Ivory Coast - MPCI,89,0,0,0,01/16/2003,01/16/2003,1,"AFP 2003-01-16 ""France struggles to bridge differences in Ivory Coast peace talks by Jean-Pierre Campagne [Corrected 01/16/03]""",1,0,0,0,France,220,0,0,0,0,0,0,0,0,0,0,0,0,0,0,0,0,0,0,0,1,1,3,1,0,0,0,0,0,0,0
1514,Ivory Coast,225,437,0,Government of Ivory Coast - MPCI,89,0,0,0,01/16/2003,01/16/2003,1,"AFP 2003-01-16 ""France struggles to bridge differences in Ivory Coast peace talks by Jean-Pierre Campagne [Corrected 01/16/03]"" AND Reuters 2003-01-16 ""Ivory Coast talks tackle citizenship issue first""",1,0,0,0,France,220,0,0,0,0,0,0,0,0,0,0,0,0,0,0,0,0,0,0,0,1,2,3,1,0,0,0,0,0,0,0
1515,Ivory Coast,225,437,2,Government of Ivory Coast - MPIGO,91,0,0,1,01/16/2003,01/16/2003,1,"AFP 2003-01-16 ""France struggles to bridge differences in Ivory Coast peace talks by Jean-Pierre Campagne [Corrected 01/16/03]""",1,0,0,0,France,220,0,0,0,0,0,0,0,0,0,0,0,0,0,0,0,0,0,0,0,1,1,3,1,0,0,0,0,0,0,0
1516,Ivory Coast,225,437,2,Government of Ivory Coast - MPIGO,91,0,0,1,01/16/2003,01/16/2003,1,"AFP 2003-01-16 ""France struggles to bridge differences in Ivory Coast peace talks by Jean-Pierre Campagne [Corrected 01/16/03]"" AND Reuters 2003-01-16 ""Ivory Coast talks tackle citizenship issue first""",1,0,0,0,France,220,0,0,0,0,0,0,0,0,0,0,0,0,0,0,0,0,0,0,0,1,2,3,1,0,0,0,0,0,0,0
1517,Ivory Coast,225,437,2,Government of Ivory Coast - MJP,245,0,0,1,01/16/2003,01/16/2003,1,"AFP 2003-01-16 ""France struggles to bridge differences in Ivory Coast peace talks by Jean-Pierre Campagne [Corrected 01/16/03]""",1,0,0,0,France,220,0,0,0,0,0,0,0,0,0,0,0,0,0,0,0,0,0,0,0,1,1,3,1,0,0,0,0,0,0,0
1518,Ivory Coast,225,437,2,Government of Ivory Coast - MJP,245,0,0,1,01/16/2003,01/16/2003,1,"AFP 2003-01-16 ""France struggles to bridge differences in Ivory Coast peace talks by Jean-Pierre Campagne [Corrected 01/16/03]"" AND Reuters 2003-01-16 ""Ivory Coast talks tackle citizenship issue first""",1,0,0,0,France,220,0,0,0,0,0,0,0,0,0,0,0,0,0,0,0,0,0,0,0,1,2,3,1,0,0,0,0,0,0,0
1519,Ivory Coast,225,437,0,Government of Ivory Coast - MPCI,89,1,0,0,01/17/2003,01/17/2003,1,"United Nations/All Africa Global Media via COMTEX 2003-01-17 ""Government Must Provide Relief for All Those in Need, UN Envoy Stresses""",0,1,0,0,UN,11024,0,0,0,0,0,0,0,0,0,0,0,0,0,0,0,0,0,0,0,1,1,3,0,0,1,0,0,0,0,0
1520,Ivory Coast,225,437,0,Government of Ivory Coast - MPCI,89,0,0,0,01/17/2003,01/24/2003,1,"Reuters 2003-01-17 ""UPDATE 2-Ivory Coast peace talks make headway on nationality row"" AND AFP 2003-01-17 ""Progress at I. Coast peace talks but rebels insist Gbagbo must go by Jean-Pierre Campagne [Corrected 01/17/03]"" AND AFP 2003-01-18 ""Pro, anti-Gbagbo marches in Ivory Coast as peace talks continue"" AND AFP 2003-01-19 ""Hopes rise at Ivory Coast peace talks"" AND AFP 2003-01-19 ""Ivory Coast peace talks move towards accord as tensions rise [Corrected 01/20/03]"" AND AFP 2003-01-20 ""Ivory Coast peace talks edge towards accord [Corrected 01/20/03]"" AND AFP 2003-01-21""Gbagbo, Annan due in Paris to seal Ivory Coast peace accord [Corrected 01/21/03]"" AND Reuters 2003-01-21 ""Ivory Coast peace talks address security, new govt"" AFP 2003-01-22 ""Deadly fighting kills 29, overshadows Ivory Coast peace talks [Corrected 01/22/03]"" AND Reuters 2001-01-23 ""Chirac to study results of Ivory Coast talks Friday"" AND OsterDowJones 2003-01-23""Ivory Coast Delegates Reach Consensus On Transition Govt"" AND Reuters 2003-01-24 ""Ivory Coast plan calls for consensus govt-source""",1,0,0,0,France,220,0,0,0,0,0,0,0,0,0,0,0,0,0,0,0,0,0,0,0,1,3,1,1,0,0,0,0,0,0,0
1521,Ivory Coast,225,437,2,Government of Ivory Coast - MPIGO,91,1,0,1,01/17/2003,01/17/2003,1,"United Nations/All Africa Global Media via COMTEX 2003-01-17 ""Government Must Provide Relief for All Those in Need, UN Envoy Stresses""",0,1,0,0,UN,11024,0,0,0,0,0,0,0,0,0,0,0,0,0,0,0,0,0,0,0,1,1,3,0,0,1,0,0,0,0,0
1522,Ivory Coast,225,437,2,Government of Ivory Coast - MPIGO,91,0,0,1,01/17/2003,01/24/2003,1,"Reuters 2003-01-17 ""UPDATE 2-Ivory Coast peace talks make headway on nationality row"" AND AFP 2003-01-17 ""Progress at I. Coast peace talks but rebels insist Gbagbo must go by Jean-Pierre Campagne [Corrected 01/17/03]"" AND AFP 2003-01-18 ""Pro, anti-Gbagbo marches in Ivory Coast as peace talks continue"" AND AFP 2003-01-19 ""Hopes rise at Ivory Coast peace talks"" AND AFP 2003-01-19 ""Ivory Coast peace talks move towards accord as tensions rise [Corrected 01/20/03]"" AND AFP 2003-01-20 ""Ivory Coast peace talks edge towards accord [Corrected 01/20/03]"" AND AFP 2003-01-21""Gbagbo, Annan due in Paris to seal Ivory Coast peace accord [Corrected 01/21/03]"" AND Reuters 2003-01-21 ""Ivory Coast peace talks address security, new govt"" AFP 2003-01-22 ""Deadly fighting kills 29, overshadows Ivory Coast peace talks [Corrected 01/22/03]"" AND Reuters 2001-01-23 ""Chirac to study results of Ivory Coast talks Friday"" AND OsterDowJones 2003-01-23""Ivory Coast Delegates Reach Consensus On Transition Govt"" AND Reuters 2003-01-24 ""Ivory Coast plan calls for consensus govt-source""",1,0,0,0,France,220,0,0,0,0,0,0,0,0,0,0,0,0,0,0,0,0,0,0,0,1,3,1,1,0,0,0,0,0,0,0
1523,Ivory Coast,225,437,2,Government of Ivory Coast - MJP,245,1,0,1,01/17/2003,01/17/2003,1,"United Nations/All Africa Global Media via COMTEX 2003-01-17 ""Government Must Provide Relief for All Those in Need, UN Envoy Stresses""",0,1,0,0,UN,11024,0,0,0,0,0,0,0,0,0,0,0,0,0,0,0,0,0,0,0,1,1,3,0,0,1,0,0,0,0,0
1524,Ivory Coast,225,437,2,Government of Ivory Coast - MJP,245,0,0,1,01/17/2003,01/24/2003,1,"Reuters 2003-01-17 ""UPDATE 2-Ivory Coast peace talks make headway on nationality row"" AND AFP 2003-01-17 ""Progress at I. Coast peace talks but rebels insist Gbagbo must go by Jean-Pierre Campagne [Corrected 01/17/03]"" AND AFP 2003-01-18 ""Pro, anti-Gbagbo marches in Ivory Coast as peace talks continue"" AND AFP 2003-01-19 ""Hopes rise at Ivory Coast peace talks"" AND AFP 2003-01-19 ""Ivory Coast peace talks move towards accord as tensions rise [Corrected 01/20/03]"" AND AFP 2003-01-20 ""Ivory Coast peace talks edge towards accord [Corrected 01/20/03]"" AND AFP 2003-01-21""Gbagbo, Annan due in Paris to seal Ivory Coast peace accord [Corrected 01/21/03]"" AND Reuters 2003-01-21 ""Ivory Coast peace talks address security, new govt"" AFP 2003-01-22 ""Deadly fighting kills 29, overshadows Ivory Coast peace talks [Corrected 01/22/03]"" AND Reuters 2001-01-23 ""Chirac to study results of Ivory Coast talks Friday"" AND OsterDowJones 2003-01-23""Ivory Coast Delegates Reach Consensus On Transition Govt"" AND Reuters 2003-01-24 ""Ivory Coast plan calls for consensus govt-source""",1,0,0,0,France,220,0,0,0,0,0,0,0,0,0,0,0,0,0,0,0,0,0,0,0,1,3,1,1,0,0,0,0,0,0,0
1525,Ivory Coast,225,437,0,Government of Ivory Coast - MPCI,89,0,0,0,01/24/2003,01/24/2003,1,"AFP 2003-01-24 ""African leaders head to Paris to bolster Ivory Coast deal [Corrected 01/24/03] """,1,0,0,0,France,220,0,0,0,0,0,0,0,0,0,0,0,0,0,0,0,0,0,0,0,1,3,1,1,0,0,0,0,0,0,0
1526,Ivory Coast,225,437,2,Government of Ivory Coast - MPIGO,91,0,0,1,01/24/2003,01/24/2003,1,"AFP 2003-01-24 ""African leaders head to Paris to bolster Ivory Coast deal [Corrected 01/24/03] """,1,0,0,0,France,220,0,0,0,0,0,0,0,0,0,0,0,0,0,0,0,0,0,0,0,1,3,1,1,0,0,0,0,0,0,0
1527,Ivory Coast,225,437,2,Government of Ivory Coast - MJP,245,0,0,1,01/24/2003,01/24/2003,1,"AFP 2003-01-24 ""African leaders head to Paris to bolster Ivory Coast deal [Corrected 01/24/03] """,1,0,0,0,France,220,0,0,0,0,0,0,0,0,0,0,0,0,0,0,0,0,0,0,0,1,3,1,1,0,0,0,0,0,0,0
1528,Ivory Coast,225,437,0,Government of Ivory Coast - MPCI,89,0,0,0,01/25/2003,01/25/2003,1,"AFP 2003-01-25 ""Gbagbo accepts accord at Ivory Coast summit [Corrected 01/25/03]""",1,1,0,0,"UN, France",11024,220,0,0,0,0,0,0,0,0,0,0,0,0,0,0,0,0,0,0,2,1,3,1,0,0,0,0,0,0,0
1529,Ivory Coast,225,437,2,Government of Ivory Coast - MPIGO,91,0,0,1,01/25/2003,01/25/2003,1,"AFP 2003-01-25 ""Gbagbo accepts accord at Ivory Coast summit [Corrected 01/25/03]""",1,1,0,0,"UN, France",11024,220,0,0,0,0,0,0,0,0,0,0,0,0,0,0,0,0,0,0,2,1,3,1,0,0,0,0,0,0,0
1530,Ivory Coast,225,437,2,Government of Ivory Coast - MJP,245,0,0,1,01/25/2003,01/25/2003,1,"AFP 2003-01-25 ""Gbagbo accepts accord at Ivory Coast summit [Corrected 01/25/03]""",1,1,0,0,"UN, France",11024,220,0,0,0,0,0,0,0,0,0,0,0,0,0,0,0,0,0,0,2,1,3,1,0,0,0,0,0,0,0
1531,Ivory Coast,225,437,0,Government of Ivory Coast - MPCI,89,1,0,0,01/31/2003,01/31/2003,1,"AFP 2003-01-31 ""W. African leaders meet with Ivory Coast govt, rebel delegates [Corrected 01/31/03]""",0,1,0,0,ECOWAS,11006,0,0,0,0,0,0,0,0,0,0,0,0,0,0,0,0,0,0,0,1,1,3,0,0,0,1,0,0,0,0
1532,Ivory Coast,225,437,0,Government of Ivory Coast - MPCI,89,1,0,0,01/31/2003,01/31/2003,1,"AFP 2003-01-31 ""W. African leaders meet with Ivory Coast govt, rebel delegates [Corrected 01/31/03]""",0,1,0,0,ECOWAS,11006,0,0,0,0,0,0,0,0,0,0,0,0,0,0,0,0,0,0,0,1,2,3,0,0,0,1,0,0,0,0
1533,Ivory Coast,225,437,0,Government of Ivory Coast - MPCI,89,1,0,0,01/31/2003,01/31/2003,1,"AFP 2003-01-31 ""W. African leaders meet with Ivory Coast govt, rebel delegates [Corrected 01/31/03]""",1,0,0,0,Senegal,433,0,0,0,0,0,0,0,0,0,0,0,0,0,0,0,0,0,0,0,1,3,0,0,0,0,0,1,0,0,0
1534,Ivory Coast,225,437,2,Government of Ivory Coast - MPIGO,91,1,0,1,01/31/2003,01/31/2003,1,"AFP 2003-01-31 ""W. African leaders meet with Ivory Coast govt, rebel delegates [Corrected 01/31/03]""",0,1,0,0,ECOWAS,11006,0,0,0,0,0,0,0,0,0,0,0,0,0,0,0,0,0,0,0,1,1,3,0,0,0,1,0,0,0,0
1535,Ivory Coast,225,437,2,Government of Ivory Coast - MPIGO,91,1,0,1,01/31/2003,01/31/2003,1,"AFP 2003-01-31 ""W. African leaders meet with Ivory Coast govt, rebel delegates [Corrected 01/31/03]""",0,1,0,0,ECOWAS,11006,0,0,0,0,0,0,0,0,0,0,0,0,0,0,0,0,0,0,0,1,2,3,0,0,0,1,0,0,0,0
1536,Ivory Coast,225,437,2,Government of Ivory Coast - MPIGO,91,1,0,1,01/31/2003,01/31/2003,1,"AFP 2003-01-31 ""W. African leaders meet with Ivory Coast govt, rebel delegates [Corrected 01/31/03]""",1,0,0,0,Senegal,433,0,0,0,0,0,0,0,0,0,0,0,0,0,0,0,0,0,0,0,1,3,0,0,0,0,0,1,0,0,0
1537,Ivory Coast,225,437,2,Government of Ivory Coast - MJP,245,1,0,1,01/31/2003,01/31/2003,1,"AFP 2003-01-31 ""W. African leaders meet with Ivory Coast govt, rebel delegates [Corrected 01/31/03]""",0,1,0,0,ECOWAS,11006,0,0,0,0,0,0,0,0,0,0,0,0,0,0,0,0,0,0,0,1,1,3,0,0,0,1,0,0,0,0
1538,Ivory Coast,225,437,2,Government of Ivory Coast - MJP,245,1,0,1,01/31/2003,01/31/2003,1,"AFP 2003-01-31 ""W. African leaders meet with Ivory Coast govt, rebel delegates [Corrected 01/31/03]""",0,1,0,0,ECOWAS,11006,0,0,0,0,0,0,0,0,0,0,0,0,0,0,0,0,0,0,0,1,2,3,0,0,0,1,0,0,0,0
1539,Ivory Coast,225,437,2,Government of Ivory Coast - MJP,245,1,0,1,01/31/2003,01/31/2003,1,"AFP 2003-01-31 ""W. African leaders meet with Ivory Coast govt, rebel delegates [Corrected 01/31/03]""",1,0,0,0,Senegal,433,0,0,0,0,0,0,0,0,0,0,0,0,0,0,0,0,0,0,0,1,3,0,0,0,0,0,1,0,0,0
1540,Ivory Coast,225,437,0,Government of Ivory Coast - MPCI,89,0,0,0,02/01/2003,02/01/2003,1,"AFP 2003-02-01 ""African leaders bid to rescue peace deal, Ivorians stage giant anti- French demo [Corrected 02/01/03""",3,0,0,0,"Ghana, Togo, Nigeria",452,461,475,0,0,0,0,0,0,0,0,0,0,0,0,0,0,0,0,0,3,1,3,0,0,0,1,0,0,0,0
1541,Ivory Coast,225,437,0,Government of Ivory Coast - MPCI,89,0,0,0,02/01/2003,02/28/2003,4,"AFP 2003-02-13 ""Ivory Coast's new prime minister to hold talks with rebels on unity govt [Corrected 02/13/03]""",1,0,0,0,France,220,0,0,0,0,0,0,0,0,0,0,0,0,0,0,0,0,0,0,0,1,2,3,0,0,0,1,0,0,0,0
1542,Ivory Coast,225,437,2,Government of Ivory Coast - MPIGO,91,0,0,1,02/01/2003,02/01/2003,1,"AFP 2003-02-01 ""African leaders bid to rescue peace deal, Ivorians stage giant anti- French demo [Corrected 02/01/03""",3,0,0,0,"Ghana, Togo, Nigeria",452,461,475,0,0,0,0,0,0,0,0,0,0,0,0,0,0,0,0,0,3,1,3,0,0,0,1,0,0,0,0
1543,Ivory Coast,225,437,2,Government of Ivory Coast - MPIGO,91,0,0,1,02/01/2003,02/28/2003,4,"AFP 2003-02-13 ""Ivory Coast's new prime minister to hold talks with rebels on unity govt [Corrected 02/13/03]""",1,0,0,0,France,220,0,0,0,0,0,0,0,0,0,0,0,0,0,0,0,0,0,0,0,1,2,3,0,0,0,1,0,0,0,0
1544,Ivory Coast,225,437,2,Government of Ivory Coast - MJP,245,0,0,1,02/01/2003,02/01/2003,1,"AFP 2003-02-01 ""African leaders bid to rescue peace deal, Ivorians stage giant anti- French demo [Corrected 02/01/03""",3,0,0,0,"Ghana, Togo, Nigeria",452,461,475,0,0,0,0,0,0,0,0,0,0,0,0,0,0,0,0,0,3,1,3,0,0,0,1,0,0,0,0
1545,Ivory Coast,225,437,2,Government of Ivory Coast - MJP,245,0,0,1,02/01/2003,02/28/2003,4,"AFP 2003-02-13 ""Ivory Coast's new prime minister to hold talks with rebels on unity govt [Corrected 02/13/03]""",1,0,0,0,France,220,0,0,0,0,0,0,0,0,0,0,0,0,0,0,0,0,0,0,0,1,2,3,0,0,0,1,0,0,0,0
1546,Ivory Coast,225,437,0,Government of Ivory Coast - MPCI,89,0,0,0,02/04/2003,04/04/2004,1,"Heldt & Wallensteen 2005; http://www.zmag.org/content/showarticle.cfm?ItemID=5769, See also UN doucmentS/2003/374 and S/RES/1464 (2003) Difficult to establish start. It existed at least by Febr. 4; S/RES/1528 (2004)",0,1,0,0,ECOWAS,11006,0,0,0,0,0,0,0,0,0,0,0,0,0,0,0,0,0,0,0,1,0,0,0,0,0,0,0,0,0,1
1547,Ivory Coast,225,437,0,Government of Ivory Coast - MPCI,89,0,0,0,02/04/2003,12/31/2007,6,Heldt & Wallensteen 2005; http://www.zmag.org/content/showarticle.cfm?ItemID=5769. See also UN doucmentS/2003/374 and S/RES/1464 (2003) Difficult to establish start. It existed at least by Febr. 4;,1,0,0,0,France,220,0,0,0,0,0,0,0,0,0,0,0,0,0,0,0,0,0,0,0,1,0,0,0,0,0,0,0,0,0,1
1548,Ivory Coast,225,437,2,Government of Ivory Coast - MPIGO,91,0,0,1,02/04/2003,04/04/2004,1,"Heldt & Wallensteen 2005; http://www.zmag.org/content/showarticle.cfm?ItemID=5769, See also UN doucmentS/2003/374 and S/RES/1464 (2003) Difficult to establish start. It existed at least by Febr. 4; S/RES/1528 (2004)",0,1,0,0,ECOWAS,11006,0,0,0,0,0,0,0,0,0,0,0,0,0,0,0,0,0,0,0,1,0,0,0,0,0,0,0,0,0,1
1549,Ivory Coast,225,437,2,Government of Ivory Coast - MPIGO,91,0,0,1,02/04/2003,12/31/2007,6,Heldt & Wallensteen 2005; http://www.zmag.org/content/showarticle.cfm?ItemID=5769. See also UN doucmentS/2003/374 and S/RES/1464 (2003) Difficult to establish start. It existed at least by Febr. 4;,1,0,0,0,France,220,0,0,0,0,0,0,0,0,0,0,0,0,0,0,0,0,0,0,0,1,0,0,0,0,0,0,0,0,0,1
1550,Ivory Coast,225,437,2,Government of Ivory Coast - MJP,245,0,0,1,02/04/2003,04/04/2004,1,"Heldt & Wallensteen 2005; http://www.zmag.org/content/showarticle.cfm?ItemID=5769, See also UN doucmentS/2003/374 and S/RES/1464 (2003) Difficult to establish start. It existed at least by Febr. 4; S/RES/1528 (2004)",0,1,0,0,ECOWAS,11006,0,0,0,0,0,0,0,0,0,0,0,0,0,0,0,0,0,0,0,1,0,0,0,0,0,0,0,0,0,1
1551,Ivory Coast,225,437,2,Government of Ivory Coast - MJP,245,0,0,1,02/04/2003,12/31/2007,6,Heldt & Wallensteen 2005; http://www.zmag.org/content/showarticle.cfm?ItemID=5769. See also UN doucmentS/2003/374 and S/RES/1464 (2003) Difficult to establish start. It existed at least by Febr. 4;,1,0,0,0,France,220,0,0,0,0,0,0,0,0,0,0,0,0,0,0,0,0,0,0,0,1,0,0,0,0,0,0,0,0,0,1
1552,Ivory Coast,225,437,0,Government of Ivory Coast - MPCI,89,0,0,0,02/05/2003,02/05/2003,1,"AFP 2003-02-05 ""Ghana's Kufuor tells Ivory Coast president to implement French peace deal by Ben Ephson [Corrected 02/05/03]""",0,1,0,0,ECOWAS,11006,0,0,0,0,0,0,0,0,0,0,0,0,0,0,0,0,0,0,0,1,1,3,1,0,0,0,0,0,0,0
1553,Ivory Coast,225,437,0,Government of Ivory Coast - MPCI,89,0,0,0,02/05/2003,02/05/2003,1,"AFP 2003-02-05 ""Ghana's Kufuor tells Ivory Coast president to implement French peace deal by Ben Ephson [Corrected 02/05/03]""",1,0,0,0,Ghana,452,0,0,0,0,0,0,0,0,0,0,0,0,0,0,0,0,0,0,0,1,1,0,0,0,0,0,1,0,0,0
1554,Ivory Coast,225,437,2,Government of Ivory Coast - MPIGO,91,0,0,1,02/05/2003,02/05/2003,1,"AFP 2003-02-05 ""Ghana's Kufuor tells Ivory Coast president to implement French peace deal by Ben Ephson [Corrected 02/05/03]""",0,1,0,0,ECOWAS,11006,0,0,0,0,0,0,0,0,0,0,0,0,0,0,0,0,0,0,0,1,1,3,1,0,0,0,0,0,0,0
1555,Ivory Coast,225,437,2,Government of Ivory Coast - MPIGO,91,0,0,1,02/05/2003,02/05/2003,1,"AFP 2003-02-05 ""Ghana's Kufuor tells Ivory Coast president to implement French peace deal by Ben Ephson [Corrected 02/05/03]""",1,0,0,0,Ghana,452,0,0,0,0,0,0,0,0,0,0,0,0,0,0,0,0,0,0,0,1,1,0,0,0,0,0,1,0,0,0
1556,Ivory Coast,225,437,2,Government of Ivory Coast - MJP,245,0,0,1,02/05/2003,02/05/2003,1,"AFP 2003-02-05 ""Ghana's Kufuor tells Ivory Coast president to implement French peace deal by Ben Ephson [Corrected 02/05/03]""",0,1,0,0,ECOWAS,11006,0,0,0,0,0,0,0,0,0,0,0,0,0,0,0,0,0,0,0,1,1,3,1,0,0,0,0,0,0,0
1557,Ivory Coast,225,437,2,Government of Ivory Coast - MJP,245,0,0,1,02/05/2003,02/05/2003,1,"AFP 2003-02-05 ""Ghana's Kufuor tells Ivory Coast president to implement French peace deal by Ben Ephson [Corrected 02/05/03]""",1,0,0,0,Ghana,452,0,0,0,0,0,0,0,0,0,0,0,0,0,0,0,0,0,0,0,1,1,0,0,0,0,0,1,0,0,0
1558,Ivory Coast,225,437,0,Government of Ivory Coast - MPCI,89,0,0,0,02/07/2003,02/07/2003,1,"Reuters 2003-02-07 ""UPDATE 1-Ivory Coast rebels hold talks with Ghana president."" AND AFP 2003-02-07 ""Ivory Coast rebel commander holds talks with Ghana's Kufuor [Corrected 02/07/03]""",0,1,0,0,ECOWAS,11006,0,0,0,0,0,0,0,0,0,0,0,0,0,0,0,0,0,0,0,1,2,3,0,0,0,1,0,0,0,0
1559,Ivory Coast,225,437,0,Government of Ivory Coast - MPCI,89,0,0,0,02/07/2003,02/07/2003,1,"Reuters 2003-02-07 ""UPDATE 1-Ivory Coast rebels hold talks with Ghana president."" AND AFP 2003-02-07 ""Ivory Coast rebel commander holds talks with Ghana's Kufuor [Corrected 02/07/03]"" AND Reuters 2002-02-09 ""African officials toil towards Ivory Coast summit.""",1,0,0,0,Ghana,452,0,0,0,0,0,0,0,0,0,0,0,0,0,0,0,0,0,0,0,1,0,0,0,0,0,0,1,0,0,0
1560,Ivory Coast,225,437,2,Government of Ivory Coast - MJP,245,0,0,1,02/07/2003,02/07/2003,1,"Reuters 2003-02-07 ""UPDATE 1-Ivory Coast rebels hold talks with Ghana president."" AND AFP 2003-02-07 ""Ivory Coast rebel commander holds talks with Ghana's Kufuor [Corrected 02/07/03]""",0,1,0,0,ECOWAS,11006,0,0,0,0,0,0,0,0,0,0,0,0,0,0,0,0,0,0,0,1,2,3,0,0,0,1,0,0,0,0
1561,Ivory Coast,225,437,2,Government of Ivory Coast - MJP,245,0,0,1,02/07/2003,02/07/2003,1,"Reuters 2003-02-07 ""UPDATE 1-Ivory Coast rebels hold talks with Ghana president."" AND AFP 2003-02-07 ""Ivory Coast rebel commander holds talks with Ghana's Kufuor [Corrected 02/07/03]"" AND Reuters 2002-02-09 ""African officials toil towards Ivory Coast summit.""",1,0,0,0,Ghana,452,0,0,0,0,0,0,0,0,0,0,0,0,0,0,0,0,0,0,0,1,0,0,0,0,0,0,1,0,0,0
1562,Ivory Coast,225,437,0,Government of Ivory Coast - MPCI,89,0,0,0,02/10/2003,02/10/2003,1,"AFP 2003-02-10 ""African leaders start talks on Ivory Coast peace accord as rebels dig in [Corrected 02/10/03]""",0,2,0,0,"ECOWAS, AU",11006,11000,0,0,0,0,0,0,0,0,0,0,0,0,0,0,0,0,0,0,2,1,3,1,0,0,0,0,0,0,0
1563,Ivory Coast,225,437,2,Government of Ivory Coast - MPIGO,91,0,0,1,02/10/2003,02/10/2003,1,"AFP 2003-02-10 ""African leaders start talks on Ivory Coast peace accord as rebels dig in [Corrected 02/10/03]""",0,2,0,0,"ECOWAS, AU",11006,11000,0,0,0,0,0,0,0,0,0,0,0,0,0,0,0,0,0,0,2,1,3,1,0,0,0,0,0,0,0
1564,Ivory Coast,225,437,2,Government of Ivory Coast - MJP,245,0,0,1,02/10/2003,02/10/2003,1,"AFP 2003-02-10 ""African leaders start talks on Ivory Coast peace accord as rebels dig in [Corrected 02/10/03]""",0,2,0,0,"ECOWAS, AU",11006,11000,0,0,0,0,0,0,0,0,0,0,0,0,0,0,0,0,0,0,2,1,3,1,0,0,0,0,0,0,0
1565,Ivory Coast,225,437,0,Government of Ivory Coast - MPCI,89,0,0,0,02/14/2003,02/14/2003,1,"AFP 2003-02-14 ""Ivory Coast's new PM in delicate talks with rebels to form unity government by Ben Ephson [Corrected 02/14/03]""",0,1,0,0,ECOWAS,11006,0,0,0,0,0,0,0,0,0,0,0,0,0,0,0,0,0,0,0,1,3,1,1,0,0,0,0,0,0,0
1566,Ivory Coast,225,437,0,Government of Ivory Coast - MPCI,89,0,0,0,02/14/2003,02/14/2003,1,"AFP 2003-02-14 ""Ivory Coast's new PM in delicate talks with rebels to form unity government by Ben Ephson [Corrected 02/14/03]""",1,0,0,0,Ghana,452,0,0,0,0,0,0,0,0,0,0,0,0,0,0,0,0,0,0,0,1,3,0,0,0,0,0,1,0,0,0
1567,Ivory Coast,225,437,0,Government of Ivory Coast - MPCI,89,0,0,0,02/16/2003,02/17/2003,1,"AFP 2003-02-17 ""Ivory Coast rebels press Nigeria and Niger for diplomatic support [Corrected 02/17/03]""",1,0,0,0,Niger,436,0,0,0,0,0,0,0,0,0,0,0,0,0,0,0,0,0,0,0,1,2,3,1,0,1,0,0,0,0,0
1568,Ivory Coast,225,437,0,Government of Ivory Coast - MPCI,89,0,0,0,02/17/2003,02/17/2003,1,"AFP 2003-02-17 ""Ivory Coast rebels press Nigeria and Niger for diplomatic support [Corrected 02/17/03]""",1,1,0,0,"Niger, ECOWAS",436,11006,0,0,0,0,0,0,0,0,0,0,0,0,0,0,0,0,0,0,2,2,3,0,0,0,1,0,0,0,0
1569,Ivory Coast,225,437,0,Government of Ivory Coast - MPCI,89,0,0,0,03/01/2003,03/01/2003,1,"AFP 2003-03-01 ""Ivory Coast's Gbagbo appeals for regional support to form new government [Corrected 03/01/03]""",0,1,0,0,ECOWAS,11006,0,0,0,0,0,0,0,0,0,0,0,0,0,0,0,0,0,0,0,1,1,3,1,0,0,0,0,0,0,0
1570,Ivory Coast,225,437,2,Government of Ivory Coast - MPIGO,91,0,0,1,03/01/2003,03/01/2003,1,"AFP 2003-03-01 ""Ivory Coast's Gbagbo appeals for regional support to form new government [Corrected 03/01/03]""",0,1,0,0,ECOWAS,11006,0,0,0,0,0,0,0,0,0,0,0,0,0,0,0,0,0,0,0,1,1,3,1,0,0,0,0,0,0,0
1571,Ivory Coast,225,437,2,Government of Ivory Coast - MJP,245,0,0,1,03/01/2003,03/01/2003,1,"AFP 2003-03-01 ""Ivory Coast's Gbagbo appeals for regional support to form new government [Corrected 03/01/03]""",0,1,0,0,ECOWAS,11006,0,0,0,0,0,0,0,0,0,0,0,0,0,0,0,0,0,0,0,1,1,3,1,0,0,0,0,0,0,0
1572,Ivory Coast,225,437,0,Government of Ivory Coast - MPCI,89,0,0,0,03/04/2003,03/04/2003,1,"AFP 2003-03-04 ""Monitors in talks with Ivory Coast rebels to rescue peace deal [Corrected 03/04/03] """,0,1,0,0,UN,11024,0,0,0,0,0,0,0,0,0,0,0,0,0,0,0,0,0,0,0,1,2,3,0,0,0,1,0,0,0,0
1573,Ivory Coast,225,437,0,Government of Ivory Coast - MPCI,89,0,0,0,03/06/2003,03/08/2003,1,"AFP 2003-03-06 ""Ivory Coast belligerents urged to quickly form government [Corrected 03/06/03]"" AFP 2003-02-07 ""Ivory Coast rebels, politicians resume power-sharing talks [Corrected 03/07/03]"" AND AFP 2003-03-08 ""Ivory Coast rebels, politicians ink deal on power-sharing talks [Corrected 03/08/03]""",0,1,0,0,ECOWAS,11006,0,0,0,0,0,0,0,0,0,0,0,0,0,0,0,0,0,0,0,1,3,1,1,0,1,0,0,0,0,0
1574,Ivory Coast,225,437,0,Government of Ivory Coast - MPCI,89,0,0,0,03/06/2003,03/08/2003,1,"AFP 2003-03-06 ""Ivory Coast belligerents urged to quickly form government [Corrected 03/06/03]"" AFP 2003-02-07 ""Ivory Coast rebels, politicians resume power-sharing talks [Corrected 03/07/03]"" AND AFP 2003-03-08 ""Ivory Coast rebels, politicians ink deal on power-sharing talks [Corrected 03/08/03]""",1,0,0,0,Ghana,452,0,0,0,0,0,0,0,0,0,0,0,0,0,0,0,0,0,0,0,1,3,0,0,0,0,0,1,0,0,0
1575,Ivory Coast,225,437,2,Government of Ivory Coast - MPIGO,91,0,0,1,03/06/2003,03/08/2003,1,"AFP 2003-03-06 ""Ivory Coast belligerents urged to quickly form government [Corrected 03/06/03]"" AFP 2003-02-07 ""Ivory Coast rebels, politicians resume power-sharing talks [Corrected 03/07/03]"" AND AFP 2003-03-08 ""Ivory Coast rebels, politicians ink deal on power-sharing talks [Corrected 03/08/03]""",0,1,0,0,ECOWAS,11006,0,0,0,0,0,0,0,0,0,0,0,0,0,0,0,0,0,0,0,1,3,1,1,0,1,0,0,0,0,0
1576,Ivory Coast,225,437,2,Government of Ivory Coast - MPIGO,91,0,0,1,03/06/2003,03/08/2003,1,"AFP 2003-03-06 ""Ivory Coast belligerents urged to quickly form government [Corrected 03/06/03]"" AFP 2003-02-07 ""Ivory Coast rebels, politicians resume power-sharing talks [Corrected 03/07/03]"" AND AFP 2003-03-08 ""Ivory Coast rebels, politicians ink deal on power-sharing talks [Corrected 03/08/03]""",1,0,0,0,Ghana,452,0,0,0,0,0,0,0,0,0,0,0,0,0,0,0,0,0,0,0,1,3,0,0,0,0,0,1,0,0,0
1577,Ivory Coast,225,437,2,Government of Ivory Coast - MJP,245,0,0,1,03/06/2003,03/08/2003,1,"AFP 2003-03-06 ""Ivory Coast belligerents urged to quickly form government [Corrected 03/06/03]"" AFP 2003-02-07 ""Ivory Coast rebels, politicians resume power-sharing talks [Corrected 03/07/03]"" AND AFP 2003-03-08 ""Ivory Coast rebels, politicians ink deal on power-sharing talks [Corrected 03/08/03]""",0,1,0,0,ECOWAS,11006,0,0,0,0,0,0,0,0,0,0,0,0,0,0,0,0,0,0,0,1,3,1,1,0,1,0,0,0,0,0
1578,Ivory Coast,225,437,2,Government of Ivory Coast - MJP,245,0,0,1,03/06/2003,03/08/2003,1,"AFP 2003-03-06 ""Ivory Coast belligerents urged to quickly form government [Corrected 03/06/03]"" AFP 2003-02-07 ""Ivory Coast rebels, politicians resume power-sharing talks [Corrected 03/07/03]"" AND AFP 2003-03-08 ""Ivory Coast rebels, politicians ink deal on power-sharing talks [Corrected 03/08/03]""",1,0,0,0,Ghana,452,0,0,0,0,0,0,0,0,0,0,0,0,0,0,0,0,0,0,0,1,3,0,0,0,0,0,1,0,0,0
1579,Ivory Coast,225,437,0,Government of Ivory Coast - MPCI,89,0,0,0,03/10/2003,03/10/2003,1,"AFP 2003-03-10 ""Numerous civilians killed in clashes in west Ivory Coast: officials""",0,1,0,0,UN,11024,0,0,0,0,0,0,0,0,0,0,0,0,0,0,0,0,0,0,0,1,1,3,0,0,0,1,0,0,0,0
1580,Ivory Coast,225,437,2,Government of Ivory Coast - MPIGO,91,0,0,1,03/10/2003,03/10/2003,1,"AFP 2003-03-10 ""Numerous civilians killed in clashes in west Ivory Coast: officials""",0,1,0,0,UN,11024,0,0,0,0,0,0,0,0,0,0,0,0,0,0,0,0,0,0,0,1,1,3,0,0,0,1,0,0,0,0
1581,Ivory Coast,225,437,2,Government of Ivory Coast - MJP,245,0,0,1,03/10/2003,03/10/2003,1,"AFP 2003-03-10 ""Numerous civilians killed in clashes in west Ivory Coast: officials""",0,1,0,0,UN,11024,0,0,0,0,0,0,0,0,0,0,0,0,0,0,0,0,0,0,0,1,1,3,0,0,0,1,0,0,0,0
1582,Ivory Coast,225,437,0,Government of Ivory Coast - MPCI,89,0,0,0,03/12/2003,03/12/2003,1,"AFP 2003-03-12 ""Ivory Coast president, PM hold talks after landmark peace meeting by Christophe Koffi [Corrected 03/12/03] """,0,0,1,0,Amnesty,12003,0,0,0,0,0,0,0,0,0,0,0,0,0,0,0,0,0,0,0,1,1,3,0,0,1,0,0,0,0,0
1583,Ivory Coast,225,437,2,Government of Ivory Coast - MPIGO,91,0,0,1,03/12/2003,03/12/2003,1,"AFP 2003-03-12 ""Ivory Coast president, PM hold talks after landmark peace meeting by Christophe Koffi [Corrected 03/12/03] """,0,0,1,0,Amnesty,12003,0,0,0,0,0,0,0,0,0,0,0,0,0,0,0,0,0,0,0,1,1,3,0,0,1,0,0,0,0,0
1584,Ivory Coast,225,437,2,Government of Ivory Coast - MJP,245,0,0,1,03/12/2003,03/12/2003,1,"AFP 2003-03-12 ""Ivory Coast president, PM hold talks after landmark peace meeting by Christophe Koffi [Corrected 03/12/03] """,0,0,1,0,Amnesty,12003,0,0,0,0,0,0,0,0,0,0,0,0,0,0,0,0,0,0,0,1,1,3,0,0,1,0,0,0,0,0
1585,Ivory Coast,225,437,0,Government of Ivory Coast - MPCI,89,0,0,0,04/02/2003,04/02/2003,1,"AFP 2003-04-02 ""Ivory Coast rebels agree to take up seats in unity govt: PM [Corrected 04/02/03]""",0,1,0,0,ECOWAS,11006,0,0,0,0,0,0,0,0,0,0,0,0,0,0,0,0,0,0,0,1,3,1,1,0,0,0,0,0,0,0
1586,Ivory Coast,225,437,0,Government of Ivory Coast - MPCI,89,0,0,0,04/02/2003,04/02/2003,1,"AFP 2003-04-02 ""Ivory Coast rebels agree to take up seats in unity govt: PM [Corrected 04/02/03]""",1,0,0,0,Ghana,452,0,0,0,0,0,0,0,0,0,0,0,0,0,0,0,0,0,0,0,1,3,0,0,0,0,0,1,0,0,0
1587,Ivory Coast,225,437,2,Government of Ivory Coast - MPIGO,91,0,0,1,04/02/2003,04/02/2003,1,"AFP 2003-04-02 ""Ivory Coast rebels agree to take up seats in unity govt: PM [Corrected 04/02/03]""",0,1,0,0,ECOWAS,11006,0,0,0,0,0,0,0,0,0,0,0,0,0,0,0,0,0,0,0,1,3,1,1,0,0,0,0,0,0,0
1588,Ivory Coast,225,437,2,Government of Ivory Coast - MPIGO,91,0,0,1,04/02/2003,04/02/2003,1,"AFP 2003-04-02 ""Ivory Coast rebels agree to take up seats in unity govt: PM [Corrected 04/02/03]""",1,0,0,0,Ghana,452,0,0,0,0,0,0,0,0,0,0,0,0,0,0,0,0,0,0,0,1,3,0,0,0,0,0,1,0,0,0
1589,Ivory Coast,225,437,2,Government of Ivory Coast - MJP,245,0,0,1,04/02/2003,04/02/2003,1,"AFP 2003-04-02 ""Ivory Coast rebels agree to take up seats in unity govt: PM [Corrected 04/02/03]""",0,1,0,0,ECOWAS,11006,0,0,0,0,0,0,0,0,0,0,0,0,0,0,0,0,0,0,0,1,3,1,1,0,0,0,0,0,0,0
1590,Ivory Coast,225,437,2,Government of Ivory Coast - MJP,245,0,0,1,04/02/2003,04/02/2003,1,"AFP 2003-04-02 ""Ivory Coast rebels agree to take up seats in unity govt: PM [Corrected 04/02/03]""",1,0,0,0,Ghana,452,0,0,0,0,0,0,0,0,0,0,0,0,0,0,0,0,0,0,0,1,3,0,0,0,0,0,1,0,0,0
1591,Ivory Coast,225,437,0,Government of Ivory Coast - MPCI,89,0,0,0,06/23/2003,04/04/2004,1,"SIPRI yearbook 2004 page 169, http://www.un.org/Depts/dpko/missions/minuci/index.html; http://www.un.org/Depts/dpko/missions/minuci/chron.html; http://www.un.org/Depts/dpko/missions/minuci/index.htm",0,1,0,0,UN,11024,0,0,0,0,0,0,0,0,0,0,0,0,0,0,0,0,0,0,0,1,0,0,0,0,0,0,0,0,1,0
1592,Ivory Coast,225,437,2,Government of Ivory Coast - MPIGO,91,0,0,1,06/23/2003,04/04/2004,1,"SIPRI yearbook 2004 page 169, http://www.un.org/Depts/dpko/missions/minuci/index.html; http://www.un.org/Depts/dpko/missions/minuci/chron.html; http://www.un.org/Depts/dpko/missions/minuci/index.htm",0,1,0,0,UN,11024,0,0,0,0,0,0,0,0,0,0,0,0,0,0,0,0,0,0,0,1,0,0,0,0,0,0,0,0,1,0
1593,Ivory Coast,225,437,2,Government of Ivory Coast - MJP,245,0,0,1,06/23/2003,04/04/2004,1,"SIPRI yearbook 2004 page 169, http://www.un.org/Depts/dpko/missions/minuci/index.html; http://www.un.org/Depts/dpko/missions/minuci/chron.html; http://www.un.org/Depts/dpko/missions/minuci/index.htm",0,1,0,0,UN,11024,0,0,0,0,0,0,0,0,0,0,0,0,0,0,0,0,0,0,0,1,0,0,0,0,0,0,0,0,1,0
1594,Ivory Coast,225,437,0,Government of Ivory Coast - FRCI,439,0,0,0,06/23/2003,04/04/2004,1,"SIPRI yearbook 2004 page 169, http://www.un.org/Depts/dpko/missions/minuci/index.html; http://www.un.org/Depts/dpko/missions/minuci/chron.html; http://www.un.org/Depts/dpko/missions/minuci/index.htm",0,1,0,0,UN,11024,0,0,0,0,0,0,0,0,0,0,0,0,0,0,0,0,0,0,0,1,0,0,0,0,0,0,0,0,1,0
1595,Ivory Coast,225,437,0,Government of Ivory Coast - MPCI,89,0,0,0,09/23/2003,09/23/2003,1,"Reuters 2002-09-23 ""Moves towards talks in Ivory Coast crisis""",1,0,0,0,France,220,0,0,0,0,0,0,0,0,0,0,0,0,0,0,0,0,0,0,0,1,1,3,0,0,0,1,0,0,0,0
1596,Ivory Coast,225,437,2,Government of Ivory Coast - FRCI,439,0,0,1,03/19/2004,03/19/2004,1,"United Nations/All Africa Global Media via COMTEX 2004-03-23 ""UN Envoy Urges Ivory Coast Parties to Follow Peace Agreement""",0,1,0,0,UN,11024,0,0,0,0,0,0,0,0,0,0,0,0,0,0,0,0,0,0,0,1,1,3,0,0,1,0,0,0,0,0
1597,Ivory Coast,225,437,2,Government of Ivory Coast - FRCI,439,0,0,1,04/04/2004,12/31/2007,6,"Heldt & Wallensteen 2005, http://www.un.org/Depts/dpko/missions/unoci/; S/RES/1528 (2004)
See also http://www.un.org/Depts/dpko/missions/unoci/; S/RES/1528 (2004)
See also http://www.un.org/Depts/dpko/missions/unoci/;",0,1,0,0,UN,11024,0,0,0,0,0,0,0,0,0,0,0,0,0,0,0,0,0,0,0,1,0,0,0,0,0,0,0,0,0,1
1598,Ivory Coast,225,437,2,Government of Ivory Coast - FRCI,439,0,0,1,04/18/2004,04/19/2004,1,"Xinhua 2004-04-19 ""UN urges Ivory Coastan concerned parties to return to government"" AND 2004-04-19 ""UN peacekeeping chief in talks with I.Coast president over reconciliation""",0,1,0,0,UN,11024,0,0,0,0,0,0,0,0,0,0,0,0,0,0,0,0,0,0,0,1,1,3,0,0,1,0,0,0,0,0
1599,Ivory Coast,225,437,2,Government of Ivory Coast - FRCI,439,0,0,1,05/03/2004,05/03/2004,1,"""Radio Togo, Lome, in French 0600 gmt 3 May 04"" 2004-05-03 ""Togolese president in talks with Ivorian defence minister""",1,0,0,0,Togo,461,0,0,0,0,0,0,0,0,0,0,0,0,0,0,0,0,0,0,0,1,1,3,0,0,0,1,0,0,0,0
1600,Ivory Coast,225,437,2,Government of Ivory Coast - FRCI,439,0,0,1,05/03/2004,05/03/2004,1,"Radio Togo, Lome, in French 0600 gmt 4 May 04 2004-05-04 ""Ivorian New Forces' delegation says ""solution to crisis in horizon""""",1,0,0,0,Togo,461,0,0,0,0,0,0,0,0,0,0,0,0,0,0,0,0,0,0,0,1,2,3,0,0,0,1,0,0,0,0
1601,Ivory Coast,225,437,2,Government of Ivory Coast - FRCI,439,0,0,1,05/12/2004,05/13/2004,1,"Radio Ghana, Accra, in English 1800 gmt 13 May 04 2004-05-13 ""Ghana: Ivorian premier leaves after talks with President Kufuor""",0,1,0,0,ECOWAS,11006,0,0,0,0,0,0,0,0,0,0,0,0,0,0,0,0,0,0,0,1,1,3,0,0,0,1,0,0,0,0
1602,Ivory Coast,225,437,2,Government of Ivory Coast - FRCI,439,0,0,1,05/12/2004,05/13/2004,1,"Radio Ghana, Accra, in English 1800 gmt 13 May 04 2004-05-13 ""Ghana: Ivorian premier leaves after talks with President Kufuor""",1,0,0,0,Ghana,452,0,0,0,0,0,0,0,0,0,0,0,0,0,0,0,0,0,0,0,1,1,0,0,0,0,0,1,0,0,0
1603,Ivory Coast,225,437,2,Government of Ivory Coast - FRCI,439,0,0,1,05/31/2004,06/03/2004,1,"UN News Service/All Africa Global Media via COMTEX 2004-06-03 ""UN Envoy Holds Talks Aimed At Breaking Impasse in Ivory Coast """,0,1,0,0,UN,11024,0,0,0,0,0,0,0,0,0,0,0,0,0,0,0,0,0,0,0,1,1,3,0,0,0,1,0,0,0,0
1604,Ivory Coast,225,437,2,Government of Ivory Coast - FRCI,439,0,0,1,05/31/2004,06/03/2004,1,"UN News Service/All Africa Global Media via COMTEX 2004-06-03 ""UN Envoy Holds Talks Aimed At Breaking Impasse in Ivory Coast """,0,1,0,0,UN,11024,0,0,0,0,0,0,0,0,0,0,0,0,0,0,0,0,0,0,0,1,2,3,0,0,0,1,0,0,0,0
1605,Ivory Coast,225,437,2,Government of Ivory Coast - FRCI,439,0,0,1,06/01/2004,06/01/2004,1,"Radio Ivory Coast, Abidjan, in French 1900 gmt 1 Jun 04 2004-06-01 ""Ivorian leader in talks with visiting Togolese premier, Libyan envoy in Abidjan """,2,0,0,0,"Togo, Libya",461,620,0,0,0,0,0,0,0,0,0,0,0,0,0,0,0,0,0,0,2,1,3,0,0,0,1,0,0,0,0
1606,Ivory Coast,225,437,2,Government of Ivory Coast - FRCI,439,0,0,1,06/19/2004,06/19/2004,1,"AFP 2004-06-20 ""President Gbagbo arrives in Togo for talks on Ivory Coast crisis"" AND AFP 2004-06-20 ""Gbagbo and Eyadema arrive in Abuja for talks on Ivorian crisis""",1,0,0,0,Togo,461,0,0,0,0,0,0,0,0,0,0,0,0,0,0,0,0,0,0,0,1,1,3,0,0,0,1,0,0,0,0
1607,Ivory Coast,225,437,2,Government of Ivory Coast - FRCI,439,0,0,1,06/20/2004,06/20/2004,1,"AP 2004-06-21 ""Three African Leaders To Mediate Ivory Coast Conflict"" AND AFP 2004-06-20 ""Gbagbo and Eyadema arrive in Abuja for talks on Ivorian crisis""",3,0,0,0,"Togo, Nigeria, Ghana",461,475,452,0,0,0,0,0,0,0,0,0,0,0,0,0,0,0,0,0,3,1,3,0,0,1,0,0,0,0,0
1608,Ivory Coast,225,437,2,Government of Ivory Coast - FRCI,439,0,0,1,06/21/2004,06/30/2004,1,"UN News Service/All Africa Global Media via COMTEX 2004-06-22 ""UN Security Council Representatives Start 10-Day Mission to West Africa"" AND AFP 2004-06-23 ""UN Security Council team holds talks with Ivory Coast leaders""",14,0,0,0,"China, France, UK, USA, Angola, Chile, Germany, Pakistan, Spain, Algeria, Benin, Brazil, Philippines, Romania",710,220,200,2,540,155,255,770,230,615,434,140,840,360,0,0,0,0,0,0,14,0,0,0,0,0,0,0,1,0,0
1609,Ivory Coast,225,437,2,Government of Ivory Coast - FRCI,439,0,0,1,06/25/2004,06/25/2004,1,"AFP 2004-06-26 ""Ivory Coast ex-rebels refuse offer of peace talks""",1,1,0,0,"Gabon, ECOWAS",481,11006,0,0,0,0,0,0,0,0,0,0,0,0,0,0,0,0,0,0,2,1,3,0,0,0,1,0,0,0,0
1610,Ivory Coast,225,437,2,Government of Ivory Coast - FRCI,439,0,0,1,06/29/2004,06/29/2004,1,"AFP 2004-06-29 ""Ivory Coast president, opposition hold first talks in three months""",1,0,0,0,Gabon,481,0,0,0,0,0,0,0,0,0,0,0,0,0,0,0,0,0,0,0,1,1,3,0,0,0,1,0,0,0,0
1611,Ivory Coast,225,437,2,Government of Ivory Coast - FRCI,439,0,0,1,07/02/2004,07/02/2004,1,"UN Integrated Regional Information Networks/All Africa Global Media via COMTEX 2004-07-02 ""Ivory Coast: Ministers Not Reinstated, Opposition in Gabon for Talks""",1,0,0,0,Gabon,481,0,0,0,0,0,0,0,0,0,0,0,0,0,0,0,0,0,0,0,1,2,3,0,0,0,1,0,0,0,0
1612,Ivory Coast,225,437,2,Government of Ivory Coast - FRCI,439,0,0,1,07/02/2004,07/02/2004,1,"AFP 2004-07-02 ""Talks to revive Ivory Coast peace process begin in Gabon"" AND Radio France Internationale, Paris, in French 1230 gmt 3 Jul 04 2004-07-03 ""Gabon's Bongo receives Ivorian government, opposition delegations to talks""",1,0,0,0,Gabon,481,0,0,0,0,0,0,0,0,0,0,0,0,0,0,0,0,0,0,0,1,1,3,0,0,0,1,0,0,0,0
1613,Ivory Coast,225,437,2,Government of Ivory Coast - FRCI,439,0,0,1,07/03/2004,07/03/2004,1,"Radio Ghana, Accra, in English 1800 gmt 3 Jul 04 2004-07-03 ""President Kufuor in talks with Ivorian premier ahead of AU Summit""",1,0,0,0,Ghana,452,0,0,0,0,0,0,0,0,0,0,0,0,0,0,0,0,0,0,0,1,1,3,0,0,0,1,0,0,0,0
1614,Ivory Coast,225,437,2,Government of Ivory Coast - FRCI,439,0,0,1,07/06/2004,07/06/2004,1,"AFP 2004-07-06 ""Ivory Coast crisis talks to be held in Ghana July 29""",2,2,0,0,"UN, AU, Mali, Gabon",11024,11000,432,481,0,0,0,0,0,0,0,0,0,0,0,0,0,0,0,0,4,1,3,0,0,1,0,0,0,0,0
1615,Ivory Coast,225,437,2,Government of Ivory Coast - FRCI,439,0,0,1,07/15/2004,07/15/2004,1,"Radio Togo, Lome, in French 1900 gmt 16 Jul 04 2004-07-16 ""Togolese president urges Ivorian factions to make concessions during talks""",1,0,0,0,Togo,461,0,0,0,0,0,0,0,0,0,0,0,0,0,0,0,0,0,0,0,1,1,3,0,0,0,1,0,0,0,0
1616,Ivory Coast,225,437,2,Government of Ivory Coast - FRCI,439,0,0,1,07/19/2004,07/19/2004,1,"AFP 2004-07-19 ""Ivory Coast president in Morocco for crisis talks with Bongo """,1,0,0,0,Togo,461,0,0,0,0,0,0,0,0,0,0,0,0,0,0,0,0,0,0,0,1,1,3,0,0,0,1,0,0,0,0
1617,Ivory Coast,225,437,2,Government of Ivory Coast - FRCI,439,0,0,1,07/19/2004,07/19/2004,1,"AFP 2004-07-19 ""Ivory Coast president in Morocco for crisis talks with Bongo """,1,0,0,0,Morocco,600,0,0,0,0,0,0,0,0,0,0,0,0,0,0,0,0,0,0,0,1,1,0,0,0,0,0,1,0,0,0
1618,Ivory Coast,225,437,2,Government of Ivory Coast - FRCI,439,0,0,1,07/29/2004,07/30/2004,1,"Standard Times/All Africa Global Media via COMTEX 2004-07-30 ""Standard Point"" AND UN News Service/All Africa Global Media via COMTEX 2004-07-30 Annan's ""Summit On Troubled Ivory Coast Meets for an Extra Day"" AND UN News Service/All Africa Global Media via COMTEX 2004-08-02 ""Ivory Coast Parties Renew Commitment to Peace Agreement"" AND The New York Times 2004-07-31 ""Warring Ivory Coast Parties Sign a Deal""",1,2,0,0,"UN, ECOWAS, Ghana",11024,11006,452,0,0,0,0,0,0,0,0,0,0,0,0,0,0,0,0,0,3,3,1,1,1,0,0,0,0,0,0
1619,Ivory Coast,225,437,2,Government of Ivory Coast - FRCI,439,0,0,1,07/31/2004,07/31/2004,1,"Angop news agency web site, Luanda, in Portuguese 2 Aug 04 2004-08-04 ""Angolan premier, Ivorian leader hold talks in Abidjan""",1,0,0,0,Angola,540,0,0,0,0,0,0,0,0,0,0,0,0,0,0,0,0,0,0,0,1,1,3,0,0,1,0,0,0,0,0
1620,Ivory Coast,225,437,2,Government of Ivory Coast - FRCI,439,0,0,1,10/03/2004,10/03/2004,1,"Africa No 1 radio, Libreville, in French 1200 gmt 4 Nov 04 2004-11-04 ""Ivorian presidential spokesman says ex-rebels' attitude ""unbearable"" - radio""",1,0,0,0,Togo,461,0,0,0,0,0,0,0,0,0,0,0,0,0,0,0,0,0,0,0,1,2,3,0,0,0,1,0,0,0,0
1621,Ivory Coast,225,437,2,Government of Ivory Coast - FRCI,439,0,0,1,11/04/2004,11/04/2004,1,"BBC Monitoring research in French 4 Nov 04 2004-11-05  ""Ivory Coast media behaviour 0700 gmt 5 Nov 04""",1,1,0,0,"USA, ECOWAS",2,11006,0,0,0,0,0,0,0,0,0,0,0,0,0,0,0,0,0,0,2,1,3,0,1,0,0,0,0,0,0
1622,Ivory Coast,225,437,2,Government of Ivory Coast - FRCI,439,0,0,1,11/08/2004,11/08/2004,1,"Reuters 2004-11-08 ""Ivorian army in talks with French military - radio"".",1,0,0,0,France,220,0,0,0,0,0,0,0,0,0,0,0,0,0,0,0,0,0,0,0,1,1,3,0,0,0,1,0,0,0,0
1623,Ivory Coast,225,437,2,Government of Ivory Coast - FRCI,439,0,0,1,11/08/2004,11/08/2004,1,"Xinhua 2004-11-08 ""S. African president to leave for Ivory Coast on crisis-solving mission"" AFP 2004-11-10 ""Mbeki invites Ivory Coast opposition leaders to South Africa for talks""",0,2,0,0,"AU, ECOWAS",11000,11006,0,0,0,0,0,0,0,0,0,0,0,0,0,0,0,0,0,0,2,1,3,0,0,0,1,0,0,0,0
1624,Ivory Coast,225,437,2,Government of Ivory Coast - FRCI,439,0,0,1,11/13/2004,11/13/2004,1,"BBC Monitoring research in French 12 Nov 04 2004-11-12 ""Ivory Coast media behaviour 11-12 November""",0,1,0,0,International Francophone Organisation,11012,0,0,0,0,0,0,0,0,0,0,0,0,0,0,0,0,0,0,0,1,1,3,0,0,0,1,0,0,0,0
1625,Ivory Coast,225,437,2,Government of Ivory Coast - FRCI,439,0,0,1,11/14/2004,11/14/2004,1,"AFP 2004-11-14 ""Ivory Coast crisis talks begin in Nigerian capital""",5,3,0,0,"ECOWAS, UN, AU, Senegal, Togo, Gabon, Burkina Faso, Libya",11006,11024,11000,433,461,481,439,620,0,0,0,0,0,0,0,0,0,0,0,0,8,1,3,0,0,0,1,0,0,0,0
1626,Ivory Coast,225,437,2,Government of Ivory Coast - FRCI,439,0,0,1,11/14/2004,11/14/2004,1,"AFP 2004-11-14 ""Ivory Coast crisis talks begin in Nigerian capital""",1,0,0,0,Nigeria,475,0,0,0,0,0,0,0,0,0,0,0,0,0,0,0,0,0,0,0,1,1,0,0,0,0,0,1,0,0,0
1627,Ivory Coast,225,437,2,Government of Ivory Coast - FRCI,439,0,0,1,11/20/2004,11/21/2004,1,"AFP 2004-11-20 ""South Africa's Mbeki Begins Round Of Talks On Ivory Coast""",0,2,0,0,"AU, ECOWAS",11000,11006,0,0,0,0,0,0,0,0,0,0,0,0,0,0,0,0,0,0,2,1,3,0,0,0,1,0,0,0,0
1628,Ivory Coast,225,437,2,Government of Ivory Coast - FRCI,439,0,0,1,11/20/2004,11/21/2004,1,"SAPA news agency web site, Johannesburg, in English 0000 gmt 20 Nov 04 2004-11-20 ""Mbeki positive about progress after talks with Ivorian rebel leader"" AND AFP 2004-11-21 ""South Africa's Mbeki pursues talks to end Ivory Coast crisis""",0,2,0,0,"AU, ECOWAS",11000,11006,0,0,0,0,0,0,0,0,0,0,0,0,0,0,0,0,0,0,2,2,3,0,0,0,1,0,0,0,0
1629,Ivory Coast,225,437,2,Government of Ivory Coast - FRCI,439,0,0,1,11/25/2004,11/25/2004,1,"AP 2004-11-25 ""S African Min Ends Talks On Ivory Coast Peace Mission""",1,0,0,0,South Africa,560,0,0,0,0,0,0,0,0,0,0,0,0,0,0,0,0,0,0,0,1,1,3,0,0,0,1,0,0,0,0
1630,Ivory Coast,225,437,2,Government of Ivory Coast - FRCI,439,0,0,1,12/03/2004,12/06/2004,1,"AFP 2004-12-03 ""Mbeki faces tough hurdles in Ivory Coast crisis talks"" AND AFP 2004-12-04 ""South Africa's Mbeki making some headway in Ivory Coast peace mediation"" AND AFP 2004-12-05 ""Mbeki to leave Ivory Coast on Monday after round of shuttle peace talks"" AND Radio France Internationale, Paris, in French 1230 gmt 7 Dec 04 2004-12-07 ""Ivorian presidency, rebel New Forces react to Mbeki's ""road map""""",0,2,0,0,"AU, ECOWAS",11000,11006,0,0,0,0,0,0,0,0,0,0,0,0,0,0,0,0,0,0,2,3,2,1,0,0,0,0,0,0,0
1631,Ivory Coast,225,437,2,Government of Ivory Coast - FRCI,439,0,0,1,12/16/2004,12/17/2004,1,"AP 2004-12-06 ""Ivory Coast Rebels Present Proposals To S African Pres"" AND BuaNews/All Africa Global Media via COMTEX 2004-12-07 ""Talks on Ivory Coast Continue in Pretoria""",0,2,0,0,"AU, ECOWAS",11000,11006,0,0,0,0,0,0,0,0,0,0,0,0,0,0,0,0,0,0,2,2,3,1,1,1,0,0,0,0,0
1632,Lesotho,217,570,2,Government of Lesotho - Military faction,92,0,0,1,09/11/1998,09/12/1998,1,"Reuters News. ""SADC unlikely to achieve Congo solution - diplomats"". By Alister Bull. 11 September 1998.",0,1,0,0,South African Development Community,11019,0,0,0,0,0,0,0,0,0,0,0,0,0,0,0,0,0,0,0,1,1,3,0,0,1,0,0,0,0,0
1633,Lesotho,217,570,2,Government of Lesotho - Military faction,92,0,0,1,09/13/1998,09/13/1998,1,"Reuters News. ""SADC unlikely to achieve Congo solution - diplomats"". By Alister Bull. 11 September 1998.",1,0,0,0,Ethiopia,530,0,0,0,0,0,0,0,0,0,0,0,0,0,0,0,0,0,0,0,1,1,0,0,0,0,0,1,0,0,0
1634,Liberia,146,450,2,Government of Liberia - LURD,95,0,0,1,10/01/2000,10/01/2000,1,"Reuters 2000-10-01, ""Sierra Leone and Liberia discuss regional tension""",1,0,0,0,Sierra Leone,451,0,0,0,0,0,0,0,0,0,0,0,0,0,0,0,0,0,0,0,1,1,3,0,0,1,0,0,0,0,0
1635,Liberia,146,450,2,Government of Liberia - LURD,95,0,0,1,10/05/2000,10/05/2000,1,"AFP 2000-10-05, ""Military observers for Guinea-Liberia-SLeone border: ECOWAS""",0,1,0,0,ECOWAS,11006,0,0,0,0,0,0,0,0,0,0,0,0,0,0,0,0,0,0,0,1,1,3,0,0,1,0,0,0,0,0
1636,Liberia,146,450,2,Government of Liberia - LURD,95,0,0,1,10/05/2000,10/05/2000,1,"AFP 2000-10-05, ""Military observers for Guinea-Liberia-SLeone border: ECOWAS""",1,0,0,0,Nigeria,475,0,0,0,0,0,0,0,0,0,0,0,0,0,0,0,0,0,0,0,1,0,0,0,0,0,0,1,0,0,0
1637,Liberia,146,450,2,Government of Liberia - LURD,95,0,0,1,11/01/2000,11/30/2000,4,"AFP 2000-11-15, ""ECOWAS committee leaves for Guinea, Liberia and S.Leone""; Reuters 2000-11-19, ""INTERVIEW-ECOWAS team wants Liberia-Guinea border monitors""",0,1,0,0,ECOWAS,11006,0,0,0,0,0,0,0,0,0,0,0,0,0,0,0,0,0,0,0,1,0,0,0,0,0,0,0,1,0,0
1638,Liberia,146,450,2,Government of Liberia - LURD,95,0,0,1,12/27/2000,12/27/2000,1,"Reuters 2000-12-27, ""West Africa army chiefs meet on Guinea deployment""",0,1,0,0,ECOWAS,11006,0,0,0,0,0,0,0,0,0,0,0,0,0,0,0,0,0,0,0,1,1,3,0,0,1,0,0,0,0,0
1639,Liberia,146,450,2,Government of Liberia - LURD,95,0,0,1,12/27/2000,12/27/2000,1,"Reuters 2000-12-27, ""West Africa army chiefs meet on Guinea deployment""",1,0,0,0,Nigeria,475,0,0,0,0,0,0,0,0,0,0,0,0,0,0,0,0,0,0,0,1,1,0,0,0,0,0,1,0,0,0
1640,Liberia,146,450,2,Government of Liberia - LURD,95,0,0,1,04/11/2001,04/11/2001,1,"AFP 2001-04-11, ""ECOWAS asks UN to OK west African troops in conflict zone""",0,1,0,0,ECOWAS,11006,0,0,0,0,0,0,0,0,0,0,0,0,0,0,0,0,0,0,0,1,1,3,0,0,1,0,0,0,0,0
1641,Liberia,146,450,2,Government of Liberia - LURD,95,0,0,1,04/11/2001,04/11/2001,1,"AFP 2001-04-11, ""ECOWAS asks UN to OK west African troops in conflict zone""",1,0,0,0,Nigeria,475,0,0,0,0,0,0,0,0,0,0,0,0,0,0,0,0,0,0,0,1,1,0,0,0,0,0,1,0,0,0
1642,Liberia,146,450,2,Government of Liberia - LURD,95,0,0,1,06/01/2001,06/30/2001,4,"UN Integrated Regional Information Network/All Africa Global Media via COMTEX 2001-08-15, ""Irin Focus On Peace Efforts By Women in the Mano River Countries""",0,0,1,0,"NGO, domestic or local ",12028,0,0,0,0,0,0,0,0,0,0,0,0,0,0,0,0,0,0,0,1,1,3,0,0,1,0,0,0,0,0
1643,Liberia,146,450,2,Government of Liberia - LURD,95,0,0,1,08/14/2001,08/14/2001,1,"Xinhua 2001-08-15, ""Sierra Leone, Guinea, Liberia Agree to Address Armed Groups""; Reuters 2001-08-14, ""UPDATE 1-Ministers plan summit to end West African war""",2,0,0,0,"Sierra Leone, Guinea",451,438,0,0,0,0,0,0,0,0,0,0,0,0,0,0,0,0,0,0,2,1,3,0,0,1,0,0,0,0,0
1644,Liberia,146,450,2,Government of Liberia - LURD,95,0,0,1,09/08/2001,09/09/2001,1,"Reuters 2001-09-08, ""West African talks focus on stopping armed rebels""; Reuters 2001-09-10, ""Guinea's Conte says ready to meet Taylor over war""",2,0,0,0,"Sierra Leone, Guinea",451,438,0,0,0,0,0,0,0,0,0,0,0,0,0,0,0,0,0,0,2,1,3,0,0,1,0,0,0,0,0
1645,Liberia,146,450,2,Government of Liberia - LURD,95,0,0,1,01/01/2002,12/31/2002,5,"allAfrica.com/All Africa Global Media via COMTEX 2002-07-16, ""Attempts to Bring Peace to Liberia - Can They Succeed?""",0,1,0,0,ECOWAS,11006,0,0,0,0,0,0,0,0,0,0,0,0,0,0,0,0,0,0,0,1,3,4,0,1,0,0,0,0,0,0
1646,Liberia,146,450,2,Government of Liberia - LURD,95,0,0,1,02/27/2002,02/27/2002,1,"Reuters 2002-02-27, ""UPDATE 2-West African leaders spell out measures for peace""; Reuters 2002-02-27, ""Crucial West African peace talks start in Morocco""",3,0,0,0,"Sierra Leone, Morocco, Guinea",451,600,438,0,0,0,0,0,0,0,0,0,0,0,0,0,0,0,0,0,3,1,3,0,1,0,0,0,0,0,0
1647,Liberia,146,450,2,Government of Liberia - LURD,95,0,0,1,03/15/2002,03/16/2002,1,"Reuters 2002-03-14, ""Liberian rebels rule out going to peace meeting""; Reuters 2002-03-15, ""Liberian rebels boycott peace talks in Nigeria""; Reuters 2002-03-16, ""Liberian civil society leaders urge 'stabilisation force'""; Reuters 2002-03-16, ""Taylor's rivals demand neutral force in Liberia""; The NEWS/All Africa Global Media via COMTEX 2002-03-18, ""The Next Step to Reconciliation""",0,1,0,0,ECOWAS,11006,0,0,0,0,0,0,0,0,0,0,0,0,0,0,0,0,0,0,0,1,1,3,1,1,1,0,0,0,0,0
1648,Liberia,146,450,2,Government of Liberia - LURD,95,0,0,1,03/15/2002,03/16/2002,1,"Reuters 2002-03-14, ""Liberian rebels rule out going to peace meeting""; Reuters 2002-03-15, ""Liberian rebels boycott peace talks in Nigeria""; Reuters 2002-03-16, ""Liberian civil society leaders urge 'stabilisation force'""; Reuters 2002-03-16, ""Taylor's rivals demand neutral force in Liberia""; The NEWS/All Africa Global Media via COMTEX 2002-03-18, ""The Next Step to Reconciliation""",1,0,0,0,Nigeria,475,0,0,0,0,0,0,0,0,0,0,0,0,0,0,0,0,0,0,0,1,1,0,0,0,0,0,1,0,0,0
1649,Liberia,146,450,2,Government of Liberia - LURD,95,0,0,1,05/01/2002,05/31/2002,4,"Reuters 2002-06-01, ""UN force commander warns Liberian minister over Sierra Leone""",0,1,0,0,UN,11024,0,0,0,0,0,0,0,0,0,0,0,0,0,0,0,0,0,0,0,1,1,3,0,0,1,0,0,0,0,0
1650,Liberia,146,450,2,Government of Liberia - LURD,95,0,0,1,05/17/2002,05/17/2002,1,"Reuters 2002-05-17, ""Liberia asks West Africa to help fight rebels""; AFP 2002-05-18, ""West African leaders propose peace talks for Liberia""",0,1,0,0,The New Partnership for Africa's Development,11023,0,0,0,0,0,0,0,0,0,0,0,0,0,0,0,0,0,0,0,1,1,3,0,1,1,0,0,0,0,0
1651,Liberia,146,450,2,Government of Liberia - LURD,95,0,0,1,05/27/2002,05/27/2002,1,"Reuters 2002-05-29, ""Taylor Supports Call for Cease Fire, But """,0,1,0,0,AU,11000,0,0,0,0,0,0,0,0,0,0,0,0,0,0,0,0,0,0,0,1,1,3,0,1,1,0,0,0,0,0
1652,Liberia,146,450,2,Government of Liberia - LURD,95,0,0,1,11/01/2002,11/30/2002,4,"The NEWS/All Africa Global Media via COMTEX 2002-11-25, ""U. S. Official Tours Refugee, IDPs Camps...pledges Efficient Support""",1,0,0,0,USA,2,0,0,0,0,0,0,0,0,0,0,0,0,0,0,0,0,0,0,0,1,1,3,0,0,1,0,0,0,0,0
1653,Liberia,146,450,2,Government of Liberia - LURD,95,0,0,1,11/25/2002,11/25/2002,1,"The NEWS/All Africa Global Media via COMTEX 2002-11-26, ""Government Ready to Dialogue With Rebels-Issues Joint Communique With Ecowas' Chair""; The NEWS/All Africa Global Media via COMTEX 2002-11-27, ""Government Ready to Dialogue With Rebels - Issues Joint Communique With Ecowas""; UN Integrated Regional Information Networks/All Africa Global Media via COMTEX 2002-11-28, ""Taylor Urges Ecowas To Arrange Talks With Lurd""",0,1,0,0,ECOWAS,11006,0,0,0,0,0,0,0,0,0,0,0,0,0,0,0,0,0,0,0,1,1,3,0,0,1,0,0,0,0,0
1654,Liberia,146,450,2,Government of Liberia - LURD,95,1,0,2,01/16/2003,01/16/2003,1,"Taylor, U.S. Ambassador Meet Behind Closed Doors. 543 words , 17 January 2003, 01:31, All Africa",1,0,0,0,USA,2,0,0,0,0,0,0,0,0,0,0,0,0,0,0,0,0,0,0,0,1,1,3,0,0,1,0,0,0,0,0
1655,Liberia,146,450,2,Government of Liberia - MODEL,352,1,0,1,01/16/2003,01/16/2003,1,"Taylor, U.S. Ambassador Meet Behind Closed Doors. 543 words , 17 January 2003, 01:31, All Africa",1,0,0,0,USA,2,0,0,0,0,0,0,0,0,0,0,0,0,0,0,0,0,0,0,0,1,1,3,0,0,1,0,0,0,0,0
1656,Liberia,146,450,2,Government of Liberia - LURD,95,0,0,2,02/06/2003,02/08/2003,1,"Liberian rebels agree to talks with government. By Christo Johnson , 401 words 9 February 2003, 19:10, Reuters News",0,0,1,0,Civil society / community activists,12008,0,0,0,0,0,0,0,0,0,0,0,0,0,0,0,0,0,0,0,1,2,3,0,0,1,0,0,0,0,0
1657,Liberia,146,450,2,Government of Liberia - LURD,95,0,0,2,02/06/2003,02/08/2003,1,"Liberian rebels agree to talks with government. By Christo Johnson , 401 words 9 February 2003, 19:10, Reuters News",1,0,0,0,Sierra Leone,451,0,0,0,0,0,0,0,0,0,0,0,0,0,0,0,0,0,0,0,1,2,0,0,0,0,0,1,0,0,0
1658,Liberia,146,450,2,Government of Liberia - LURD,95,0,0,2,04/15/2003,04/15/2003,1,"No Date Set for Peace Talks - Contact Group. 365 words 15 April 2003, 23:14, All Africa",7,4,0,0,"Senegal, USA, Morocco, Nigeria, Ghana, France, UK, UN, AU, EC/EU, ECOWAS",433,2,600,475,452,220,200,11024,11000,11010,11006,0,0,0,0,0,0,0,0,0,11,1,3,0,0,0,1,0,0,0,0
1659,Liberia,146,450,2,Government of Liberia - MODEL,352,0,0,1,04/15/2003,04/15/2003,1,"No Date Set for Peace Talks - Contact Group. 365 words 15 April 2003, 23:14, All Africa",7,4,0,0,"Senegal, USA, Morocco, Nigeria, Ghana, France, UK, UN, AU, EC/EU, ECOWAS",433,2,600,475,452,220,200,11024,11000,11010,11006,0,0,0,0,0,0,0,0,0,11,1,3,0,0,0,1,0,0,0,0
1660,Liberia,146,450,2,Government of Liberia - LURD,95,0,0,2,05/07/2003,05/07/2003,1,"Peace Facillitator Calls for Immediate Ceasefire. 268 words 8 May 2003, 00:28, All Africa",0,1,0,0,ECOWAS,11006,0,0,0,0,0,0,0,0,0,0,0,0,0,0,0,0,0,0,0,1,1,3,0,1,0,0,0,0,0,0
1661,Liberia,146,450,2,Government of Liberia - MODEL,352,0,0,1,05/07/2003,05/07/2003,1,"Peace Facillitator Calls for Immediate Ceasefire. 268 words 8 May 2003, 00:28, All Africa",0,1,0,0,ECOWAS,11006,0,0,0,0,0,0,0,0,0,0,0,0,0,0,0,0,0,0,0,1,1,3,0,1,0,0,0,0,0,0
1662,Liberia,146,450,2,Government of Liberia - LURD,95,0,0,2,05/26/2003,05/27/2003,1,"One Liberian rebel faction shows for peace talks. By Christo Johnson 432 words , 26 May 2003, 20:57 Reuters News. ""Liberian rebels impose conditions for truce ahead of peace talks.""
420 words ,27 May 2003, Agence France Presse",0,1,0,0,ECOWAS,11006,0,0,0,0,0,0,0,0,0,0,0,0,0,0,0,0,0,0,0,1,2,3,0,1,1,0,0,0,0,0
1663,Liberia,146,450,2,Government of Liberia - LURD,95,0,0,2,05/26/2003,05/27/2003,1,"One Liberian rebel faction shows for peace talks. By Christo Johnson 432 words , 26 May 2003, 20:57 Reuters News",1,0,0,0,Sierra Leone,451,0,0,0,0,0,0,0,0,0,0,0,0,0,0,0,0,0,0,0,1,2,0,0,0,0,0,1,0,0,0
1664,Liberia,146,450,2,Government of Liberia - LURD,95,0,0,2,06/11/2003,06/11/2003,1,"Liberian president agrees truce with rebels besieging his capital city. by Terence Sesay and Emmanuel Goujon 620 words , 11 June 2003, Agence France Presse",1,0,0,0,Ghana,452,0,0,0,0,0,0,0,0,0,0,0,0,0,0,0,0,0,0,0,1,1,3,0,1,0,0,0,0,0,0
1665,Liberia,146,450,2,Government of Liberia - MODEL,352,0,0,1,06/11/2003,06/11/2003,1,"Liberian president agrees truce with rebels besieging his capital city. by Terence Sesay and Emmanuel Goujon 620 words , 11 June 2003, Agence France Presse",1,0,0,0,Ghana,452,0,0,0,0,0,0,0,0,0,0,0,0,0,0,0,0,0,0,0,1,1,3,0,1,0,0,0,0,0,0
1666,Liberia,146,450,2,Government of Liberia - LURD,95,0,0,2,06/13/2003,06/20/2003,1,"Peace Talks Close to Agreement On Ceasefire. 731 words , 13 June 2003, 18:51, All Africa . Taylor to be excluded from Liberia's transition govt - official. 91 words 17 June 2003, Agence France Presse",7,4,0,0,"Senegal, USA, Morocco, Nigeria, Ghana, France, UK, UN, AU, EC/EU, ECOWAS",433,2,600,475,452,220,200,11024,11000,11010,11006,0,0,0,0,0,0,0,0,0,11,3,1,1,1,1,0,0,0,0,0
1667,Liberia,146,450,2,Government of Liberia - MODEL,352,0,0,1,06/13/2003,06/20/2003,1,"Peace Talks Close to Agreement On Ceasefire. 731 words , 13 June 2003, 18:51, All Africa . Taylor to be excluded from Liberia's transition govt - official. 91 words 17 June 2003, Agence France Presse",7,4,0,0,"Senegal, USA, Morocco, Nigeria, Ghana, France, UK, UN, AU, EC/EU, ECOWAS",433,2,600,475,452,220,200,11024,11000,11010,11006,0,0,0,0,0,0,0,0,0,11,3,1,1,1,1,0,0,0,0,0
1668,Liberia,146,450,2,Government of Liberia - LURD,95,0,0,2,06/25/2003,06/25/2003,1,"Taylor agrees to US plan for buffer zone in war-ravaged Monrovia. 476 words , 27 July 2003, Agence France Presse",1,0,0,0,USA,2,0,0,0,0,0,0,0,0,0,0,0,0,0,0,0,0,0,0,0,1,3,4,0,1,0,0,0,0,0,0
1669,Liberia,146,450,2,Government of Liberia - LURD,95,1,0,2,06/30/2003,06/30/2003,1,"West African ministers to meet Friday on Liberia, Ivory Coast crises. 239 words , 30 June 2003, Agence France Presse",0,1,0,0,ECOWAS,11006,0,0,0,0,0,0,0,0,0,0,0,0,0,0,0,0,0,0,0,1,1,3,0,0,1,0,0,0,0,0
1670,Liberia,146,450,2,Government of Liberia - LURD,95,0,0,2,06/30/2003,06/30/2003,1,"West African ministers to meet Friday on Liberia, Ivory Coast crises. 239 words , 30 June 2003, Agence France Presse",1,0,0,0,Ghana,452,0,0,0,0,0,0,0,0,0,0,0,0,0,0,0,0,0,0,0,1,1,0,0,0,0,0,1,0,0,0
1671,Liberia,146,450,2,Government of Liberia - MODEL,352,1,0,1,06/30/2003,06/30/2003,1,"West African ministers to meet Friday on Liberia, Ivory Coast crises. 239 words , 30 June 2003, Agence France Presse",0,1,0,0,ECOWAS,11006,0,0,0,0,0,0,0,0,0,0,0,0,0,0,0,0,0,0,0,1,1,3,0,0,1,0,0,0,0,0
1672,Liberia,146,450,2,Government of Liberia - MODEL,352,0,0,1,06/30/2003,06/30/2003,1,"West African ministers to meet Friday on Liberia, Ivory Coast crises. 239 words , 30 June 2003, Agence France Presse",1,0,0,0,Ghana,452,0,0,0,0,0,0,0,0,0,0,0,0,0,0,0,0,0,0,0,1,1,0,0,0,0,0,1,0,0,0
1673,Liberia,146,450,2,Government of Liberia - LURD,95,0,0,2,07/07/2003,07/08/2003,1,"Liberian Government, Rebel Groups Restart Peace Talks in Accra, Ghana-UN. 436 words , 8 July 2003, 06:24, All Africa . Liberia proposes that VP take over from Taylor. 75 words, 8 July 2003, 19:40, Reuters News",0,2,1,0,"ECOWAS, UN, Civil society / community activists",11006,11024,12008,0,0,0,0,0,0,0,0,0,0,0,0,0,0,0,0,0,3,3,2,1,0,0,0,0,0,0,0
1674,Liberia,146,450,2,Government of Liberia - LURD,95,0,0,2,07/07/2003,07/08/2003,1,"Liberian Government, Rebel Groups Restart Peace Talks in Accra, Ghana-UN. 436 words , 8 July 2003, 06:24, All Africa",1,0,0,0,Ghana,452,0,0,0,0,0,0,0,0,0,0,0,0,0,0,0,0,0,0,0,1,1,0,0,0,0,0,1,0,0,0
1675,Liberia,146,450,2,Government of Liberia - MODEL,352,0,0,1,07/07/2003,07/08/2003,1,"Liberian Government, Rebel Groups Restart Peace Talks in Accra, Ghana-UN. 436 words , 8 July 2003, 06:24, All Africa . Liberia proposes that VP take over from Taylor. 75 words, 8 July 2003, 19:40, Reuters News",0,2,1,0,"ECOWAS, UN, Civil society / community activists",11006,11024,12008,0,0,0,0,0,0,0,0,0,0,0,0,0,0,0,0,0,3,3,2,1,0,0,0,0,0,0,0
1676,Liberia,146,450,2,Government of Liberia - MODEL,352,0,0,1,07/07/2003,07/08/2003,1,"Liberian Government, Rebel Groups Restart Peace Talks in Accra, Ghana-UN. 436 words , 8 July 2003, 06:24, All Africa",1,0,0,0,Ghana,452,0,0,0,0,0,0,0,0,0,0,0,0,0,0,0,0,0,0,0,1,1,0,0,0,0,0,1,0,0,0
1677,Liberia,146,450,2,Government of Liberia - LURD,95,0,0,2,07/18/2003,07/23/2003,1,"Sharpton accuses Bush of Liberia policy lapse. By Robert Gibbons , 304 words , 25 July 2003, 19:25 Reuters News",1,0,0,0,USA,2,0,0,0,0,0,0,0,0,0,0,0,0,0,0,0,0,0,0,0,1,3,4,0,0,0,1,0,0,0,0
1678,Liberia,146,450,2,Government of Liberia - LURD,95,0,0,2,07/18/2003,07/23/2003,1,"Sharpton accuses Bush of Liberia policy lapse. By Robert Gibbons , 304 words , 25 July 2003, 19:25 Reuters News",1,1,0,0,"Ghana, ECOWAS",452,11006,0,0,0,0,0,0,0,0,0,0,0,0,0,0,0,0,0,0,2,3,0,0,0,0,0,1,0,0,0
1679,Liberia,146,450,2,Government of Liberia - MODEL,352,0,0,1,07/18/2003,07/23/2003,1,"Sharpton accuses Bush of Liberia policy lapse. By Robert Gibbons , 304 words , 25 July 2003, 19:25 Reuters News",1,0,0,0,USA,2,0,0,0,0,0,0,0,0,0,0,0,0,0,0,0,0,0,0,0,1,3,4,0,0,0,1,0,0,0,0
1680,Liberia,146,450,2,Government of Liberia - MODEL,352,0,0,1,07/18/2003,07/23/2003,1,"Sharpton accuses Bush of Liberia policy lapse. By Robert Gibbons , 304 words , 25 July 2003, 19:25 Reuters News",1,1,0,0,"Ghana, ECOWAS",452,11006,0,0,0,0,0,0,0,0,0,0,0,0,0,0,0,0,0,0,2,3,0,0,0,0,0,1,0,0,0
1681,Liberia,146,450,2,Government of Liberia - LURD,95,0,0,2,08/03/2003,08/03/2003,1,"Liberian rebel leader in Rome as guest of Sant'Egidio mediators. 179 words , 3 August 2003, Agence France Presse",0,0,1,0,The Sant' Egidio Community,12033,0,0,0,0,0,0,0,0,0,0,0,0,0,0,0,0,0,0,0,1,2,3,0,0,0,1,0,0,0,0
1682,Liberia,146,450,2,Government of Liberia - LURD,95,0,0,2,08/03/2003,08/03/2003,1,"Liberian rebel leader in Rome as guest of Sant'Egidio mediators. 179 words , 3 August 2003, Agence France Presse",1,0,0,0,Italy,325,0,0,0,0,0,0,0,0,0,0,0,0,0,0,0,0,0,0,0,1,2,0,0,0,0,0,1,0,0,0
1683,Liberia,146,450,2,Government of Liberia - LURD,95,0,0,2,08/07/2003,08/07/2003,1,"Top west African delegation visits Liberia's Taylor. 260 words , 8 August 2003, Agence France Presse",0,1,0,0,ECOWAS,11006,0,0,0,0,0,0,0,0,0,0,0,0,0,0,0,0,0,0,0,1,1,3,0,0,0,1,0,0,0,0
1684,Liberia,146,450,2,Government of Liberia - MODEL,352,0,0,1,08/07/2003,08/07/2003,1,"Top west African delegation visits Liberia's Taylor. 260 words , 8 August 2003, Agence France Presse",0,1,0,0,ECOWAS,11006,0,0,0,0,0,0,0,0,0,0,0,0,0,0,0,0,0,0,0,1,1,3,0,0,0,1,0,0,0,0
1685,Liberia,146,450,2,Government of Liberia - LURD,95,0,0,2,08/12/2003,08/12/2003,1,"West African troops to deploy in Monrovia port on Thursday - envoy. 91 words, 12 August 2003, Agence France Presse",1,0,0,0,USA,2,0,0,0,0,0,0,0,0,0,0,0,0,0,0,0,0,0,0,0,1,2,3,0,0,0,1,0,0,0,0
1686,Liberia,146,450,2,Government of Liberia - LURD,95,0,0,2,08/14/2003,08/18/2003,1,"Ghana: Liberian president arrives for peace talks, 201 words , 14 August 2003, 23:07, BBC Monitoring Africa. Ghana: Comprehensive peace plan for Liberia to be signed 16 August, 296 words 
14 August 2003, 23:27, BBC Monitoring Africa",0,2,0,0,"ECOWAS, UN",11006,11024,0,0,0,0,0,0,0,0,0,0,0,0,0,0,0,0,0,0,2,3,1,1,0,0,0,0,0,0,0
1687,Liberia,146,450,2,Government of Liberia - LURD,95,0,0,2,08/14/2003,08/18/2003,1,"Ghana: Liberian president arrives for peace talks, 201 words , 14 August 2003, 23:07, BBC Monitoring Africa. Ghana: Comprehensive peace plan for Liberia to be signed 16 August, 296 words 
14 August 2003, 23:27, BBC Monitoring Africa",1,0,0,0,Ghana,452,0,0,0,0,0,0,0,0,0,0,0,0,0,0,0,0,0,0,0,1,3,0,0,0,0,0,1,0,0,0
1688,Liberia,146,450,2,Government of Liberia - LURD,95,1,0,2,08/14/2003,09/30/2003,5,"http://www.reliefweb.int/rw/rwb.nsf/AllDocsByUNID/30d35e9eada151b6c1256d8300624180 , West African peacekeepers arrive in rebel-held port. 66 words, 14 August 2003, Agence France Presse, Heldt & Wallensteen 2005,",0,1,0,0,ECOWAS,11006,0,0,0,0,0,0,0,0,0,0,0,0,0,0,0,0,0,0,0,1,0,0,0,0,0,0,0,0,0,1
